start	end	text
0	20740	So Leute, ich habe einen nice Dude im Internet drin gefunden und der hat einen kleinen Mikrokanal
20740	28620	genauso wie ich und im Gegensatz zu mir gibt er sich massiv Mühe mit seinem Content und
28620	35980	ich bin dafür, dass ihr euch den mal reinzieht und wenn ihr Bock drauf habt, den auch supportet,
35980	42020	weil der Boy, der hat's drauf, der macht das so wie ich auch einfach nebenbei als Hobby,
42020	48780	weil er einfach mal ein Idealist ist und ja, ich habe jetzt, was ihr jetzt sehen werdet,
48780	54020	gleich ist einfach nur das Rohr-Uncut-Material, ich habe mich mit ihm online unterhalten,
54020	57380	habe ihm gesagt, ich nehme das auf und werde das veröffentlichen, um seinen Kanal zu pushen und
57420	63220	dann haben wir uns einfach ein bisschen unterhalten. Und daraus ist jetzt das Video entstanden. Viel Spaß.
63220	71220	So, hast du gesagt, du bist ein Biologe? Ja, ich bin Biologe, genau. Also ich studiere Biologie.
71220	78300	Also ich kann noch nicht sagen, ich bin Biologe, aber. Welches Semester? Ich bin jetzt im 5.
78300	86460	Semester, aber ehrlich gesagt bin ich da auch nur, wie sagt man, offiziell. Also ich habe
86500	89940	relativ spät angefangen zu studieren. Ich habe auch erst mein Abitur nachgeholt,
89940	98780	weil ich das mal abgebrochen hatte damals aus verschiedensten Gründen und ja, jetzt habe ich,
98780	103620	was heißt jetzt, vor fünf Jahren ungefähr habe ich dann mein Abitur nachgemacht und dann
103620	110580	hatte ich zwei Jahre lang Unternehmen und danach habe ich angefangen zu studieren. Zuerst zwei
110580	116460	Semester Chemie und dann habe ich geswitcht zu Bio, weil ich fand Bio noch ein bisschen
116460	125340	umfänglicher einfach und ich habe so ein bisschen so, ja vielleicht so ADHS typisch,
125340	131140	also ich bin so ein typischer ADHSler, so dieses Problem, dass ich mich nie lange voll auf eine
131140	136980	Sache nur fokussieren kann und da ist Bio mir sehr, sehr entgegengekommen und das war auch eine sehr
136980	143300	gute Entscheidung für mich. Okay. Genau. Also mir wurde dein Kanal, ich bin ja jetzt auch so ein
143300	147180	bisschen in diesen linken Bubbles drin, seitdem ich das hier mit YouTube mache, werde ich auch
147180	150820	manchmal durchgereicht zu anderen und gehe dann da auf die Kanäle und die helfen mir dann sozusagen
150820	157220	mit Abos aus und ich dachte ich mache das mit dir. Weißt du, weil ich deinen, der wurde mir angezeigt
157220	160820	von einer von diesen Bubbles hier von wegen, kann den mal einer supporten hier, das ist ein
160820	168100	nicer Dude. Das ist ja nice, ich habe das gar nicht so richtig mitbekommen. Das ist ja out of scope,
168100	175220	das ist out of scope, also konkret war das der Discord Server vom Proletopia, da hat das jemand,
175220	180340	ich glaube alle drei zusammen hat es direkt, alle drei zusammen Christoph hat es durchgereicht. Ja,
180340	186820	also ehrlich gesagt kenne ich die gar nicht, also ich habe natürlich, nachdem ich da benachrichtigt
186820	193500	wurde von, genau Christoph hieß er glaube ich, Christoph war sein Name. Wie der heißt, in echt
193500	197820	weiß ich nicht. Nein, nein, ich meine sein... Alle drei zusammen Christoph, das ist ein Name,
197820	203140	das ist ein total absurder Scheißname, aber er prägt sich auch ein und mich hat er damals auch
203140	207780	vernetzt mit anderen, also das ist so ein Typ, der macht scheinbar, seine Passion ist im YouTube
207780	214060	drin hängen und Leute anschreiben. Richtiger Christoph halt. Ja genau, das ist ein nicer Dude.
214060	220100	Ja und ich habe dein Video gesehen hier zur Zensur, ich glaube das ist der erste Teil,
220100	224460	du willst es ja in drei Teile irgendwie, ich weiß nicht ob die schon alle da sind. Also ich
224460	230740	hatte, also das Ding ist, wie ich dir gerade schon sagte, ADS, immer den Überblick schön verlieren
230740	238500	und immer irgendwas machen und nichts richtig, aber der ursprüngliche Plan war Zensur, Überwachung
238500	245260	und Propaganda in Demokratien und genau der erste Teil war eben die Zensur, der zweite Teil die
245260	250100	Überwachung, den hatte ich auch schon hochgeladen. Ja, das ist ein langes Video, 50 Minuten. 50
250100	254060	Minuten, ja es ist sehr lang geworden, das war nicht geplant, also eigentlich war der Plan ein
254060	261180	zehn Minuten zu jedem Thema, das hat absolut nicht geklappt. Kenn ich. Ja das war der Wahnsinn, so und
261180	264980	es hat auch immer länger gedauert, jedes Video danach hat immer länger gedauert als das davor,
264980	269860	selbst wenn es wieder kürzer war, weil es gab immer mehr Dinge, auf die ich Wert gelegt habe und es
269860	275300	ist immer so ausgeartet in so ein Exzess irgendwie. Ich glaube für das letzte Video habe ich einen
275300	281060	Monat quasi nonstop gearbeitet und also das war aber dann das Manufacturing Consent Video,
281060	287420	was im Endeffekt das Propaganda Video sein sollte, also ursprünglich war das so angelegt und dann
287420	293580	beim Skript schreiben habe ich gemerkt, dass das ganze, also alles was ich sagen wollte nicht
293580	299340	ansatzweise in die Zeit gepasst hat und dann habe ich mir überlegt, okay, da mache ich jetzt ein
299340	304820	Dreiteil aus dem dritten Teil. Okay. Und deswegen steht da auch nicht Propaganda drauf, also Teil 3,
304820	311540	sondern ich habe einfach darauf vertraut, dass die Leute eh nichts sich gemerkt haben und nochmal
311540	317340	neu angefangen quasi. Aber im Endeffekt liefer ich ja trotzdem. Redest du auch von Edward Bernays dann
317340	323620	oder machst du nur nur am Chimps? Edward Bernays kommt im zweiten Teil. Ich finde das krass,
323620	329460	weil ich weiß nicht, ob du dir ein Video von mir schon angeguckt hast, ich gebe mir ja gar keine
329460	333540	Mühe mit meinem Content. Null Mühe mit meinem Content, ich setze mich hier einfach hin, so wie jetzt,
333540	339700	dann mache ich meistens ein Bier auf und dann habe ich einen Textfeil, höchstens Brust, ich habe
339700	343620	höchstens einen Textfeil, wo so ein paar Stichpunkte drin stehen und dann quatsche ich drauf los und dann
343620	349140	kann das auch schon mal passieren, dass das 50 Minuten dauert und das war's. Also es ist auch
349140	354660	immer nur eine Aufnahme, also ich habe einmal musste ich mal ein Video abbrechen, weil irgendwie es
354660	358260	an der Tür geklingelt hat und dann haben die Katzen irgendwas gemacht und dann war ich so im Arsch,
358260	361980	dass ich gesagt habe, ich mache morgen das Video noch mal. Aber sonst habe ich das noch nie gemacht,
361980	365380	ganz einfach deswegen, weil ich gar keine Zeit dafür habe und ich weiß, wie viel Arbeit das
365380	369980	kosten würde und ich sehe das ja bei dir, du schneidest ja jeden Scheiß, jeden, schneidest du
369980	375340	raus, jeden, alles und das ist übelst aufwendig und dann natürlich benutzt du auch noch einen
375340	382060	Haufen andere Videos und Bilder und so und das mache ich ja alles nicht. Das will ich eigentlich
382060	387500	gar nicht machen, ich rutsche halt immer nur da rein, weil ich mich da drin so verliere. Ich nehme
387500	390380	eigentlich jedes Mal vor, es nicht aufwendig zu machen. Weißt du, was bei mir am allerlängsten
390380	394660	dauert? Das, was mir am wenigsten bringt. Ich mache am Ende von meinen Videos immer ein Metal
394660	401700	Lied und irgendein Clip oder irgendwo, wo die Lyrics passen zum Video und das dauert am längsten,
401700	404900	weil ich nämlich immer noch die Lyrics reinnehme und die noch auf Deutsch übersetze,
404900	408940	weil so viele Leute kein Englisch können. Das dauert bei mir am allerlängsten und das bringt
408940	412620	mir am wenigsten, weil ich sehe ja, dass sozusagen, sobald das Video ist, so zack, zehn Prozent gucken
412620	416900	noch. Die gucken sich dann das noch an. Aber das ist egal, aber ich weiß, was du meinst,
416900	422940	wenn man damit einmal anfängt, dann... Ja, es war auch ganz, also ich hatte sehr gemischte
422940	430180	Gefühle, als ich mein Video zu Martin Sonneborn gemacht habe. Das hat jetzt mittlerweile 5000
430180	433300	Klicks, was für mich persönlich viel ist. Also andere werden da vielleicht überlachen,
433300	439980	aber für mich ist es krass und... Naja, ich habe halt, das war an dem Tag, wo das bekannt
439980	445340	geworden ist, dass Nico Semstraut aus der Partei austritt und ich war sehr, sehr überrascht und
445340	450900	auch schockiert davon. Also, weil für mich persönlich war und ist auch immer noch die
450900	457780	Partei, die Partei ein linker Lichtblick und... Naja, auf jeden Fall, ich dachte, boah, krass,
457780	461540	Alter, da muss ich direkt ein Video zu machen. Dann habe ich mir ein paar Gedanken gemacht,
461540	468180	ein bisschen mich noch mal eingelesen zu dem Thema, alles researcht, was ich finden konnte. Es gab
468180	472340	da noch nicht viel zu dem Zeitpunkt. Dann habe ich mir eine Stichpunktliste gemacht und wirklich
472340	476020	innerhalb von, ich weiß nicht, 20 Minuten oder so das Video auf, also was heißt das Video,
476020	480300	das Audio nur aufgenommen. Das war ja nur ein Audio-Kommentar, den ich angesprochen habe. Dann
480300	484660	habe ich noch ein paar Amps und Stillen und so rausgeschnitten, weil wenn ich mit mir alleine
484660	488220	rede, dann kann ich nicht so flüssig reden wie jetzt mit dir. Ich kann das einfach irgendwie nicht.
488220	500980	Und dann ist das Video voll abgegangen, über Nacht. Ich war morgens auf und hatte das schon 1000
500980	506740	Klicks und so viel hatte nach zwei Monaten mein bestes Video zu dem Zeitpunkt noch nicht. Und das
506740	509820	war so, ja, okay, warum mache ich mir eigentlich immer so viel Mühe?
509820	515540	Ja, das ist halt, ich meine, das war dann halt gerade wahrscheinlich ein trendendes Hashtag.
515540	520300	Ja, na klar, na klar. Aber ich habe auch bei den Themen davor mal versucht irgendwie.
520300	526500	Ja, aber du musst da zeitnah sein. Das muss genau passen. Das siehst du ja auch. Sobald
526500	530460	irgendwas ist, zum Beispiel wenn Rezo sein neues Video macht, dann müssen alle so schnell wie
530460	533380	möglich darauf reakten und auch noch was abkriegen von der Reichweite.
533380	538060	Ja, aber das ist doch so Geier-mäßig. Ja, natürlich. Ich mache das auch nicht.
538060	541660	Aber ich habe auch eine völlig andere Einstellung zu meinem Kanal. Also,
541660	545940	ich muss ja kein Marketing machen und ich will es ja auch nicht als Beruf machen,
545940	548780	zumindest jetzt noch nicht. Keine Ahnung, vielleicht mache ich das später tatsächlich.
548780	551940	Aber so ist das für mich wirklich nur ein Projekt. Und wie gesagt,
551940	555740	ich stecke ja auch keine großartige Zeit jetzt in die Videos rein, so wie du.
555740	562780	Ja, also bei mir ist es so, ich kriege natürlich auch kein Center für und bei mir ist es auch Hobby,
562780	568700	aber im Endeffekt war es schon dann ein Vollzeit-Hobby, das mich auf jeden Fall
568700	571660	Studienzeit gekostet hat. Allerdings bereue ich das auch kein bisschen,
571660	579340	weil es hat ja auch schon Spaß gemacht. Also, ich habe schon immer mega gern mit Videos
579340	585140	experimentiert und Aufnahmen gemacht und ich habe schon als Kind irgendwie von meinen Eltern eine
585140	591980	Kamera bekommen und habe damit irgendeinen Kram gefilmt und früher irgendwelche Matchbox-Autos
591980	594900	genommen und da Böller reingesteckt und das habe ich gefilmt und Side-Loop-Aufnahmen
594900	598220	davon gemacht, als ich 10 war. Das habe ich schon immer gemacht.
598220	605860	Ja, ich bin ja ein bisschen älter als du. Wir hatten das Analogon mit Kassettenrekordern und
605860	610900	Mikros und dann haben wir... Ich bin jetzt 34.
610900	617980	Okay, du bist älter als ich, aber ja. Und stopp, ich komme aus dem Osten. Wir hatten
617980	623980	nichts. Aus dem Osten? Aus dem Osten. Wir hatten nichts. Wir haben ja nichts. Und wir hatten
623980	630460	höchstens mal so einen ullen Kampfforder und dann mussten wir mit einem Tape über die Kassetten
630460	635260	drüber und dann konnte man die überspielen. Und dann habe ich mich mit meinem Kumpel hingesetzt und
635260	638660	wir waren vielleicht 10 und dann haben wir so getan, als wären wir Radiomoderatoren und haben uns
638660	642380	Shows ausgedacht und so. Nur so ein Scheiß oder vielleicht waren wir auch noch viel jünger. Also,
642380	647580	ich habe die auch noch hier rumliegen, diesen super Cringe. Manchmal hole ich sie raus und gucke
647580	651140	mir sie an und dann rufe ich ihn an und sage, ich habe hier noch diese Tapes, weißt du? Und er so,
651140	656180	oh nein, bloß weg damit, bloß weg damit. Das ist aber witzig, da sieht man, wie kreativ kleine Jungs
656180	662340	schon sein können. Aber witzig, dass du das noch hast. Ich wünschte, ich hätte das noch. Ja,
662340	668460	ich habe... Es war sogar so, ich glaube, er hatte sie bei sich zu Hause und ich habe ihn nach... Wir
668460	672100	haben uns sechs, sieben, zehn Jahre nicht gesehen und ich habe ihn noch mal besucht und ich so, ey,
672100	676060	hast du diese Dinge noch? Und er so, ja, ich habe die noch, nimm die bloß, ich will die nicht haben,
676060	679820	aber ich wollte sie auch nicht kaputt machen, weil mir das zu schade war und deswegen habe ich die
679820	686020	jetzt aufgehoben. Das ist super witzig. Wir hatten früher dieses Fischerpreisgerät, ich glaube,
686020	692100	es hatte früher jeder. Ja, genau, so ein Ding hatten wir auch. Das war auch geil. Ich werde
692100	697260	fragen, ob deine Kinder das heute noch machen oder wie das heute läuft. Naja, heute macht man das mit
697260	702940	TikTok direkt im Internet drin. Du nimmst ein Smartphone und hast es dann direkt da, ne? Ja. Da
702940	705820	ist die App drauf, die heißt TikTok, da muss man nicht mal mehr sich was überlegen,
705820	711340	sondern es wird direkt, es kommt dann direkt online. Ich frage mich immer, was ich machen würde,
711340	718780	wenn ich ein Kind hätte, ob ich, also wie ich mit meinem Kind umgehen müsste bezüglich Smartphones,
718780	724060	Social Media und dem ganzen Kram. Ich sage dir, wie man das macht. Ich habe ein Kind. Bitte. Du hast
725060	736540	meine Tochter ist dreieinhalb. Ja, so gehe ich damit um. Ich bin militant gegen Smartphones. Also meine
736540	741740	Frau hat jetzt eins, weil sie im Lockdown bemerkt hat, dass sie ausgeschlossen ist, wenn sie keins
741740	746260	hat. Ich komme aber super gut klar, weil ich ein PC-Nörd bin, schon mein ganzes Leben lang sitze
746260	752660	ich vor dem Computer. Ich habe genug Screentime und wir haben auch keinen Fernseher und ich habe
752940	759420	zu viele Paper und zu viele Vorträge von Manfred Spitzer gesehen, dass ich genau weiß, wie toxisch
759420	763460	das ist. Gerade bei der Kindesentwicklung, gerade im jungen Alter, die haben massive kognitive
763460	768540	Handicaps in ihrer Entwicklung. Also da gibt es so viele. Das musst du mir mal schicken. Also da
768540	773540	kann ich mich interessieren. Ich habe auch Videos dazu gemacht. Ich habe auch einen englischen Kanal,
773540	776780	übrigens, den habe ich ein Jahr vor dem deutschen gemacht, aber das ist viel schlimmer und viel
776780	780580	anstrengender. Nicht nur, weil mein Englisch furchtbar ist, aber auch, weil du sozusagen da
780660	786220	viel weniger Reichweite generieren kannst, weil der Markt so kompetitiv ist und dann war es auch so,
786220	791300	meine Hauptleute, die da kommentiert haben, waren fast alles Deutsche und dann haben die gesagt,
791300	794900	mach doch deutsch, mach doch deutsch und irgendwann habe ich damit gemacht. Das ist auch schon witzig. Haben die auch immer auf
794900	801220	deutsch kommentiert? Ja, gab es die meisten ja. Viele, da habe ich es trotzdem gewusst, dass sie
801220	805380	deutsch sind, auch wenn sie englisch kommentiert haben, aber viele haben auch einfach deutsch.
805380	809220	Vielleicht haben die auf deutsch dann so geschrieben, wie du dann vielleicht gesprochen hast.
809220	820980	Ja, aber so war es dann halt. So heftig nicht, aber es ist schon ein bisschen grinsch dabei,
820980	825740	diese Videos, aber ich werde auch besser. Für mich war es einfach ein Projekt, weil ich musste zu
825740	829740	der Zeit meine Dissertation schreiben und musste mich davon ablenken und zocken hat nicht mehr
829740	833260	gereicht, also musste ich was anderes machen und dann war das wahrscheinlich so wie bei dir. Ich
833260	837340	habe wirklich so viel reingepumpt, ich habe im Prinzip jeden Tag ein Video veröffentlicht,
837340	842180	aber mit diesem Workflow, also schwarz-weiß, einfach aufgenommen, losgeschickt und hinten und
842180	846860	vorne noch einen sinnlosen Clip dran gehangen. Zum Beispiel habe ich mit einer GoPro aufgenommen,
846860	850260	wie ich Müll wegbringe oder so und das habe ich dann als Intro-Clip genommen. So ein Scheiß.
850260	856380	Der Kanal hatte sozusagen diese Ausstrahlung, hier ist der räudige Basement-Nerd und den interessiert
856380	859780	es wirklich nicht, was die anderen denken und so war es auch. Der Vorteil war aber dadurch,
859940	866260	hatte ich schon mal so ein bisschen Erfahrung, wie es ist, mit Videos machen, Workflow kriegen und
866260	872860	Struktur in meinen eigenen Gedanken, weil das ist genau das, was ich nicht hatte. Ganz spät wurde
872860	877180	ich erst politisiert, würde ich jetzt mal wieder sagen. Ich war in meiner Jugendzeit ein Punker mit
877180	881660	grünen Dreadlocks und dann hatte ich irgendwann keinen Bock mehr auf die Szene und habe dann Physik
881660	886580	studiert und habe dann rumgenerdet und war dann raus aus allem, was mit Gesellschaft und so zu
886580	890980	tun hatte. Ich bin erst seit ein paar Jahren wieder dabei und da hat mir dieser englische Kanal
890980	894540	viel mehr geholfen. Da habe ich dann alles schon mal erklärt und dann im deutschen konnte ich
894540	899180	sozusagen die Zusammenfassung in Videos packen. Das war dann automatisch besser. Also du hast
899180	904620	dich quasi politisiert, indem du laut über Politik nachgedacht hast vor der Kamera. Ja,
904620	908300	da habe ich manchmal auch zuerst das erste Mal irgendwelche Gedanken gehabt, die ich vorher noch
908300	912860	nie ausgesprochen habe und ich rede ja schon viel mit Leuten und wenn ich auf einer Party bin oder
912860	917300	so, klar, oder ich habe hier Kumpels, aber das ist nicht das gleiche gewesen, weil irgendwie,
917300	922380	wenn du zu einer Webcam redest, die dir kein Feedback gibt, dann lässt du manchmal deine
922380	927100	Gedanken auch ganz anders fließen. Also ich hatte wirklich ein Video, da wollte ich einfach nur
927100	934340	darüber sprechen, wo Profite herkommen oder irgendwas ganz, und ich war auch voll im Baller und ich
934340	937380	war wirklich schon betrunken und dann irgendwann ist mir so aufgefallen, während ich so rede,
937380	943540	dass irgendwie alles sieht für mich aus wie ein Schneeballsystem. Wenn ich lange genug drauf
943540	948820	gucke, sieht es aus wie ein Ponzi Schema, weißt du? Unten muss exponentiell nachwachsen. Es muss
948820	952700	immer nach oben durchgereicht werden, der Profit, es ist eine Hierarchie. Sicher, dass du nicht eine
952700	959180	Pappe oder so etwas hattest? Ne, mache ich eigentlich gar nicht, weil ich bin kein Raucher und ich werde
959180	965940	von den Tabak meistens super müde und Ballern, also Kekse zum Beispiel sind meine Nemesis total,
965940	971580	die ballern ja mit einmal rein und da muss ich meistens kotzen gehen, aber ich bin einfach so
971580	979460	ein Biotyp. Ne, ich meinte mit Pappe auch kein Gras, aber ich meinte LSD natürlich. Mit dem
979460	985420	Slang, weißt du, mit dem Slang kenne ich mich wirklich nicht aus. Macht nichts, alles gut. Nein,
985420	990980	weil wegen diesen Fraktalarten, das war einfach nur so. Ich habe meine Diplomarbeit über
990980	996740	Fraktale geschrieben. Nee. Computerorientierte theoretische Physik hatte nichts mehr mit Physik
996740	1004140	zu tun und es ging nur noch um 20 bis 30 dimensionale Raumcluster, also die in 20 Dimensionen leben,
1004140	1008540	diese Cluster und bestimmte Eigenschaften haben und dann halt numerik machen damit, also erforschen,
1008540	1012700	was die Eigenschaften von den Dingern sind, Hausdruckdimensionen ausrechnen, Box Counting,
1012700	1015780	alle möglichen Box Counting Dimensionen ausrechnen, die es so gibt, da gibt es ja einen
1015780	1021700	Haufen Metriken. Das war interessant. Ich habe keinen Plan, Mann. Fraktale, Junge. Aber was ich
1021700	1026700	mich immer gefragt habe, ist generell, wie das mit diesen Dimensionen ablaufen soll, die über die
1026700	1033820	wahrnehmbaren, also für den menschwahrnehmbaren hinausgehen, also visuell wahrnehmbar. Also du
1033820	1040660	meinst jetzt wie, wenn jetzt die Physiker sagen Stringtheorie, zehn Dimensionen? Richtig. Okay.
1040660	1046060	Ich habe jetzt auch an Hawkins gerade gedacht. Da würde ich eher immer argumentieren,
1046060	1052140	das muss man sich wie ein Freiheitsgrad vorstellen. Ein Freiheitsgrad? Ein Freiheitsgrad, ja also hier
1052140	1058300	zum Beispiel mein Handy, das hat jetzt, sagen wir mal, die Ecke von diesem Handy, das ist die
1058300	1063300	Koordinaten, das sind drei Raumkoordinaten, dann habe ich schon mal drei Freiheitsgrader, weil das
1063300	1069660	Handy kann so machen, so machen, so machen und dann kann ich es aber auch noch rotieren und man
1069660	1073980	stellt fest, wenn man Algebra macht, lineare Algebra, das kann man noch mal mit drei weiteren
1073980	1079660	Zahlen beschreiben, weil das sozusagen, man kann sich einen Vorzugsrichtungsvektor geben und der,
1079660	1086340	der codiert sozusagen die Ausrichtung im Raum, dann hast du schon sechs Freiheitsgrade. Das heißt,
1086340	1092460	das System dieses Handys hier, das reine, also nur wie der Kasten hier orientiert ist, der hat
1092460	1096780	schon sechs Freiheitsgrade und das könntest du zum Beispiel mit sechs Dimensionen interpretieren.
1096780	1102380	Das hat natürlich nichts damit zu tun, dass du sechs Raumdimensionen hast, aber du stellst
1102380	1106860	halt fest, dass wenn du jetzt das physikalische System hinschreiben willst von dem Ding und die
1106860	1111740	Dynamik abbilden willst von diesem Handy hier, dann kommst du nicht drum rum, dass du einen
1111740	1116540	sechsdimensionalen Konfigurationsraum hast und dann hast du einen zwölfdimensionalen Phasenraum.
1116540	1123140	Das spricht nämlich nochmal, da stecken dann noch die ganzen Geschwindigkeiten drin, also aus
1124140	1128060	jeder Koordinate, jetzt zum Beispiel eins, zwei, drei und dann nochmal die drei Dinge hier, diese
1128060	1133460	Ausrichtung. Die zeitlichen Ableitungen davon sind die Geschwindigkeiten und die braucht man, um die
1133460	1137540	Dynamik abzubilden. Das heißt, das ganze System hier ist nur eindeutig definiert, wenn du sechs
1137540	1143260	Zahlen hast für die Ausrichtung und nochmal sechs Zahlen für die Geschwindigkeit, weil einmal hast
1143260	1147460	du so eine Geschwindigkeit, so eine, so eine, das sind die Raumdimensionsgeschwindigkeiten und dann
1147460	1151540	kannst du umkippen in die Richtung, klappen in die Richtung, klappen in die Richtung und drehen und
1151540	1156220	so und das sind nochmal Geschwindigkeiten, die sind aber intern hier sozusagen in diesen
1156220	1163180	Freiheitsgraden drin und dann hast du schon zwölf. Also du hast einfach, dann hast du einfach ein
1163180	1168820	Tupel von zwölf Zahlen und das beschreibt deinen sozusagen deinen Zustand, deinen physikalischen
1168820	1173700	Zustand und das ist eher das, was der Physiker meint, wenn er von Dimensionen redet. Also es
1173700	1177980	geht um eine Zustandsbeschreibung und nicht um eine Ortsbeschreibung. Es geht erstmal genau,
1177980	1182340	es geht erstmal darum festzustellen, wie kannst du sozusagen den minimalen Satz an Informationen
1182340	1186860	kodieren, in Zahlen typischerweise. Das heißt, ein paar Dimensionen sind Ortszuschreibungen,
1186860	1191540	aber nicht alle Dimensionen sind das. Ja, also bei der Stringtheorie zum Beispiel gibt es so völlig
1191540	1198740	absurde Dimensionen, die können binär oder so sein, an und aus oder Farbe oder warte, die haben da
1198740	1204660	lustige Smell oder Taste irgendwie. Wirklich, da gibt es so absurde Dimensionen, die haben da so
1204660	1210580	drei Werte, zum Beispiel Orange, Blau und sonst was. Und die haben eine Algebra, wie die sich
1210580	1214980	miteinander addieren und so ein Zeug. Also da gibt es noch sozusagen Untergruppen und Algebra,
1214980	1220100	sozusagen komplizierte Algebra, einfache Algebra, verschiedenste Sachen. Zum Beispiel bei einem
1220100	1223980	Elektronen würde man auch sagen, der Spinn ist ein Freiheitsgrad, der kann sozusagen in zwei
1223980	1228580	Richtungen zeigen. Ab und down, ne? Genau, wenn du ein externes Magnetfeld anlegst, dann richtet
1228580	1234100	er sich aus, dann hast du zwei Freiheitsgrade da dran. Das ist ein binäres Ding und ist trotzdem
1234100	1242660	eine Dimension quasi. Alles richtig, ab und down bei Elektronen oder ist das nicht nur bei Quarks?
1242660	1247780	Ja, da heißt das ab und down, das ist noch was anderes, aber beim Spinn ist es auch so, du hast
1247780	1252980	sozusagen bezüglich eines externen Magnetfelds hast du eine Vorzugsrichtung und dann kannst du
1252980	1256580	sagen in diese Richtung oder entgegen dieser Richtung kann der Spinn ausgerichtet sein und
1256740	1261220	da kann man auch hoch und runter zu sagen oder plus und minus. Ja, ich kenne es nur aus der Chemie,
1261220	1267060	einfach mit diesen Spinn-Eigenschaften, wenn man Orbitale ausrechnet, dann kann man ja immer der
1267060	1274420	Reihe nach gehen und auffüllen und dann die Energieniveaus bestimmen. Da erkannte ich das,
1274420	1281540	aber das war, das ist aber jetzt auch schon wieder zwei Jahre her. Ja, aber Orbitale? Du als
