start	end	text
1354000	1360000	sonst würde Wirtschaften nicht funktionieren. Wirtschaften bedeutet Profite nach oben durchzureichen, sonst würde das niemand machen.
1360000	1370000	Und das ist bekannt und dann gibt es diese ganzen FDP-Wichser und andere auch Grüne, die einfach immer sagen, das ist gar kein Problem, dass es da reiche Leute gibt.
1371000	1373000	Die haben das sicherlich verdient.
1373000	1382000	Außerdem glauben die immer noch diese Lüge von der Cat-Netz-Kurve, also dass irgendwie nach einer gewissen Zeit Trickle-Down-Effekte stattfinden.
1382000	1390000	Aber wie soll das passieren, wenn irgendwie 96 Prozent der Überschussrendite, die diese Leute haben, einfach wieder zurück in den Finanzmarkt fließen.
1390000	1396000	Die fließen doch nicht in den kleinen Bäcker hier nebenan, der irgendwie sein Brot noch selber bäckt.
1396000	1400000	Oder die fließen auch nicht in irgendeine Hilfeaktion in Afrika.
1400000	1410000	Nee, die fließen nur in Waffengeschäfte und Spekulationen blasen in die Zukunft, in irgendwelche Bitcoins und irgendwelche anderen erfundenen Geschichten, die überhaupt keinen Sinn ergeben.
1410000	1423000	Übrigens, wenn ihr jetzt mit Bitcoin kommt, also bei Bitcoin ist es offensichtlich zumindest schon mal so, dass eine Transaktion so viel Energie, also so viel CO2 produziert, wie 400.000 Kreditkarten Transaktion.
1423000	1427000	Das kann also nicht von, das kann gar nicht nachhaltig sein. Bitcoin ist Schwachsinn.
1427000	1434000	Also die Idee ist witzig, ich verstehe auch die Idee, die ist witzig von irgendeinem Nerd halt.
1434000	1441000	Aber die ist nicht praktikabel, zumindest nicht wenn man eine endlichere Energiehaushalt irgendwo hat. Und das haben wir.
1441000	1447000	Aber na gut, ich schweife ab. Ich wollte nur mal sagen, Schneeballsysteme sind eigentlich überall.
1447000	1454000	Und es ist schon ganz interessant, dass wenn man sich anstrengt, die eigentlich auch überall erkennen kann.
1567000	1571000	Übrigens, der Kanal ist wie eine schöne Vorlesung aufgebaut.
1571000	1578000	Wenn ich unten Videos verlinke, dann wäre es angebracht, sich die auch reinzuziehen, weil das aufeinander aufbaut.
1578000	1581000	Bestimmte Begriffe werden definiert, viele Beispiele werden genannt.
1581000	1590000	Und ja, ich denke mir schon was dabei, weil es sozusagen meinen eigenen Erkenntnisprozess abbildet, die Reihenfolge, in denen ich die Videos hier hochlade.
1597000	1602000	Das war's für heute. Bis zum nächsten Mal.
