start	end	text
0	19000	Derjenige, der seinen Trieb verleugnet, verleugnet genau das, was ihn zu Menschen macht.
20000	25000	So, ich erzähle euch jetzt mal eine Geschichte.
25000	31000	Als ich noch an der Uni war und noch bevor ich meine Doktorarbeit angefangen habe zu schreiben,
31000	36000	habe ich halt Forschung gemacht und ich saß mit meinen leisten Physiker-Boys in einem Büro
36000	39000	und wir sind in die Mensa gegangen und haben da immer gegessen, jeden Tag.
39000	46000	Und einmal hatte einer von den Boys, das war so ein Kloppertyp, der gerne zum Jiu-Jitsu geht
46000	52000	und auch so übelst wie Sport macht und der hatte einen Klopperkumpel dabei, also einen aus seiner Sportgruppe oder so.
52000	55000	Und der saß mit bei uns und hat mit gegessen.
55000	63000	Und der hat pausenlos die ganze Zeit erzählt, was er für ein geiler Typ ist, was er schon für Tussis gefickt hat
63000	68000	und dann kamen irgendwelche Tussis vorbei und der hat ihnen auf den Arsch geguckt und hat die ganze Zeit so gedacht,
68000	73000	die sieht aber geil aus und die sieht geil aus, die hat ja geile Titten und die ganze Zeit nur diesen Scheiß.
74000	78000	Und irgendwann habe ich zu ihm gesagt, sag mal, was bist du eigentlich für ein armes Würstchen,
78000	82000	dass du dein ganzes Leben lang scheinbar nur darauf ausrichtest, wie irgendwelche Tussis aussehen
82000	85000	und ob du die jetzt ficken willst, hast du eigentlich nichts besseres zu tun, sag mal.
85000	91000	Weil, ihr müsst euch klar machen, normalerweise gingen wir in die Mensa und wir sind da die vier Nerds gewesen
91000	99000	und wir haben uns über was, was eigentlich lustige mathematische Wikipedia-Artikel unterhalten, zum Beispiel die Wurstkatastrophe.
99000	104000	Da könnt ihr ja mal euch reinziehen, was das ist. Oder andere Dinge, oder was weiß ich, Quantenmechanik.
104000	114000	Wir haben halt über Nerdsachen geredet, richtige Nerdsachen, nicht hier Big Bang Theory, was ist letztens passiert mit Sheldon und Penny, sondern Nerdsachen.
114000	120000	Und auf einmal war da dieser Typ und der hat die ganze Atmosphäre gedrückt mit seinem dummen Schwachsinngehabe.
120000	131000	Und jedenfalls habe ich ihm klar gemacht, dass ich das total armselig finde, wenn Leute so tun, als wäre ihr komplettes Leben darauf ausgerichtet, endlich mal einen wegzustecken.
131000	141000	Denn es ist nicht so, wie Maus sagt bei Matrix, wer das verleugnet, verleugnet genau das, was ihn zu Menschen macht.
141000	146000	Bei Matrix ist es halt so, da geht es ja darum, dass das sozusagen der Unterschied zwischen den Maschinen und den Menschen ist.
147000	152000	Aber das ist meiner Meinung nach eher das, was die biologischen Lebewesen ausmacht.
152000	159000	Wir sind aber als Spitze der Evolution natürlich eigentlich viel krasser, weil wir das ja schon längst überwunden haben.
159000	165000	Wir sehen ja, wie es läuft mit der Fortpflanzung. Und ich meine, es ist ja auch lächerlich, weil eh die ganze Zeit verhütet wird.
165000	175000	Das heißt, es geht sowieso nicht um Fortpflanzung bei uns. Es geht nur um Befriedigung niederer Instinkte. Und das ist halt relativ trivial.
175000	180000	Jedenfalls, dieser Typ kam mir vor wie ein echter Lappen und das habe ich ihm auch gesagt.
180000	186000	Und der war dann auch richtig down. Und mir ging es halt richtig auf den Sack.
186000	193000	Das hat mich richtig genervt, weil das hat mich erinnert an diese ganze Scheiße, die ich damals in meiner Kindheit schon gesehen habe und in meiner Jugend, als ich aufgewachsen bin.
193000	201000	Dass die ganzen Boys auf einmal zu solchen Übermachos mutiert sind und dachten, sie sind jetzt die Allergeilsten und sie müssen die ganze Zeit nur so in den Müll labern.
201000	204000	Dabei sind sie so klein mit Hut und totalen Pisser.
205000	209000	So und damit leite ich jetzt hier mal dieses Video ein.
210000	212000	Das ging mir nämlich damals richtig auf den Sack.
212000	219000	Und für mich ist es so, dass solche Leute, die ihr ganzes Leben darauf ausrichten, jetzt maximal richtig viel rumzufuhren,
219000	225000	also so wie das bei Two and a Half Men propagiert wird, was Charlie Sheen da gemacht hat,
225000	230000	dass das jetzt das oberste Ziel ist, dass das ein hammermäßiges Leben ist, das kann ich überhaupt nicht bestätigen.
230000	232000	Ich kann mich da auch überhaupt nicht reinversetzen.
232000	239000	Ich kann zwar verstehen, dass es Leute gibt, die das so sehen, aber die tun mir halt wirklich richtig leid, weil das ist echt peinlich.
239000	245000	Und ich habe ja schon mal erklärt in meinem Life Coach Video über toxische Beziehungen,
245000	250000	dass ich finde, dass das, was da abgeht, im Wesentlichen Kasualisierung ist.
250000	254000	Leute, die ihr Leben darauf ausrichten, sind meiner Meinung nach verraten sich selbst.
254000	258000	Und die reden sich dann ein, dass das ja hammermäßig ist, ganz viele Tussis zu ficken.
259000	263000	Aber das ist halt völlig trivial. Ich meine, das ist eine Fotze, da fickt man rein.
263000	266000	Die sehen alle im Wesentlichen gleich aus. Die fotzen. Das Gefühl ist immer das gleiche.
266000	268000	Der einzige Unterschied ist, das sieht anders aus.
269000	272000	Die riecht anders. So ein Scheiß.
272000	279000	Dann hat man irgendwie das Knistern und das Jagdgefühl und diesen ganzen Schwachsinn, was die Leute so erzählen.
279000	281000	Das kann ich schon verstehen, dass das auch irgendwie Spaß macht.
281000	284000	Aber wenn das alles ist, dann ist es halt wirklich echt richtig traurig.
284000	287000	Aber das ist das, was aus unserer Gesellschaft kommt.
287000	290000	Unsere Gesellschaft kriegt es einfach nicht hin, den Leuten mal zu zeigen,
290000	293000	was man eigentlich mal richtig nice so mit seinem Gehirn veranstalten kann
293000	295000	und über was man so nachdenken könnte.
295000	299000	So, und jetzt erzähle ich euch mal ein bisschen, wie ich so aufgewachsen bin.
299000	306000	Also ich war schon immer, muss ich sagen, eher schon so ein Nerd, der über viele Sachen nachgedacht hat.
306000	311000	Und das ging schon in der Grundschule los, dass ich mir dachte, die anderen sind irgendwie zu doof.
311000	314000	Die raffen es nicht oder die sind abgelenkt durch Konsum oder so.
314000	320000	Und ich war natürlich nicht Teil der beliebten Jungs, die dann auch alle immer beim Fußball spielen waren und so.
320000	323000	Und da immer als erstes ins Team gewählt worden und so ein Scheiß.
323000	328000	Und natürlich wurde ich da auch teilweise ausgegrenzt und das ist alles überhaupt kein Problem, das kann man machen.
328000	332000	Ich hatte halt den Eindruck, dadurch, dass ich relativ arm war,
332000	336000	beziehungsweise meine Mutter mir nicht so viel Spielzeug geschenkt hat wie den anderen Fratzenkindern,
336000	338000	dass ich nicht so abgelenkt war durch Konsum.
339000	344000	Und dadurch war ich einfach smarter. Vielleicht war ich dadurch smarter, ich war vielleicht auch einfach so smarter, keine Ahnung.
344000	349000	Jedenfalls habe ich versucht, sozialen Status zu erlangen durch witzig sein.
349000	353000	Also ich war körperlich unterlegen, ich war halt kleiner als die normalen Boys, die da so waren.
353000	356000	Die haben mir halt auf die Schnauze gehauen, wenn ich rumgenervt habe.
356000	358000	Das heißt, ich konnte sozusagen nicht in diesem Wettbewerb bestehen.
358000	361000	Und vielleicht kommt daher auch meine Aversion gegen Wettbewerb.
361000	363000	Sehr wahrscheinlich ist das so.
363000	366000	Aber ich kann halt begründen, warum Wettbewerb scheiße ist.
366000	370000	Und ich habe dann halt versucht, irgendwie witzig zu sein und habe erkannt, dass das geht.
370000	374000	Also man kann sich sozusagen die Social Credits besorgen bei den Boys,
374000	381000	wenn man irgendwie Teil des Clubs wird durch nicht Teilharm am toxischen, am maskulinen Dasein.
381000	387000	Also Fußballclub gut finden und WWF gucken und Undertaker ist der beste.
387000	389000	Nee, Hulk Hogan ist der beste, so ein Scheiß.
389000	392000	Das habe ich bestimmt auch probiert in der zweiten, dritten Klasse,
392000	395000	aber da habe ich dann in der fünften Klasse wieder auch mal aufgehört oder so irgendwann.
395000	399000	Ich glaube, so in der fünften habe ich angefangen, meine Identität so zu entwickeln
399000	402000	und festzustellen, wo ich eigentlich hingehe.
402000	412000	Und ja, diese ganze Entwicklung, die ich war auch dann mit 14 relativ extrovertiert schon.
412000	413000	Ich hatte Chrono Dreadlocks und so.
413000	415000	Und mir war das wirklich scheiß egal, was andere über mich denken.
415000	417000	Zumindest habe ich mir das eingeredet.
417000	418000	Wahrscheinlich war das ein Konzept.
418000	422000	Ich wollte, dass die anderen denken, dass mir das egal ist, was die anderen denken.
422000	425000	Das war wahrscheinlich so ein Schutzschild, den ich mir dann aufgebaut hatte,
425000	430000	weil man ja wahrscheinlich mit diesem Status denken und mit diesem,
430000	432000	was denken die anderen über einen, damit wächst man auf als Junge.
432000	434000	Man muss irgendwie der Krasseste sein.
434000	436000	Man muss irgendwie gut dastehen.
436000	439000	Die anderen müssen denken, oh, das ist aber jetzt der Geilste von den Boister oder so.
439000	442000	Und ich denke mal, auf diese Schiene bin ich da gefahren.
442000	444000	Das wird wahrscheinlich der psychologische Hintergrund sein,
444000	447000	warum ich mich so entwickelt habe, gerade mit 14, 15.
448000	454000	Und später, mit 22, wo ich schon der totale Alpha-Mehl war,
454000	457000	weil ich einfach davon überzeugt war, dass ich wirklich der Smarteste von allen bin
457000	460000	und die können mir alle überhaupt nicht das Wasser reichen, weil ich der Krasseste bin.
460000	464000	So im dritten Semester an Physik zum Beispiel, da dachte ich halt wirklich, ich bin der Geilste.
464000	471000	Da war es so, dass ich hatte in meiner Studentenbude immer Party und zwar immer saufen.
471000	475000	Und ich war so eine Art Goldstandard für die anderen, für die Bewertung von anderen Leuten.
475000	479000	Ich war so eine Art Alpha-Mehl, der oben auf dem Thron drauf saß und auf die anderen runtergerillt hat.
479000	481000	Wenn jemand irgendwie doof war, sich doof benommen hat,
481000	484000	irgendwas nicht verstanden hat, irgendwie einen Witz nicht gecheckt hat
484000	487000	oder irgendwie einfach zu doof war, dann habe ich den rund gemacht.
487000	491000	Und alle haben sich irgendwie so mobbingmäßig, also nicht mobbingmäßig,
491000	495000	ich meine wir waren alle im Freundeskreis, aber trotzdem, so im Nachhinein würde ich sagen,
495000	499000	dieses ganze Klima war ein bisschen toxisch irgendwie.
500000	506000	Ich würde sagen, da habe ich toxische Maskulinität ausgeübt, könnte ich mir vorstellen.
506000	514000	Aber sonst, jedenfalls durch mein Nerd aufwachsen, gerade so mit 14, 15, 16,
514000	520000	hatte ich eine ganz andere Perspektive auf Sexualität und diese klassischen Stereotypen, die sich da entwickelt haben.
520000	525000	Ich war gar nicht Teil davon, ich wollte da auch nicht Teil von sein, ich habe das eher beobachtet.
525000	530000	Und ich habe beobachtet, wie sich die Jungs verändern und wie sie ihr Verhalten anpassen
530000	535000	und wie dieser Gruppendenk auch zustande kam und dass auf einmal die Weiber sich alle gruppiert haben
535000	540000	und die Jungs auf einmal alle gruppiert haben und so auf dem Schulhof so eine Dynamik entstand.
540000	543000	Und wie das alles so gewachsen ist, da habe ich dann auch später noch drüber nachgedacht,
543000	550000	das hat mich wirklich nicht losgelassen, dass nur dieser Sexualtrieb alleine so einen Unterschied macht.
550000	555000	Dass das irgendwie so krass ist bei der menschlichen Entwicklung.
555000	561000	Und was hat mich jetzt an diesen Stereotypen, an diesen klassischen Stereotypen so gestört?
561000	566000	Das Problem, dass Leute erstmal die Reduktion von Komplexität betreiben,
566000	572000	sie reduzieren jemand auf seine isexuelle Identität, in dem Fall du bist ein 14-jähriger Boy oder ein 15-jähriger
572000	576000	oder du bist eine Tussi und deswegen ist das und das und das.
576000	579000	Mich hat das genervt und ich wollte das auch selber nicht, dass Leute das machen.
579000	582000	Mir war das unangenehm, wenn Leute irgendwas geschlussfolgert haben.
582000	589000	Also ganz einfaches Beispiel, irgendwann in der 9. oder 8. Klasse haben die Weiber angefangen,
589000	593000	sich nicht mehr Hallo zu sagen, sondern die haben sich umarmt und die knutscht.
593000	597000	Und dann war das auch so, dass sie alle irgendwie abgeknutscht haben.
597000	603000	Und für mich war das so, was ist denn da jetzt los, kommt mal klar, verpisst euch mal mit eurem Scheiß.
603000	607000	Und habe ich nicht mitgemacht und ich denke im Nachhinein war es vor allem so,
607000	610000	weil für mich war das irgendwie schon zu intim.
610000	618000	Das war für mich schon so irgendwie, wenn man da mit reingeht in diesen Brauch,
618000	624000	in diese Tradition, die die da entwickelt haben, dann ist man irgendwie Teil des Wettbewerbs.
624000	628000	Also man wirbt dann mit den anderen Boys um die Tussis.
628000	632000	Und ich wollte bei dem Wettbewerb gar nicht teilnehmen, weil ich fand den affig.
632000	639000	Und deswegen habe ich das nicht gemacht, habe ich einfach immer so Hallo gesagt oder so, keine Ahnung.
639000	649000	Und selbst heute ist das für mich mit diesem Wettbewerb um Tussis.
649000	653000	Und ich sage mal jetzt der normale Alpha-Mail, der von sich behauptet,
653000	656000	also ich habe schon mit 50 verschiedenen Frauen geschlafen oder so.
656000	659000	Das ist für mich genauso wie G-Jack das sagt.
659000	666000	G-Jack sagt, One-Night-Dance und Sex mit vielen verschiedenen Frauen, das ist im Wesentlichen Masturbation.
666000	669000	Das ist eigentlich eine extrem gute Analogie.
669000	673000	Also ob Leute auf U-Porn sich einen abwechseln oder ob sie jeden Abend in eine Disco gehen,
673000	679000	sich eine Rennendrissi aufreißen und die dann ficken, das ist das Gleiche wie Masturbation im Wesentlichen.
679000	681000	Es ist bloß ein bisschen komplizierter.
681000	686000	Und aus irgendeinem Grund ist das eine total der Status und das andere nicht.
687000	692000	Und irgendwie diese Einstellung, die finde ich total nice, die G-Jack da geäußert hat,
692000	695000	das ist sowieso ein geiler Boy, ich bin totaler Fan von dem.
695000	697000	Der ist einfach witzig.
697000	701000	Und jetzt mal, ich habe jetzt mal noch was anderes.
701000	705000	Ich habe mir irgendwie so ein Gespräch von Philipp Hübel reingezogen.
705000	708000	Das ist so ein Philosoph, kennt er bestimmt oder auch nicht.
708000	715000	Und der sagt halt, naja, hier, Maskulin, das ist im Wesentlichen Aggression, starker Sexualtrieb.
715000	720000	Männer sind eher an Dingen interessiert und nicht an Personen.
720000	725000	Und Männer sind auch eher an Dominanz interessiert und an Hierarchien.
725000	728000	Also die stehen drauf, die ordnen sich gerne ein.
728000	731000	Und sie wollen auch gerne, dass die Ordnung bestehen bleibt.
731000	734000	Und das sage ich jetzt sozusagen.
734000	741000	Meiner Meinung nach ist es so, dass Männer irgendwie eher dazu tendieren, High-Risk-High-Revert-Strategien zu fahren.
741000	747000	Also mehr reinzugehen, mehr Risiko reinzugehen und dafür aber auch stärkeres Outcome zu haben.
747000	750000	Das spiegelt sich auch immer wieder in dieser Glockenprobe,
750000	754000	wo alle sagen, der EQ, der ist glockenförmig um 100 verteilt, bei Männern und Frauen gleich,
754000	756000	aber die Varianz bei Männern ist größer.
756000	760000	Also es gibt mehr super intelligente Männer, dafür gibt es aber auch mehr komplette Volltröpfel.
760000	762000	So ist das auch mit dem High-Risk-High-Revert.
762000	765000	Manchmal gewinnt man, manchmal verliert man, aber dann ist es gleich viel härter
765000	768000	und die Frauen gehen weniger Risiko, deswegen ist die Varianz kleiner.
768000	770000	So ungefähr ist das da auch.
770000	772000	Und jetzt ist die Frage, wieso?
772000	774000	Naja, das habe ich schon mal erwähnt.
774000	777000	Es gibt so eine ziemlich geile Doku von der Deutschen Welle, die ist aber nur auf Englisch,
777000	780000	über Testosteron und was das jetzt mal macht.
780000	783000	Testosteron ist jetzt nicht, dass es einfach nur aggressiv macht.
783000	787000	Das macht nur aggressiv, wenn man irgendwie auch noch unter Stress leidet.
787000	791000	Testosteron, was es im Wesentlichen macht, und das macht es schon bei kleinen Jungs,
791000	793000	das macht es schon als Baby.
793000	796000	Jungs haben schon mehr Testosteron als Mädchen.
796000	802000	Es macht einfach, dass das Bedürfnis nach sozialem Status höher ist.
802000	804000	Jungs wollen unbedingt sozialen Status haben.
804000	808000	Und daher kommt dieser Wettbewerbsschwachsinn, dieser Fetisch des Wettbewerbs.
808000	810000	Der ist in Jungs einfach stärker vertreten.
810000	814000	Natürlich gibt es immer Anomalien, also es gibt zum Beispiel Mädchen,
814000	817000	die überdurchschnittlich viel Testosteron haben,
817000	821000	und dann gibt es auch Jungs, die unterdurchschnittlich viel oder überdurchschnittlich viel Testosteron haben
821000	823000	und solche Sachen.
823000	825000	Es gibt jetzt auch interessante Messungen und Experimente.
825000	828000	Vielleicht finde ich noch ein paar Paper raus, vielleicht auch nicht.
828000	831000	Ich wollte eh noch mal irgendwann ein gesondertes Video dazu machen,
831000	837000	wie das mit der Biologie dazu ist, aber wie dem auch sei.
837000	841000	Es ist so, dass der Hübel jetzt so sagt, also der Philipp Hübel,
841000	844000	Zivilisation macht Männer im Prinzip femininer.
844000	850000	Und damit meint er jetzt, dass diese ganzen charakteristischen Eigenschaften,
850000	855000	Aggressivität, Sexualtrieb, mehr Dinge als Personen und Dominanz und Hierarchie,
855000	858000	dass die ein bisschen reduziert werden durch Zivilisation,
858000	862000	weil wir ja sozusagen den Urwaldmenschen oder was auch immer,
862000	866000	dem einfachen Mann, das jetzt hier aufzwingen mit unseren Gesetzen.
866000	870000	Wenn er könnte, dann würde der normale ungehobelte Pflege am liebsten
870000	874000	jede Tussi, die auf der Straße sieht, überwältigen und vergewaltigen.
874000	875000	So nach dem Motto.
875000	877000	Und das geht halt nicht wegen Zivilisation.
877000	881000	Das hat dann zu viele Konsequenzen und deswegen lassen die Börse das.
881000	884000	Das ist im Wesentlichen die Aussage.
884000	888000	Und angebracht als Beispiel werden dann immer die sogenannten feminine Kulturen
888000	891000	und Gesellschaften, also die skandinavischen Länder,
891000	895000	wo die Chancengleichheit am höchsten ist und die Gleichberechtigung auch am höchsten ist.
895000	898000	Und da kann man halt vor allem messen, dass diese ganzen Metriken,
898000	902000	die Lebenserwartung, Glück, sexuelle Zufriedenheit und dieser ganze Kram,
902000	906000	die sind da alle höher als im Rest der Welt.
906000	910000	Und daraus kann man im Prinzip Schlussvorgaben, na ja, es ist tatsächlich so,
910000	914000	dass diese sogenannte toxische Maskulinität tatsächlich toxisch ist.
914000	918000	Die wirkt auf all diesen Metriken auch als Symptom.
918000	923000	Das kann man dann beobachten, dass wenn das stärker ist, dass das dann scheiße ist.
926000	930000	Mehr Befriedung sozusagen, wenn man mehr Frieden hat und einfach mal soziale
930000	933000	ausgeglichenheit, dann ist einfach alles entspannter.
933000	937000	Man kann dann auch messen, da sind weniger Morde, da sind weniger Vergewaltigungen und so.
937000	943000	Und gegen diese Feminisierung oder so gibt es natürlich auch Gegenbewegungen,
943000	947000	zum Beispiel die ganzen religiösen, konservativen Fanatiker und so.
947000	951000	Oder die Inzels, die kotzen halt ab, dass sie jetzt nicht mehr rechtmäßig,
951000	954000	nur weil sie ein Mann sind, einfach eine Frau gestellt bekommen,
954000	960000	weil das Patriarchat nicht mehr so heftig durchknallt, weil es nicht mehr so stark ist.
960000	962000	Da kotzen die Leute darauf ab.
962000	967000	Und wenn Gillette mal so einen komischen Spot macht, da war ja irgendwie die große Aufregung.
967000	970000	Gillette hat einen Werbespot gegen toxische Maskulinität gemacht.
970000	973000	Da wurden sich Stübis drüber aufgeregt. Das finde ich super lächerlich.
973000	975000	Weil erstmal, wieso fühlt man sich davon angesprochen?
975000	977000	Ich fühle mich davon überhaupt nicht angesprochen.
977000	984000	Das ist wie damals, als die Ärzte diesen Song rausgebracht haben, Männer sind Schweine.
984000	987000	Da weiß ich noch, da war ich in der 6. Klasse oder so.
987000	991000	Und da gab es Jungs bei mir in der Schule, und die haben sich darüber aufgeregt.
991000	994000	Und dachten so, jetzt werden hier alle pauschal, alle Männer als Schweine beteiligt.
994000	996000	Da habe ich mir erst mal gedacht, löll, wieso fühlt man sich angesprochen?
996000	1000000	Du bist überhaupt kein Mann, du bist ein kleiner Junge, verpiss dich mal.
1000000	1003000	Und zum anderen, löll, da braucht man sich doch nicht angesprochen für.
1003000	1007000	Ich meine, offensichtlich ist da ein ganz bestimmter Stereotyp von Mann mit gemeint.
1007000	1010000	Nämlich derjenige, der Frauen belügt und sie dann fickt.
1010000	1013000	Und dann eine andere Frau belügt und die dann fickt.
1013000	1015000	Ein ganz normales dummes Macho-Gehabe halt.
1015000	1017000	Die sind damit gemeint.
1017000	1020000	Und ich meine, das ist ja bekannt, wie das läuft.
1032000	1034000	Wieso fühlen sich die Leute da angesprochen?
1034000	1036000	Na ja, wahrscheinlich weil dieser Gruppendenk so stark ist.
1036000	1039000	Ich bin ja Mann, das ist ja meine Identität, da fühle ich mich jetzt aber angesprochen.
1039000	1041000	Nee, tu ich überhaupt nichts, mir völlig egal.
1041000	1046000	Und es ist ja auch so, ich meine, wenn man ein dummes Arschloch ist
1046000	1050000	und gerne mal die Sekretärin anmacht, dumm oder so,
1050000	1054000	dann fühlt man sich natürlich auch angesprochen davon, weil man ein dummes Arschloch ist,
1054000	1056000	dann ist das ja auch berechtigt.
1056000	1061000	Und für mich ist das immer irgendwie schon, also abgesehen davon,
1061000	1064000	dass ich mit 20, 22 ein übelster Chauvinist war und Frauen für mich,
1064000	1068000	also für mich war so die Hierarchie, wenn du nichts kannst, dann bist du auch nichts wert.
1068000	1070000	Und für mich war es so, Frauen können nichts.
1070000	1074000	Das habe ich mit 20, weil ich das beobachtet habe, dachte ich, das ist sozusagen,
1074000	1077000	das ist der naturalistische Fehlschluss.
1077000	1081000	Weil es so beobachtbar ist, muss es auch so sein und alle Frauen sind so.
1081000	1083000	Das war sozusagen meine primitive Denke.
1083000	1086000	Und zu dem Zeitpunkt war mir das halt auch wirklich völlig egal.
1086000	1090000	Ich war halt so drauf, naja klar, man kann mit Frauen schon ficken,
1090000	1094000	aber da war ich dann auch ehrlich und ich habe da auch irgendwie keinen Rosenkranz drum gemacht und so,
1094000	1096000	ich war da ganz entspannt.
1096000	1102000	Ich war aber auch völlig befreit dadurch, weil ich niemals diesen Schwachsinn gemacht habe,
1102000	1106000	von wegen jetzt immer 100% kommitten, ein ganzes Wochenende in eine Disco gehen
1106000	1109000	und dann irgendwie die Tussis raussuchen und so.
1109000	1113000	Ich habe eine Tussi mitgenommen, wenn sie sich angeboten hat quasi.
1113000	1114000	Aber das war es.
1114000	1117000	Ich habe diesen ganzen Schwachsinn nicht mitgemacht, weil mir das viel zu anstrengend war.
1117000	1121000	Ich hatte halt besseres zu tun, zum Beispiel Nachdenken über Mathe oder Zocken.
1121000	1124000	Das war mein Shit, das hat mir viel mehr Spaß gemacht.
1124000	1127000	Und deswegen fühle ich mich von so einem Schwachsinn nicht angesprochen.
1127000	1131000	Und ja, dumme Arschlöcher, die das halt permanent machen,
1131000	1135000	also auch mit ihren dummen Anmachen ständig Frauen belästigen
1135000	1139000	und ihre Hierarchieposition, vielleicht wenn sie in irgendeiner Bürokratie super stark sind,
1139000	1142000	auf die Untergebenden runterscheißen und sie anmachen dumm.
1142000	1144000	Das ist halt wirklich das Problem.
1144000	1146000	Das ist das, was man mit toxischer Maskulinität meint.
1146000	1151000	Wenn man auf der Straße irgendwie Tussis hinterherpfeift, dann ist das halt eine Belästigung.
1151000	1153000	Das würde ich niemals machen.
1153000	1154000	Das habe ich auch damals nicht gemacht.
1154000	1159000	Ich war sozusagen aus diesem Jäger-Beute-Schema so raus, ich habe das niemals gemacht.
1159000	1162000	Deswegen habe ich alle Menschen gleich behandelt.
1162000	1165000	Ich habe mir vielleicht meinen Teil gedacht, so von wegen, oh Mann, ist die bescheuert
1165000	1167000	oder, oh Mann, was ist das für ein Volltrottel.
1167000	1171000	Aber natürlich habe ich sozusagen bei Leuten, die ich nicht kenne,
1171000	1173000	die habe ich bestimmt nicht in der Straßenbahn dumm angemacht
1173000	1178000	oder am besten noch mitten in der Nacht auf einer Straße ganz alleine irgendeine Tussi vollgequatscht,
1178000	1181000	damit die noch Panik kriegt und denkt, ich will die vergewaltigen oder so.
1181000	1186000	Ich meine, Leute, die das nicht sehen, die sind halt zu doof, sich mal an den anderen reinzuversetzen,
1186000	1190000	dass das vielleicht schwachsinnig ist und auch mal total unhöflich.
1190000	1196000	Ich meine, das ist halt sozusagen gegen die normale Menschenwürde,
1196000	1202000	Leute irgendwie so zu belästigen, dass sie, wenn sie Angststörungen haben,
1202000	1204000	da eine Angststörung entwickeln zum Beispiel.
1204000	1206000	Das kann man ja nicht wissen.
1206000	1210000	Also diese Welt war mir auch völlig unbekannt, abgesehen davon,
