start	end	text
2231000	2233000	ja.
2233000	2235000	Reingehauen ihr Boys.
2246000	2248000	Digga, steh am Start.
2248000	2250000	Hau dich alle platt.
2250000	2252000	Ich mach deine Mutter Messer von hinten.
2252000	2254000	Nimm mir Wurme.
2254000	2256000	Mach dich kalt. Mach dein Bruder
2256000	2258000	tot.
2258000	2260000	Digga, mach keinen Stress. Ich habe dicke Freunde.
2260000	2262000	Machen dich tot mit
2262000	2264000	Keule. Ich tot.
2264000	2266000	Du tot. Du im
2266000	2268000	Arsch.
2268000	2270000	Ich meine Bushiflo am Start. Aller fett.
2270000	2272000	Aller dick. Dick. Aller ficken.
2272000	2274000	Aller dick. Aller fett. Ich hau dir auf den Sack,
2274000	2276000	man. Fick deine Mutter. Fick dein
2276000	2278000	Vater. Fick deine Mutter nochmal.
2278000	2280000	Ich fick deine Mutter 10 Mal
2280000	2282000	hintereinander. Und wenn ich fertig bin,
2282000	2284000	dann fick ich deinen Vater. Und dann,
2284000	2286000	und dann fick ich meine Mutter.
2286000	2288000	Weil das ist mir egal. Aller, aller, aller,
2288000	2290000	aller. Digga, ich habe einen Haupt.
2290000	2292000	Du nur unreal. Weißt du deine Mutter?
2292000	2294000	Die steckt aus dem Arsch. Weißt du,
2294000	2296000	weißt du, dein Vater, er stinkt auch.
2296000	2298000	Alle deine Familie sieht
2298000	2300000	aus wie Scheiße.
2300000	2302000	Irgendwann
2302000	2304000	ey, zieh dir mal rein, ey,
2304000	2306000	Rhymes, aller. Rhymes und
2306000	2308000	Styles, aller. Skills und Styles
2308000	2310000	und Sonnüberhaus, aller. Ey,
2310000	2312000	zieh dir rein, alter, Rhymes, ey.
2312000	2314000	Ficken. Geld. Drogen. Nodden.
2314000	2316000	Und meine fette Styles,
2316000	2318000	aller. Zieh dir mal rein, aller. Ficken.
2318000	2320000	Geld. Drogen. Nodden. Und meine
2320000	2322000	fette Styles, aller. Zieh dir mal rein,
2322000	2324000	aller. Wenn ich deine Fresse sehe, fange ich
2324000	2326000	an zu kotzen. Wenn ich durch die Strassen
2326000	2328000	wander, denke ich, ich will Gott. Digga,
2328000	2330000	fick dich. Fick dich. Wenn ich bin frisch,
2330000	2332000	ich bin frisch, ich bin frisch.
2332000	2334000	Lalalalala.
2334000	2336000	Gewalt und Ficken, das ist mein
2336000	2338000	Lebensinhalt, ja, du Sau.
2338000	2340000	Fick dich. Dein Schwester, die hat gut
2340000	2342000	gepoppt. Ich habe sie genommen, von hinten
2342000	2344000	und von vorne. Alles gleichzeitig,
2344000	2346000	denn ich hab zwei Schwänze, denn ich hab
2346000	2348000	zwei Schwänze, ich hab zwei Schwänze.
2348000	2350000	Alles gleichzeitig, denn ich hab zwei
2350000	2352000	Schwänze, ich hab zwei Schwänze,
2352000	2354000	ich hab zwei Schwänze. Ey, man pitpult
2354000	2356000	zur Beiste im Kind das Gesicht,
2356000	2358000	weil es zu klein ist, um meine Platten zu kaufen,
2358000	2360000	Digga. Und wenn ich das jetztmal
2360000	2362000	mach, dann zahl ich nichts, weil es ist
2362000	2364000	dort und das ist gut, so Digga.
2364000	2366000	Ficken, Geld, Drogen, Noten
2366000	2368000	und meine fette Style, aller.
2368000	2370000	Sieh dir mal rein, aller. Ficken, Geld,
2370000	2372000	Drogen, Noten und meine fette
2372000	2374000	Style, aller. Sieh dir mal rein, aller.
2374000	2376000	Ficken, Geld, Drogen, Noten
2376000	2378000	und meine fette Style, aller.
2378000	2380000	Sieh dir mal rein, aller. Ficken,
2380000	2382000	Geld, Drogen, Noten und meine
2382000	2384000	Fette Style, aller. Sieh dir mal rein, aller.
2388000	2391960	Alter, guck mal, mein Mercedes, Alter, guck mal, guck mal, ey, ey,
2392040	2394480	im Kofferloh, Alter, zehn Leichen von Babys.
2394560	2397000	Von Babys, von Nunden, von Obers und Scheiße.
2397080	2399920	Von unten und von kleinen Amseln, arme Känzchen, ey.
2400000	2402240	Arme Känzchen, hab ich kaputt geschossen.
2402320	2404800	Weil ich so'n geiler, fetter Dämer-Track.
2404880	2407280	Alter, ich bin so fett. Alter, zieh' dir rein.
2407360	2409920	Zieh' dir rein, du Däme, Alter, krass, Alter.
2410000	2412400	Ey, Alter, Bass, hörst du Bass? Ey, ey, ey.
2412480	2415040	Komm los, mein Computer. Ey, ey, ey, komm los, mir.
2415120	2417680	Hab ich selber erfunden, ey, vor tausend Jahren.
2417800	2419280	Hab ich was erfunden, ey.
2419360	2421600	Musik hab ich auch erfunden, yeah, yeah.
2422200	2425520	Bing, g Bulgar Nunden, und meine fetten Styles, Alter.
2425600	2426760	Zieh' dir rein, Alter.
2427200	2430600	Bing, g Bulgar Nunden, und meine fetten Styles, Alter.
2430680	2432000	Zieh' dir rein, Alter.
2432280	2435720	Bing, g Bulgar Nunden, und meine fetten Styles, Alter.
2435800	2437300	Zieh' dir rein, Alter.
2437960	2441180	Bing, g Bulgar Nunden, und meine fetten Styles, Alter.
2441280	2442480	Zieh' dir rein, Alter.
2442840	2444640	Bing, g Bulgar Nunden.
2444640	2459520	Übrigens, der Kanal ist wie eine schöne Vorlesung aufgebaut.
2459520	2465240	Wenn ich unten Videos verlinke, dann wäre es angebracht, sich die auch reinzuziehen,
2465240	2466560	weil das aufeinander aufbaut.
2466560	2469120	Bestimmte Begriffe werden definiert, viele Beispiele werden genannt.
2469120	2474920	Ich denke mir schon was dabei, weil es meinen eigenen Erkenntnisprozess abbildet,
2474920	2477040	die Reihenfolge, in denen ich die Videos hier hochlade.
