start	end	text
1277040	1278840	Ist das für dich legitim?
1278840	1283640	Ich glaube, es ist relevant, was du mit vorbeugend und was du mit einschüchtern meinst,
1283640	1290040	weil Notwehr, also in demokratisch wehrhafter Notwehr zu handeln, ist auch geschützt,
1290040	1292440	also ist auch ein Recht, das Menschen haben.
1292440	1295040	Jetzt ist die Frage, ab wann gilt eine Notwehr als Notwehr
1295040	1302040	und ab wann gilt ein Einschüchtern als Überschreiten der körperlichen Souveränität einer Person beispielsweise
1302040	1305440	oder auch moralischen Souveränität einer Person.
1305440	1309840	Wenn du aber direkt fragst, ist es erlaubt, einen Nazi zu schlagen,
1309840	1311840	ist es erlaubt, zu punchen Nazi,
1311840	1314840	also ich würde nie an den Menschen Gewalt antun.
1314840	1319240	Wenn jemand einen Nazi irgendwie boxt oder so, um mich zu schützen,
1319240	1322840	dann sage ich auch nicht, das ist nicht in Ordnung, sondern bin dankbar, dass er das macht.
1322840	1326840	Das ist aber eine sehr, wie soll ich sagen, individuelle Darstellung dieses Problems,
1326840	1328440	das ein bisschen komplexer ist.
1328440	1331440	Und ehrlich gesagt, hast du die Frage auch nicht 100 Prozent beantwortet?
1331440	1336040	Nein, weil ich eine definitorische Ungenauigkeit anklage in deiner Frage.
1336040	1340040	Naja, du hast das Wort vorbeugend einfach rausgenommen und hast sie dann beantwortet.
1340040	1345040	Wenn jemand den Nazi boxt, bevor er dir Gewalt antut und sagt, sonst hätte er es getan.
1345040	1346640	Das heißt ja vorbeugend.
1346640	1348440	Dann verstehe ich deine Frage auch.
1348440	1350440	Nein.
1350440	1351440	Würdest du?
1351440	1353040	Ich glaube auch nicht.
1353040	1355240	Aber es ist eine knappe Entscheidung.
1355240	1358440	Und ich finde, es lohnt sich, ganz genau darüber nachzudenken oder zu diskutieren,
1358440	1361640	wie man zu der Entscheidung kommt.
1361640	1366040	Jakob Springfeld, das ist der Autor eines Buches namens Unter Nazis,
1366240	1370440	jung Ostdeutsch gegen rechts, damit ist, glaube ich, auch schon ungefähr erklärt,
1370440	1375840	worum es darin geht und wo er herkommt, hat einen sehr guten Thread of Twitter geschrieben,
1375840	1379840	den wir auch verlinken, in dem er das auf verschiedenen Ebenen ganz praktisch,
1379840	1384240	lebensbiografisch durchgegangen ist, weil er eben unter Nazis sehr gelitten hat
1384240	1386640	und dann ein Buch darüber geschrieben hat und jetzt Lesungen im Osten macht
1386640	1388840	und jetzt wieder bedroht wird und so weiter und so fort,
1388840	1394040	aber auch intellektuell, finde ich, sehr lesenswert dekliniert hat.
1394040	1397240	Und er hat gesagt, wenn man jetzt den demokratischen Konsens hat,
1397240	1398840	auch allein aus der deutschen Geschichte heraus,
1398840	1405640	dass NationalsozialistInnen in Deutschland nur mit Gewalt gestoppt werden konnten damals
1405640	1408640	und man sie hätte auch schon, das ist jetzt mein Zusatz,
1408640	1414040	viel früher hätte stoppen sollen und das Widerstand gegen die historischen Nazis
1414040	1418440	Pflicht gewesen wäre, zumindest unbedingt Not getan hätte.
1418440	1420240	Was folgern wir denn für das Heute daraus?
1420240	1422840	Und er erkennt zwei Antwortmuster.
1422840	1427240	Erstens, entweder der Nationalsozialismus heute ist besiegt,
1427240	1428440	wir leben in einem Rechtsstaat
1428440	1432440	und jede Form der antifaschistischen Selbstorganisierung ist antidemokratisch,
1432440	1435440	also man darf sich nicht ermächtigen gegen potenzielle Nazis
1435440	1437240	oder zweitens, andere Möglichkeit,
1437240	1440840	die Gefahr des Nationalsozialismus war und ist niemals gebannt,
1440840	1443640	auf Staat und Behörden sollten wir uns nie blind verlassen.
1443640	1450640	So und ich finde, wenn man jetzt, ja jetzt sage ich doch vielleicht irgendeine Zahl,
1450640	1458240	wenn man sich dann vor Augen hält, dass seit 1990 es 219 Todesopfer rechter Gewalt in Deutschland gab,
1458240	1459840	muss man ja einfach mal feststellen,
1459840	1464640	Nazis sind da, sie existieren heute in Deutschland zu Zehntausenden und sie morden.
1464640	1467240	Das ist ein Fakt, um den kommt man nicht herum.
1467240	1470240	Und dann muss man ja als Bürgerin sozusagen,
1470240	1473240	sich diese zwei Antwortmöglichkeiten wieder vor Augen halten und sagen,
1473240	1475240	naja, erstens kann ja dann schon mal nicht sein,
1475240	1478640	der Nationalsozialismus ist anscheinend nicht endgültig besiegt
1478640	1481440	und wir leben zwar in einem Rechtsstaat,
1481440	1484440	aber der schafft es nicht, ihn zu besiegen.
1484440	1488240	Der schafft es nicht, alle Bürgerinnen vor den Nazis zu beschützen.
1488240	1492240	219 Bürgerinnen hat er nicht davor beschützen können.
1492240	1495440	So und dann muss ja der nächste Schritt eigentlich sein,
1495440	1501040	naja, mindestens wenn es darauf ankommt, muss ich mich wehren und mich und andere schützen dürfen.
1501040	1503040	So, das ist die Notwehrsituation.
1503040	1505440	Und zwar auf irgendeine Form tätlich,
1505440	1511440	weil wir haben ja festgestellt, ohne Gewalt hat es noch nie funktioniert und wird es nicht funktionieren.
1511440	1512440	Leider.
1512440	1514440	So und das führt ja direkt in dieses Dilemma,
1514440	1517840	dass wir sagen, wir müssen besser sein als die und wir müssen die Werte und Normen,
1517840	1522040	an die wir glauben, wie zum Beispiel Rechtsstaat ohne Selbstjustiz in diesem Fall
1522040	1526840	und die wir zu verteidigen angeben, auch selbst achten und beachten.
1526840	1529640	Dazu gehört, dass ich darf keine Selbstjustiz üben
1529640	1533840	und ich darf vor allem keine Strafe ohne Urteil akzeptieren.
1533840	1536040	Das geht nicht nach unseren Werten.
1536040	1540440	So und andererseits weiß ich, wenn ich diese Haltung strikt durchhalte,
1540440	1543240	dann riskiere ich Opfer zu werden oder dass andere Opfer werden,
1543240	1545440	weil sehen wir ganz pragmatisch.
1545440	1550240	Und dann höre ich eben Stimmen wie Jakob Springfeld oder auch Lalo Sander,
1550240	1553840	das ist ein Chef vom Dienst von der Tat, der einen tollen Text geschrieben hat
1553840	1560240	über seine Zeit in Leipzig als migrantisch gelesene Person und wie wenig der Staat da schützen konnte.
1560240	1562640	Und die sagen natürlich jetzt Wunder mal im Jahr.
1562640	1565840	So, wenn ich jetzt hier schön Berlin-Berndslauer Berg sage,
1565840	1567840	jetzt dürft ihr doch nicht machen, müsst euch doch,
1567840	1570840	du musst doch die Polizei machen und sagen dir, zieh mal da ein Jahr hin.
1570840	1574240	So und dann bleib mal friedlich, auch in deiner Geisteshaltung.
1574240	1579640	Und das finde ich so interessant auch an Lina E.'s Biografie, die aus Kassel kommt,
1579640	1584840	in der der NSU 2006 auch mordete, Verfassungsschützer war mit am Tatort damals
1584840	1588040	und erst fünf Jahre später flog die Terror-Serie wirklich auf
1588040	1590240	mit den wahren Hintermännern und Frauen.
1590240	1593840	Und das soll Lina E. wohl auch politisiert haben.
1593840	1599640	Und finde ich, dann wird irgendwo eine, auf eine Art stringentere Kette daraus,
1599640	1602240	als wenn man das Ganze nur vom Ende betrachtet, in dem man sagt,
1602240	1606240	das große Problem ist als erstes, es gibt Nazis, sie morden,
1606240	1609040	es gibt Staat und Polizei, die uns alle davor schützen sollen
1609040	1611640	und sie versagen dabei immer wieder.
1611640	1616240	Jetzt hat man ein Problem und der militante Antifaschismus,
1616240	1619440	das in Anführungszeiten, Linksextreme, was jetzt so hart verfolgt wird,
1619440	1620840	ist eine Reaktion darauf.
1620840	1623440	Und ich finde, das muss man schon einmal klar machen,
1623440	1629040	bevor man sich ein ethisches Moralphilosophisches urteilt.
1629040	1634840	Absolut, aber genau, du adressierst ja genau das Dilemma, das falsche Wort.
1634840	1641040	Es ist eine Dysfunktionalität in unserem System, institutionell, strukturell,
1641040	1644440	auch ideologisch, wenn nach wie vor sehr viele Leute die Gefahr
1644640	1648040	mehr im Linksextremismus sehen wollen auch teilweise,
1648040	1650640	auch medial befeuert als im Rechtsextremismus,
1650640	1654040	der ja, wie du dargelegt hast, statistisch die viel größere Gefahr,
1654040	1658440	die reale, existenzbedrohende Gefahr darstellt.
1658440	1660840	Ja, jetzt hast du mit dem Wasserfarbmalkasten genau
1660840	1662640	etwas sehr Feines gemalt.
1662640	1663240	Vielen Dank dafür.
1663240	1667440	Es ist eine gesellschaftlich-politische Dysfunktionalität,
1667440	1670240	die uns in ein moralphilosophisches Dilemma führt.
1670240	1670840	Ja, exakt.
1670840	1671840	Weil es keine gute Lösung gibt.
1671840	1676040	Genau, weil das war gerade mein Einwand sozusagen,
1676040	1678240	der dir aber gar nicht widersprechen sollte,
1678240	1682240	sondern wir haben einen Konflikt zwischen Wehrhaftigkeit
1682240	1685040	einer Demokratie, Funktionalität des Staates,
1685040	1687040	welcher aber hier versagt sozusagen,
1687040	1691840	einem Rechtssystem, was bestimmten Regeln folgen muss
1691840	1694840	und dann beispielsweise eine Radikalisierungsbiografie
1694840	1698840	nicht in dem Maße berücksichtigt oder eine Statistik nicht in dem Maße
1698840	1701440	berücksichtigt, wie es eigentlich ethisch geboten wäre.
1701440	1703840	Und politisch geboten wäre zu tun,
1703840	1706840	weil die Institution an dieser Stelle sagt,
1706840	1710040	ich bin in der Funktion eben nicht politisch zu sein,
1710040	1714040	beispielsweise, oder eine demokratische Wehrhaftigkeit
1714040	1717840	durch, in Anführungszeichen, Parteienahme zu unterstützen.
1717840	1720240	Und das führt dann aber zu einem Urteil,
1720240	1722240	was nicht nur sich ungerecht anfühlt,
1722240	1725840	sondern meines Erachtens oder meiner bescheidenen Meinung nach
1725840	1729240	einfach als Bürgerin von außen betrachtet ungerecht ist,
1729240	1732040	weil das ist der andere Faktor, Menschen,
1732040	1736440	die dieselben Taten tun, aber einen anderen Überbau haben,
1736440	1738840	einen, der vermittelt, dass es keine angeblich
1738840	1741640	staatsfeindliche Handlung war, was ja Teil der Begründung war,
1741640	1745840	eben bei Lina E., weniger streng bestraft werden.
1745840	1748840	Und dann vor dem Hintergrund, dass aber ausgerechnet
1748840	1750840	ihre politische Linie viel gefährlicher ist,
1750840	1754440	offenbart eine so komplette Karambolage dessen,
1754440	1755840	was eigentlich hier verhandelt wird.
1755840	1757240	Also worum geht es hier eigentlich?
1757240	1759040	Das ist genau gemeint mit dem Gründen
1759040	1761440	einer kriminellen Vereinigung.
1761440	1764440	Ich verstehe juristisch, warum es so gelabelt wird,
1764440	1766240	aber man könnte dann auch sagen,
1766240	1769640	sie versuchen zukünftige Opfer
1769640	1773240	eines rechtsextremistischen Terrorismus zu schützen.
1773240	1775240	Und inwiefern ist das eine kriminelle Vereinigung?
1775240	1778840	Und dann sind wir fast wieder auch bei den Aktivistinnen,
1778840	1782440	die sich auf die Straße kleben und eben als kriminelle Vereinigung gelten,
1782440	1784640	obwohl sie eigentlich das Grundgesetz nicht nur schützen,
1784640	1786840	sondern alle Institutionen daran erinnern,
1786840	1788240	dass sie sich daran zu halten haben.
1788240	1789840	Ich wollte gerade sagen, die Frage stellt sich
1789840	1791840	die letzte Generation in den letzten Worten auch.
1791840	1793640	Was ist eigentlich eine kriminelle Vereinigung?
1793640	1796640	Absolut. Und ich finde das auch in dieser kurzen zeitlichen Abfolge
1796640	1799040	interessant, dass das nicht rechtsphilosophisch
1799040	1801840	oder rechtsethisch mehr verhandelt wird.
1801840	1804240	Weil ich merke oder ich den Eindruck habe,
1804240	1808040	dass auch die deutsche Justiz da an semantische,
1808040	1810840	nicht semantische, aber an Bedeutungsgrenzen kommt,
1810840	1815440	dessen, was der Geist der von ihnen verteidigten Gesetze
1815440	1820840	und der von ihnen verteidigten Normen eigentlich meint und braucht und will.
1820840	1823840	Das heißt, ich habe den Eindruck, es findet hier einen Umsetzen
1823840	1826240	bestimmter Regularien sozusagen statt,
1826240	1828840	wenn man das jetzt so ganz bürokratisch denken möchte,
1828840	1832640	der aber nicht begreift, warum dieses System so funktionieren soll,
1832640	1834840	wie es funktioniert oder warum dieses System zur Stärkung
1834840	1836640	der Demokratie eigentlich da sein sollte
1836640	1839440	oder zur Stärkung oder zum Schutz der Gesellschaft.
1839440	1842840	Und deswegen für mich diese Woche eher großes Entsetzen
1842840	1845240	und das tiefe, tiefe Gefühl
1845240	1848040	einer großen Ungerechtigkeit, die hier stattgefunden hat.
1849440	1851640	Ich hatte gerade noch eine spontane Idee,
1851640	1852640	vielleicht ist das auch Quatsch,
1852640	1856640	aber zu der Frage, was ist eigentlich eine kriminelle Vereinigung,
1856640	1861240	sind nicht eigentlich schon drei Rechtsextremisten,
1861240	1862440	welcher Art auch immer,
1862440	1866240	die noch überhaupt nichts tun per se ideologisch
1866240	1868840	schon so etwas wie eine kriminelle Vereinigung?
1868840	1872640	Ich spreche jetzt nicht vom juristischen Paragraph 129,
1872640	1874840	da kenne ich mich viel zu wenig aus, da natürlich wahrscheinlich nicht,
1874840	1877040	aber da müsste man ihn eigentlich nachschärfen und sagen,
1877040	1881040	Leute, die glauben, dass es wertes und unwertes Leben gibt
1881040	1884840	und dass deswegen auch dieser Staat in Konsequenz abgeschafft werden sollte,
1884840	1888240	weil er anderer Meinung ist und sie dafür irgendwann verfolgen wird,
1888240	1889840	die sind per se kriminell.
1889840	1892640	Die sind, also ich weiß natürlich um die Problematik,
1892640	1895040	du kannst niemanden wegen seiner Gedanken verhaften
1895040	1896240	und auch das müssen wir aushalten,
1896240	1898240	das ist das nächste sozusagen auch juristische,
1898240	1900640	politiktheoretische, auch ethische Dilemma,
1900640	1903840	also das alte Toleranzparadoxo,
1903840	1906240	wir müssen die tolerieren, die uns nicht tolerieren würden,
1906240	1907240	sonst geht es nicht.
1907240	1913040	Aber trotzdem, würde es sich gerechter oder weniger ungerecht anfühlen,
1913040	1917240	wenn man zwar linksextreme Gewalt, sagen wir mal, bestraft,
1917240	1918440	vielleicht auch hart bestraft,
1918440	1920040	weil es war ja auch wirklich drastisch,
1920040	1921640	mit Hämmern auf Knochen und Schädel schlagen
1921640	1923040	ist jetzt auch kein Kavaliersdelikt,
1923040	1924240	so das wollen wir auch gar nicht behaupten,
1924240	1927840	aber dafür andererseits sozusagen viel, viel, viel, viel härter,
1927840	1929640	viel früher und viel abschreckender,
1929640	1933040	viel präventiver juristisch gegen Neonazis vorgehen würde.
1933040	1935640	Unbedingt, unbedingt und das ist ja,
1935640	1938240	das ist ja auch keine originelle oder neue Forderung von mir.
1938240	1941840	Das ist ja, darum ringen ja von Aktivistinnen
1941840	1943640	zu migrantisch gelesen Personen,
1943640	1947240	zu Communities in Deutschland seit Jahrzehnten,
1947240	1949440	dass eine strengere Rechtsprechung
1949440	1955040	in Bezug auf rechtsextremen Terror und Gewalt durch Neonazis erfolgt.
1955040	1957840	Und das meine ich aber auch mit Dysfunktionalität im System,
1957840	1961240	also angefangen von einer nach wie vor nicht stattgefunden
1961240	1964640	haben im Justizsystem Entnazifizierung,
1964640	1967240	nachzulesen bei Ronen Steinke sehr gut,
1967240	1971040	wo tatsächlich einfach dieser Prozess ausgesetzt worden ist
1971040	1976240	und man einfach gehofft hat, dass Moos derzeit die Probleme löst,
1976240	1978640	die es in den juristischen Apparaten gibt,
1978640	1980640	also in der Julikative schlussendlich gibt.
1980640	1983240	Und da geht es ja los, weil wer darüber entscheidet,
1983440	1985640	ob Gesetze eingehalten worden sind oder nicht
1985640	1989240	und darüber verfügen kann, wer bestraft wird oder nicht,
1989240	1992040	der kann auch festlegen, was eine Norm ist,
1992040	1995240	was eine Gesellschaftsnorm ist, was ein Gesellschaftsideal ist.
1995240	1999440	Und dementsprechend ist hier unglaublich viel politische Macht
1999440	2003440	versammelt zum Einhalten von, entweder zum Schützen entweder
2003440	2006240	von Privilegien oder zum Einhalten eines Status quo
2006240	2010240	oder zum auch Selbstschutz, also zum Schutz der ganzen Apparatur,
2010240	2012240	die diese Macht dort versammelt.
2012240	2016640	Und wenn ausgerechnet diese Machtkonzentration eben
2016640	2020040	auf juristischer Ebene nicht nur nicht genutzt wird,
2020040	2022440	um Menschen, die die Demokratie attackieren wollen
2022440	2025440	in Form von Rechtsextremismus, zu bestrafen,
2025440	2027840	sondern noch dazu missbraucht wird,
2027840	2032640	um Menschen auf der anderen Seite des politischen Spektrums
2032640	2035240	zu stigmatisieren und zu sanktionieren
2035240	2038640	und zu entmächtigen oder unmächtig zu machen,
2038640	2042640	dann sagt mir das unglaublich viel über die Gesellschaft
2042640	2046240	und das Land, in dem dieses juristische System operiert.
2046240	2049440	Dann sagt mir das sehr viel über eine innenwohnende Asymmetrie,
2049440	2052840	eine Wahrnehmung von Menschen in wertes und unwertes Leben
2052840	2056240	und einen noch nach wie vor vorherrschenden Autoritarismus
2056240	2057240	und ein Rechtsdreil.
2057240	2060840	Und das ist nicht nur problematisch ungerecht unfair,
2060840	2061840	sondern auch gefährlich.
2061840	2065840	Es ist auch gefährlich für die Integrität unserer Demokratie.
2065840	2067840	Ich weiß, die Urteilsverkündung war auch sehr lang.
2067840	2070240	Der Richter hat sich auch bemüht zu erklären,
2070240	2072240	wie er dazu kam und warum.
2074240	2078240	Ich habe gerade den größten Raben aller Zeiten hier auf meinem...
2078240	2081240	Entschuldigung.
2081240	2083240	Hoffen wir, er ist Linksextres.
2083240	2085240	Entschuldigung.
2085240	2089240	Er war so groß wie so ein kleiner Drachen.
2089240	2091240	Das kommt auch nicht vor.
2091240	2093240	Samira lässt sich sonst nie abwenden.
2093240	2094240	Überhaupt nicht.
2094240	2096240	Aber wenn man im Augenwinkel plötzlich etwas...
2096640	2100640	Wenn man denkt, Batman ist gerade auf den Blumenkasten geentert,
2100640	2102640	dann...
2102640	2104640	Crow vs. Samira.
2104640	2106640	Er hat sich bemüht.
2106640	2108640	Er war sich auch darüber gewahr
2108640	2110640	über die Bedeutung dieses Urteils,
2110640	2113640	auch über die öffentliche Rezeption und die mediale Rezeption.
2113640	2115640	Dementsprechend war er natürlich sehr bemüht,
2115640	2117640	genau zu erklären, wie er zu dem Urteil kam.
2117640	2121640	Aber das Wichtigste, finde ich, hat er eben nicht rausgearbeitet.
2121640	2124640	Warum im Verhältnis zu ihrer Verurteilung
2125040	2127040	andere Menschen,
2127040	2129040	die gesellschaftlich schlimmere Dinge machen,
2129040	2131040	nicht zu streng bestraft werden in Deutschland?
2133040	2137040	Samira, ich weiß, dass wir uns in einer Sache ähnlich sind.
2137040	2139040	Mindestens.
2139040	2141040	Wir schieben beide gerne unangenehme Dinge auf.
2141040	2143040	Was ist es bei dir vor allem?
2143040	2145040	Bei mir ist es vor allem die Altersvorsorge.
2145040	2147040	Ein super und sexy Thema.
2147040	2149040	Ich scheue mich davor, ich will es nicht machen.
2149040	2151040	Aber mithilfe der Clark-App ist es mir nun möglich,
2151040	2154040	mithilfe von Expertinnen die richtige Altersvorsorge zu finden.
2154440	2156440	Denn auch hier gibt es natürlich immer Luft nach oben.
2156440	2158440	Ist ja klar.
2158440	2160440	Wenn ihr das mal ausprobieren wollt,
2160440	2162440	gibt Clark allen Podcast-Hörerinnen
2162440	2164440	einen Shoppinggutschein von bis zu 30 Euro.
2164440	2166440	Dafür müsst ihr einfach nur die Clark-App runterladen
2166440	2168440	oder direkt auf die Webseite gehen.
2168440	2170440	Clark.de für Deutschland
2170440	2172440	oder goclark.at für Österreich
2172440	2174440	und den Gutscheincode Powerplay.
2174440	2176440	Alles groß eingeben.
2176440	2178440	Genau.
2178440	2180440	Ihr ladet dort einfach eure bestehende Versicherung hoch
2180440	2182440	und wenn ihr zwei Versicherungen hochladet,
2182840	2184840	bekommt ihr sogar 30 Euro Gutscheine
2184840	2186840	für Brands wie beispielsweise
2186840	2188840	Apple, Zalando, den App Store
2188840	2190840	und viele weitere Marken.
2190840	2192840	Aber ihr könnt das Ganze natürlich auch spenden.
2192840	2194840	Alle Teilnahmebedingungen und alle Infos
2194840	2196840	findet ihr in den Show Notes.
2196840	2198840	Was bei diesem Prozess
2198840	2200840	und dem ganzen Drumherum
2200840	2202840	ja immer wieder sehr explizit
2202840	2204840	und sehr eindeutig wurde,
2204840	2206840	ist die Kritik an der Polizei.
2206840	2208840	Also an verschiedenen Orten in Deutschland.
2208840	2210840	Vor allem aber auch eben
2211240	2213240	im Osten, wo sie funktionieren müsste.
2213240	2215240	Wo sie heftige Gegenwerte bieten müsste.
2215240	2217240	Wo sie Neonazis
2217240	2219240	und ihre Ideologie unterbinden müsste.
2219240	2221240	Und das funktioniert nicht.
2221240	2223240	Das haben wir schon festgestellt
2223240	2225240	und oft drüber gesprochen.
2225240	2227240	Und in diesem Kontext
2227240	2229240	scheint es ja dann nochmal bitterer,
2229240	2231240	weil sie offensichtlich kann.
2231240	2233240	Ist ja keine Frage von Kompetenz.
2233240	2235240	Die alte Frage
2235240	2237240	Inkompetenz oder Boshaftigkeit.
2237240	2239240	Ist sie wirklich auf dem rechten Auge blind
2239640	2241640	oder hält sie sich jetzt zu?
2241640	2243640	Und wir sehen ja jetzt daran,
2243640	2245640	dass sie mit großen Mitteln
2245640	2247640	sehr effektiv
2247640	2249640	gegen kriminelle
2249640	2251640	mutmaßliche Straftäter
2251640	2253640	vorgehen kann.
2253640	2255640	Und das tut sie gegen rechts eben nicht.
2255640	2257640	Und deswegen wollten wir heute dann
2257640	2259640	mit einer sanften Verspätung
2259640	2261640	noch über den Fall Bahar Aslan sprechen.
2261640	2263640	Und darüber,
2263640	2265640	wie wohl wir uns aus verschiedenen Perspektiven
2265640	2267640	eigentlich mit Polizei fühlen
2268040	2270040	in Deutschland in diesen Wochen.
2270040	2272040	Es tut mir leid, Samira,
2272040	2274040	aber weil der Fall schon ein bisschen her ist
2274040	2276040	und auch nicht ganz unkomplex,
2276040	2278040	musst du jetzt nochmal die Tafel wischen
2278040	2280040	und uns eine knappe Zusammenfassung geben,
2280040	2282040	was passiert ist.
2282040	2284040	Okay, wir hatten die Situation,
2284040	2286040	dass Lehrerin und Polizeidozentin
2286040	2288040	Bahar Aslan auf Twitter gesagt hatte,
2288040	2290040	sie hat über eine Situation berichtet,
2290040	2292040	in der sie Angst hat,
2292040	2294040	wenn sie von der Polizei kontrolliert wird,
2294040	2296040	dass ihr das Herz schneller schlägt.
2296440	2298440	Ich fand, dass sie das als Polizeidozentin sagt,
2298440	2300440	die eben Anti-Rassismus-Workshops
2300440	2302440	unter anderem oder interkulturelle
2302440	2304440	Kommunikation unterrichtet.
2304440	2306440	Und sie schrieb dann unter anderem,
2306440	2308440	dass sie hofft, dass dieser braune Dreck
2308440	2310440	in der Polizei
2310440	2312440	endlich wegkommt, sinngemäß.
2312440	2314440	Und was darauf folgte,
2314440	2316440	war eine konservative Kampagne,
2316440	2318440	muss ich sagen, mit strategischem Missverstehen,
2318440	2320440	weil der Tweet willentlich
2320440	2322440	falsch gelesen worden ist
2322440	2324440	und behauptet wurde, dass sie gesagt habe,
2324840	2326840	die Personen dort seien brauner Dreck.
2328840	2330840	Und Ähnlichkeiten mit dem Fall
2330840	2332840	Hengameh-Jagobi-Facher rein zufällig,
2332840	2334840	aber auch da natürlich
2334840	2336840	eine Frage an die Lesekompetenz
2336840	2338840	der konservativen Journalistinnen,
2338840	2340840	ob sie die Sachen,
2340840	2342840	die sie kritisieren, auch mal richtig lesen.
2342840	2344840	Da ging es darum,
2344840	2346840	dass sie behauptet haben soll, Polizisten seien Müll
2346840	2348840	oder gehörten auf dem Müll.
2348840	2350840	Und das ist auch nicht das,
2350840	2352840	was sie in ihrer Taz-Glosse geschrieben hatte.
2353240	2355240	Dementsprechend bei Herr Aslan
2355240	2357240	hat natürlich die Kritik geübt
2357240	2359240	an rassistischen Strukturen
2359240	2361240	innerhalb der Polizei,
2361240	2363240	gegen die sie offensichtlich ankämpft.
2363240	2365240	Und ihr wurde eben unterstellt zu sagen,
2365240	2367240	die Polizisten seien nicht Müll,
2367240	2369240	sondern der braune Dreck.
2369240	2371240	Dann hat sie ihren Job verloren,
2371240	2373240	wurde gekündigt.
2373240	2375240	Das wurde inzwischen wieder aufgehoben,
2375240	2377240	weil sie eine Anwältin hat,
2377240	2379240	die dagegen Revision eingelegt hatte.
2379240	2381240	Und sie bat
2381640	2383640	Unterstützung. Dementsprechend
2383640	2385640	wurde ein Brief verfasst.
2385640	2387640	Einer der Verfassers, Stefan Anpalagan,
2387640	2389640	in dem
2389640	2391640	verschiedene Menschen,
2391640	2393640	insbesondere aus dem Bereich der
2393640	2395640	Kriminalforschung und Bereich des
2395640	2397640	Forschungs rund um das Polizieren
2397640	2399640	und auch die Rechtsetik,
2399640	2401640	aber auch Künstlerinnen und
2401640	2403640	Journalistinnen unterschrieben haben,
2403640	2405640	insgesamt 450 Personen, die
2405640	2407640	diesen Brief, um sich solidarisch zu zeigen
2407640	2409640	mit Baha Aslan und diese Kündigung
2409640	2411640	zu kritisieren, unterschrieben haben.
2411640	2413640	Und der Brief, der von der Zeit
2413640	2415640	veröffentlicht wurde, begann mit den Worten
2415640	2417640	Wir stehen unter der Polizei.
2417640	2419640	Das führte dazu, dass ein
2419640	2421640	Gru von Menschen, die
