start	end	text
4702920	4708040	sind da im Deutschen ja deutlich ähnlicher, dass man öfter in so einem Multiparteispektrum
4708040	4713480	unterwegs ist und da vor allem als Linke-Partei was reißen kann, wenn man halt mit den Leuten
4713560	4718360	in Kontakt ist konkret. Genau, das ist ja eigentlich schon der Shift zu unserem zweiten Punkt,
4718360	4721000	zu diesem Shift zum Organizing.
4721000	4727360	Ja, finde ich einen wichtigen Punkt, also es wird jetzt schon lange irgendwie immer mehr
4727360	4733800	darüber geredet in linken Kreisen, dass man irgendwie stärker ins Organizing muss, dass
4733800	4741000	man raus muss aus so den urbanen Wohlfühlzentren und stärker eben in Kontakt gehen muss mit
4741080	4745720	einem gesellschaftlichen Mainstream, mit gesellschaftlichen Gruppen, die vielleicht nicht der eigene
4745720	4752760	Freundeskreis sind und ich fand das in Bewegungskontexten oft irgendwie auch ein bisschen komisch,
4752760	4756680	weil ich mir so ein bisschen dachte, so okay, aber das, was Bewegungen gut können, ist
4756680	4763080	praktisch polarisieren, stark nach vorne gehen, Thema in den Diskurs bringen und warum sollen
4763080	4768080	wir da jetzt auf einmal nur noch Haustürgespräche führen oder in Gewerkschaften Mitglieder
4768160	4772400	werben. Aber ich bin mich überzeugt, ehrlich gesagt, mega in diesem Parteikontext, also
4772400	4776800	auch, dass man sagt, okay, vielleicht ist gerade nicht der große Bewegungsmoment, wir
4776800	4783040	gehen jetzt eher in diese Strukturen rein und versuchen da gezielt Leute einfach zu
4783040	4785360	gewinnen für ein größeres politisches Projekt.
4785360	4789880	Das finde ich auch zum jetzigen Zeitpunkt einfach in Bewegung irgendwie ziemlich interessant,
4789880	4794680	weil wir schon öfter auch diese Analyse hatten, dass eigentlich ein großer Bewegungszyklus
4794760	4799800	mit den Klimaprotesten dann zu Ende gegangen ist und was dann ja oft folgt oder was dann
4799800	4804200	auf eine Art und Weise auch folgen muss, ist halt eine Institutionalisierung, dass man sich
4804200	4808320	jetzt mit einer Partei und auch vielleicht sozusagen mit dem Organizing Drive in einer
4808320	4813640	Partei nochmal stärker auch in so einer Institutionalisierung von der linken Bewegung bewegt, also tatsächlich
4813640	4818760	sozusagen Menschen in eine Parteiverankerung bringt, die auch über die so ein bisschen
4818760	4823080	schwammige Zugehörigkeit zu einer Bewegung irgendwie hinausgeht und das finde ich auf
4823080	4827320	jeden Fall einen spannenden, aber auch einen total wichtigen Punkt und merke ich auch,
4827320	4831360	dass ich das interessant finde, dass man selber so zu erleben in diesem Zyklus.
4831360	4836320	Was ich dazu auch interessant fand, also es gab ja diese Debatte zwischen Ines Schwertner
4836320	4842840	und Mario Candeas und Mario Candeas, wo es so darum ging, in welche Richtung soll es
4842840	4848960	gehen und Ines Schwertner hat so sehr stark gemacht, wir brauchen jetzt die Organisierung
4848960	4854520	von unten der Beschäftigten irgendwie so ein bisschen so in die Richtung und ganz viel
4854520	4862120	Strukturaufbau und auf der anderen Seite so ein bisschen die Position war, naja wir brauchen
4862120	4867000	schon eine Partei, die sich eben auch stark an Bewegung orientiert, Bewegung unterstützt
4867000	4871520	und so weiter und ich habe das Gefühl, da wurde so ein Dualismus aufgemacht, der eigentlich
4871520	4877360	null dem gerecht wird, was da gerade passiert, also weil das jetzt Leute wie Litza, die kommen
4877360	4884680	eben ganz klar aus einem Bewegungshintergrund, gehen da jetzt rein, aber nicht mit dem Ziel,
4884680	4891080	das zu einer Bewegungspartei umzubauen, sondern auch dem Ziel, die Partei zwar kampagnenfähig
4891080	4896760	zu machen, aber gleichzeitig eben diese Arbeit vor Ort auch total wertschätzen und sagen,
4896760	4899960	da muss auch die Verankerung stattfinden, also ich habe das Gefühl, da werden manchmal
4899960	4906200	auch so Scheindebatten vom Zaun gebrochen und da sollte man eher einfach mal genau,
4906240	4909160	vielleicht ein bisschen genauer rangehen, um zu schauen, was da passiert, anstatt da so
4909160	4913040	irgendwelche Sachen gegeneinander zu diskutieren. Ja, finde ich einen spannenden Punkt und ich
4913040	4917680	finde das jetzt auch in diesem Erneuerungsprozess ziemlich spannend, weil die Frage jetzt auch
4917680	4921960	gerade ist, wenn diese Aktivisten in die Partei kommen, das sind ja Leute, die sind zum Teil
4921960	4926600	zumindest extrem gut qualifiziert auch schon im politischen Bereich, wie man dann eigentlich
4926600	4930400	das Onboarding dieser Leute so machen kann, dass man deren Wissen tatsächlich auch einsetzen kann
4930400	4937440	und so. Das ist nochmal ein ganz anderes Thema und vielmehr ein organisationsstrategisch internes
4937440	4941760	Thema, aber das ist aber auch, glaube ich, ziemlich wichtig und scheint aber auch so zu sein,
4941760	4946240	als ob zumindest jetzt im Fall von Litza, die ja gerade einen ziemlich guten Weg gefunden haben,
4946240	4953280	auch diese Bewegungs- und Kampagnenerfahrung zu nutzen. Ich glaube, sobald man sich in
4953280	4957800	Parteikontexten bewegt, da stellen sich ja diese organisationsstrategischen Fragen eben auch ganz
4957800	4963200	stark. Also wie baut man einen Prozess um, um so einen Tanker, wie eine Partei ein Tanker ist,
4963200	4968280	irgendwie umzusteuern oder umzubauen? Und ich finde, da haben sie eben auch ganz interessante
4968280	4974480	Ideen, wie die das organisieren. Ja, finde ich auch richtig interessant und auch sehr schlau gemacht,
4974480	4978080	dass es halt einmal diese Neuentritte gibt und die müssen natürlich in die Kreisverbände die
4978080	4983400	Menschen, weil die da ja auch konkret Sachen gestalten wollen und sollen. Und das ist aber
4983400	4988960	gleichzeitig müssen diese parallele Verankerung gibt der Neuen in so einer Struktur, wo die sich
4988960	4991960	noch mal untereinander austauschen können. Weil es ist wirklich krass, glaube ich, in eine Partei
4991960	4995760	zu kommen mit diesen ganzen Strukturen. Da gibt es tausends Geschäftsordnungen, es gibt ganz viele
4995760	5001280	Sachen, die muss man neu lernen und die sind nicht alle super spannend, weil viele davon auch
5001280	5007920	einfach sehr deutsch sind, im Falle sind des deutschen Parteienrechts und dann aber irgendwann
5007920	5010880	können und die sind auch wichtig. Die Leute, die jetzt in eine Partei eintreten, die wollen ja
5010880	5014960	vor allem aber erstmal was machen. Und dass man da so eine Vernetzungsstruktur schafft,
5014960	5019120	dass die Leute A. sich nicht so verloren vorkommen und B. aber vielleicht sich auch gegenseitig
5019120	5022840	unterstützen können und auch strategisch unterstützen können gegenseitig, wie sie
5022840	5027960	schaffen trotzdem schnell aktiv zu werden. Ja und ich finde aber auch, wo man noch mal einfach
5027960	5034680	auch ein bisschen spezifischer auch sich zu so Missionen committen kann. Also Leute, die heute
5034680	5040240	in Parteien eintreten, die wollen eben nicht diese Vereinsmeierei und irgendwie MTA und bla
5040480	5044840	und Kassenwart sein und so weiter, auch wenn es natürlich Leute gibt, Leute braucht, die genau
5044840	5050040	das machen. Also ich will jetzt gar nicht sagen, dass es unwichtig ist, aber es ist halt so eine
5050040	5055840	bestimmte Motivation, die da auch dahintersteht, denke ich mal. Sondern die wollen vielleicht eben
5055840	5060520	einfach Wahlkampf unterstützen oder die haben eben, wie du gesagt hast, schon total viel
5060520	5065920	Kampagnenerfahrung, die sie einbringen wollen. Und dann ergibt es natürlich Sinn, dass die Leute
5065920	5071760	sich da irgendwie überlokal oder überregional vernetzen können, um eine Kampagne zu machen mit
5071760	5077280	anderen Leuten, die Lust haben auf eine Kampagne, anstatt in seinem Kreisverband irgendwie zu
5077280	5081560	versuchen, die Leute, die schon seit 20 Jahren das immer alles genau so gemacht haben und es auch
5081560	5088240	weiter so machen wollen, mit denen jetzt zu versuchen, als so ich AG, was neu zu starten.
5088240	5092320	Das wird dann auf allen Seiten wahrscheinlich Frust mit sich bringen und da finde ich es
5092320	5097800	interessant, eben stärker zu gucken, wie kann man punktuell und auch so funktional differenziert,
5097800	5102920	also einfach so je nach Erwartung Leute zusammenbringen, die eben auf was bestimmtes
5102920	5108000	Bock haben. Das denkt, finde ich, so diese Parteiformen oder Politik in Parteien auch
5108000	5114320	noch mal ein bisschen weiter. Ja, das finde ich einen guten Punkt, aber ich fand auch den Punkt
5114320	5118200	total gut, dass die Leute natürlich trotzdem in Kreisverbände gehen, weil am Ende verändert
5118200	5122080	man so eine große Struktur wie eine Partei, verändert man schon auch durch Leute on the ground
5122080	5126680	und viele Menschen in der Linkspartei, das habe ich auch nochmal betont, haben auch Lust auf Wandel
5126680	5132720	und dass man da jetzt gut zusammenkommen kann, das finde ich auch einen total coolen Prozess.
5132720	5136080	Ja und ich glaube, es ist auch extrem wichtig, dass man da jetzt nicht einfach irgendwelche
5136080	5141080	Parallelstrukturen aufbaut und das dann so unverbunden miteinander steht und dann sich
5141080	5146000	nicht zu einem Projekt zusammenfügt. Also da ist ja auch gerade dieser Titel der Kampagne
5146000	5150840	Eine Linke für alle, finde ich auch gut gewählt, weil es eben schon zeigt, es geht nicht darum,
5150840	5155600	jetzt noch eine neue Strömung irgendwie mit reinzubringen, sondern Leute mitzunehmen,
5155600	5162480	Leuten Lust zu machen auf diese Veränderungen und da auch wirklich zusammen nach vorne zu gehen.
5162480	5167280	Ja, Valentin, jetzt haben wir jetzt schon relativ viel über diese Kreisverbände gesprochen,
5167280	5170640	dass es wichtig ist, dass da auch Leute hingehen. Wenn wir jetzt nochmal an die
5170640	5175200	Sprachnachrichten denken, die uns Leute geschickt haben, dann muss ich jetzt gerade nochmal daran
5175200	5180920	denken, dass ja schon nicht so wenige Leute eher so gesagt haben, sie treten jetzt ein,
5180920	5184160	weil sie glauben, es ist umgewichtig und weil sie auch glauben, es ist wichtig,
5184160	5187680	dass es eine linke Partei gibt, aber die jetzt gar nicht so dafür brennen,
5187680	5191080	sich in den Kreisverband einzubringen und ich frage mich, glaube ich, einfach gerade so ein
5191080	5195480	bisschen, also ja, ich glaube, ich frage mich so ein bisschen, was heißt das eigentlich für
5195480	5199880	eine Kampagne, die natürlich aber schon stark darauf angewiesen ist, dass Leute jetzt konkret
5199880	5204800	was machen. Ich glaube, das wird man sehen. Also ich glaube, es wird Leute geben, die haben
5204800	5209960	darauf Lust. Es gibt Leute, die haben darauf weniger Lust und ich glaube,
5209960	5216160	erstmal muss man jetzt einfach so darauf aufbauen, auf dieser Mobilisierung, die es irgendwie gerade
5216160	5219440	gibt und gucken, wie man die Leute so unterbringen kann, wie es zu ihnen passt.
5219440	5223760	Toll. Und dafür wiederum ist ja die Struktur jetzt auch eine Chance, dass es auch so ein
5223760	5228440	bisschen kampagnemäßigeren Strukturen gibt, wo Leute, die aus Bewegung kommen, vielleicht sich
5228440	5231520	auch ein bisschen mehr so einbringen können, wie sie es gewohnt sind und Lust haben.
5231520	5236840	Genau, wie sie es gewohnt sind, aber gleichzeitig finde ich, also habe ich jedenfalls auch den
5236840	5242000	Eindruck, dass es eben auch viele Leute gibt, die aus Bewegung kommen und Lust haben, genau das
5242000	5246760	jetzt auch zu lernen, was sie vielleicht noch nicht aus Bewegung kennen. Also es gibt auch
5246760	5252720	viel Interesse an Wissen, was schon vorhanden ist in der Partei. Genau, wir haben ja auch in den
5252720	5256720	Sprachnachrichten gehört, dass es Leute gibt, die eben auch total Bock haben jetzt auf diese neuen,
5256960	5262320	also Leute aus der Partei, die sagen, so das ist genau das, was wir brauchen und let's go.
5262320	5264440	Ja, besser kann es ja eigentlich auch nicht sein.
5264440	5270920	Voll. Wir haben euch ja in der Anmoderation schon versprochen, dass wir aber noch auf ein anderes
5270920	5275800	Thema ein bisschen eingehen wollen, nämlich die Proteste gegen die AfD. Und ich glaube, jetzt
5275800	5280240	vielleicht der Punkt, um das noch mal so ein bisschen zu machen. Wir dachten, dass es ja irgendwie
5280240	5284800	nicht sein kann, dass wir das Ganze jetzt so komplett unbesprochen lassen, was sich da tut,
5285080	5291480	weil ich erinnere mich noch an unsere vorletzte Folge, die wir mit Felix Kolb zu Strategien gegen
5291480	5296320	die AfD gemacht haben. Und da war so das Gefühl von uns noch so, okay, fuck, die AfD wird immer
5296320	5302840	größer, aber irgendwie tut sich total wenig auf der Bewegungsprotestebene. Und das hat sich jetzt
5302840	5306000	auf einmal schlagartig geändert. Was passiert da gerade?
5306000	5310880	Ja, es ist irgendwie richtig abgefallen, weil ja Anfang des Jahres das erste Mal diese großen
5310880	5316400	Bauernproteste gab, wo diese ganzen Bauern wegen des neuen Haushalts praktisch da mit
5316400	5321040	Traktoren nach Berlin gefahren sind. Und es war einfach richtig viele. Und dann gab es ja auch
5321040	5326800	diese Vermischung von Rechtsextremen und Bauern. Und das fand ich ganz schön scary, weil das so
5326800	5331480	Bauern so eine krasse Lobby haben in Deutschland. Also es ist gar nicht nur in Form des Bauernverbandes,
5331480	5335360	sondern einfach auch, wenn man in Umfragen guckt, was Bevölkerungsgruppen sind, denen die
5335360	5340120	Bevölkerung extrem viel Legitimität zuspricht, dann sind Bauern die Gruppe mit der höchsten
5340800	5345880	Zustimmung oder mit der höchsten Legitimität in ihren Positionen in Deutschland. Und wenn die
5345880	5351640	plötzlich so anfangen, auch rechtsextreme Sachen zu sagen oder so Ampelpolitiker in einem Geigen
5351640	5357400	aufhängen, dann ist das irgendwie eine ganz schön krasse Verrohung und Entgleisung. Und das fand
5357400	5359280	ich irgendwie erstmal ganz schön krass.
5359280	5363240	Ich fand da dran tatsächlich auch krass, dass die ja einfach ganz viel blockiert haben, also
5363240	5367560	Straßenblockaden gemacht haben, so den Alltag gestört haben mit Taktiken, die wir sonst eher
5367640	5372600	von der letzten Generation kannten, und das aber gesellschaftlich komplett anders verarbeitet
5372600	5377720	wurde. Also da hatte man so, wurde dann irgendwie immer eher so gesagt, ja, also da hatte man so den
5377720	5383000	Eindruck, die repräsentieren eben gesellschaftlich jetzt so die hart arbeitenden Leute, die gar
5383000	5390040	nichts mehr irgendwie gewertschätzt werden von der Politik und so. Und das fand ich auch irgendwie
5390040	5395440	auch so zum Teil das Beängstigende daran, dass man das Gefühl hatte, genau, da stellen sich so
5395520	5401760	viele Leute gesellschaftlich eben hinter diese krassen Rechten.
5402200	5406880	Ja, auch hinter diesen Mob gegen Habeck. Also ich bin selber kein richtiger Habeck-Fan, aber das
5406880	5411200	war einfach schon richtig krass, den sozusagen auf dem Rückweg aus dem Urlaub zu hindern, daran von
5411200	5417520	seiner Fähre zu kommen und da auch einfach gewalttätig unterwegs zu sein gegen Personen.
5417600	5422320	Das ist was, das hätte sich so die Klimabewegung niemals getraut, auch zurecht nicht, das macht man
5422400	5428880	auch einfach nicht. Und das aber dann auch in der Presse nicht so krass gelaufen ist oder das dann
5428880	5432360	irgendwie auch schnell wieder so in den Hintergrund getreten ist, fand ich schon krass.
5432360	5437160	Naja, beziehungsweise die Bildzeitung hat ja sogar geschrieben, so Foto von Robert Habeck dann mit der
5437160	5442800	Überschrift, hier schleicht sich Habeck irgendwie von Bord. Also so war dann der Twist eher, nicht
5442800	5449000	so krass, was geht ab, was machen die da, das geht gar nicht, sondern so ja noch mal in das Horn
5449000	5455960	reingeblasen. Vor allem, vor allem. Und das ist der Kontext, in dem es diese Korrektivrecherche gab,
5455960	5462480	nachdem auf einmal deutschlandweit knapp eine Million Menschen auf die Straße gegangen sind.
5462480	5468160	Ja, das war einfach richtig, richtig viele und richtig beeindruckend und wir haben uns natürlich
5468160	5473280	auch direkt gefragt, wo kommen jetzt plötzlich alle her, war es unsere Folge zur AfD, ich scherze,
5473280	5479520	aber einfach ein krasser Moment, wo sich plötzlich so die Zivilgesellschaft mobilisiert und halt diese
5479520	5483120	in Anführungsstrichen schweigende Mehrheit, wie sie jetzt immer genannt wird, aber wo einfach ganz
5483120	5487440	viele Menschen, die glaube ich, bei denen sich echt viel angesammelt hat, also Frust über die AfD und
5487440	5492360	auch Frust, glaube ich, mit der Situation, dass es immer, dass die AfD immer weiter gewinnt und immer
5492360	5497280	weiter an Zulauf gewinnt und man so das Gefühl hat, man kann nichts dagegen tun, dass die dann
5497280	5501080	alle auf die Straße gegangen sind. Und ich glaube, was ich richtig interessant finde, ist, dass man
5501080	5506080	sich ja wirklich jetzt einfach die Frage stellt, warum jetzt? Und das, glaube ich, einen total starken
5506080	5509400	Zusammenhang auch mit diesen warmen Protesten hat, die wir vorher besprochen haben. Also das,
5509400	5514000	glaube ich, ist einfach dieser Punkt von Leute sind schon auf der Straße unterwegs, auch auf der
5514000	5518600	anderen Seite, dann auch so eine Gegenreaktion auslöst, in der auch Leute sich die Straße
5518600	5523320	zurücknehmen wollen. Das finde ich eine total spannende Entwicklung. Ja, das denke ich auch. Es war,
5523320	5528160	glaube ich, so ein Jetzt-reichts-Moment und ich fand aber auch tatsächlich mega überraschend,
5528160	5533120	dass diese Recherche überhaupt dazu geführt hat, dass es jetzt so einen gesellschaftlichen
5533120	5536840	Aufreger gab. Und ich glaube, das lag so ein bisschen an, also, weil das, was die da
5536840	5541800	rausgefunden haben, ist letztendlich, muss man dafür gar nicht so investigativ arbeiten. Also,
5541800	5548520	dass es bei der AfD Rechtsextreme gibt, wussten wir lange. Dass Martin Sellner im Umkreis der
5548520	5555280	AfD rumläuft als gesicherter Rechtsextremist und identitärer Typ, das wussten wir auch alle.
5555280	5562960	Dass Martin Sellner in seinen Büchern Staatsstreiche herbei reibt, kann man nachlesen,
5562960	5568040	kann man sich einfach bestellen, die Bücher, und sieht es dann schwarz auf weiß. Genau,
5568040	5573520	also diese ganzen Sachen, das ist so, okay, ja, wusste man, wusste man, wusste man. Aber was
5573520	5579760	die halt geschafft haben mit dieser Recherche war, das auf einmal noch mal anders zu erzählen. Also,
5579840	5585720	ist irgendwie ja so ein bisschen Storytelling mäßig zu verpacken und einfach das als Geschichte
5585720	5591520	zu erzählen, bei der noch mal den Leuten ganz anders klar wird, was passiert da,
5591520	5597680	wie ist das eingebettet in so ein größeres Projekt, was könnte wirklich drohen. Also,
5597680	5602280	in dem Interview mit Felix Kolb hat er ja auch gesagt, es hilft nichts einfach immer nur die
5602280	5608080	Nazi Keule auszupacken und zu sagen, das sind Nazis, sondern man muss sagen, was bedeutet das
5608240	5613120	denn konkret, was die sagen für bestimmte Gruppen beispielsweise. Und ich finde,
5613120	5616920	das hat diese Korrektivrecherche halt mega gut umgesetzt, dass die eben genau gesagt haben,
5616920	5622000	okay, ah, die reden jetzt von Remigration, wir gucken uns das mal ganz genau an, was das denn
5622000	5627920	genau bedeuten würde, wer ist denn davon dann alles, auf welche Art betroffen. Und das war dann
5627920	5633280	irgendwie so einer der, glaube ich, wichtigen Punkte neben diesem Es reicht-Moment, dass die
5633280	5638880	Leute eben dann sich aktiviert haben. Das glaube ich auch, dass die Recherche voll gut
5638880	5645200	gezeigt hat, wie Menschen ganz konkret persönlich betroffen wären. Und jetzt kann ich leider aus dem
5645200	5649520	Kopf nicht genau sagen, was für einen Anteil der deutschen Bevölkerung Migrationshintergrund hat,
5649520	5653240	aber es sind auf jeden Fall über ein Viertel. Und das betrifft dann einfach schon ganz viele
5653240	5657880	Leute ganz konkret, entweder persönlich oder es sind andere Leute, fast alle Leute kennen halt
5657880	5662640	jemanden, den es betreffen würde und diese Fantasien. Und das ist voll krass. Und ich finde
5662640	5666440	aber wirklich, jetzt nochmal interessant, wenn man sich anguckt, wie Mobilisierungsmomente
5666440	5673200	entstehen, halt wirklich diesen Dreischlag aus. Es gibt einen Klima, in dem es vielen Leuten reicht
5673200	5676840	und sich viele Leute nicht repräsentiert fühlen, dadurch, dass immer über die große AfD gesprochen
5676840	5682080	wird und gar nicht mehr zur Sprache kommt, wie viele Leute eigentlich anders denken. Dann gibt
5682080	5687200	es die Gelegenheit, also einen Moment, in dem es diese Korrektivrecherche gibt und der so ein
5687200	5691160	bisschen das Fass zum Überlaufen bringt. Und ich glaube, dass dann aber tatsächlich auch diese
5691160	5695480	Bauernproteste gar nicht so sehr in ihrem Inhalt, sondern wirklich vor allem in der Form einfach
5695480	5700080	gerade gezeigt haben, okay, das macht man dann, wenn man wütend ist, man geht auf die Straße. Und
5700080	5711120	dass das deswegen in dem Moment auch die naheliegende Handlungsoption war tatsächlich. Aber ich glaube
5711120	5716480	tatsächlich, dass das Handlungsrepertoire einen relativ großen Faktor nochmal ausmacht.
5716480	5722920	Ja, interessant, finde ich einen guten Punkt. Eine Sache, die ich allerdings auch interessant finde,
5722920	5726800	abgesehen davon, dass es jetzt auf einmal zu diesen großen Mobilisierungen kommt und wo,
5726800	5730440	glaube ich, auch so ein bisschen tatsächlich auch eine strategische Frage drinsteckt und die
5730440	5736440	uns hier ja im Podcast immer beschäftigen, ist die Frage von, welches Verhältnis haben diese
5736440	5742160	Proteste jetzt eigentlich zu der Politik der Ampelregierung einerseits? Aber was ist auch
5742160	5749200	das richtige Verhältnis zur Union? Weil also, man muss ja ehrlich sagen, dass die Ampel auf
5749200	5757400	eine Art auch rechte Forderungen nach Abschottung einfach durch ihre Politik umsetzt. Es geht jetzt
5757400	5763000	noch nicht um Deportation von Leuten, die zwar einen deutschen Pass haben, aber in der
5763000	5767840	Familiengeschichte irgendwie Migration eine Rolle gespielt hat. Aber es geht eben schon darum,
5767840	5775680	Leute konsequent abzuschieben in den Worten des Bundeskanzlers und das bedeutet, finde ich,
5775680	5782480	dass diese Proteste irgendwie auch im Kontext gesehen werden müssen von dem Rechtsruck der
5782480	5788400	sogenannten Mitteparteien. Das stimmt. Ich finde, dass es da auch eine total interessante
5788400	5792760	Begriffsverschiebung gab, weil jetzt ja im Kontext dieser Korrektivrecherche immer von
5792760	5797160	Deportationen gesprochen wurde. Die kommen da in dieser Recherche eigentlich nicht vor,
5797160	5802720	sondern das, was unter der Krimi-Migration läuft in diesen AfD-Kreisen ist, das Land für die Leute,
5802720	5808520	die sie hier nicht haben wollen, so ungemütlich und scheiße zu machen, dass die gehen. Und ich
5808520	5813320	glaube aber, was passiert war, war, dass Abschiebung jetzt schon so normalisiert war im Ampel- und
5813320	5818040	Unionsdiskurs, dass die halt, das Abschiebungs- oder gerade das Rückführungsgesetz beschlossen,
5818040	5824880	also Abschiebungen wurden okayisiert und galten dann eigentlich schon als normal und deswegen
5824880	5828280	muss man einen neuen Begriff finden für das, was die AfD da jetzt machen will. Das, finde ich,
5828280	5831760	zeigt auch so richtig die Absurdität da drin, also dass man so jetzt sagt, ich meine, auf
5831760	5835360	eine Art ist, wenn man sich das anguckt, wie eine Abschiebung tatsächlich funktioniert,
5835360	5839920	auch mit Leuten, die Leute werden von zu Hause abgeholt mitten in der Nacht, dann kommen die
5839920	5844040	irgendwie in den Abschiebeknast und werden da festgehalten, dann werden sie gegen ihren
5844040	5850040	Willen mit Polizisten ins Gefängnis, ins Flugzeug gesetzt und da dann weggebracht. Ich sag mal so,
5850040	5855480	also fließend. Also ich finde es irgendwie total irre, wie gleichzeitig so eine komplette
5855480	5860640	Normalisierung stattgefunden hat von Abschiebung und wie du sagst. Und jetzt aber auch mit einem
5860640	5865560	neuen Begriff, das, was die Rechten da jetzt fordern, dann trotzdem auch irgendwie...
5865560	5870320	Trotzdem die Leute noch richtig aufgeregt. Ich finde es auch eine irgendwie interessante
5870320	5875120	Gleichzeitigkeit, wenn man sieht, wie die soziale Welt ist, ambivalent und Gedankengebäude nicht
5875120	5879160	unbedingt schlüssig. Ja, genau. Aber ich finde, es ist so ein bisschen da drin, steckt eben dann jetzt
5879160	5885640	die Frage. Man kann ja beobachten, dass irgendwie SPD und Grüne in meiner Wahrnehmung nach, aber auch
5885640	5892120	Leute von der CDU jetzt eben auch auf diese, also auch Funktionsträger und Mandatsträger, dass die
5892120	5898920	jetzt auch auf diese Demos gehen. Und da ist, finde ich, jetzt die Frage, wie geht man damit um? Versuchen
5898920	5903880	die das eigentlich geradezu vereinnahmen? Und es ist ein Problem oder es ist total wichtig, dass die
5903880	5908920	da auch sind und da auch sprechen dürfen, wenn man sie dadurch wieder so ein bisschen auf die
5908920	5914360	richtige Seite, auf die gute Seite der Macht zurückholt. Und jetzt zum Beispiel bei der Union,
