start	end	text
0	3800	Erst mal ist es ein absoluter Befreiungsschlag für die Linke,
3800	9520	dass endlich dieser Schritt, der so lange überfällig war, stattgefunden hat.
9520	12960	Und es gab ja einfach schon bestehende Konflikte,
12960	15400	die wirklich nicht mehr vereinbar miteinander sind.
15400	18640	Und das beruht auf politischen Weltbildern,
18640	21560	die sich wirklich teilweise konträr gegenüberstehen.
21560	24720	Und deswegen glaube ich, es ist wirklich nur gut,
24720	27560	dass endlich dieser Schlussstrich gezogen ist
27560	29960	und diese Trennung stattgefunden hat.
30040	35280	Und ich habe mir ein paar Meinungsforschungsstudien angeschaut,
35280	38680	wo auch sichtbar wird, dass es eigentlich auch vom Wählerpotenzial
38680	41360	gar nicht so viele Überschneidungen gibt mit der Linkspartei.
41360	43720	Ich glaube, da gibt es tatsächlich deutlich mehr mit der AfD
43720	45760	und eher rechteren Parteien.
45760	48040	Und da bin ich einfach total gespannt, wie sich das entwickelt.
48040	50640	Sie versucht, glaube ich, sehr unterschiedliche Zielgruppen
50640	53240	tatsächlich anzusprechen und zu vereinen.
53240	55600	Und ich glaube, es wird total spannend, ob sie das schaffen werden.
55600	59080	Zum Beispiel einmal hat sie ja diese gesamte Friedensthematik,
59120	61680	die sie ein bisschen versucht, so als Alleinstellungsmerkmal
61680	64440	oder auch ein bisschen gegen die Linke auszuspielen,
64440	67480	obwohl halt auch für die Linke Friedenspolitik sehr wichtig ist.
67480	69040	Auf der anderen Seite so ein bisschen
69040	71720	dieses gesamte verschwörungstheoretische Netzwerk
71720	74760	dockt sie an, wo auch irgendwie die Corona-Leugner und so weiter
74760	77680	dazugehören und sehr nach rechts offen ist.
77680	81560	Und dann das eher antimigrationsrassistische Kontext.
81560	84680	Und ich habe auch den Eindruck, also auch Sachen, die ich gelesen habe,
84680	87840	was ich total spannend finde, dass auch diese verschiedenen Gruppen
87840	90080	halt teilweise nur einen Punkt teilen,
90080	93600	dass denen aber so wichtig, dass sie das andere mit in Kauf nehmen.
93600	95960	Da bin ich total gespannt, wie sich das trägt,
95960	99960	also ob sie es trotzdem schafft, so eine Kernzielgruppe aufzubauen,
99960	102920	die irgendwie auch miteinander funktioniert
102920	105840	und auch wie lange sich das trägt, dass sie das versucht,
105840	110080	über ihre Berühmtheit so zu machen, also ob das relativ schnell verpufft,
110080	111960	wenn sie dann eigentlich liefern muss.
111960	115200	Könnte auch sein, dass das gar nicht klappt.
115200	116920	Ich glaube, wir müssen es beobachten.
116960	120080	Und es ist auf jeden Fall ein spannender Versuch.
120080	123800	Ja, aber ich glaube wirklich, dass es einfach von der ideologischen
123800	126200	Überzeugung so weit weg ist von der Linkspartei,
126200	128840	dass sie einfach in einem sehr anderen Milieu überhaupt fischt.
145200	146600	Hallo und herzlich Willkommen.
146600	149160	Wie ihr gerade schon in den Soundbites gehört habt,
149160	152200	sprechen wir heute über das Bündnis Sarah Wagenknecht,
152200	155120	darüber, was das Projekt für die Linkspartei bedeutet
155120	159080	und wie sich die Linkspartei aber auch selbst versucht zu erneuern.
159080	164200	Weil das Projekt Sarah Wagenknecht oder die Partei Bündnis Sarah Wagenknecht,
164200	168160	das ist ja gerade ein sehr neues noch,
168160	170040	aber irgendwie auch noch ganz schön unklares Projekt.
170040	172320	Wie siehst du denn das?
172320	173880	Ja, hallo auch nochmal von mir.
173880	176200	Ich finde es schon auch ganz schön überraschend,
176200	180280	dass wir mittlerweile über ein Jahr irgendwie Zeitungsartikel
180280	184200	darüber lesen, dass Sarah Wagenknecht eine neue Partei gründet
184200	188680	und trotzdem noch so wenig irgendwie klar ist, was das jetzt genau heißt.
188680	192840	Also soll irgendwas mit Vernunft zu tun haben, habe ich gehört.
192840	196040	Und sie wollen gegen die Deindustrialisierung
196040	198800	des Wirtschaftsstandorts Deutschland eintreten,
198800	202160	finden Verbrenner gut und Cancel Culture blöd.
202240	208880	Aber ansonsten habe ich noch nicht so viel mitgekriegt, was denen wichtig ist.
208880	211760	Es wirkt so ein bisschen so, als hätte man jetzt praktisch mit Hilfe
211760	215120	von irgendwelchen Umfrageinstituten sich so eine Partei zusammengeschüßt hat
215120	218320	und gesagt, okay, ja, hier haben wir einerseits die Corona-Leugner,
218320	222320	die irgendwie gerade nicht gut aufgehoben sind im Parteienspektrum.
222320	226000	Dann gibt es Leute, die gesellschaftspolitisch sehr konservativ
226000	230880	eingestellt sind, aber so grundsätzlich Umverteilung gut finden.
230880	233600	Und dann gibt es irgendwie noch so ein paar Überreste
233600	238000	von der alten Friedensbewegung, die mit Putin verhandeln wollen.
238000	240320	So und die alle schmeißt man jetzt irgendwie so ein bisschen zusammen
240320	244080	in einen Topf, rührt dreimal um und dabei kommt dann
244080	245440	das Bündnis Sarah Wagenknecht raus.
245440	248200	Also so habe ich ein bisschen den Eindruck, wie siehst du das?
248200	252600	Ja, ich finde es irgendwie sehr spannend, weil das,
252600	254920	wie du gesagt hast, es schon lange so einen Raunen darüber gibt.
254920	257680	Auch klar war schon seit langer Zeit, dass Sarah Wagenknecht
257680	260360	und die Linkspartei auf jeden Fall nicht mehr zusammengehen.
260360	261800	Und die Frage war, was macht sie?
261800	265560	Weil in der Vergangenheit ja oft so One Woman oder One Man,
265560	267400	aber meistens One Woman-Parteigründungen
267400	268440	eher schiefgegangen sind.
268440	271360	Also denkt man an Frauke Petri und die Blauen.
271360	273680	Sie sind dann doch in der Versenkung verschwunden.
273680	277280	Und dieses Schicksal könnte ja auch einer Wagenknecht-Partei
277280	278920	leicht passieren.
278920	280360	Deswegen ist es jetzt erst mal spannend, dass sie das
280360	281720	wirklich überhaupt macht.
281720	282840	Und mir geht es dann aber wie dir.
282840	284760	Also es wirklich wirkt so ein bisschen wie so ein Porturi
284760	287520	aus allen Enttäuschten irgendwie.
287600	289720	Und die Frage, die jetzt im Soundbite ja aber auch schon
289720	292400	gestellt wurde, ist halt, ob das wirklich hält.
292400	295960	Und ob da auch die Umfragen halten, was sie versprechen.
295960	296480	Ja, genau.
296480	299160	Also es gibt ja einerseits so ein bisschen diese Ebene von,
299160	302600	inwieweit lässt sich das ideologisch zu einem Gesamtprojekt
302600	303600	zusammenfügen?
303600	306200	Also inwieweit kann man mit diesen unterschiedlichen Gruppen
306200	311040	da jetzt tatsächlich solide Politik machen und sich einigen
311040	312680	auf Parteitagen?
312680	314880	Und auf der anderen Seite eben auch die Frage so,
314880	315920	wen spricht man damit an?
315920	318160	Und da hattest du ja dir auch noch mal diese Umfragen
318160	319760	ein bisschen genauer angeschaut.
319760	320040	Genau.
320040	322240	Und diese Umfragen sind ja wirklich insofern auch immer
322240	325240	spannend, dass bei einer Neugründung die eine Frage ist,
325240	327280	wie du gesagt hast, so passt es ideologisch zusammen.
327280	329240	Und die zweite Frage ist wirklich aber auch immer,
329240	331280	haben die eine Chance, über die Fünf-Prozent-Hürde zu kommen
331280	333080	und werden deshalb überhaupt gewählt?
333080	334760	Also es gibt ja ganz viele Parteien, die eigentlich
334760	336600	ideologisch hohen Zuspruch hätten.
336600	339880	Wie jetzt auch so die ÖDP oder die feministische Frauenpartei
339880	341960	kommt bei mir im Walumat immer als erstes.
341960	343920	Würde ich aber niemals wählen, weil die keine Chance haben,
343920	345880	über die Fünf-Prozent-Hürde zu kommen.
345880	348480	Das ist ja bei so einer Partei auch die Frage, hat sie die?
348480	351800	Da gibt es jetzt diese Umfragen, eine aus Thüringen aktuell,
351800	355600	in denen sich 17% tatsächlich der Wählerinnen und Wähler
355600	357800	bei der Sonntagsfrage vorstellen konnten,
357800	360800	die BSW, also Bündnis Sarah Wagenknecht, zu wählen.
360800	362240	Das ist ganz schön viel.
362240	364560	Ich kann mir vorstellen, dass es aber da in Thüringen
364560	366480	auch so ein bisschen so einen Sonderfall gibt.
366480	369960	Einfach weil die AfD auf der einen Seite als Alternative
369960	373280	einfach schon sehr rechtsextrem ist mit Björn Höcke
373360	377200	und die Linkspartei auf der anderen Seite schon seit 9 Jahren regiert
377200	380840	und notwendigerweise dann natürlich viele Wählerinnen auch enttäuscht hat.
380840	383440	Und dass deswegen vielleicht das Potenzial in Thüringen
383440	385360	ausnahmemäßig hoch ist.
385360	387960	Bei diesen anderen Fragen, die die BSW ja manchmal schon
387960	391880	mit so einem Wählerpotenzial von so um die 20 oder ein paar 20% gesehen hat,
391880	394600	da wäre ich ja mal eher ein bisschen vorsichtig,
394600	397920	weil das oft Umfragen sind, wo die Menschen halt danach gefragt werden,
397920	399960	was sie sich prinzipiell mal vorstellen könnten,
399960	401560	für eine Partei zu wählen.
401560	403520	Und prinzipiell kann man sich immer viel vorstellen.
403520	407120	Aber was dann am Wahltag passiert, steht auf dem anderen Blatt.
407120	409200	Es gibt ja einige Leute, die auch sagen,
409200	411400	also so linke Leute, die sagen,
411400	415280	okay, das Bündnis Sarah Wagenknecht findet man jetzt vielleicht selber blöd,
415280	420360	aber vielleicht schafft sie es ja, die AfD stärker zusammenzuschrumpfen.
420360	422840	Wie stehst du dazu, zu dieser Frage?
422840	424400	Ja, das bleibt abzuwarten, glaube ich.
424400	425640	Aber das kann natürlich schon sein,
425640	429240	also gerade bei den Wählerinnen, die für eine strikte Migrationspolitik sind,
429240	432240	die auch sehr enttäuscht sind von diesen auf eine Art und Weise
432240	434120	auch im Osten gebrochenen Leistungsversprechen,
434120	438200	also denen versprochen wurde, dass sie jetzt mit guter Leistung was werden können
438200	441840	und für die sich das persönlich gar nicht eingelöst hat.
441840	443040	Das kann ich mir schon vorstellen,
443040	447480	dass für die das Bündnis Sarah Wagenknecht noch mal eine Alternative ist.
447480	450720	Ja, das finde ich auch eine spannende Frage.
450720	454680	Vielleicht müssen wir gegenüber unseren Hörerinnen einmal zugeben,
454720	459560	dass wir jetzt den Gründungsparteiteil von Bündnis Sarah Wagenknecht
459560	464680	vor allem als Anlass nehmen, um über wirklich linke Politik zu sprechen,
464680	469440	nämlich über die Linkspartei und den Erneuerungsprozess der Linkspartei.
469440	471120	Wir hatten es ja schon angekündigt.
471120	478080	Und genau, dafür haben wir uns eine ziemlich spannende Gesprächspartnerin eingeladen.
478080	479800	Magst du dich vielleicht kurz vorstellen?
479800	481080	Ja, genau, es ist Lizza Plaum.
481080	484400	Lizza kennt die ganz langjährigen Hörerinnen unseres Podcasts.
485160	489080	Lizza war vor zweieinhalb Jahren schon mal zu Gast bei uns im Podcast.
489080	492800	Lizza hat die Seebrücke mitgegründet, ist jetzt neu Mitglied bei den Linken
492800	496240	und ist auch Mitinitiatorin der Kampagne Eine Linke für alle.
496240	498000	Von der habt ihr vielleicht schon gehört.
498000	501600	Zumindest in unserem Freundeskreis hat es viele Leute ganz schön beschäftigt,
501600	503640	ob sie in die Linke eintreten oder nicht.
503640	507600	Und Lizza war eine Mitinitiatorin dieses Schwungs.
507600	511280	Ja, und zum Stichwort Freunde und Bekannte.
511280	516360	Also bei mir war es auf jeden Fall so, dass so in den letzten Wochen viel diskutiert wurde,
516360	522440	wer bei den Linken jetzt neu eintritt und Teil dieses Erneuerungsprozesses sein will.
522440	526120	Und das war ja auch so ein bisschen einer der Anlässe, warum wir diese Folge gemacht haben,
526120	530760	dass wir das Gefühl hatten, wir müssen mal reden über dieses Thema.
530760	534160	Und anlässlich dieser Folge haben wir dann eben auch mal reingefragt
534160	537400	in unseren Freundes- und Bekanntenkreis, wie die Leute das da so sehen
537400	544000	und haben ein paar Sprachnachrichten bekommen, die wir euch jetzt einfach mal vorspielen würden.
545360	548560	Ich bin Elenos und ich bin in die Linke eingetreten, zu meiner eigenen Überraschung.
548560	551400	Weil eigentlich hatte ich immer ein anarchistisches Selbstverständnis,
551400	555320	das habe ich auch jetzt noch und hatte sonst nie mit Parteien was im Hut.
555320	558640	Also dass ich sie halt ab und zu gewählt habe und sie tatsächlich einfach manchmal nützlich waren,
558640	561440	so für eine kleine Anfrage oder so.
561440	565040	Das sind ja dann so strukturelle Sachen und auch informationelle, finanzielle Sachen,
565080	567560	die da dranhängen, die man manchmal übersieht.
567560	571600	Und ja, ich bin eingetreten, weil ich die Vorstellung unerträglich fand,
571600	576280	dass das Linkeste, was wir in der Parteilandschaft haben, die Grünen sind oder so ein Lord Order Scholz.
576280	578920	Und ich dachte immer, Mann, warum gehen die Leute nicht zu Linken?
578920	582400	Und dann kommt natürlich der Punkt, wo man merkt, muss man vielleicht selber machen,
582400	584320	wenn man Veränderungen will.
584320	588000	Und jetzt bin ich da drin, habe aber keine Heilerwartung, sondern bin ergebnisoffen.
588000	589280	Ich gucke mir das mal an.
589280	593720	Ich finde es durchaus eine Chance, durch diese Basisorganisation im Kontakt mit Leuten zu kommen,
593720	597960	mit denen man sonst noch nichts organisiert hat, quasi, dass man auch mehr verankert in der Gesellschaft,
597960	601720	mehr verankert im Kiez ist und da vielleicht neue Bündnisse eingehen kann.
601720	605920	Das sehe ich gerade mit Aussicht auf stärker werdende autoritäre Tendenzen als überlebenswichtig.
605920	608720	Aber im Herzen bleibe ich natürlich Anarchistin.
608720	614000	Hallo, ich bin Ruben Neugebauer, ich habe Sea-Watch mitgegründet und aufgebaut
614000	619720	und bin jetzt in die Linke eingetreten, weil uns schlicht nichts anderes übrig bleibt.
619760	624440	Wir haben die Woche vor Weihnachten gesehen, dass die Grünen mit Bauchschmerzen hin oder her
624440	629560	sowohl der verheerenden Gehersreform zugestimmt haben, als auch dem Ausländer
629560	632480	noch schneller rausgesetzt von Nancy Faeser.
632480	638600	Und daran zeigt sich einfach, wie dringend es notwendig ist, dass es ja auch eine linke Opposition
638600	646320	im Bundestag gibt und nicht nur das rechtsradikale Konglomerat aus AfD und CDU-CSU.
646320	651600	Wir sehen jetzt daran, dass die Linkspartei den Fraktionsstatus verloren hat.
651600	654960	Wie verheerend das eigentlich ist, wenn wir keine starke Linke haben.
654960	660080	Wir können ja noch nicht mal mehr kleine Anfragen stellen und deswegen ist es so wichtig,
660080	667120	dass ja jetzt sehr viele Leute den Entschluss getroffen haben, in die Linkspartei einzutreten.
667120	672360	Lange war ja die Sarah Wagenknecht ein Grund für mich, das nicht zu tun,
672360	676520	weil die eben auch irgendwie rassistische Positionen mit vertreten hat.
676520	682480	Aber da die Wagenknechte jetzt ja die Partei verlassen haben, ja und da es einfach dringend nötig ist,
682480	688080	weil wir es nicht zulassen können, dass es eben keine linke Partei in den Parlamenten mehr gibt,
688080	691680	war jetzt der Entschluss sehr klar, dann doch in die Partei einzutreten.
692560	694480	Hallo, hier ist Caro.
694480	702280	Der Grund, warum ich mich entschlossen habe, für das Europaparlament auf der Liste der Linken zu kandidieren,
702280	707000	liegt hauptsächlich wirklich im Rechtsruck, der mich extrem besorgt.
707000	710800	Auch in der Woche, wo ich das jetzt gerade aufnehme, sind die Bauernproteste,
710800	717080	die ja massiv von rechts unterwandert, aber auch teilweise mitgeplant und mitgestaltet werden.
717080	722040	Und in so einer Situation, wo sich alles nach rechts bewegt,
722040	726680	finde ich es unabdinglich und notwendig, linke Institutionen zu schützen.
726680	730960	Und dazu gehört für mich natürlich auch die Linkspartei.
730960	734840	Ich hatte nicht vor, Parteipolitik zu machen.
734840	739920	Ich bin auch von den Vorsitzenden spezifisch deswegen parteilos angefragt worden,
739920	750040	weil es darum geht, Verbindungen zu stärken und praktisch ein starkes Bündnis aus einmal dieser institutionellen Politik,
750040	755920	aber auch Bewegungen, meinetwegen auch Gewerkschaften und weiteren Organisationen zu bilden.
755960	761200	Und dafür kann es auch eben von Vorteil sein, keine Parteimitgliedschaft zu haben.
762280	768200	Hallo, ich heiße Steffen und ich bin seit etlichen Jahren in der Linken organisiert.
768200	770080	Aktiv bin ich vor allem in meinem Ortsverband.
770080	775440	Das ist die Linke in Kreuzberg und in der Bundesarbeitsgemeinschaft Klimagerechtigkeit.
775440	779480	Dort sind jeweils auch neue Mitglieder angedockt in den vergangenen Wochen.
779480	786520	Und mein Blick auf die Eintritte, die seit dem Abgang von Wagenknecht, da ihren Weg in die Linke gefunden haben,
786520	790000	ist alles in allem richtig positiv.
790000	794920	Zum einen, weil die, die ich hier kennenlernen konnte, bisher durch die Bankweg engagierte,
794920	800840	schlaue und tatenlustige Leute sind und ich mich ziemlich freue, mit ihnen viel zu machen.
800840	808280	Und dann aber schon auch, weil ich glaube, dass es neue Leute mit neuen Ideen und neuen Netzwerken so ganz grundsätzlich braucht,
808360	812720	damit wir die Linke endlich wieder auf stabilere Füße stellen können.
812720	818680	Dabei wird sich die Partei sicher ändern und auch viele von uns, aber das ist auch gut so.
818680	824520	Ich hoffe, dass viele ihren Platz in meiner Partei finden und auch noch viele neue dazukommen.
824520	826320	Sonst wird es nämlich echt knapp.
826320	834320	Nicht, dass die Linke die einzige Lösung da draußen ist gegen Rechtsruck, Sozialabbau, Klimakrise und globale Ungerechtigkeit.
834320	838040	Aber keine Linke ist mal definitiv auch keine Lösung.
838080	841480	Also, herzlich willkommen und auf viele gemeinsame Abenteuer.
842480	845800	Hey, ich bin Stefanos und bin seit zehn Jahren Mitglied in der Linken.
845800	850000	Eingetreten bin ich in meiner Hammerstadt Köln und bin jetzt in Berlin-Neukölln aktiv.
850000	853520	Für mich ist eine sozialistische Partei als Organisationsform so wichtig,
853520	861280	weil sie eben es schafft, über eine Wahl oder ein konkretes Projekt hinaus Menschen unabhängig von Alter, Beruf oder Wohnort zusammen zu organisieren.
861280	867280	Und ich denke, viele erkennen diesen Wert jetzt und freue mich total über die ganzen Beiträge, die jetzt gerade stattfinden.
867280	870520	Und gerade bei uns in Neukölln ist das Zustrom wirklich riesig.
870520	873480	Der Großteil hier ist eher jünger und mit akademischem Hintergrund.
873480	879920	Und auch wenn andere das vielleicht so als Zeichen für den Wandel der Partei hin zu einem bestimmten Milieu werten, sehe ich das erstmal anders.
879920	884440	Viele haben schon plötzliche Erfahrungen von den Neuen und eine klare Klassenplötzsche-Ausrichtung.
884440	890960	Und deswegen hoffe ich, dass wir mit all dieser Organisationserfahrung, die jetzt in die Partei fließt, die Parteistrukturen einerseits offener gestalten können
890960	895840	und andererseits, wie wir mehr schaffen, arbeiten und auch migrantische Menschen zu organisieren und anzusprechen.
895840	900280	Und für meinen Tag kann ich sagen, in meinem Umfeld sind die Leute wirklich extrem motiviert.
900280	905440	Und ich hoffe, dass jetzt der Grundstein gelegt wird, um in Zukunft all die Arbeitskämpfe, die Bewegungen für öffentlichen Wohnraum
905440	911720	oder für eine Klimawende in einer Stimme zusammenzuführen und wieder zu einer echten linken Option für die Menschen hier und die Gesellschaft zu werden.
911720	915240	Eine Frage ist jetzt natürlich, wie wir all die Neumitglieder gut einbinden können.
915240	922160	Ganz klassisch würde ich sagen, können wir mit mehr Menschen natürlich auch bei Verteilaktionen und Plakataktionen mehr Inhalt und Material an mehr Menschen bringen.
922200	930520	Das ist das eine. Aber wie viele Anlaufpunkte für konkrete inhaltliche Arbeit im Kiez oder im Viertel es gibt, ist natürlich auch von Ort zu Ort unterschiedlich.
930520	938360	Bei uns in Neukölln kann ich zum Beispiel ganz konkret sagen, dass sich zum Beispiel im linken Gewerkschaftsratsschlag mit anderen Beschäftigten vernetzt werden kann.
938360	946320	Oder man kann in einer Arbeitsgruppe für die Schaffung eines Sozialforces für Neukölln mitarbeiten, der sich an der Arbeit der KPO in Graz orientiert.
946320	949640	Das sind sicher so Beispiele, die auch an anderen Orten Sinn machen würden.
949640	954600	Und ich denke, Neumitglieder sollten da keine Scheu haben, so etwas auch selbst in die Hand zu nehmen.
954600	958720	Sollten die Strukturen vor Ort zum Beispiel eher eingeschlafen oder eben total klein sein.
958720	964480	Und gleichzeitig ist es wichtig, finde ich, den neuen, die oft träge wirkenden Strukturen einer Partei näherzubringen.
964480	968800	Ich denke, es ist oftmals einfacher, Einfluss zu nehmen, als es von außen scheint.
968800	974400	Das ist gerade wichtig, wenn es auch darum geht, alte und verkrustigte Strukturen manchmal aufzubrechen,
974400	979920	mit neuem Personal in Gremien und für Parlamente sich neu zu ordnen und wieder mehr Menschen erreichen zu können.
979920	983880	Und durch die Erneuerungskampagne, die jetzt gerade läuft, mit all den neuen, hoffe ich mir,
983880	987120	dass wir diesen Wandel wirklich strukturell und bundesweit umsetzen können.
987120	993360	Und da sind zum Beispiel Quoten für arbeitende und migrantische Menschen oder eben auch Neumitglieder sicher total gute Ansätze.
993360	998560	Da sind wir wieder. Ihr habt ja jetzt in den Sprachnachrichten einige gute Gründe dafür gehört einzutreten,
998560	1002880	in die Linkspartei und auch einige gehört, die sich dagegen entschieden haben.
1002880	1009160	Ein Grund, warum einige Leute jetzt auch eintreten, ist halt der starke Rechtsruck und dass die Menschen das Gefühl haben,
1009160	1011800	wir müssen dem jetzt wirklich mal was entgegensetzen.
1011800	1014640	Und da ist jetzt ganz schön viel passiert Anfang des Jahres.
1014640	1018800	Und darüber werden Weinstein und ich in der Abmoderation auch nochmal sprechen.
1018800	1024240	Das wollten wir euch schon mal ankündigen, dass wir da auch nochmal ein bisschen über die aktuellen Proteste sprechen,
1024240	1028600	wie die eigentlich so groß geworden sind und was vielleicht auch gegen die AfD helfen kann.
1028600	1033120	Ja, jetzt möchten wir euch aber erstmal ganz viel Spaß wünschen beim Gespräch mit Litza.
1033120	1034120	Viel Spaß.
1051960	1053960	Hallo jetzt zum Podcastgespräch.
1054000	1060760	Wir haben uns jetzt hier mit Litza in Berlin-Kreuzberg getroffen und sitzen zusammen in so einem Hinterhofbüro.
1060760	1062960	Und ich freue mich schon sehr auf das Gespräch. Hallo Litza.
1062960	1064800	Hi.
1064800	1068320	Ja, stell dich doch gerne einfach nochmal den Hörerinnen und Hörern vor.
1068320	1073280	Du bist ja jetzt schon lange in sozialen Bewegungen aktiv und jetzt bist du in die Linke eingetreten.
1073280	1076640	Und du hast sogar davon auf dem letzten Parteitag erzählt.
1076640	1078320	Warum hast du denn das gemacht?
1078320	1082840	Genau, ich bin Litza. Ich bin schon lange aktivistisch aktiv.
1082880	1090320	Insbesondere war ich in der Migrationsbewegung aktiv, habe die Seebrücke mitgegründet und denke aber auch in diesem Kontext schon lange darüber nach,
1090320	1095160	wie eigentlich linke Realpolitik vielleicht auch anders gestaltet werden kann.
1095160	1099920	Und da in diesem Zuge habe ich mich natürlich auch mit der Linkspartei schon länger beschäftigt.
1099920	1108040	Und ich glaube, es ist gerade wirklich eine, besteht eine große Chance, die Partei wirklich grundsätzlich zu erneuern und zu stärken.
1108080	1109960	Und davon will ich Teil sein.
1109960	1115560	Und deswegen bin ich in die Linke eingetreten und habe auch die Kampagne Eine Linke für alle mit gestartet.
1115560	1120280	Ja, cool. Da werden wir auf jeden Fall im weiteren Gespräch nochmal näher drauf eingehen.
1120280	1124320	Ich muss gerade daran denken, Litza, du warst ja schon mal bei uns im Podcast zu Gast.
1124320	1129640	Damals ging es auch um Parteien, aber sehr viel weniger um die Linkspartei, sondern um die Grünen.
1129640	1132320	Das war im Bundestagswahlkampf im letzten.
1132320	1137480	Und wenn ich mich richtig erinnere, dann war da so ein bisschen dein Fokus, dass du gesagt hast,
1137480	1140880	okay, die Grünen werden auf jeden Fall Teil der nächsten Regierung sein.
1140880	1146440	Ob das gut oder schlecht wird, hängt so ein bisschen davon ab, ob da jetzt die richtigen Leute reingehen.
1146440	1150960	Jetzt zwei Jahre später ist die Linkspartei bei dir im Fokus. Wie kam es dazu?
1150960	1156520	Ja, ich habe auch auf dem Weg hier hin zum Gespräch mit euch habe ich auch tatsächlich darüber nachgedacht,
1156520	1162440	dass ich ja schon mal in dem Podcast war und dass ich da ja eine ganz andere Strategie hatte, würde ich sagen.
1162480	1168080	Und habe selber dann nochmal reflektiert, habe einfach gemerkt, dass ich auch einfach viel gelernt habe in den letzten zwei Jahren.
1168080	1171040	Und dass aber tatsächlich der Grund, warum ich jetzt dieses Projekt mache,
1171040	1176000	eben auch mit dem, was ich davor gemacht habe, zusammenhängt und eher aufeinander aufbaut.
1176000	1180360	Zu der Zeit hatten wir ja überlegt, also mit einer Gruppe von Leuten, ob es nicht das Richtige ist,
1180360	1186160	dass Menschen aus Bewegungen kandidieren und eben bei Linken oder auch Grünen in den Bundestag einziehen.
