start	end	text
2349920	2355040	das ist irgendwie auch so ein Aspekt, der einfach heftig ist und der natürlich, wo ich auch den
2355040	2360600	Eindruck habe, da gibt es eben auch einen Kulturkampf, den man aber auch von links mitführen muss, weil
2360600	2366440	sonst verändern sich so die Baselines eigentlich gesellschaftlich, dass man da auch gar nicht mehr
2366440	2372680	dagegen ankommt. Ja, also ich finde es einen total spannenden Aspekt und insbesondere, wie verändert
2372680	2378680	man einfach ein so festsitzendes Paradigma oder irgendwie Leitbild? Ich glaube, das wird Jahre
2378680	2384120	dauern, ehrlich gesagt, weil das ja auch über Jahre aufgebaut hat und ich finde es auch immer
2384120	2388200	wieder spannend, wie man sieht, auch wer hat irgendwie eine starke Lobby, auch im öffentlichen
2388200	2393640	Diskurs, fand ich auch zum Beispiel bei dieser Elterngeldgeschichte, wo das Elterngeld für sehr
2393640	2400000	reiche oder sehr gutverdienende Paare gekürzt werden sollte und innerhalb von einem Tag irgendwie
2400000	2405200	alle Medien, überall waren ganz laute Stimmen von Müttern, Vätern und so weiter, die sich
2405200	2410360	dagegen gesetzt haben, wobei diese Bürgergelddebatte, da habe ich das Gefühl, da wurde nur irgendwie,
2410360	2414880	also überhaupt nicht mal von den, da ging es gar nicht darum, dass es eigentlich total notwendig
2414880	2420040	ist und dass es immer noch viel, viel, viel zu wenig ist und das ist glaube ich ein, finde ich
2420040	2425680	auch einen krassen Aspekt, dass es einfach kaum diese Stimme gibt, die dafür kämpft und die dann
2425680	2430920	auch vielleicht dazu führen könnte, dass sich dieses Leitbild oder so ändert und genau, ich glaube,
2430920	2434360	das ist echt auch eben eine große Aufgabe und ich glaube auch, dass es eine Aufgabe einer linken
2434360	2439360	Partei ist, genau diese Interessen wieder zu organisieren und hörbar machen und ich würde sagen,
2439360	2442960	im Kleinen ist es ja in Teilen, in verschiedenen Kämpfen gelungen, also wenn wir uns anschauen,
2442960	2448080	irgendwie vielleicht in Teilen im Krankenhaus kämpfen, jetzt nicht riesig im medialen Diskurs,
2448080	2452640	aber wo auch, glaube ich, ein neues Verständnis oder so ein Klassenbewusstsein entstanden ist
2452640	2456640	oder auch in den, jetzt vielleicht auch in den Tarifauseinandersetzungen im öffentlichen
2456640	2461880	Verkehrsbereich und ich glaube, dass es genau diese Kämpfe auch sind, die eine linke Partei
2461880	2466000	unterstützen muss, stärken muss und genau auch diese Gruppen, die sie ansprechen muss und mit
2466000	2471440	organisieren muss. Ich finde es irgendwie voll interessant, weil ich finde, eine Sache sind ja
2471440	2475760	die Gruppen, die man ansprechen muss und die Frage ist dann ja, mit welchen Themen genau und ich
2475760	2479040	finde jetzt, so wie wir drüber gesprochen haben, gibt es ja echt so ein bisschen zwei Seiten einer
2479040	2483120	Medaille und die eine Seite ist tatsächlich einfach die Erbengesellschaft, wo einfach,
2483120	2488280	ich glaube, dass das auch ein Grund dafür ist, dass vor allem die reichen Leute wissen, dass es nicht
2488280	2493160	an Leistung liegt, weil die genau die Erfahrung gerade machen in unserer Generation und ein bisschen
2493160	2498400	älter, dass sie zum Beispiel um sich eine Wohnung oder eine Innenstadt zu kaufen oder ein Haus, dass
2498400	2502280	das nur geht, wenn man erbt und die Leute wissen natürlich ganz genau, dass sie es nicht verdient
2502280	2507400	haben, das, was sie halt erben, während das ja aber ein Diskurs ist, der total unsichtbar ist und
2507400	2511240	dadurch auch für die Leute, die nicht erben, unsichtbar bleibt, also die sehen das ja gar nicht,
2511240	2517920	was für Mengen an Geld da eigentlich transferiert werden von einer Generation zur nächsten und die
2517920	2521960	andere Seite ist dann halt genau die Seite der armen Leute, wo den Leuten, glaube ich, auch
2521960	2526440	überhaupt nicht bewusst ist, in Anführungsstrichen, was für großer Gesellschaft, die sich eigentlich
2526440	2530080	bewegen, also wenn man sich nochmal die Zahlen anguckt sind, wir haben das letztens erst
2530080	2534840	nachgeguckt, 20 Prozent der deutschen Bevölkerung liegen an der Armutsgrenze und 20 Prozent, das sind
2534840	2540360	so jetzt mal überschlagen acht, fünfzehn Millionen Leute in Deutschland und davon sind fünf Millionen
2540360	2545560	ungefähr arbeitslos und dann hat man einfach einen riesigen Sektor an Leuten, denen es wirklich nicht
2545560	2550640	gut geht und die darunter krass leiden und die jetzt aber halt noch gegeneinander ausgespielt
2550640	2555160	werden und wo, glaube ich, schon echt die Frage ist, wie man das hinbekommt. Ich würde immer
2555160	2558280	so ein bisschen Abstand vom Klassenbewusstsein, weil ich glaube, dass das sozusagen die deutsche
2558280	2562000	Gesellschaft nicht mehr so richtig abbildet, aber irgendwie so ein Bewusstsein dafür zu schaffen,
2562000	2567640	wie viele Leute das eigentlich sind und auch wie wenig Leute es sind, die das Geld haben.
2567640	2572840	Eine Sache zu dem Klassenbewusstsein, ich glaube auch, dass die Gesellschaft sich verändert hat,
2572840	2577520	aber ich glaube, dass es braucht trotzdem neue Gemeinsamkeiten und vielleicht eben eine neue Art,
2577520	2582960	wie ein Klassenbewusstsein heutzutage aussieht in dieser sehr veränderten Gesellschaft, in dem
2583040	2588080	man zum Beispiel merkt, krass, ich gehöre zu einfach einem großen Teil von so und so vielen
2588080	2593560	Millionen Leuten, die einfach nur so viel Geld haben oder die aufgrund dessen sich einfach diese
2593560	2597400	und diese Sachen nicht leisten können, die da was Geteiltes haben und ich glaube, das ist
2597400	2602040	tatsächlich komplett notwendig aufzubauen, weil genau einfach diese Vorstellung fehlt und ich
2602040	2607480	meine, das ist ja auch letztens dieses ZDF-Doku über die Superreichen, fand ich echt auch selber
2607480	2612080	noch mal zu sehen, richtig krass, einfach in was für einem Paralleluniversum die leben, wie
2612080	2617240	versteckt und heimlich und es einfach für die meisten sogar irgendwie mittlerweile sehr
2617240	2622320	privilegierte Personen wie ich, das einfach überhaupt nicht sehe und wenn ich jetzt auch
2622320	2626840	irgendwie an meine Mutter denke, die zum Beispiel auch von Armut betroffen ist, das ist einfach
2626840	2630720	eine krass andere Realität, wenn du einfach überlegen musst und auch wie die Sozialleistungen
2630720	2635800	teilweise gestrickt sind, was für Steine sie dir immer wieder in den Weg werfen, da kannst du
2635800	2639640	einfach gar nicht weiterkommen und daraus wieder kommen. Ja und das ist irgendwie krass, weil die
2639640	2643160	Leute ja genau die sind, die sich nicht wehren können, weil die so wenig Zeit haben und so krass
2643160	2647160	hasseln in ihrem Leben, dass die das gar nicht nachvollziehen können und dann auch gar nicht
2647160	2651400	demonstrieren gehen können. Also ich habe jetzt gerade, gab es noch mal so eine Tagesschau-Slide
2651400	2656640	zu dem neuen Haushalt und wäre jetzt eigentlich in diesen Sparsachen am meisten auf die höchsten
2656640	2659760	Mehrbelastungen zukommen und die höchsten Mehrbelastungen kommen auf alleinerziehende
2659760	2664080	Mütter, also alleinerziehende, die ja meistens alleinerziehende Mütter sind, zu einfach,
2664080	2668480	weil die keine Lobby haben, die haben einfach keine Zeit sich darum zu kümmern, dass sie irgendwie
2668480	2672720	politisch vertreten werden. Und das finde ich ist echt eine spannende Frage in Bezug auf eine
2672720	2680040	linke Partei, wie man es schafft, Leute dafür zu mobilisieren, sich genau für diese Leute
2680040	2685560	im Grunde ja einzusetzen, die selber keine Zeit dazu haben und sich mit denen solidarisch zu fühlen.
2685560	2690240	Ja das ist auch ein Stück weit eine strukturelle Herausforderung einfach bei linker Politik,
2690240	2693640	dass man einerseits möchte man keine reine Stellvertreterpolitik ja auch machen,
2693640	2697280	also man möchte ja auch nicht nur für die Leute immer sprechen, sondern man möchte ja auch denen
2697280	2700720	die Möglichkeit geben sich einzubringen und gleichzeitig sind die Leute, die man versucht
2700720	2705600	zu vertreten, zu stärken, eben genau die, für die die Hürden sich zu engagieren und einzubringen
2705600	2710600	am höchsten sind und damit muss man auf jeden Fall umgehen. Lizza du hast ja jetzt so das Schlagwort
2710600	2716480	noch mal gesagt von das gemeinsame, was man irgendwie teilt, also eine Art neues Klassenbewusstsein
2716480	2721960	vielleicht, was es bräuchte von so wo stehe ich in der Gesellschaft und wer steht da noch alles,
2721960	2727360	also könnte man das vielleicht übersetzen. Gleichzeitig, wir sind ja jetzt noch beim Thema
2727360	2733360	Herausforderung für die Linkspartei und da sieht man eben ganz deutlich, dass eigentlich die Krisen
2733360	2738880	der letzten Jahre eigentlich alle welche waren, von denen die Linke, gesellschaftliche Linke,
2738880	2745160	nicht profitieren konnte. Also da gibt es ja einerseits Krieg, da hat sich die gesellschaftliche Linke
2745160	2751320	dran zerlegt, dann gab es Corona, da hat sich es auch ganz schön dran zerlegt, dann aber auch die
2751320	2755880	Themen wie Migration, das wäre dann ein bisschen der Kampf zwischen Sarah Wagenknecht und ihren
2755880	2762280	Gefolgsleuten und dem Rest der Linkspartei, wo es da eben auch sehr stark zur Sache ging. Aber auch
2762280	2767400	bei Klima ist es ja auch immer wieder so eine Frage, ob da auch eigentlich, also inwieweit das auch
2767400	2773920	spaltet, das linke Lager, die Einstellung zu stärkerem Klimaschutz. Warum ist es so? Also
2773920	2778320	warum, normalerweise, ich habe das Gefühl als Linke haben wir, also beziehungsweise wenn ich
2778320	2783800	von mir selbst spreche, habe ich eigentlich immer wieder so den Eindruck, okay, eigentlich kann doch
2783800	2789000	Linke Politik auch von Krisen fast, müsste doch eigentlich fast profitieren können. Wenn es den
2789000	2793960	Leuten, wenn es Schwierigkeiten gibt, dann stellen sie sich grundsätzlichere Fragen dazu, wie die
2793960	2798000	Gesellschaft organisiert ist, woran das liegt, dass es ihnen schlecht geht und könnten ja dann eben
2798000	2803920	auch zu dem Schluss kommen, dass es, dass sich was ändern muss. Aber scheinbar passiert das nicht.
2803920	2809080	Wie blickst du da drauf, auf diese ganzen vielen Spaltungslinien, die sich innerhalb des linken
2809080	2813840	Lagers in den letzten Jahren so immer wieder auftun? Also mir fallen da so zwei Aspekte ein,
2813840	2819280	die ich da glaube ich ganz wichtig finde. Also einmal glaube ich fällt sowieso dieses gemeinsame
2819280	2825920	Feld linken Leuten nicht so leicht. Also das merken wir in unseren kleinen Gruppen, aber auch
2825920	2830920	eben in größeren Zusammenhängen. Und ich glaube, das ist echt ein krass großes Problem, eine richtig
2830920	2837200	große Herausforderung. Und ich glaube, wir brauchen eine neue, gemeinsam handelnde linke Praxis,
2837200	2843840	die weniger vielleicht sich über theoretische Texte zerlegt, diskutiert und so weiter. Natürlich
2843840	2848680	ist auch wichtig, irgendwie ein theoretisches Fundament zu haben, aber die wirklich mehr in
2848680	2853960	der Praxis im Handeln, das gemeinsame entdeckt und guckt, wie können wir so die Gesellschaft
2853960	2858120	organisieren. Und ich hoffe, dass die Linkspartei sich in diese Richtung entwickeln kann, auch Teil
2858120	2864280	von dieser neuen Praxis werden kann. Und auf der anderen Seite genau die Frage mit den Krisen,
2864280	2869160	warum kann die Linke nicht genau in diesen Krisen organisieren und irgendwie Unterstützung
2869160	2873600	gewinnen. Also das ist wirklich meine eigene Spekulation, aber ich habe den Eindruck, dass
2873600	2879800	sich in so Krisen eigentlich bei den Menschen eher so der Horizont so verengt und dass eher das
2879800	2885240	Angstgefühl vorherrschend ist. Und das Angstgefühl ist so das Gegenteil, glaube ich, von dem von
2885240	2890240	Solidarität und Teilen. Und ich glaube, auch dieses Angstgefühl wird von jeder schlechten
2890240	2895600	Nachricht und Krise weiter geschürt. Und ich glaube auch, dass wir deswegen auch als Linke
2895600	2900520	insgesamt oder auch als Linke Partei gar nicht mehr auch so mit dieser Angstkommunikation arbeiten
2900520	2905440	sollten, weil das bezahlt im Endeffekt auf das falsche Konto ein und zwar auf das Konto der
2905440	2910480	Rechten. Und die profitieren, die werden immer stärker. Und ich glaube, wir müssen eigentlich
2910480	2917360	deutlich freundlicher werden, netter und sympathischer und konfliktfreier und auch
2917360	2920560	in unserer öffentlichen Kommunikation, weil ich glaube, also ich glaube es auch nicht sehr
2920560	2925480	attraktiv. So das führt echt zu einer Verengung und in der stecken wir gerade fest. Voll, das
2925480	2929080	muss ich gerade noch mal dran denken. Ich war vor ein paar Jahren mal auf einer internationalen
2929080	2934040	Konferenz von Aktivistinnen und Aktivisten und da hat eine Forscherin oder Aktivistin,
2934040	2940560	weiß ich nicht mehr genau, aus den USA gesagt, die Rechten, they win on fear and we win on hope.
2940560	2944600	Und das stimmt, glaube ich. Das ist, glaube ich, echt viel dran, auch wenn man sich die erfolgreichen
2944600	2950800	letzten Wahlkämpfe von linken und linksliberalen Parteien anguckt. Und das ist aber, glaube ich,
2950800	2954520	genau wie du sagst, so innerhalb dieser Krisen fällt es einfach extrem schwer, diesen
2954520	2958560	Hoffnungshorizont aufzubauen, weil man sich so sehr erdrückt fühlt irgendwie auch vom negativen
2958560	2963560	Ausblick und von der Last dieser Krisen irgendwie. Und trotzdem glaube ich, dass da auch eine Aufgabe
2963680	2968240	drin steckt, weil es wird ja, jetzt wenn man sich die Klimakrise anguckt und so, in vielen
2968240	2971480	Stellen wird es nicht besser werden. Wir müssen irgendeinen Umgang damit finden, wie wir trotzdem
2971480	2974520	sagen können und ich glaube auch den Leuten so eine Art Sicherheit vermitteln können zu sagen,
2974520	2981800	hey aber hier kommt viel und es wird viel passieren. Aber A, ihr habt schon ganz schön viel gemacht,
2981800	2986960	also ja oder ihr habt schon ganz schön viel auch gemeistert jetzt auch gerade was zur
2986960	2990640	Transformationskompetenz angeht, zum Beispiel in den jetzt gar nicht mehr so neuen Bundesländern,
2990640	2995920	aber in den östlichen Bundesländern. Und B, die größte Sicherheit, die wir haben können, schaffen
2995920	2999520	wir gemeinsam und so. Und ich glaube, das ist aber wirklich ein Feld, wo wir noch mal so ein bisschen
2999520	3005440	darüber, wo wir noch mehr experimentieren müssen, wo man die Leute kriegen kann. Genau, jetzt wollen
3005440	3008840	wir aber noch mal ein bisschen weitergehen im Gespräch und noch mal vielleicht auch ein Blick
3008840	3014480	auf das Bündnis der Ravagenknecht werfen. Das sind ja nun genau die, die eher mit Angst und
3014480	3020080	vielleicht auch zum Teil mit Wut auf alle, die was verändern wollen, Wahlkampf machen. Wie
3020080	3025360	bewertest du denn jetzt die Abspaltung und was liegen da vielleicht auch für Chancen oder was
3025360	3031480	auch für Gefahren drin? Also ich glaube erstmal ist es ein absoluter Befreiungsschlag für die Linke,
3031480	3038400	dass endlich dieser Schritt, der so lange überfällig war, stattgefunden hat. Und es gab ja
3038400	3044200	einfach schon bestehende Konflikte, die wirklich nicht mehr vereinbar miteinander sind. Und das
3044200	3049720	beruht auf politischen Weltbildern, die sich wirklich teilweise konträr gegenüberstehen. Und
3049720	3055840	deswegen glaube ich, es ist wirklich nur gut, dass endlich dieser Schlussstrich gezogen ist und diese
3055840	3062400	Trennung stattgefunden hat. Und wenn wir uns dann auch, ich habe mir so ein paar Meinungsforschungsstudien
3062400	3067280	angeschaut, wo auch sichtbar wird, dass eigentlich auch vom Wählerpotenzial es gar nicht so viele
3067280	3070800	Überschneidungen gibt mit der Linkspartei. Ich glaube, da gibt es tatsächlich deutlich mehr mit
3070800	3075960	der AfD und eher rechteren Parteien. Und da bin ich einfach total gespannt, wie sich das entwickelt,
3075960	3081080	weil viele sagen ja irgendwie gut, wenn sie der AfD die Stimmen nimmt. Ist das so? Keine Ahnung,
3081080	3085160	kann ich gar nicht beurteilen, ob das dann wirklich so ist, dass es dann so ein bisschen moderater
3085160	3090440	wird oder vielleicht ist es aber auch eher so, dass eine weitere eher rechte Partei einfach das Lager
3090440	3096800	stärkt. Gibt es ja auch irgendwie die Theorien dazu. Genau, deswegen denke ich, dass es für uns als
3096800	3101360	Linke einfach gar nicht mehr so eine große Rolle spielen wird. Okay, das ist jetzt erstmal ziemlich
3101480	3108440	hoffnungsvoll, aber es ist jetzt schon so, dass sie möglicherweise ein paar sehr bekannte Gesichter
3108440	3114200	mitnimmt. Also Fabio De Masi hat jetzt gesagt, dass er auch Teil des Bündnisses Sarah Wagenknecht sein
3114200	3118920	wird. Und das ist ja schon sehr, wer seht, der Finanzpolitiker, der auch einfach ganz konkrete
3118920	3124840	parlamentarische Erfahrung hat. Und da bin ich schon mal gespannt, was das oder hoffe ich,
3124840	3130440	dass nicht noch viel mehr sehr erfahrenen Leute mitgehen. Da sehe ich, glaube ich, schon so ein
3130800	3137040	Gefahr drin. Aber mich würde noch mal interessieren, was du denn glaubst, worauf sie eigentlich genau
3137040	3143200	abzielt oder ob sie sich eigentlich wirklich Chancen ausrechnet, irgendwo einzuziehen. Weil
3143200	3147760	das ist für mich irgendwie auch noch ziemlich fragwürdig, ob sie eigentlich oder fragwürdig
3147760	3151520	ist eher freundlich ausgedrückt dafür, ob sie eigentlich wirklich eine Chance hat, irgendwo auch
3151520	3157080	die ausreichenden Sitze zu bekommen. Ja, das finde ich auch total spannend und ist für mich auch
3157080	3162480	total schwierig einzuschätzen. Ich glaube, dass sie halt schon, sie versucht, glaube ich,
3162480	3167160	sehr unterschiedliche Zielgruppen tatsächlich anzusprechen und zu vereinen. Und ich glaube,
3167160	3170320	es wird total spannend, ob sie das schaffen werden. Zum Beispiel einmal hat sie ja diese
3170320	3175200	gesamte Friedensthematik, die sie verbissen versucht, so als Alleinstellungsmerkmal oder
3175200	3179560	auch ein bisschen gegen die Linke auszuspielen, obwohl halt auch für die linke Friedenspolitik
3179560	3184200	sehr wichtig ist. Auf der anderen Seite so ein bisschen dieses gesamte verschwörungstheoretische
3184200	3188880	Netzwerk dockt sie an, wo auch irgendwie die Corona-Leugner und so weiter dazugehören,
3188880	3195640	sehr nach rechts offen ist. Und dann das eher antimigrationsrassistische Kontext. Und ich habe
3195640	3199080	auch den Eindruck, also auch Sachen, die ich gelesen habe, was ich total spannend finde,
3199080	3203160	dass auch diese verschiedenen Gruppen halt teilweise nur einen Punkt teilen,
3203160	3207920	dass denen aber so wichtig, dass sie das andere mit in Kauf nehmen. Da bin ich total gespannt,
3207920	3213080	wie sich das trägt. Also ob sie es trotzdem schafft, so eine Kernzielgruppe aufzubauen,
3213280	3218760	die irgendwie auch miteinander funktioniert. Und auch wie lange sich das trägt, dass sie das
3218760	3223760	versucht, über ihre Berühmtheit so zu machen. Also ob das relativ schnell verpufft, wenn sie
3223760	3228840	dann eigentlich liefern muss, könnte auch sein, dass das gar nicht klappt. Ich glaube,
3228840	3234560	wir müssen es beobachten. Und es ist auf jeden Fall ein spannender Versuch. Ja, aber ich glaube
3234560	3239160	wirklich, dass es einfach von der ideologischen Überzeugung so weit weg ist von der Linkspartei,
3239240	3243160	dass sie einfach in einem sehr anderen Milieu überhaupt fischt. Das finde ich irgendwie auch
3243160	3246760	richtig interessant. Das hat Steffen Mauer am Ende seines dieses einen Spiegelinterviews,
3246760	3251000	auf das wir jetzt auch schon Bezug genommen haben, gesagt. Meinte er so was wie, weil er
3251000	3256440	sehr empirischer Soziologe ist. Die Wirklichkeit ist immer noch ein bisschen verrückter, als man
3256440	3260560	so denkt und auch als man so theoretisch oder ideologisch getrieben oft denkt. Und die Leute
3260560	3267120	können ganz schön unterschiedliche Weltbilder miteinander irgendwie vereinen, solange das
3267120	3271200	Gesamtpaket oder ihr wichtigstes Thema irgendwie hinhaut. Da bin ich auch gespannt,
3271200	3274800	wie das sein wird in der Partei oder wie lange es dauert, bis sich dann einzelne
3274800	3282000	Gruppen irgendwie doch wieder abspalten, auch davon. Hallo und sorry für die kurze Unterbrechung.
3282000	3288600	Du hast jeden was tun, Podcast. Und viele von euch wissen es bestimmt bereits. Damit ein Podcast wie
3288600	3292440	unserer vielen Menschen angezeigt wird und möglichst vielen Menschen ausgespielt wird,
3292440	3297360	brauchen wir viele gute Bewertungen in den Podcatchern. Deshalb bitten wir euch um eure
3297360	3301960	Hilfe. Wenn ihr das noch nicht getan habt, dann klickt doch jetzt in eurem Podcatcher auf die
3301960	3306000	5 Sterne und wenn ihr mögt, schreibt auch gerne einen Kommentar zum Podcast. Wenn wir viele
3306000	3309720	Interaktionen haben, dann wird der Podcast mehr Menschen angezeigt und noch mehr Menschen können
3309720	3318320	unsere Folgen hören. Vielen Dank und jetzt viel Spaß beim Weiterhören. So in meinem Umfeld war es
3318320	3322880	auf jeden Fall auch immer ein wichtiger Grund, nicht in die Linkspartei einzutreten, dass Sarah
3322880	3327520	Wang nicht da war. Jetzt ist sie weg und jetzt ist dieser wichtige Grund auf einmal auch irgendwie
3327520	3332360	hinfällig und viele Leute stellen sich vor dem Hintergrund einfach noch mal anders die Frage,
3332360	3336840	ob man da dabei sein will und dabei sein kann. Gleichzeitig erlebe ich das aber schon auch immer
3336840	3343800	wieder in linken Kreisen so eine gewisse Grundskepsis gegenüber Parteien so allgemein, vielleicht auch
3343800	3348520	basierend auf der Erfahrung, dass man schon mal auf irgendwas gehofft hat und dann enttäuscht
3348520	3355080	wurde von diesen ewigen Kompromissen, die Parteien eben ja auch immer wieder produzieren müssen auf
3355080	3361440	eine Art auch. Wie war das für dich immer schon irgendwie so eine klare Sache, dass die Partei
3361440	3366560	viel Potenzial hat oder hattest du da auch so ein Prozess, der dazu geführt hat, dass du sagst,
3366560	3373160	okay, ich werde da jetzt Teil von? Auf jeden Fall ein Prozess. Also ich würde sagen, vor ein paar
3373160	3378080	Jahren habe ich schon überlegt und habe gemerkt, ich kann einfach nicht in der Partei beitreten,
3378080	3384920	da war ich noch nicht an dem Punkt. Ich glaube aber, der Prozess hat eben schon vor ein paar Jahren
3384920	3389720	begonnen, wo ich auch gemerkt habe, auch Bewegungspolitik hat natürlich starke Grenzen,
3389720	3394640	natürlich hat auch Parteipolitik starke Grenzen, es sind sehr unterschiedliche Rollen und ich hatte
3394640	3399680	irgendwann selber mehr Lust oder hatte auch irgendwie gemerkt, so ich will nicht immer nur
3399680	3404480	appellieren. Ich will nicht immer nur eine Kampagne nacheinander starten, die dann doch
3404480	3409560	irgendwie verpufft, die auch auf jeden Fall deutlich weniger Aufmerksamkeit kriegt und ich
3409560	3414880	glaube, als Partei hast du das Potenzial, dass du einfach deutlich langfristiger Leute organisieren
3414880	3420800	kannst. Du hast ja auch sehr viel Zugang zu verschiedenen Orten in der Gesellschaft,
3420800	3426400	sowohl irgendwie dann im Lokalen, aber eben halt auch in die größeren Orte der Macht wie Bundestag,
3426640	3432160	Landtage und so weiter und das erscheint mir einfach mittlerweile als absolut notwendig,
3432160	3439120	dass es da irgendwie eine starke linke Stimme gibt und ich glaube aber auch, dass es notwendig ist,
3439120	3443280	eine gewisse Pragmatik da mitzubringen. Man darf wahrscheinlich auch nicht zu pragmatisch sein,
3443280	3447840	aber das wird natürlich nicht die reine Leere sein oder was man sich in seiner Gruppe vorher
3447840	3451680	vorgestellt hat, was man alles durchkriegen kann. Ich meine, es sind ja jetzt auch schon die Debatten,
3451680	3457320	die Linke regiert ja auch in Ländern mit, auch da finden Sachen statt, wo ich auch sagen würde,
3457320	3464080	finde ich absolut scheiße, aber man muss dann halt auch abwägen, was ist das kleinere Übel,
3464080	3468400	das glaube ich gibt es in jeder Situation neu zu denken und ich glaube aber trotzdem,
3468400	3472960	dass es nicht gut ist, wenn die, also ich glaube die Linke muss auch stark bei ihren Themen bleiben
3472960	3477880	und grundsetzen und sich wirklich gut überlegen, wann lohnt es sich mit in so eine Regierungsverantwortung
3477880	3481880	zum Beispiel zu gehen. Ja, das ist interessant. Ich habe das Gefühl, in der Partei ist man dann
3481880	3487120	einfach noch mal anders gezwungen, auch immer nachdem man halt die Konflikte auf Parteitagen
3487120	3492280	hart geführt hat und eine Entscheidung kam, dann eben auch am Ende aber zu sagen, okay,
3492280	3497360	das ist jetzt die Position, auf die wir uns geeinigt haben in unserem Verfahren und jetzt trage ich
3497360	3501440	das auch mit. Das heißt, man ist dann eben auch schnell in so einer Lage und in so einer Position,
3501440	3506280	wo man auf eine Art auch die Kompromisse rechtfertigen muss, die man selber vielleicht
3506440	3511520	individuell gar nicht so sieht und da das gut auszutarieren. Ich glaube, daher kommt einerseits
