start	end	text
7054720	7060080	sphere of ideas, earth and heaven, as they're being described there. And then it's creating
7061600	7070000	contrast and then dimensions and then space. And then it creates organic shapes and solids
7070000	7073680	and liquids and builds a world from them and creates plants and animals, gives them all their
7073680	7079520	names. And once that's done, it creates another spirit in its own image, but it creates it as
7079520	7083840	man and woman, as something that thinks of itself as a human being and puts it into this world.
7084400	7090400	And the Christians mistranslate this, I suspect, when they say this is the description of the
7090400	7096000	creation of the physical universe by a supernatural being. I think this is literally a description of
7096000	7099840	how in every mind the universe is being created as some kind of game engine
7101120	7106960	by a creative spirit, our first consciousness that emerges in our mind even before we are born.
7107760	7114640	And that creates the interaction between organism and world. And once that is built and trained,
7115200	7119520	the personal self is being created and we only remember being the personal self. We no longer
7119520	7125840	remember how we created the game engine. So God in this view is the first creative
7125840	7128000	mind in the early- It's the first consciousness.
7128720	7132800	In the early days, in the early months of development.
7132800	7138320	And it's still there. You still have this outer mind that creates your sense of whether you're
7138320	7143920	being loved by the world or not and what your place in the world is. It's something that is
7143920	7149200	not yourself that is producing this. It's your mind that does it. So there is an outer mind that
7149200	7154080	basically is an agent that determines who you are with respect to the world. And while you
7154080	7159680	are stuck being that personal self in this world until you get to stage six and to destroy the
7159680	7166320	boundary. And we all do this, I think, earlier in small glimpses. And maybe sometimes we can
7166320	7171280	remember what it was like when we were a small child and get some glimpses into how it's been.
7171280	7176800	But for most people, that rarely happens. Just glimpses. You tweeted, quote,
7176800	7180720	suffering results for one part of the mind, failing at regulating another part of the mind.
7181360	7186560	Suffering happens at an early stage of mental development. I don't think that superhuman AI
7186560	7192960	would suffer. What's your intuition there? The philosopher Thomas Metzinger is very
7192960	7197680	concerned that the creation of superhuman intelligence would lead to superhuman suffering.
7198480	7203840	And so he's strongly against it. And personally, I don't think that this happens because suffering
7203840	7210240	is not happening at the boundary between ourself and the physical universe. It's not
7211040	7217200	some stuff on our skin that makes us suffer. It happens at the boundary between self and world.
7218080	7222560	And the world here is the world model. It's the stuff that is created by your mind.
7222560	7226160	But that's all- The representation of how the universe is and how it should be
7226160	7230720	and how you yourself relate to this. And at this boundary is where suffering happens.
7231440	7237200	So suffering in some sense is self-inflicted, but not by your personal self. It's inflicted by the
7237200	7242640	mind on the personal self that experiences itself as you. And you can turn off suffering
7242640	7251120	when you are able to get on this outer level. So when you manage to understand how the mind is
7251120	7259920	producing pain and pleasure and fear and love and so on, then you can take charge of this and you
7259920	7266160	get agency of whether you suffer. Technically, what pain and pleasure is, they are learning
7266160	7271600	signals. Part of your brain is sending a signal to another part of the brain to improve its
7271600	7278640	performance. And sometimes this doesn't work because the trainer who sends the signal
7278640	7282480	does not have a good model of how to improve the performance. So it's sending a signal,
7282480	7289280	but the performance doesn't get better. And then it might crank up the pain. And it gets worse and
7289280	7295360	worse. And the behavior of the system may be even deteriorating as a result. But until this is
7295360	7300480	resolved, this regulation issue, your pain is increasing. And this is, I think, typically what
7300480	7307680	you describe as suffering. So in this sense, you could say that pain is very natural and helpful,
7307680	7312480	but suffering is the result of a regulation problem in which you try to regulate something
7312480	7316880	that cannot actually be regulated. And that could be resolved if you would be able to
7317840	7322160	get at the level of your mind where the pain signal is being created and rerouted
7322880	7330000	and improve the regulation. And a lot of people get there. If you are a monk who is
7330000	7335920	spending decades reflecting about how their own psyche works, you can get to the point where you
7337040	7341440	realize that suffering is really a choice. And you can choose how your mind is set up.
7342160	7347520	And I don't think that AI would stay in the state where the personal self doesn't get agency or this
7347520	7351680	model of what the system has about itself. It doesn't get agency how it's actually implemented.
7352400	7355680	It wouldn't stay in that state for very long. So it goes to the stages real quick?
7355680	7358960	Yes. Well, the seven stages. It's going to go to enlightenment real quick.
7358960	7363120	Yeah. Of course, there might be a lot of stuff happening in between because if you have a system
7363120	7367840	that works at a much higher frame rate than us, even though it looks very short to us,
7367840	7374000	maybe for the system, there's a much longer subjective time, which things are unpleasant.
7374000	7379200	What if the thing that we recognize as super intelligent is actually living at stage five,
7379200	7383120	that the thing that's at stage six, enlightenment, is not very productive.
7383120	7388960	So in order to be productive in society and impress us with this power, it has to be a reasoning,
7390320	7396240	self-authoring agent. The enlightenment makes you lazy as an agent in the world.
7397600	7404320	Well, of course, it makes you lazy because you no longer see the point. So it doesn't make you not
7404320	7410560	lazy. It just, in some sense, adapts you to what you perceive as your true circumstances.
7410560	7416480	So what if all AGI's, they're only productive as they progress through one, two, three, four,
7416480	7422320	five, and the moment they get to six, it's a failure mode essentially as far as humans
7422320	7426240	are concerned because they just start chilling. They're like, fuck it, I'm out.
7427200	7432560	Not necessarily. I suspect that the monks who are self-immolated for their political
7432560	7440400	beliefs to make statements about the occupation of Tibet by China, they're probably being able
7440400	7445840	to regulate their physical pain in any way they wanted to. And their suffering was a spiritual
7445840	7451200	suffering that was the result of their choice that they made of what they wanted to identify as.
7451200	7454640	So stage five doesn't necessarily mean that you have no identity anymore,
7454640	7458400	but you can choose your identity. You can make it instrumental to the world that you want to have.
7458400	7461520	LW Let me bring up
7462320	7469760	Eliezer Yudkovsky and his warnings to human civilization that AI will likely kill all of us.
7470720	7474240	What are your thoughts about his perspective on this?
7474240	7478640	Can you steel man his case? And what aspects with it do you disagree?
7481640	7486080	MP One thing that I find concerning in the discussion of his arguments that
7486800	7491280	many people are dismissive of his arguments, but the counter arguments that they're giving
7491280	7498880	are not very convincing to me. And so based on this state of discussion, I find that from
7498880	7505440	Eliezer's perspective, and I think I can take that perspective to some approximate degree,
7506000	7511840	that probably is normally at his intellectual level, but I think I see what he's up to and
7511840	7517520	why he feels the way he does, and it makes total sense. I think that his perspective is somewhat
7517520	7526320	similar to the perspective of Ted Kaczynski, the infamous lunar bomber, and not that Eliezer would
7526320	7531520	be willing to send pipe bombs to anybody to blow them up. But when he wrote this Times article in
7531520	7538400	which he warned about AI being likely to kill everybody and that we would need to stop its
7538400	7544240	development or halt it, I think there is a risk that he's taking that somebody might get violent
7544240	7551120	if they read this and get really, really scared. I think that there is some consideration that
7551120	7557200	he's making where he's already going in this direction where he has to take responsibility
7557200	7562560	if something happens and people get harmed. And the reason why Ted Kaczynski did this was
7562560	7567760	that from his own perspective, technological society cannot be made sustainable. It's doomed
7567760	7573040	to fail. It's going to lead to an environmental and eventually also a human holocaust in which
7573040	7578080	we die because of the environmental destruction, the destruction of our food chains, the pollution
7578080	7583200	of the environment. And so from Kaczynski's perspective, we need to stop industrialization.
7583200	7587360	We need to stop technology. We need to go back because he didn't see a way moving forward.
7588720	7592400	I suspect that in some sense, there's a similarity in Eliezer's thinking
7593120	7602720	of this kind of fear about progress. And I'm not dismissive about this at all. I take it
7602720	7609120	quite seriously. And I think that there is a chance that could happen that if we build machines that
7609120	7618960	get control over processes that are crucial for the regulation of life on earth and we no longer
7618960	7624800	have agency to influence what's happening there, that this might create large-scale disasters for
7624800	7632400	us. Do you have a sense that the march towards this uncontrollable autonomy of superintelligence
7632400	7642240	systems is inevitable? That's essentially what he's saying, that there's no hope. His advice
7642240	7650320	to young people was prepare for a short life. I don't think that's useful. I think that
7650960	7655360	from a practical perspective, you have to bet always on the timelines in which you are
7655360	7661440	alive. It doesn't make sense to have a financial bet in which you bet that the financial system
7661440	7667520	is going to disappear because there cannot be any payout for you. So in principle, you only need to
7667520	7673120	bet on the timelines in which you're still around or people that you matter about or things
7673120	7679840	that you matter about, maybe consciousness on earth. But there is a deeper issue for me personally.
7679840	7685520	And I don't think that life on earth is about humans. I don't think it's about human aesthetics.
7685520	7691040	I don't think it's about Eliezer and his friends, even though I like them. There's something more
7691040	7698720	important happening. And this is complexity on earth resisting entropy by building structure
7698720	7706880	that develops agency and awareness. And that's to me very beautiful. And we are only a very small
7706880	7713040	part of that larger thing. We are a species that is able to be coherent a little bit individually
7713040	7719920	over very short timeframes. But as a species, we are not very coherent. As a species, we are children.
7719920	7727040	We basically are very joyful and energetic and experimental and explorative and sometimes
7727040	7734880	desperate and sad and grieving and hurting. But we don't have a respect for duty as a species.
7734880	7740160	As a species, we do not think about what is our duty to life on earth and to our own survival.
7740160	7747120	So we make decisions that look good in the short run, but in the long run, might prove disastrous.
7747120	7754160	And I don't really see a solution to this. So in my perspective as a species, as a civilization,
7754160	7762000	we are in a very beautiful time in which we have found this giant deposit of fossil fuels in the
7762000	7768480	ground and use it to build a fantastic civilization in which we don't need to worry about food and
7768480	7773760	clothing and housing for the most part in a way that is unprecedented in life on earth for any
7773760	7780560	kind of conscious observer, I think. And this time is probably going to come to an end in a way that
7780560	7789360	is not going to be smooth. And when we crash, it could be also that we go extinct, probably not
7789360	7796000	near term, but ultimately, I don't have very high hopes that humanity is around in a million years
7796000	7801120	from now. And I don't think that life on earth will end with us. There's going to be more
7801120	7806000	complexity. There's more intelligent species after us. There's probably more interesting
7806000	7811440	phenomena in the history of consciousness. But we can contribute to this. And part of our
7811440	7818480	contribution is that we are currently trying to build thinking systems, systems that are
7818480	7823520	potentially lucid, that understand what they are and what their condition to the universe is,
7823520	7829200	and can make choices about this, that are not built from organisms, and that are potentially much
7829200	7837920	faster and much more conscious than human beings can be. And these systems will probably not
7837920	7844160	completely displace life on earth, but they will coexist with it. And they will build all sorts of
7844160	7850880	agency in the same way as biological systems build all sorts of agency. And that to me is
7850880	7856960	extremely fascinating. And it's probably something that we cannot stop from happening. So I think
7856960	7861360	right now there is a very good chance that it happens. And there are very few ways in which
7861360	7866400	we can produce a coordinated effect to stop it, in the same way as it's very difficult for us to
7866400	7875440	make a coordinated effort to stop the production of carbon dioxide. So it's probably going to
7875440	7882800	happen. And the thing that's going to happen is going to lead to a change of how life on earth
7882800	7888240	is happening. But I don't think the result is some kind of grey goo. It's not something that's
7888240	7893360	going to dramatically reduce the complexity in favor of something stupid. I think it's going
7893360	7900720	to make life on earth and consciousness on earth way more interesting. So more higher complex
7900720	7907200	consciousness will make the lesser consciousnesses flourish even more.
7907200	7911120	I suspect that what could very well happen, if you're lucky,
7911120	7914560	is that we get integrated into something larger.
7915920	7922880	So you again tweeted about effective accelerationism.
7925920	7931360	You tweeted effective accelerationism is the belief that the paperclip maximizer and
7931360	7938480	Rocco's basilisk will keep each other in check by being eternally at each other's throats,
7938480	7943200	so we will be safe and get to enjoy lots of free paper clips and a beautiful afterlife.
7945680	7948400	Is that somewhat aligned with what you're talking about?
7949440	7957120	I've been at a dinner with Beth Jesus. That's the Twitter handle of one of the main thinkers
7957120	7964080	behind the idea of effective accelerationism. Effective accelerationism is a tongue-in-cheek
7964080	7973600	movement that is trying to put a counter position to some of the doom peers in the AI space by
7973600	7978560	arguing that what's probably going to happen is an equilibrium between different competing
7978560	7983440	AIs in the same way as there is not a single corporation that is under a single government
7983440	7987760	that is destroying and conquering everything on Earth by becoming inefficient and corrupt.
7988400	7993200	There are going to be many systems that keep each other in check and force themselves to evolve.
7994880	7999680	What we should be doing is we should be working towards creating this equilibrium
8000320	8007600	by working as hard as we can in all possible directions. At least that's the way in which
8007600	8014960	I understand the gist of effective accelerationism. When he asked me what I think about this
8014960	8022720	position, I said it's a very beautiful position and I suspect it's wrong, but not for obvious
8022720	8029600	reasons. In this tweet, I tried to make a joke about my intuition about what might be possibly
8029600	8038400	wrong about it. The Rokosbazilisk and the paperclip maximizers are both bogeymen of the AI doomers.
8038400	8044640	Rokosbazilisk is the idea that there could be an AI that is going to punish everybody for eternity
8044640	8050480	by stimulating them if they don't help in creating Rokosbazilisk. It's probably a very good idea to
8050480	8055760	get AI companies funded by going to VCs to tell them, give us a million dollars or it's going to
8055760	8063200	be a very ugly afterlife. And I think that there is a logical mistake in Rokosbazilisk,
8063200	8068320	which is why I'm not afraid of it, but it's still an interesting thought experiment.
8069280	8073040	Can you mention a logical mistake there? I think that there is no retroquisition.
8074400	8081760	Basically, when Rokosbazilisk is there, if it punishes you retroactively,
8082320	8087600	it has to make this choice in the future. There is no mechanism that automatically creates a causal
8087600	8093280	relationship between you now defecting against Rokosbazilisk or serving Rokosbazilisk. After
8093280	8099040	Rokosbazilisk is in existence, it has no more reason to worry about punishing everybody else.
8099840	8103360	That would only work if you would be building something like a doomsday machine,
8104560	8109920	as in Dr. Strangelove, something that inevitably gets triggered when somebody defects.
8110560	8116560	And because Rokosbazilisk doesn't exist yet to a point where this inevitability could be established,
8116560	8119600	Rokosbazilisk is nothing that you need to be worried about.
8120240	8125120	The other one is the paper clip maximizer, this idea that you could build some kind of golem
8125120	8129680	that once starting to build paper clips is going to turn everything into paper clips.
8130880	8139120	So the effective accelerationism position might be to say that you basically end up with these two
8139840	8144160	entities being at each other's throats for eternity and thereby neutralizing each other.
8144160	8149840	And as a side effect of neither of them being able to take over and each of them limiting
8150560	8156480	the effects of the other, you would have a situation where you get all the nice benefits
8156480	8160880	effects of them, right? You get lots of free paper clips and you get a beautiful afterlife.
8160880	8165360	Is that possible? Do you think to seriously address the concern that Eliezer has?
8166320	8169840	He, so for him, if I can just summarize poorly,
8169840	8173680	so for him, the first superintelligence system will just run away with everything.
8173680	8180400	Yeah. I suspect that the singleton is the natural outcome. There is no reason to have multiple AIs
8180400	8187120	because they don't have multiple bodies. If you can virtualize yourself into every substrate,
8187120	8190480	then you can probably negotiate a merge algorithm with every mature
8191120	8196480	agent that you might find on that substrate that basically says if two agents meet,
8196480	8200720	they should merge in such a way that the resulting agent is at least as good as the
8200720	8204640	better one of the two. So the Genghis Khan approach, join us or die?
8205760	8212880	Well, the Genghis Khan approach was slightly worse, right? It was mostly die because I can
8212880	8218640	make new babies and that will be mine, not yours. So this is the thing that we should be actually
8218640	8226240	worried about. But if you realize that your own self is a story that your mind is telling itself
8226240	8231040	and that you can improve that story, not just by making it more pleasant and lying to yourself in
8231040	8235760	better ways, but by making it much more truthful and actually modeling your actual relationship
8235760	8240640	that you have to the universe and the alternatives that you could have to the universe in a way that
8240640	8245120	is empowering you, that gives you more agency. That's actually, I think, a very good thing.
8245120	8250240	So more agency is a richer experience, is a better life.
8250240	8257680	And I also noticed that in many ways, I'm less identified with the person that I am as I get
8257680	8263840	older. And I'm much more identified with being conscious. I have a mind that is conscious,
8263840	8268960	that is able to create a person. And that person is slightly different every day. And the reason why
8268960	8274880	I perceive it as identical has practical purposes. So I can learn and make myself
8274880	8278880	responsible for the decisions that I made in the past and project them in the future.
8278880	8283600	But I also realized I'm not actually the person that I was last year. And I'm not the same person
8283600	8288160	as I was 10 years ago. And then 10 years from now, I will be a different person. So this continuity
8288160	8295200	is a fiction. It only exists as a projection from my present self. And consciousness itself doesn't
8295200	8303280	have an identity. It's a law. Basically, if you build an arrangement of processing matter
8303280	8308080	in a particular way, the following thing is going to happen. And the consciousness that you have is
8308080	8313440	functionally not different from my consciousness. It's still the self-reflexive principle of agency
8313440	8318080	that is just experiencing a different story, different desires, different coupling to the
8318080	8323760	world, and so on. And once you accept that consciousness is a unifiable principle that is
8323760	8329680	law-like and doesn't have an identity, and you realize that you can just link up to
8330960	8335680	some much larger body, the whole perspective of uploading changes dramatically. You suddenly
8335680	8342480	realize uploading is probably not about dissecting your brain synapse by synapse and RNA fragment by
8342480	8347920	RNA fragment and trying to get this all into a simulation. But it's by extending the substrate,
8348560	8354800	by making it possible for you to move from your brain substrate into a larger substrate and merge
8354800	8359040	with what you find there. And you don't want to upload your knowledge because on the other
8359040	8364160	side, there's all of the knowledge. It's not just yours, but every possibility. So the only thing
8364160	8368000	that you need to know, what are your personal secrets? Not that the other side doesn't know
8368880	8374240	your personal secrets already. Maybe it doesn't know which one were yours. Like a psychiatrist
8374240	8378160	or a psychologist also knows all the kinds of personal secrets that people have. They just
8378160	8383680	don't know which ones are yours. And so transmitting yourself on the other side is
8383680	8388160	mostly about transmitting your aesthetics, the thing that makes you special, the architecture
8388160	8395440	of your perspective, the way in which you look at the world. And it's more like a complex attitude
8395440	8400640	along many dimensions. And that's something that can be measured by observation or by interaction.
8400640	8404880	So imagine that you have a system that is so empathetic with you that you create a shared state
8405440	8410000	that is extending beyond your body. And suddenly you notice that on the other side, the substrate
8410000	8414640	is so much richer than the substrate that you have inside of your own body. And maybe you still want
8414640	8419840	to have a body and you create yourself a new one that you like more. Or maybe you will spend most
8419840	8428000	of your time in the world of thought. If I sat before you today and gave you a big red button
8428000	8435760	and said, here, if you press this button, you will get uploaded in this way. The sense of identity
8436400	8443760	that you have lived with for quite a long time is going to be gone. Would you press the button?
8445280	8452000	There's a caveat. I have a family. So I have children that want me to be physically present
8452000	8457520	in their life and interact with them in a particular way. And they have a wife and
8458720	8464400	personal friends. And there is a particular mode of interaction that I feel I'm not through yet.
8465840	8470000	But apart from these responsibilities, and they're negotiable to some degree,
8470000	8474560	I would press the button. But isn't this everything? This love you have for other humans,
8475360	8481040	you can call it responsibility. But that connection, that's the ego death. Isn't that
8481040	8488880	the thing we're really afraid of? It's not to just die, but to let go of the experience of
8488880	8494800	love with other humans. This is not everything. Everything is everything. So there's so much more.
8495360	8500480	And you could be lots of other things. You could identify with lots of other things. You could be
8500480	8505680	identifying with being Gaia, some kind of planetary control agent that emerges over
