start	end	text
0	4160	The following is a conversation with Josje Bach, his third time on this podcast.
4160	7840	Josje is one of the most brilliant and fascinating minds in the world,
7840	11520	exploring the nature of intelligence, consciousness, and computation.
12160	17440	And he's one of my favorite humans to talk to about pretty much anything and everything.
19040	23040	And now, a quick few second mention of each sponsor. Check them out in the description.
23040	27120	It's the best way to support this podcast. We've got Numerai for the world's hardest
27120	33680	data science tournament, 8Sleep for naps, Masterclass for learning, and AG1 for health,
33680	37680	choose wisely, my friends. Also, if you want to work with our amazing team,
37680	41200	we're always hiring, go to lexfreedman.com slash hiring.
41200	44720	And now, onto the full ad reads. As always, no ads in the middle.
44720	47360	I try to make this interesting, but if you must skip them,
47360	50800	please still check out our sponsors. I enjoy their stuff. Maybe you will, too.
50800	57760	This show is brought to you by Numerai, a hedge fund that uses AI and machine learning to make
57760	64000	investment decisions. It's basically a super difficult machine learning tournament that uses
64000	71120	real data and people's submitted models that try to predict the market. I love difficult
71120	77360	real world data sets. You may know that for a long time and still, I've been interested in
77360	83760	real world robotics. One of the largest scale deployment of real world robotics is autonomous
83760	89360	vehicles. Autonomous driving and semi-autonomous driving, the stakes are very high. The same is
89360	94720	true for financial markets. It's really interesting that Numerai presents to you
94720	100080	the real world data of financial markets and presents you an easy accessible mechanism by
100080	105280	which to test, deploy, and compete with others in this kind of data set. It's a really great
105280	110880	way, if you're interested in data science and machine learning, to learn, to compete,
110880	117840	to have fun, all that kind of stuff. Head over to numer.ai.lex to sign up for a tournament
117840	124480	and hone your machine learning skills. That's numer.ai.lex for a chance to play against me
124480	131440	and win a share of the tournament's prize pool. This episode is also brought to you by 8 Sleep
131520	138800	and its new Pi3 mattress. In the scorching Texas heat, the thing I go to escape, to escape nature
139440	144320	are the external harsh conditions of nature and going to the nature of my own mind.
145200	152400	Wherever that weird and beautiful dream world is, the place that has no rules, no boundaries,
153600	160400	no limits, no physics, no constraints on what is possible and what is impossible.
161520	167840	The dream world that we go to, what is that world? It's the same world as imagination.
167840	174880	It's such a fascinating world. The human mind, its capabilities are just so incredibly fascinating,
174880	180560	and one of the ways to explore that is to dream. But it's the return from the dream world that is
180560	186400	the most refreshing to me. That's why I love naps. It's a quick stroll through the dream world and
186400	193360	your back and taking on the challenges of the day in the here and now. Anyway, if you're into
193360	198800	naps as much as me, you should check out 8 Sleep and you'll get special savings when you go to
198800	207520	8sleep.com. This show is also brought to you by Masterclass. $10 a month gets you an all-access
207520	212480	pass to watch courses from the best people in the world in their respective disciplines.
213120	218640	The list of courses I've personally watched and enjoyed just lasts forever, but they have
219600	224640	everybody and anybody you ever want to listen to. I've listened to Martin Scorsese, Tony Hogg,
224640	230320	Jane Goodall, Neil Gaiman, Daniel Negron before I interviewed him, Garry Kasparov,
230320	235360	Carlos Santana, Will Wright, Neil DeGrasse Tyson, Chris Hadfield. The list is incredible.
235360	241360	I'm a huge believer that learning about a thing, at least part of learning about a thing,
241360	247120	should involve learning or listening to the best people in the world at that thing.
248400	253680	It's not only the advice they give, it's not only the analysis or the description
253680	262640	of how they approach the thing, but in the way they see life, in the way they carry themselves
262640	268480	physically and mentally. You get to watch Mastery and it's so beautiful that human beings are able
268480	275440	to reach the very top of excellence and sometimes break through the boundaries,
275440	280240	the limits of what was thought possible before, and it's just beautiful to watch those humans.
280240	285760	It's beautiful, it's inspiring, it's great to celebrate that, it's great to learn from that.
286320	290400	Anyway, get unlimited access to every Masterclass and get 15% off
290400	296240	an annual membership at masterclass.com slash lex. That's masterclass.com slash lex.
296720	303920	This show is brought to you by AG1. Their all-in-one daily drink brings happiness to me,
304400	310160	and daily for me is twice daily. It brings happiness, health, and ensures that all the
310160	315920	crazy physical and mental stuff I do is built on a foundation of basic nutritional health.
315920	322880	It's the super multivitamin that I use. It also is one of the components of daily habits
323280	332240	that I have in my life, and so whenever I do this thing, I feel grounded. I feel happy. I feel like
332240	336000	I have my life together. So you could do that both at home and with the travel packs when you're
336000	342880	traveling. In fact, it's one of the things that makes me feel like I'm at home when I'm traveling.
342880	350640	I'll drink an AG1 and it'll feel good. It'll put a smile on my face. It's green, it tastes delicious,
350640	355280	it's green, it tastes delicious. What else do you want? They'll give you a one month supply
355280	363840	of fish oil when you sign up at drinkag1.com slash lex. This is the Lex Friedman podcast.
363840	368560	To support it, please check out our sponsors in the description. And now, dear friends,
368560	371760	here's Josje Bach.
386720	389840	You wrote a post about levels of lucidity.
391920	397120	As we grow older, it becomes apparent that our self-reflexive mind is not just gradually
397120	402480	accumulating ideas about itself, but that it progresses in somewhat distinct stages.
403840	409680	There are seven of the stages. Stage one, reactive survival, infant. Stage two, personal self,
409680	417120	young child. Stage three, social self, adolescence, domesticated adult. Stage four is rational agency,
417120	423920	self-direction. Stage five is self-authoring. That's full adult. You've achieved wisdom,
423920	429920	but there's two more stages. Stage six is enlightenment. Stage seven is transcendence.
429920	435360	Can you explain each or the interesting parts of each of these stages? And what's your sense
435360	443040	why there are stages of this, of lucidity as we progress through life in this too short life?
443680	452160	This model is derived from a concept by the psychologist Robert Keegan. And he talks about
452880	457760	the development of the self as a process that happens in principle by some kind of
457760	461920	reverse engineering of a mind where you gradually become aware of yourself and thereby build
461920	468160	structure that allows you to interact deeper with the world and yourself. And I found myself using
468160	472880	this model not so much as a developmental model. I'm not even sure if it's a very good developmental
472880	479760	model because I saw my children not progressing exactly like that. And I also suspect that
479760	484000	you don't go through these stages necessarily in succession. And it's not that you work through
484000	488960	one stage and then you get into the next one. Sometimes you revisit them. Sometimes stuff is
488960	494160	happening in parallel. But it's, I think, a useful framework to look at what's present and the
494160	497840	structure of a person and how they interact with the world and how they relate to themselves.
498720	503440	So it's more like a philosophical framework that allows you to talk about how minds work.
504000	508160	And at first, when we are born, we don't have a personal self yet, I think.
508960	514000	Instead, we have an attentional self. And this attentional self is initially in the infant task
514000	518800	is building a world model and also an initial model of the self. But mostly it's building a
518800	526320	game engine in the brain that is tracking sensory data and uses it to explain it. And in some sense,
526320	530640	you could compare it to a game engine like Minecraft or so. So colors and sounds,
531760	536080	people are all not physical objects. They are creation of our mind at a certain level of
536080	544960	core screening, models that are mathematical that use geometry and that use manipulation of
544960	550480	objects and so on to create scenes in which we can find ourselves and interact with them.
550480	551200	So Minecraft.
552080	558000	And this personal self is something that is more or less created after the world is finished,
558000	564000	after it's trained into the system, after it has been constructed. And this personal self is an
564000	569840	agent that interacts with the outside world. And the outside world is not the world of quantum
569840	574960	mechanics, not the physical universe, but it's the model that has been generated in our own mind.
575760	581040	And this is us and we experience ourselves interacting with that outside world that is
581040	587760	created inside of our own mind. And outside of our self, there are feelings and they presented
587760	592640	our interface to this outside world. They pose problems to us. These feelings are basically
592640	597920	attitudes that our mind is computing that tell us what's needed in the world, the things that
597920	604160	we are drawn to, the things that we are afraid of. And we are tasked with solving this problem of
604160	609920	satisfying the needs, avoiding the aversions, following on our inner commitments and so on,
609920	616000	and also modeling ourselves and building the next stage. So after we have this personal self and
616000	622320	stage two online, many people form a social self. And this social self allows the individual to
622320	628240	experience themselves as part of a group. It's basically this thing that when you are playing
628240	633360	in a team, for instance, you don't notice yourself just as a single node that is reaching out into
633360	637840	the world, but you're also looking down. You're looking down from this entire group and you see
637840	642320	how this group is looking at this individual. And everybody in the group is in some sense,
642320	648000	emulating this group spirit to some degree. And in this state, people are forming their opinions
648000	652880	by assimilating them from this group mind. They basically gain the ability to act a little bit
652880	658960	like a hive mind. But are you also modeling the interaction of how opinions shapes and forms
658960	665280	through the interaction of the individual nodes within the group? Yeah, the way in which people
665280	671040	do it in this stage is that they experience what are the opinions of my environment. They
671040	676320	experience the relationship that I have to their environment and they resonate with people around
676320	683760	them and get more opinions through this interaction, the way in which they relate to others.
684560	689760	And at stage four, you basically understand that stuff is true and false independently,
689760	694160	what other people believe. And you have agency over your own beliefs in that stage. You basically
694160	700720	discover epistemology, the rules about determining what's true and false. So you start to learn how
700720	706800	to think. Yes. I mean, at some level, you're always thinking, you are constructing things.
706800	711280	And I believe that this ability to reason about your mental representation is what we mean by
711280	716800	thinking. It's an intrinsically reflexive process that requires consciousness. Without consciousness,
716800	722240	you cannot think. You can generate the content of feelings and so on outside of consciousness.
722240	727280	It's very hard to be conscious of how your feelings emerge, at least in the early stages
727280	733680	of development. But thoughts is something that you always control. And if you are a nerd like me,
734480	739600	you often have to skip stage three because you lack the intuitive empathy with others.
739600	744320	Because in order to resonate with a group, you need to have a quite similar architecture.
744320	750240	And if people are via differently, then it's hard for them to resonate with other people and
750240	756720	basically have empathy, which is not the same as compassion, but it is a shared perceptual mental
756720	762720	state. Empathy happens not just via inference about the mental states of others, but it's
762720	767440	a perception of what other people feel and where they're at. Can't you not have empathy
768000	772080	while also not having a similar architecture, cognitive architecture, as the others in the group?
772080	776640	I think, yes. But you often, well, I experienced that too. But you need to build something that
776640	781440	is like a meta architecture. You need to be able to embrace the architecture of the other to some
781440	788160	degree or find some shared common ground. And it's also this issue that if you are a nerd,
788160	792560	normies often, basically neurotypical people, have difficulty to resonate with you.
793120	797280	And as a result, they have difficulty understanding you unless they have enough
797280	802000	wisdom to feel what's going on there. Well, isn't the whole process of the stage
802000	807040	three to figure out the API to the other humans that have different architecture and
807600	814400	you yourself publish public documentation for the API that people can interact with for you?
815280	819920	Isn't this the whole process of socializing? My experience as a child growing up was that
820480	826080	I did not find any way to interface with the stage three people. And they didn't do that with me.
826960	827920	Did you try?
827920	832800	Yeah, of course, I tried it very hard. But it was only when I entered a mathematics school
832800	839200	at ninth grade, lots of other nerds were present, that I found people that I could
839200	845200	deeply resonate with and had the impression that, yes, I have friends now. I found my own people.
845200	849360	And before that, I felt extremely lonely in the world. There was basically nobody I could connect
849360	858880	to. And I remember there was one moment in all these years where there was a school exchange
858880	864640	and it was a Russian boy, a kid from the Russian garrison stationed in eastern Germany who visited
864640	869840	our school. And we played a game of chess against each other. And we looked into each other's eyes
869840	874080	and we sat there for two hours playing this game of chess. And I had the impression this is a human
874080	879440	being. He understands what I understand. We didn't even speak the same language.
880320	886960	I wonder if your life could have been different if you knew that it's okay to be different,
886960	893440	to have a different architecture, whether accepting that the interface is hard to figure out,
893440	897360	takes a long time to figure out, and it's okay to be different. In fact, it's beautiful to be different.
901440	907760	It was not my main concern. My main concern was mostly that I was alone. It was not so much the
907760	913920	question, is it okay to be the way I am? I couldn't do much about it, so I had to deal with it.
913920	920080	But my main issue was that I was not sure if I would ever meet anybody growing up
920960	924800	that I would connect to at such a deep level that I would feel that I could belong.
924800	928320	So there's a visceral undeniable feeling of being alone.
928320	932880	Yes. And I noticed the same thing when I came into the math school that
932880	937920	I think at least half, probably two thirds of these kids were severely traumatized as
938480	941600	children growing up and in large part due to being alone
942400	944720	because they couldn't find anybody to relate to.
944720	947280	Don't you think everybody's alone, deep down?
947280	947520	No.
952960	953440	All right.
953440	960080	I'm not alone anymore. It took me some time to update and to get over the trauma and so on,
960080	965760	but I felt that in my 20s, I had lots of friends and I had my place in the world.
965920	970640	And I had no longer doubts that I would never be alone again.
971760	975840	Is there some aspect to which we're alone together? You don't see a deep loneliness
975840	977360	inside yourself still?
977360	979360	No. Sorry.
981680	985600	Okay. So that's the nonlinear progression through the stages, I suppose. You caught
985600	986640	up on stage three at some point?
986640	990080	Yes. We're at stage four. And so basically I find that many nerds
990080	993440	jump straight into stage four by passing stage three.
993440	995200	Do they return to it then later?
995200	1000320	Yeah, of course. Sometimes they do, not always. The question is basically, do you stay a little
1000320	1005920	bit autistic or do you catch up? And I believe you can catch up. You can build this missing
1005920	1012400	structure and basically experience yourself as part of a group, learn intuitive empathy,
1012400	1016720	and develop this perceptual sense of feeling what other people feel.
1017440	1021520	And before that, I could only basically feel this when I was deeply in love with somebody
1021520	1022160	and we synced.
1023040	1028880	So there's a lot of friction to feeling that way. It only with certain people as opposed
1028880	1030960	to it comes naturally. It's frictionless.
1030960	1036160	But this is something that basically later I felt started to resolve itself for me,
1036880	1037600	to a large degree.
1037600	1038240	What was the trick?
1041200	1048560	In many ways, growing up and paying attention. Meditation did help. I had some very crucial
1048560	1058400	experiences in getting close to people, building connections, cuddling a lot in my student years.
1059680	1067040	So really paying attention to the feeling of another human being fully.
1067040	1071920	Loving other people and being loved by other people and building a space in which you can be
1071920	1078480	safe and can experiment and touch a lot and be close to somebody a lot.
1078480	1085600	And over time, basically, at some point you realize, oh, it's no longer that I feel locked
1085600	1090160	out, but I feel connected and I experience where somebody else is at.
1090160	1095200	And normally my mind is racing very fast at a high frequency. So it's not always working
1095200	1098560	like this. Sometimes it works better. Sometimes it works less.
1098560	1104000	But I also don't see this as a pressure. It's more interesting to observe myself
1104000	1108400	which frequency I'm at and at which mode somebody else is at.
1109760	1115680	Yeah. Man, the mind is so beautiful in that way. Sometimes it comes so natural to me,
1115680	1120720	so easy to pay attention to the world fully, to other people fully.
1120720	1124880	And sometimes the stress over silly things is overwhelming.
1125600	1128240	It's so interesting that the mind is that roller coaster in that way.
1128720	1131760	At stage five, you discover how identity is constructed.
1131760	1133520	Self-offered. You realize that your
1133520	1139280	values are not terminal, but they are instrumental to achieving a world that you like and aesthetics
1139280	1144800	that you prefer. And the more you understand this, the more you get agency over how your
1144800	1150080	identity is constructed. And you realize that identity and interpersonal interaction is a
1150080	1156080	costume. And you should be able to have agency over that costume. It's useful to be a costume.
1156080	1163360	It tells something to others and allows to interface in roles. But being locked into this
1163360	1166080	is a big limitation. The word costume kind of implies
1166800	1172000	that it's fraudulent in some way. Is costume a good word for you?
1172000	1173760	No. To present ourselves to the world.
1173760	1177280	In some sense, I learned a lot about costumes at Burning Man. Before that,
1177280	1182960	I did not really appreciate costumes and saw them more as uniforms, like wearing a suit if you are
1182960	1190400	working in a bank or if you are trying to get startup funding from a VC in Switzerland.
1191600	1196400	Then you dress up in a particular way. And this is mostly to show the other side that you are
1196400	1202240	willing to play by the rules and you understand what the rules are. But there is something deeper.
1202240	1206320	When you are at Burning Man, your costume becomes self-expression and there is no
1206320	1210640	boundary to the self-expression. You're basically free to wear what you want,
1210640	1215120	to express to other people what you feel like this day and what kind of interactions you want
1215120	1217200	to have. Is the costume a kind of projection
1218560	1223120	of who you are? That's very hard to say because the
1223120	1228240	costume also depends on what other people see in the costume. And this depends on the context that
1228240	1233120	the other people understand. So you have to create something, if you want to, that is legible
1233120	1239600	to the other side and that means something to yourself. Do we become prisoners of the costume?
1239600	1244320	Because everybody expects us to. Some people do. But I think that once you
1244320	1248800	realize that you wear a costume at Burning Man, a variety of costumes,
1248800	1255040	realize that you cannot not wear a costume. Basically everything that you wear and present
1255040	1263120	to others is something that is to some degree in addition to what you are deep inside.
1263120	1270480	So this stage, in parentheses, you put full adult, wisdom. Why is this full adult?
1271520	1275280	Why would you say this is full? And why is it wisdom?
1275840	1281120	It does allow you to understand why other people have different identities from yours.
1281840	1286400	And it allows you to understand that the difference between people who vote for different
1286400	1292560	parties and might have very different opinions and different value systems is often the accident of
1292560	1299600	where they are born and what happened after that to them and what traits they got before they were
1299600	1306080	born. And at some point you realize the perspective where you understand that everybody could be you
1306080	1311040	in a different timeline if you just flip those bits. How many costumes do you have?
1312400	1316240	I don't count. More than one? Yeah, of course.
1318240	1320880	How easy is to do costume changes throughout the day?
1320880	1327600	It's just a matter of energy and interest. When you are wearing your pajamas and you switch out
1327600	1335200	of your pajamas into say a work shirt and pants, you're making a costume change, right? And if you
1335200	1339040	are putting on a gown, you're making a costume change. And you could do the same with personality?
1340560	1345840	You could if that's what you're into. There are people which have multiple personalities for
1345840	1352640	interaction in multiple roles. If somebody works in a store and you put up a storekeeper personality
1352640	1357040	when you're presenting yourself at work, you develop a sub-personality for this.
1357600	1363600	And the social persona for many people is in some sense a puppet that they're playing like a marionette.
1363600	1367120	And if they play this all the time, they might forget that there is something
1367680	1370560	behind this. There's something what it feels like to be in your skin.
1371360	1378000	And I guess it's very helpful if you're able to get back into this. And for me, the other way around
1378000	1383120	is relatively hard. For me, it's pretty hard to learn how to play consistent social roles. For me,
1383120	1389520	it's much easier just to be real. Or not real, but to have one costume.
1390640	1396160	No, it's not quite the same. So basically when you are wearing a costume at Burning Man and say you
1396160	1402560	are an extraterrestrial prince. There's something where you are expressing in some sense something
1402560	1408640	that's closer to yourself than the way in which you hide yourself behind a standard closing when
1408640	1414400	you go out in the city in the default world. And so this costume that you're wearing at Burning Man
1414400	1422080	allows you to express more of yourself. And you have a shorter distance of advertising to people
1423040	1426480	what kind of person you are, what kind of interaction you would want to have with them.
1426480	1435280	And so you get much earlier into media stress. And I believe it's regrettable that we do not
1435280	1440960	use the opportunities that we have with custom-made clothing now to wear costumes that are much more
1441840	1446240	stylish, that are much more custom-made, that are not necessarily part of a fashion in which you
1446320	1451520	express which milieu you're part of and how up-to-date you are. But you also express
1452400	1456480	how you are as an individual and what you want to do today and how you feel today and
1456480	1461520	what you intend to do about it. Well, isn't it easier now in the digital world to
