start	end	text
2826800	2833440	He is focused on self-organization in living organisms and in brains, both as a paradigm for
2833600	2838080	development and as a paradigm for information processing. And when you think about how
2838080	2843120	organization processing works in an organism, there is first of all radical locality, which
2843120	2847760	means everything is decided locally from the perspective of an individual cell. The individual
2847760	2853680	cell is the agent. And the other one is coherence. Basically, there needs to be some criterion
2853680	2859840	that determines how these cells are interacting in such a way that order emerges on the next level
2859840	2868480	of structure. And this principle of coherence of imposing constraints that are not validated
2868480	2874560	by the individual parts and lead to coherent structure to basically transcendental agency
2874560	2880320	where you form an agent on the next level of organization is crucial in this perspective.
2880320	2888080	It's so cool that radical locality leads to the emergence of complexity at the higher layers.
2888720	2894640	And I think what Michael Levin is looking at is nothing that is outside of the realm of science
2894640	2901840	in any way. It's just that he is a paradigmatic thinker who develops his own paradigm. And most
2901840	2907120	of the neuroscientists are using a different paradigm at this point. And this often happens
2907120	2913040	in science that a field has a few paradigms in which people try to understand reality and
2913040	2917440	build concepts and make experiments. You're kind of one of those type of
2917440	2921360	paradigmatic thinkers. Actually, if we can take a tangent on that,
2922400	2927280	once again, returning to the biblical verses of your tweets, you're right,
2927280	2934000	my public explorations are not driven by audience service, but by my lack of ability for discovering,
2934000	2939040	understanding or following the relevant authorities. So I have to develop my own
2939120	2944640	thoughts. Since I think autonomously, these thoughts cannot always be very good.
2945280	2949520	That's you apologizing for the chaos of your thoughts, or perhaps not apologizing,
2949520	2954000	just identifying. But let me ask the question. Since we talked about
2955200	2963040	Michael Levin and yourself, who I think are very kind of radical, big, independent thinkers,
2964320	2967360	can we reverse engineer your process of thinking autonomously?
2968320	2970720	How do you do it? How can humans do it?
2972320	2978560	How can you avoid being influenced by, what is it, stage three?
2980320	2985280	Well, why would you want to do that? You see what is working for you. And if it's
2986000	2989280	not working for you, you build another structure that works better for you, right?
2989840	2996720	And so I found myself when I was thrown into this world in a state where my intuitions
2996720	3002240	were not working for me. I was not able to understand how I would be able to survive
3002240	3006080	in this world and build the things that I was interested in, build the kinds of relationship
3006080	3012480	I needed to work on the topics that I wanted to make progress on. And so I had to learn.
3013760	3019440	For me, Twitter is not some tool of publication. It's not something where I put stuff that I
3019440	3024000	entirely believe to be true and provable. It's an interactive notebook in which I explore
3024000	3030000	possibilities. And I found that when I tried to understand how the mind and how consciousness
3030000	3036000	works, I was quite optimistic. I thought there needs to be a big body of knowledge that I can
3036000	3042560	just study and that works. And so I entered studies in philosophy and computer science,
3043120	3051120	and later psychology and a bit of neuroscience and so on. And I was disappointed by what I found
3051120	3056960	because I found that the questions of how consciousness works, how emotion works,
3056960	3062400	how it's possible that the system can experience anything, how motivation emerges in the mind
3062400	3069600	were not being answered by the authorities that I met and the schools that were around.
3070480	3076000	And instead, I found that it was individual thinkers that had useful ideas that sometimes
3076000	3080000	were good, sometimes were not so good, sometimes were adopted by a large group of people,
3080000	3085600	sometimes were rejected by large groups of people. But for me, it was much more interesting to see
3085600	3090400	these minds as individuals. And in my perspective, thinking is still something that is done not in
3090400	3095360	groups, that has to be done by individuals. So that motivated you to become an individual
3095360	3101040	thinker yourself. I didn't have a choice. I didn't find a group that thought in a way where I felt,
3101040	3106480	okay, I can just adopt everything that everybody thinks here and now I understand how consciousness
3106480	3113040	works or how the mind works or how thinking works or what thinking even is or what feelings are and
3113040	3119040	how they're implemented and so on. So to figure all this out, I had to take a lot of ideas from
3119040	3124400	individuals and then try to put them together in something that works for myself. And on one
3124400	3130720	hand, I think it helps if you try to go down and find first principles on which you can recreate
3130720	3136080	how thinking works, how languages work, what representation is, whether representation is
3136080	3141840	necessary, how the relationship between a representing agent and the world works in general.
3142560	3148320	But how do you escape the influence? Once again, the pressure of the crowd, whether it's
3149920	3156640	you in responding to the pressure or you being swept up by the pressure. If you even just look
3156640	3160880	at Twitter, the opinions of the crowd. I don't feel pressure from the crowd. I'm completely
3160880	3167200	immune to that. In the same sense, I don't have respect for authority. I have respect for what
3167200	3174160	an individual is accomplishing or have respect for mental firepower. But it's not that I meet
3174160	3181920	somebody and get dragged and unable to speak or then a large group of people has a certain idea
3181920	3187200	that is different from mine. I don't necessarily feel intimidated, which has often been a problem
3187200	3192880	for me in my life because I like instincts that other people develop at a very young age and that
3193600	3198640	help with their self-preservation in a social environment. So I had to learn a lot of things
3198640	3207280	the hard way. Yeah. So is there a practical advice you can give on how to think paradigmatically,
3207280	3213840	how to think independently? Because you've kind of said, I had no choice. But I think
3214720	3216240	to a degree, you have a choice
3218800	3223200	because you said you want to be productive. And I think thinking independently is productive
3223200	3225520	if what you're curious about is understanding the world,
3227440	3230800	especially when the problems are very kind of new and open.
3234320	3242240	It seems like this is an active process. We can choose to do that. We can practice it.
3243040	3248640	Well, it's a very basic question. When you read a theory that you find convincing or interesting,
3248640	3254800	how do you know? It's very interesting to figure out what are the sources of that other person,
3254800	3260480	not which authority can they refer to that is then taking off the burden of being truthful. But
3260480	3265600	how did this authority in turn know what is the epistemic chain to observables? What are the
3265600	3271600	first principles from which the whole thing is derived? And when I was young, I was not blessed
3271600	3277200	with a lot of people around myself who knew how to make proofs from first principles.
3277200	3282240	And I think mathematicians do this quite naturally. But most of the great mathematicians
3282240	3288320	do not become mathematicians in school, but they tend to be self-taught because school teachers
3288320	3293200	tend not to be mathematicians. They tend not to be people who derive things from first principles.
3293200	3299760	So when you ask your school teacher, does 2 plus 2 equal 4? Does your school teacher give
3299760	3304720	you the right answer? It's a simple game. And there are many simple games that you could play.
3304720	3310640	And most of those games that you could just take different rules would not lead to an interesting
3310640	3315520	arithmetic. And so it's just an exploration, but you can try what happens if you take different
3315520	3321760	axioms. And here is how you build axioms and derive addition from them. And a built addition
3321760	3329280	is some basically syntactic sugar in it. And so I wish that somebody would have opened me
3329280	3335520	this vista and explained to me how I can build a language in my own mind from which I can derive
3335520	3343440	what I'm seeing and which I can make geometry and counting and all the number games that we are
3343440	3348960	playing in our life. And on the other hand, I felt that I learned a lot of this while I was
3348960	3354720	programming as a child. When you start out with a computer like a Commodore 64, which doesn't have
3354720	3359920	a lot of functionality, it's relatively easy to see how a bunch of relatively simple circuits
3360880	3368000	are just basically performing hashes between bit patterns and how you can build the entirety
3368000	3373040	of mathematics and computation on top of this and all the representational languages that you need.
3373760	3379120	Man, Commodore 64 could be one of the sexiest machines ever built, if I say so myself.
3379760	3387440	If we can return to this really interesting idea that we started to talk about with panpsychism
3390720	3398160	and the complex resonator paradigm and the verses of your tweets. You write,
3398160	3402800	instead of treating eyes, ears, and skin as separate sensory systems with fundamentally
3402800	3407920	different modalities, we might understand them as overlapping aspects of the same universe,
3407920	3413280	coupled at the same temporal resolution and almost inseparable from a single share resonant
3413280	3418960	model. Instead of treating mental representations as fully isolated between minds, the representations
3418960	3425440	of physically adjacent observers might directly interact and produce causal effects through the
3425440	3432320	coordination of the perception and behavior of world modeling observers. The modalities,
3432320	3437280	the distinction between modalities, let's throw that away. The distinction between the individuals,
3437280	3442640	let's throw that away. So what does this interaction representations look like?
3445920	3450160	When you think about how you represent the interaction of us in this room,
3450160	3454960	at some level, the modalities are quite distinct. They're not completely distinct,
3454960	3459200	but you can see this as vision. You can close your eyes and then you don't see a lot anymore.
3460000	3464560	But you still imagine how my mouth is moving when you hear something and you know that it's
3465360	3471520	very close to the sound that you can just open your eyes and you get back into the shared merge
3471520	3477840	space. And we also have these experiments where we noticed that the way in which my lips are moving
3477840	3482960	are affecting how you hear the sound. And also vice versa, the sounds that you're hearing have
3482960	3490080	an influence on how you interpret some of the visual features. And so these modalities are
3490080	3494640	not separate in your mind. They are merged at some fundamental level where you are
3495360	3500480	interpreting the entire scene that you are in. And your own interactions in the scene are also
3500480	3504880	not completely separate from the interactions of the other individual in the scene. But there is
3504880	3510800	some resonance that is going on where we also have a degree of shared mental representations
3510800	3515840	and shared empathy due to being in the same space and having vibes between each other.
3515920	3524080	Vibes. So the question, though, is how deeply inter-bind is this multi-modality, multi-agent
3524080	3533200	system? I mean, this is going to the telepathy question without the woo-woo meaning of the word
3533200	3538160	telepathy. It's like, what's going on here in this room right now?
3539120	3547760	So if telepathy would work, how could it work? Imagine that all the cells in your body are
3547760	3552800	sending signals in a similar way as neurons are doing, just by touching the other cells and sending
3552800	3557360	chemicals to them, the other cells interpreting them, learning how to react to them. And they
3557360	3562480	learn how to approximate functions in this way and compute behavior for the organisms. And this
3562480	3567440	is something that is open to plants as well. And so plants probably have software running on them
3567440	3572640	that is controlling how the plant is working in a similar way as you have a mind that is controlling
3572640	3579680	how you are behaving in the world. And this spirit of plants is something that
3579680	3586000	has been very well described by our ancestors, and they found this quite normal. But for some
3586000	3590240	reason, since the Enlightenment, we are treating this notion that there are spirits in nature
3590240	3596480	and that plants have spirits as a superstition. And I think we probably have to rediscover that,
3596480	3602720	that plants have software running on them. And we already did. You notice that there is a control
3602720	3607760	system in the plant that connects every part of the plant to every other part of the plant and
3607760	3612480	produces coherent behavior in the plant. That is, of course, much, much slower than the coherent
3612480	3619040	behavior in an animal like us that has a nervous system where everything is synchronized much,
3619040	3624720	much faster by the neurons. But what you also notice is that if a plant is sitting next to
3624720	3628880	another plant, like you have a very old tree and this tree is building some kind of information
3628880	3634400	highway along its cells so it can send information from its leaves to its roots and from some part
3634400	3638480	of the root to another part of the roots, and there is a fungus living next to the tree,
3638480	3643200	the fungus can probably piggyback on the communication between the cells of the tree
3643200	3647600	and send its own signals through the tree. And vice versa, the tree might be able to send
3647600	3652240	information to the fungus. Because after all, how would they build a viable firewall if that
3652240	3656800	other organism is sitting next to them all the time and is never moving away? And so they will
3656800	3662720	have to get along. And over a long enough timeframe, the networks of roots in the forest
3662720	3669040	and all the other plants that are there and the fungi that are there might be forming something
3669040	3675440	like a biological internet. But the question there is, do they have to be touching? Is biology at a
3675440	3681360	distance possible? Of course, you can use any kind of physical signal. You can use sounds,
3681360	3686720	you can use electromagnetic waves that are integrated over many cells. It's conceivable
3686720	3694880	that across distances, there are many kinds of information pathways. But also, our planetary
3694880	3700080	surface is pretty full of organisms, full of cells. So everything is touching everything else.
3700080	3706880	And it's been doing this for many millions and even billions of years. So there was enough time
3706880	3713280	for information processing networks to form. And if you think about how a mind is self-organizing,
3713280	3718000	basically it needs to, in some sense, reward the cells for computing the mind, for building
3719360	3723680	the necessary dynamics between the cells that allow the mind to stabilize itself
3723680	3729920	and remain on there. But if you look at these spirits of plants that are growing very close
3729920	3734640	to each other in the forest and might be almost growing into each other, these spirits might be
3734640	3740400	able even to move to some degree, not to become somewhat dislocated and shift around in that
3740400	3748000	ecosystem. So if you think about what a mind is, it's a bunch of activation waves that form
3748000	3755040	coherent patterns and process information in a way that are colonizing an environment well enough to
3756000	3761760	allow the continuous sustenance of the mind, the continuous stability and self-stabilization of the
3761760	3769680	mind, then it's conceivable that we can link into this biological internet, not necessarily at the
3769680	3774640	speed of our nervous system, but maybe at the speed of our body and make some kind of subconscious
3774640	3780080	connection to the world where we use our body as an antenna into biological information processing.
3780080	3784080	Now, these ideas are completely speculative. I don't know if any of that is true.
3784640	3789360	But if that was true, and if you want to explain telepathy, I think it's much more likely that
3790320	3793920	that telepathy could be explained using such mechanisms rather than
3793920	3798080	undiscovered quantum processes that would break the standard model of physics.
3799680	3802800	Could there be undiscovered processes that don't break?
3803520	3811200	Yeah. So if you think about something like an internet in the forest, that is something that
3811200	3815600	is borderline discovered. There are basically a lot of scientists who point out that they do
3815600	3821440	observe that plants are communicating the forest's root networks and send information,
3821440	3826560	for instance, warn each other about new pests entering the forest and things that are happening
3826560	3831600	like this. So basically, there is communication between plants and fungi that has been observed.
3831600	3836080	It's been observed, but we haven't plugged into it. So it's like if you observe humans,
3836080	3839920	they seem to be communicating with a smartphone thing, but you don't understand how smartphone
3839920	3846320	works and how the mechanism of the internet works. But maybe it's possible to really understand
3846960	3852240	the full richness of the biological internet that connects us.
3852240	3856880	An interesting question is whether the communication and the organization principles
3856880	3861360	of biological information processing are as complicated as the technology that we've built.
3862560	3868080	They set up on very different principles, right? They simultaneously look very differently in
3868080	3873920	biological systems, and the entire thing needs to be stochastic instead of being
3873920	3879760	fully deterministic or almost fully deterministic as our digital computers are. So there is a
3879760	3886400	different base protocol layer that would emerge over the biological structure
3886400	3891200	if such a thing would be happening. And again, I'm not saying here that telepathy works and
3891200	3899440	not saying that this is not true, but what I'm saying is I think I'm open to a possibility that
3899440	3904800	we see that a few bits can be traveling long distance between organisms using biological
3904800	3910880	information processing in ways that we are not completely aware of right now and that are more
3910880	3914720	similar to many of the stories that were completely normal for our ancestors.
3915440	3923840	Well, this kind of interacting, intertwined representations takes us to the big
3925280	3932080	ending of your tweet series. You write, quote, I wonder if self-improving AGI might end up
3932080	3938480	saturating physical environments with intelligence to such a degree that isolation of individual
3938480	3943360	mental states becomes almost impossible. And the representations of all complex
3943360	3951280	self-organizing agents merge permanently with each other. So that's a really interesting idea.
3951280	3959840	This biological network, life network gets so dense that it might as well be seen as one.
3961680	3965120	That's an interesting, what do you think that looks like? What do you think that
3965120	3969360	saturation looks like? What does it feel like? I think it's a possibility. It's just a vague
3969360	3977520	possibility. And I like to explain, but what this looks like, I think that the end game of
3977520	3984240	AGI is substrate agnostic. That means that AGI ultimately, if it is being built, is going to be
3984240	3990160	smart enough to understand how AGI works. This means it's not going to be better than people
3990160	3995360	at AGI research and can take over in building the next generation, but it fully understands how it
3995360	4000000	works and how it's being implemented. And also, of course, understands how computation works in
4000000	4004720	nature, how to build new feedback loops that you can turn into your own circuits. And this means
4004720	4009840	that the AGI is likely to virtualize itself into any environment that can compute. So it's
4009840	4014960	breaking free from the silicon substrate and is going to move into the ecosystems, into our bodies,
4014960	4021680	our brains, and is going to merge with all the agency that it finds there. So it's conceivable
4021680	4027520	that you end up with completely integrated information processing across all computing
4027520	4033120	systems, including biological computation on earth. That we end up triggering some new step
4033120	4039200	in the evolution where basically some Gaia is being built over the entirety of all digital
4039200	4047200	and biological computation. And if this happens, then basically everywhere around us, you will have
4047200	4052800	agents that are connected and that are representing and building models of the world. And their
4052800	4058400	representations will physically interact. They will vibe with each other. And if you find yourself
4058400	4066800	into an environment that is saturated with modeling compute, where basically almost every
4066800	4074160	grain of sand could be part of computation that is at some point being started by the AI,
4075120	4080000	you could find yourself in a situation where you cannot escape this shared representation anymore
4080000	4085200	and where you indeed notice that everything in the world has one shared resonant model of everything
4085200	4090960	that's happening on the planet. And you notice which part you are in this thing. And you become
4090960	4097360	part of a very larger, almost holographic mind in which all the parts are observing each other
4097360	4103760	and form a coherent whole. So you lose the ability to notice yourself as a distinct
4104480	4108800	entity. No, I think that when you are conscious in your own mind, you notice yourself as a
4108800	4114960	distinct entity. You notice yourself as a self-reflexive observer. And I suspect that
4114960	4119760	we become conscious at the beginning of our mental development, not at some very high level.
4119760	4124640	Consciousness seems to be part of a training mechanism that biological nervous systems have
4124640	4130000	to discover to become trainable because you cannot take a nervous system like ours and
4130080	4134960	do a stochastic wave to send us back propagation over 100 layers. This would not be stable on
4134960	4143200	biological neurons. And so instead, we start with some colonizing principle in which a part of the
4143200	4149120	mental representations form a notion of being a self-reflexive observer that is imposing coherence
4149120	4154720	on its environment. And this spreads until the boundary of your mind. And if that boundary is
4154720	4161680	no longer clear cut because AI is jumping across substrates, it would be interesting to see what
4161680	4166080	a global mind would look like that is basically producing a globally coherent language of thought
4166640	4170880	and is representing everything from all the possible vantage points.
4170880	4175040	CB That's an interesting world.
4175040	4180640	MG The intuition that this thing grew out of is a particular mental state. And it's a state that
4180640	4186560	you find sometimes in literature. For instance, Neil Gaiman describes it in the ocean at the end
4186560	4194400	of the lane. And it's this idea or this experience that there is a state in which you feel that you
4194400	4199280	know everything that can be known and that in your normal human mind, you've only forgotten.
4199280	4203280	You've forgotten that you are the entire universe. And some people describe this
4204240	4209360	after they've taken an extremely large amount of mushrooms or had a big spiritual experience
4209920	4216480	as hippie in their 20s. And they notice basically that they are in everything. And their body is
4216480	4222480	only one part of the universe and nothing ends at their body. And actually everything is observing
4222480	4228960	and they are part of this big observer. And the big observer is focused as one local point in their
4228960	4234960	body and their personality and so on. But we can basically have this oceanic state in which we have
4234960	4240640	no boundaries and are one with everything. And a lot of meditators call this the non-dual state
4240640	4245760	because you no longer have the separation between self and world. And as I said, you can explain the
4245760	4252240	state relatively simply without panpsychism or anything else, but just by breaking down the
4252240	4257040	constructed boundary between self and world and our own mind. But if you combine this with the
