start	end	text
3518980	3526980	are not frozen. And I think that the women are, in fact, the most important agent of change.
3528020	3535540	But this goes back to the idea of how to be organized, because if we are talking about real
3535540	3542900	democracy and people making decisions about their life, then there has to be a certain rootedness
3542900	3549060	in the sense that you have to know your locality. You have to know the possibilities.
3549060	3554500	You cannot make decisions for places far away for the fishermen when you are in the mountain.
3555060	3562020	So the idea of the Confederacy, the idea of exchanges, the idea of, you know, what I was
3562020	3569700	talking before, you know, the assembly might be a thousand people, but then you connect with the
3569700	3576500	assembly right all across the highlands of Guatemala. It doesn't mean that because,
3577220	3583300	you know, you have a decision making by a community which is somewhat limited in size
3584260	3596580	and has commitment that relate to all kinds of decision and cultural practices that date from,
3597220	3605620	doesn't mean that you don't also open to other similar communities and that you don't have
3605620	3612420	exchanges. The question is when you begin to have a decision making that is removed
3613940	3619780	from the people who are actually suffering the consequences of that decision making.
3620500	3627300	And here we cannot have it two ways. If you want to be in control of the consequences
3627300	3634020	of decision making, then you cannot make decisions on a global level. I cannot decide for people in
3634020	3642260	Patagonia. I cannot make decisions for people that cry. I can struggle with them when they ask me
3642260	3649620	solidarity to fight against fracking in Patagonia. I can struggle with them, but I cannot make
3649620	3655460	decisions for the people in Patagonia. And we don't have got to go as far as Patagonia, but I mean,
3655460	3664660	I cannot make decisions for people in Colorado or in Alabama, right? But I can struggle with them
3664660	3671300	because obviously we'll have similar conditions, et cetera, et cetera. And we have those agreements.
3671300	3677220	So I think that this is what we have. And of course, back to the original point,
3677860	3683300	that the struggle is the gray field of experimentation and the gray field of
3683300	3689460	transformation. This change to this new society, to a society where we have this culture, where
3689460	3696020	we have this commitment, where we have this solidarity, it's going to be a tremendous
3696020	3703220	process of transformation. We all carry a lot of capitalism within ourselves. The struggle does
3703220	3709140	not only transform the world, but has to transform who we are. There's one question I ask all of my
3709140	3714500	guests at the end, and this is, if you think about the future, what makes you joyful?
3716260	3723860	What is the alternative? I have to be joyful. I have to be joyful because I'm like, you know,
3723860	3735460	I often quote a poem, a poet from Greece, 1300 BC, 1000, Mimmo Nermo. He wrote something that I
3735460	3744900	learned as a, you know, a young person and stayed with me. Life is a tragedy, it's a comedy or a
3744900	3754180	tragedy. And you either learn to laugh of the most great sufferings, or you'll forever cry.
3754980	3763860	You know, and it's not laugh, but it's an affirmation of life. It's an affirmation of life.
3763860	3772100	And here I want to end quoting Maria Mies, quoting Maria Mies, my great sister who died,
3772740	3780340	and it's been a great pain to lose her. And she used to tell the story, she was full of life,
3781380	3788900	life-affirming person, very creative, very life-affirming. And she used to think of her
3788900	3796260	mother, who at the end of World War II, when the whole world in Germany, you can imagine,
3796260	3803380	right, in ruin, in front of a life of ruin, she pulled up her sleeves and, you know,
3803380	3810740	this was a peasant community and bought a few piglets and said, well, life has to go on,
3810740	3820660	I still have to feed my children. And this, you know, in Ecofeminism, a book that she wrote
3820660	3827460	with Vandana Shiva, in the introduction to it, you know, there is a beautiful, beautiful sentence
3827460	3833060	that I almost memorize, I see if I can, you know, it says that when in this world,
3833700	3839460	in this world of capitalism, that is devoted, seems to be devoted to the destruction,
3839460	3848180	to such a destruction of nature and human life, our world can be summed up in terms of a struggle,
3848180	3855220	you know, to nourish, to nourish the impulse, the great impulse, which is in every living thing,
3855780	3860100	which is the impulse to reproduce themselves, which is in how to live, to continue.
3860740	3870340	And this is what, you know, I, this is what makes me, makes me, gives me joy, is to see
3871140	3878020	that we have to start with what is living, with what is moving, with what the new children are
3878020	3885380	born every day. What do we say to them? Oh, too late, too late. Capitalism is destroyed
3885380	3891620	too much, but they are born now. So we have to give them something. Wonderful. Sylvia,
3891620	3896820	thank you so much for being part of Future Histories. Thank you. Thank you, Jan. Thank you,
3896900	3898740	Jan. All the best. Bye.
3904660	3909380	That was our show for today. Thanks a lot for listening. If you want to support Future
3909380	3915860	Histories, you can do so on Patreon. For this, visit patreon.com slash future histories,
3915860	3920980	or you can simply tell a friend that you liked the show and that he, she, or they
3920980	3924740	might like it as well. Thanks a lot and hear you in two weeks.
