start	end	text
0	5400	Welcome to Future Histories, my name is Jan Gross and it is my great pleasure to welcome
5400	8460	Silvia Federici in today's episode.
8460	14560	She is a highly influential feminist scholar, teacher and activist known for her groundbreaking
14560	20480	work on the intersections of capitalism, patriarchy and reproductive labor.
20480	26820	I am very happy that this episode came together, since Silvia's work provides crucial insight
26820	32500	into the question of how the separation of spheres in which there is a sphere of production,
32500	38820	which is imagined as separate of a sphere of reproduction, how this imagined separation
38820	40860	might be overcome.
40860	47580	This podcast here has featured quite a few models of democratic economic planning, which,
47580	52860	I have to be honest, oftentimes struggle to treat this question adequately.
52900	57420	And it's great to have Silvia bring in her perspective on these topics.
57420	62840	And since we touch up on the topic of commoning and commons in the course of our conversation
62840	69060	as well, if you're interested in questions of how democratic coordination of commoning
69060	75180	on a scale, I wanted to point you towards the newly translated book by Stefan Merec
75180	80220	and Simon Sutterluty called Make Capitalism History.
80220	83980	You'll find the open access publication in the show notes.
83980	90780	And then another note, just like the episodes with Matt Huber and Elisa Longkorn anti-Leo,
90780	96140	this episode also came together because of a conference I was recently invited to take
96140	97140	part in.
97140	103100	The conference was titled The Great Transition, and I was invited to take part in a symposium
103100	105420	on democratic planning.
105420	110860	And I just wanted to take the chance to say thanks to everybody involved.
110860	118020	Before we start, I wanted to also thank Lukas, Wilfried, and Carl for their kind donations.
118020	122420	And now please enjoy today's episode with Silvia Federici.
127420	131820	Silvia, I'm thrilled and honored to have you on the show.
131820	132820	Welcome.
132820	133820	Yes.
134220	135220	Thank you so much.
135220	143180	And, you know, I would like this to be a conversation and you introduce me to the topic of today
143180	150900	and give me a little bit of the background of, you know, introduce your audience to the
150900	154460	issues and the topic that we're going to discuss today.
154460	155460	Yes, absolutely.
155460	162060	Well, I think we will start with a question that goes in the direction of your critique
162700	169540	towards the idea of progress, and then we'll kind of move along to topics of commons and
169540	172060	topics of democratic planning, maybe.
172060	174460	I'm very much interested in this topic.
174460	180500	And at the end, I will have some questions around the question whether or not we should
180500	187980	overcome the category of labor as such, because in some of the models for democratic planning,
187980	193340	for example, unfortunately, the category of labor is not overcome and there are still
193340	197380	some forms of connection between work and pay.
197380	201820	And I'm quite critical of this approach, so I would be interested in what you think about
201820	202820	it.
202820	207820	But we will start with a question on progress, if that's all right with you.
208180	218180	Of course, you know, but there is a broad literature to which, you know, I refer, actually,
218180	228060	that has criticized, you know, progress as enlightenment, bourgeois conception, you know,
228060	230740	that it's very evolutionary.
230740	240220	It's a very evolutionary conception, but has been used to actually justify, you know, capitalist
240220	251500	development, yes, justify and in a sense, you know, erase, erase the cost of it, erase,
251500	260660	you know, all the atrocities that capitalist development has left and in its wake.
260660	267660	So and, you know, sponsored in order to realize.
267660	271020	So progress, it's a great lie.
271020	276900	Progress is the great lie, you know, of capitalist ideology.
276900	279900	And in fact, we can really measure.
279900	281900	How do we measure progress?
281900	285340	I think this is a very fundamental question.
285340	286820	How do we measure progress?
286820	288060	What are the value?
288220	297220	What are the core value that enable us to decide whether a society is progressing or not?
297220	304580	And within capitalist ideology, you know, progress is measured in terms of technological
304580	311180	development, so that today, for example, we can communicate Vienna and New York.
311180	313380	We can communicate this is progress.
313380	318260	Obviously, people could not do it in the Middle Ages.
318260	325980	But when we look, for example, today in terms of true exchange of knowledge, can we really
325980	334260	say that the technology has allowed human being as a whole, you know, the human community
334260	341820	to really exchange, grow in terms of its understanding of each other?
341820	343780	No, obviously not.
343780	349300	You know, we have a situation of permanent wealth here now in most parts of the world.
349300	356020	If we did have real progress, we wouldn't have two centuries of capitalist development
356020	361020	that have destroyed the life of millions and millions and millions of people.
361020	369300	No, so that when technological development is, in fact, as in fact, being primarily put
369300	376140	at the service, you know, of capitalist accumulation of individual private wealth and
376140	382900	military destruction, World War One, millions of people killed, World War Two, the threat
382900	390620	of nuclear warfare, we are now speaking of a society in which even life, even human life
390620	398100	is such because of the technology, because of the very so-called technological development
398180	405540	that is associated with the notion of progress, then we can see that we have to really
406260	414020	reconceptualize what is valuable, you know, what is that we should struggle for, what kind of
414020	423620	society we want to construct. So let's leave behind as totally tainted the notion of progress
423620	432580	and instead seeing that this development that is associated with progress, you know,
432580	438100	as in fact brought more and more misery, more and more impoverishment. Today there are millions
438100	443140	and millions of people who are totally impoverished, who have been expelled from their lands,
443140	450900	whose cultures have been destroyed, thousands of languages, species, you know, natural species,
450900	456820	and also human community have been completely destroyed. Entire cultural world is like,
456820	462740	what progress is that? What is the measurement we use? So this is my response to progress.
463300	470340	There is this strand within like orthodox Marxism, which likes to argue that first there
470340	476580	has to be capitalism that would sufficiently develop the forces of production and only then
476660	483140	on the basis of that, like real communism would be possible. And of course, you refuse this notion,
483140	490900	but I'm asking myself, what does this mean for alternatives to capitalism then for
490900	497380	this idea of transition as well? Because I have to think, for example, about the recent work of
497380	503220	Kohai Saito. I don't know if you're familiar with his work. He's developing this idea of degrowth
503780	511860	communism, which is kind of arguing in a similar direction that progress in the capitalist sense
511860	516820	is not necessary to develop communism. I would be interested in your opinion
516820	524740	on what does this mean to reject this specific idea of progress for the question of alternatives
524740	532180	to capitalism. Absolutely. So the question of, I think, Marx's idea, and you know,
532900	540420	it would be very interesting. I think that probably Marx lived at the historical
540420	547140	and political conjunction. This is the sense I can make of it, that he lived at historical
547140	560740	political conjunction, where the possibility of a broad social change, of a crisis of capitalism,
560740	569700	of the end of capitalism, seemed to be near, seemed to be soon possible. Therefore,
570340	576500	you know, this image, you know, of the worker who takes over the capitalist machine
577220	586500	and now redirects it, you know, once, you know, redirects it to a different goal, redirects it,
586500	593460	you know, to the benefit of humanity, to an egalitarian, the purposes of an egalitarian
593460	603380	society, etc., etc. So I think this is how I can justify Marx's idea that in a way, capitalism,
603380	610500	obviously, you know, capitalism, a necessary stage, well, necessary because it was an inevitable
610500	616740	stage from the point of view, you know, obviously of the power relation in Europe, but that it would
616740	625860	be necessary, you know, for constructing the condition, you know, of a communist society,
625860	634420	you know. As I said, Marx must have come to this conclusion only because he believed the revolution
634420	643700	was imminent. Otherwise, he would have had to consider what is the cost, you know, of a process
643700	650260	of large scale industrialization across the world, even from the point of view,
650900	660500	right, of, you know, what it costs to industrialize the globe in terms of its impact of nature.
661140	669540	But that's only one consideration. What he did not consider is the capitalist development
670180	678100	destroys the very condition for a communist society, creates technological conditions,
678100	684020	but destroys other conditions, destroy, for example, changes, people's subjectivities,
684900	695700	you know, destroys common solidarity, destroys commonality, and, you know, so whereas
696500	705140	it creates, you know, new technological means, new technological means, at the same time there's
705140	712740	a process of destruction, of destruction of human relations, you know, that makes the advantage of
712740	720180	a new technology, the advantage of a new technology, right, you know, limits tremendously what the
720180	729220	advantage, and there's a third consideration, which is, is it really technological underdevelopment
729940	736980	that was the cause in the Middle Ages or other society, you know, of people's misery, of people's
736980	744340	hunger, of communities inability to reproduce themselves, or it was the social relation,
745060	750980	the fact that in the Middle Ages you had a feudal old, a feudal world that was built on the
750980	758580	exploitation of people, where those who made decision was a military class, right, so the idea
759140	768100	that in a way capitalism was necessary because it provided the means to, you know, overcome hunger,
768100	774740	overcome poverty, overcome scarcity, no, technology was never the problem of scarcity,
775540	782020	technology, the lack of technology, and we know, for example, that there were other roads to
782020	788420	technological development, for example in China, China had reached a quite high level of technological
788420	795060	development by the 16th century, there were other roads to technology, other than the capitalist one,
795620	801300	that the fact that the capitalist road to technological development, you know, was built
801300	808900	on the exploitation of labor, on the destruction of community, on violence, all this also
810100	816580	undermined, you know, the advantages, and moreover, what, what technology was invented,
816580	820580	capitalism invented a technology that was instrumental to exploitation,
821460	828820	it's not the technology, technology is not a general term, technology is not a universal,
828820	836340	you know, road or a form of wealth, you know, what kind of technology capitalism has developed,
836340	841620	other type of technology, the technology capitalism has developed has always been a
841620	850820	political technology, a technology that served to defeat, right, to contrast, you know, work as
850820	857140	solidarity, work as capacity to resist, work as capacity to struggle, so it is the technology
857140	863540	that has always had built within it a political problem, capitalist technology has always built
863540	871380	within itself elements that made it impossible to take over by a communist, a real communist
871380	877700	society, for instance, disregard for nature, a technology that has disregard for nature is not
877700	882980	a technology we can use, it's not a technology that should be generalized across the world,
882980	890500	a technology that is built within itself, you know, a program that is antagonistic to work as
890500	896100	solidarity, antagonistic, so yes, capitalism brings workers together, but how it brings workers
896100	904100	together, not in a way that enhances their solidarity, so I think that Marx was wrong
904660	911620	in terms of this idea that of the transfer of technology, right, okay, so the revolution
911620	916420	and then we take over the machine and we put the machine to good use, well that machine could not
916420	923380	be put because it had built-in problems, other machines have to be used, no, and secondly,
923380	930180	it did not see the kind of devastation, you know, and now it's all too obvious,
930820	939460	now it's all too obvious. One last thing, I don't particularly, of course, I'm against the idea of
939460	944420	capitalist growth because capitalist world growth is capitalist development, it's capitalism,
945060	952500	right, but I don't think that growth is the enemy, the enemy is capitalism, growth is a
952500	961060	subcategory, it's a subcategory, it's one of the pieces, right, it's one of the strategies
961060	968820	that capitalism uses to reproduce itself, no, but it's not growth, the enemy is capitalism,
968820	974340	the enemy is the exploitation of nature and humanity, this is the fundamental and in this,
974340	983620	in a way, I agree with Marx, you know, that I think that the powerful expert and still alive
983620	992660	and still fundamental expert of Marx's work, you know, is having focus and identify capitalism
992660	1000180	as a system that is built, you know, on the accumulation of people's labor, on the exploitation,
1000180	1008900	on expropriation, dispossession, right, on therefore these forms of, you know, alienation,
1008900	1014260	enslavement, et cetera, et cetera, and constant immiseration because once you take away from people
1014260	1021300	the means of their reproduction, then there is no limit to how much you can immiserate their life,
1021300	1026420	and we see now where we live in a world of permanent welfare, permanent dispossession,
1026420	1033460	millions and millions thrown, you know, into refugee camps, you know, entire areas,
1033460	1042020	you know, of the world destroyed by climatic change. So, yes, we really need to rethink
1042020	1046020	this idea about the necessity of capitalism, God forbid.
1047780	1054740	Yeah, and I would really like to explore a bit the question of alternatives because
1055460	1063780	if we do not go along the road of ideas of, let's say, socialist modernity, so to speak,
1063780	1069140	what is the alternative that you would like to come about? I mean, you already pointed towards
1069140	1074500	we, of course, need alternative social relations. We might also need alternative technologies,
1074500	1080100	you pointed out. I mean, you are quite famous for your engagement with this idea of commoning.
1080100	1086020	It's an important part of your research. I'm quite sure that commoning would have to be an
1086020	1092500	element of the alternative as well, but there are many examples where commoning works quite well
1092500	1099540	within communal structures up to a certain size, I would say. Community-supported agriculture would
1099540	1106420	be one example, and there are many, many more, and there are also examples for commoning on a global
1106420	1113700	scale in the realm of digital commons, which are easily reproducible and, let's say, nonrivalous.
1115140	1125860	There are less examples for global commons that are rival resources, so to speak. I would be
1125860	1132180	interested in how you think about what might collective forms of organization look like
1132180	1139860	at a level of society as a whole that are organized along this principle of commoning.
1139860	1150740	Yeah, so first of all, what commons will be like is almost very difficult, and I don't think it is
1150740	1161380	useful to actually have a map, a theoretical political map now, because even our own imagination
1161380	1169300	is very much conditioned by what we have, but the situation that we are living. So the definition
1169300	1174900	of what kind of a communal society will be, you know, is something that is a process,
1175540	1181620	and it's something that can be defined only in a process of struggle, and in a process of struggle,
1181620	1188580	and the coming together of different struggles across the globe, because there's not one model,
1188580	1194820	as Massimo de Angelis has written over and over and very eloquently, the idea
1195380	1202260	that, you know, in this great globe, Asia, Africa, with different history, different climatic
1202260	1210180	situations, different trajectories, that there could be a model of commons, that this is
1210980	1218740	unthinkable. Like the Separatists say, many yeses, one no, no to the exploitation,
1218740	1224980	no to capitalism, and then many yeses, many roads, different roads, you know,
1226900	1232340	shaped by the historic trajectories, the historic struggles that people have made,
1232340	1239860	right? So this is very, very important, and I think, first of all, no to global commons.
1239860	1244900	There's no such a thing as global commons. Who's going to be the agent to make decisions
1244900	1249220	on a global level? We don't have a global subject. Now we have the UN, and we know what the
1249220	1256180	disaster the United Nations has been. So if we're talking about, and here we are already entering
1256180	1262820	the discussion of what is democracy. Democracy is the rule of the people. So how do people rule,
1262820	1268340	you know, who is the global subject, right? The idea of a global superstructure, this is what
1268340	1274420	capitalism has, has created, and we know what the global superstructure is. Capitalism is the
1274420	1281860	United Nations, which is really the, you know, institutional face of capital, international
1281860	1290340	capital. So no to that global idea of a global commons. I want to quote here, over and over,
1290340	1295620	Maria Mies, who just died, you know, a great feminist, one of the most lucid, powerful
1296340	1304340	anti-capitalist voices within the feminist movement. And she was very adamant about rejecting
1304340	1312340	the idea of the global commons, right? And so, you know, what we are talking about, you know,
1312340	1323300	is instead replanting, you know, rerouting, you know, decision making, the construction of
1323300	1331460	community, you know, and the construction of commons, right, on localities, which doesn't mean
1331460	1338580	that they are fragmented, isolated, and unconnected. Absolutely not. And here I,
1338580	1347060	you know, I want to make reference, for instance, to what, you know, what we call Latin American was,
1347060	1354980	you know, before the conquest, before colonization, you know, when you had, you know, a vast world
1354980	1362900	all throughout, you know, from the south of the continent to the north, of local economies,
1363540	1370020	local society, and yet with a tremendous amount of exchange, with a tremendous amount of
1370020	1377700	interconnection, right? So it's not true that to think of local commons is to think,
1377700	1385620	you know, of isolation, of going back to the Stone Age. Not at all. Not at all. It means that
1385620	1392340	to have, for example, for instance, of confederacies of commons, you know, and of
1392340	1399540	course today we also, some of the technologies, some of the means that are in existence can also
1399540	1407380	be used, can also be used, but with great discrimination, with great discrimination.
1408260	1416180	And about digital commons. Well, digital commons, right? I'm always a bit hesitant
1416180	1423460	and skeptical, you know, before embracing them, because when I think of digital today,
1423460	1429220	I immediately think, you know, massacres in the Congo. This is what I immediately think.
1429220	1434500	Not only the Congo, but I'm thinking of lithium. I think, where's the lithium coming from?
1434980	1439300	Where's the coltan? Where's the real earth? Where are all the minerals?
1439300	1445140	And so far, you know, those minerals have been the disaster, have been the cause of wars,
1445140	1450500	have been the cause of massacres, have been the cause of recolonization of entire areas of the
1450500	1458580	world. So unless we find, you know, unless the question of not only what can be done with the
1458580	1465700	digital, but how the digital is produced, unless the question becomes central to the discussion on
1465700	1472740	digital commons, then I have to say, no, this cannot be the solution, because we have to
1473300	1481220	realize that behind much of the warfare and much of the predatory practices, the incredibly
1481220	1487620	predatory practices of international capital today, especially in Africa, Latin America,
1487620	1494980	there is exactly, you know, the need to feed this new technology, right? And unfortunately also,
1494980	1500260	you know, the new green technology, the one that is supposed to, you know, save the earth,
1500260	1506100	right? Which now depends on the production of billions of batteries, you know, for electrical
1506100	1512420	cars. Where are those batteries going to go? In which ocean? In which fields? Who is going to be
1512420	1517540	the beneficiary of all that poison that is going to leak out of those batteries?
1518580	1525220	So I think we have to be careful with the digital commons. And I think we need instead to see what
1525220	1531860	gives power back to community, back to the people who are knowledgeable about the condition of the
1531860	1537860	earth, of the soil, and the condition of the social relation of the places in which they live.
1537940	1545140	I mean, it's also the construction of humanity. You know, we are becoming, and now we're AI,
1545140	1551540	and you know, we are becoming zombies. We are really, you know, artificial intelligence is a
1551540	1559060	big problem. The problem is also the mechanization of human beings. The mechanization of human beings.
1559060	1569780	I'm really flabbergasted about how much, you know, population that seem to have all this power,
1569780	1579860	the computer, the little phone, and so on, you know, are in fact unable to really impact
1579860	1588340	in a significant way the politics, you know, of international capital. And at times,
1588340	1597460	I even think that precisely access to these gadgets, you know, have in a sense put back the
1597460	1606420	struggle, dozens and dozens of years. In other words, the capitalism, you know, with the computer,
1606420	1614420	with the iPhone, the iPad, and all of that, you know, as pacified, as succeeded in pacifying,
1614420	1623780	and giving people assimilated of a power that in fact we don't have. Yes, we can call this,
1623780	1630820	yes, we can call that, but actually decisions are being made that are extraordinary, extraordinary.
1630820	1636100	We have people in the streets in New York. We have people dying in the streets in New York.
1636100	1642820	We have the largest incarceration, the larger number of people incarcerated. This society,
1642820	1649940	which is, you know, the leading capitalist society, presumably in prosperity, you know,
1649940	1655780	is a society where people are dying in the street, where we have the life, where people have been
1655780	1664980	executed with summary processes, you know, not to mention, not to mention, you know, the 800 jails
1664980	1670100	that the US is running across the world, the military intervention in much of the world,
1670100	1677460	and we are not able to stop it. And so I've been wondering how much this technology,
1677460	1685780	which has been thrown at us and made more available, has also given this pseudo-empowerment,
1686500	1689940	pseudo-empowerment, and I'm not saying that there are not advantages to it,
1690580	1698340	right, but certainly we are very unaware on a day-to-day basis of the cost of this technology.
1698340	1703860	We don't know whose fields have been expropriated in order to create the iPhone,
1704420	1710180	right, that we use on a day or the computer that we use. We are totally unaware of that.
1710180	1717380	So the distancing also, the capitalism has produced the distances of the places where
1717380	1721620	things are extracted, where things are produced, and where things are consumed.
1722180	1729060	That distances that makes us irresponsible, responsible and irresponsible, right? It's
1729060	1735700	really a serious problem. So we need actually to bring together production and consumption
1735700	1744340	so that we know, that we know if the oranges we eat, if the clothes that we wear have caused
1744340	1753460	somebody's blood, have caused somebody's life, have caused somebody's loss of land and forced
1753460	1762660	migration. Yeah. Let's maybe dig a little deeper into that because this idea of bringing together
1762660	1770180	production and reproduction, or maybe in other terms transcend this idea of separation of spheres,
1770180	1776020	this is really important, I think, as you already pointed towards right now. I would
