start	end	text
1776020	1783380	be interested in what this might look like in connection to this question of organization,
1783380	1790420	because you refused this idea of a global commons that would have a form of meta-organization,
1790420	1796820	so to speak, but you also pointed out that there will be quite a lot of coordination going on
1796820	1802500	between the different commons. So maybe we can cross these two. Then the question would be,
1803140	1811380	what would a form of organizing a mode of reproduction, so to speak, what would that
1811380	1818900	look like when these separations of spheres of production on the one side and reproduction
1818980	1827860	on the other is overcome? So how to organize a, let's say, mode of reproduction between these
1827860	1835540	different commons and projects and whatever entities there might be to coordinate with?
1836820	1843300	Yeah. This, of course, again, that cannot be a universal model. I mean, I imagine if you are
1843300	1849060	living in Eskimo land or if you're living in Mozambique, there are very different
1849060	1855220	possibilities, right? I'm thinking, for instance, in pre-Columbian America, the example of Peru,
1855220	1862820	you know Peru is a very elongated territory, and that elongated territory made for very different
1862820	1872020	types of cultivation, very different types of cultivation. So Peru, before the conquest,
1872580	1882020	was very alive, was an intricate system of exchanges that enabled people within a limited
1882020	1889700	territory after all, you know, to in fact benefit, you know, from production coming from different
1889700	1896740	areas, from different types of production. And, you know, of course, now we are in another world,
1896740	1904580	but this is something that now we can think of, right? In other words, when I was speaking of,
1904580	1913380	you know, the Confederacy of Commons, you know, I think that this also has implications on the
1913380	1921300	condition of production, which means that exchanges, yes, but not exchanges, you know,
1921300	1926820	you go to a supermarket today and, you know, perhaps the fish in the United States, you know,
1926820	1933860	may be coming from Africa or may be coming from across the world. And it's different if the fish
1933860	1942900	may come from Long Island or from areas. And so where, in fact, the possibility of the economic
1942900	1951060	exchange, right, is not only an ecological disaster as it is today, all these boxes,
1951620	1956980	all these boats, all these that are really destroying the planet,
1958180	1965940	but also allows for the circulation of human relations, so that you know the people from
1966020	1974100	which the food is coming. They are actually human social, cultural interchanges. This is a kind of
1974100	1980260	world that we want to reconstruct. And today we have in a very atomic form, you know, with the
1980260	1988020	community-supported agriculture, for instance, as a little, as a microcosm, right? But when you look
1988020	1994740	and analyze it and you expand it, as if on a computer, and you expand it, then you see that
1994740	2000980	what is being exchanged, you know, is not only the food, what is being brought to the city from
2000980	2007620	the farms and so on. It's not only the food, but there is also a whole set of relations, right?
2007620	2013060	People are getting to know, yeah, who are the producers. You begin to develop a relationship
2013060	2020420	of trust, right? You begin to understand more about what is actually being produced, you know?
2020420	2027060	What are the vegetables of this season? You don't have these, you know, plastic enveloped,
2027060	2035620	you know, universal, ever-present, you know, ever-available, you know, food production,
2035620	2041540	no? But you actually begin to understand. So there is a richness that we have lost.
2042100	2048020	There is a richness of, and I think of that way, I think of the way of expanding scale,
2048020	2053940	you know, every different modalities, obviously, depending on, you know, communities on the
2053940	2061380	mountains, communities on the sea, you know, but something along those lines, you know, it's,
2061380	2072100	I think, and I come back to my original point that much of this is also something that we learn
2072740	2079060	in the process of the struggle, which is, has to be a process of construction,
2079700	2086500	not just resistance, but construction, experimentation. The struggle is a moment
2086500	2093060	not only to say no, but to experiment with alternative. From the beginning, there is no
2093060	2098580	real struggle unless it is accompanied by an immediate transformation of relation among the
2098580	2103780	people who are doing the struggle. Unless the struggle immediately constructs something new.
2103780	2108260	It's not just a no, but it's a yes to a different kind of social relations.
2110740	2112500	Maybe we can carve out...
2113780	2118820	I say the commons are a condition of the struggle, are a condition of the social
2118820	2124020	transformation. They are not just the goal, the objective of the social transformation.
2124020	2126900	They are the conditions. They are the ones that make it possible.
2128660	2136500	Yeah, and I mean, I think even though you kind of are a bit hesitant to reach too far ahead in
2136500	2142420	order not to prescribe some form of model or something like that, I still think that there are
2143140	2152820	some, let's say, maybe basic coordinates that can be distilled from this type of approach. So,
2153380	2158820	one you just pointed towards, it's not just about resistance, but also about construction.
2158820	2163140	Maybe one might say creative construction, experimental construction.
2165860	2171140	I think there are some basic coordinates that one might distill from this approach.
2171140	2178900	For example, as I pointed towards earlier, this question of labor and whether or not in alternative
2178900	2185940	modes of, in this case, modes of reproduction, one would want to reproduce this category of
2185940	2192340	labor or not. Because within the models of democratic economic planning that I engage with,
2192340	2199620	oftentimes these socialist models of democratic planning that I know, they usually tend to
2199620	2207220	reproduce and maintain this category of labor along with a form of remuneration that is paid
2207220	2213540	in exchange for work. So, this remuneration is, of course, not a classical wage relation then,
2213540	2219940	because it doesn't involve a surplus that is going to a capitalist. But still, the category of labor
2219940	2227780	as such and this exchange relation in the form of work for pay tends to be reproduced. I would be
2227780	2233860	interested in how you think about this, because within these models, at least, the rationale,
2233860	2240180	the argument of the people developing these models is kind of along this traditional idea of
2240180	2246340	two-phase model developed by Marx in the Goethe Program, where the idea is that you would have to
2246340	2254660	have a first phase where this connection between work and pay is still in place. And then afterwards,
2254660	2262340	you would have the ability to come to a second phase. But this all rests on this idea of progress
2262340	2269940	that you, of course, reject. So, I assume you would reject this two-phase model as well and the idea
2269940	2277620	of continuation of labor as a category as such as well. Am I right in assuming that?
2279780	2281300	So, it's a long story. Too much.
2282580	2288900	A lot of things. No, I disagree. The idea of the two-phase is not the idea of progress.
2289860	2301060	I just, the idea of progress is the ideas of this almost natural development that is attributed
2302500	2310580	to social. It's a way of naturalizing social relation and particularly capitalist relation,
2310580	2316500	right? Inevitably. So, the old is bad and we're going towards the new and the new, of course,
2316500	2323140	and also the connection with technology. No, labor. First of all, the distinction,
2323140	2330100	I think also in Marx, labor and work, right? The idea of labor implies exploitation. Labor implies
2330100	2336340	exploitation. So, I think there's a difference between labor and activity, right? Activity,
2336340	2343700	creative activity, self-determined or collectively self-determined. Not individually, but activity
2343700	2349780	that is very different from labor which is done under somebody else's, you know, decision-making,
2349780	2357460	et cetera, right? So, I think in terms of the transition and the question of money,
2358180	2364820	you know, I think in terms of a transition and I faced this issue so many times because there was
2364820	2370740	a time in my life I was involved in a feminist international organization called Wages for
2370740	2379380	Housework and we were accused of institutionalizing women in the home. We were accused of
2379380	2386900	confirming capitalism, monetizing the only sphere of life in which, you know, love, et cetera, et
2386900	2393380	cetera. And I famously, you know, thought that, you know, famously because that has been the most
2393380	2399380	popular things I've said in my life. Yeah, you know, they call it love. We call it unpaid labor.
2400740	2409460	And I still stay behind it. I still subscribe to it. So, the question of money. The question of
2409460	2421940	money is two points I want to make. Number one, struggle for monetary compensation. It's inevitable
2422900	2432500	until we can change the power relation between workers and capital because as long as we do not
2432500	2440900	re-appropriate the material condition of our reproduction, then we need to use money. Otherwise,
2440900	2448580	we die. The Zapatistas who have been, you know, the group of people, to my knowledge, who have
2448580	2458660	been most advanced in refusing monetary relation, they still use some money. They sell coffee for
2458660	2467380	monetary compensation because they have not been able yet to create all the material condition
2467380	2474100	of reproduction that are necessary without some money. So, as long as we are in a society
2474820	2482900	where the capitalist class still monopolizes, you know, much of the material condition, the land,
2482900	2490260	the soil, the waters, the technology, et cetera, et cetera, money is both a way of guaranteeing
2490260	2499460	some reproduction and also sucking wealth away from the capitalists. Obviously, that struggle
2499460	2505060	is not the struggle that is going. It's a struggle that is necessary, but it's also a
2505060	2512340	struggle that has to be accompanied by many, many, many other, you know, struggles. It's not this,
2512340	2521460	the main road, you know, to revolution. But we cannot say, and I used to, my response to people
2521460	2526980	who were critical of wages for households was to say, well, very good. Give up your wage. You are
2526980	2534180	teaching a university. Give up your wage. Liberate yourself from this bondage to capitalism. Work
2534180	2540260	for free. Of course, nobody has done that. Of course, you've been conceivable, you know. So,
2540260	2546980	I found the hypocrisy, the double standard. You know, I found that, you know, once again, yes,
2547620	2554340	you know, women's work in the home is treated as something very different. And no matter how much
2554340	2562340	you show that is the foundation for every labor activity, that is work that is exploited by
2562340	2568740	capital, is work that produces accumulation, creates work, blah, blah, blah, blah, etc. And
2568740	2576180	that has put women in the condition of, you know, having to accept any wage once they went out of
2577060	2585060	home. So, I think the money, you know, there is a phase of struggle. And that phase of struggle,
2585700	2592500	the goal of it is to change the poverty relation and reappropriate. So, to me, the goal of our
2592500	2602180	struggling every, every moment, every place, every moment is reappropriate, you know, the wealth
2602660	2608580	that has been produced, the wealth that we are producing, you know, control, I mean, land,
2608580	2615060	the issue of land, millions of people, land, land, land, land means everything. Land means trees,
2615620	2623060	land means waters, you know, land means, you know, leaves, medical roots,
2623860	2631060	land has such, is such wealth that when you lose your wealth, land, you lose much more than
2632020	2638900	physical sustenance, you lose a culture, you lose knowledges, you lose a tremendous amount of
2638900	2647460	knowledge when you lose the land. So, that process, you know, and I think in terms of
2647460	2654500	a future society, you know, in terms of, I think of a society without money or with money,
2655460	2663540	but money, see, that's the issue. What is money? And I'm thinking, I'm now, this is the issue of
2663540	2668100	money is really matching my mind because I'm really interested in the relation between women
2668100	2676980	and money. You know, what has been historically women? Yeah. And, you know, I have this book in
2676980	2684580	mind, which is called Women, Money and the Devil, that, you know, begins with the pact on the devil
2684580	2691060	between the witch and, you know, the devil gives her money. And then of course she, she's desperate,
2691700	2698980	you know, and she's, you know, screaming to her misery, he comes, give us some money.
2699540	2706020	And eventually, of course, has become my servant, I'll solve your problem. It's a very marital deal,
2706100	2716260	totally marital. And then she copulates with him. But within a few days, the money has given her
2716260	2723700	turns into ashes. This has intrigued me. In many demonologies, you find that detail.
2724500	2731780	And this has intrigued me immensely. Why? Even once they made the pact, even when they sold their soul,
2732660	2740420	women could not keep the money. Even when they sold their soul, capitalism has instituted this
2740420	2748580	incredible incompatibility between women and money. But aside from this, money has existed. I
2748580	2756260	visited many years ago with my partner, we visited the first place in Turkey. And right now I don't
2756260	2762980	have the, I don't remember the name. Yeah, but it's a famous place, but 3000 years ago,
2763540	2771380	the first coins were minted. 3000 years ago. But money had a very different function
2771940	2781140	than capitalist money. Money had ceremonial function, money sometimes served, so you didn't
2781140	2789780	want to bring, to move cattle, et cetera, et cetera. So you'd use the money as a substitute
2789780	2798340	for the transportation of goods. But money is different in capitalism and begins to function
2798340	2809300	capitalistically only when you have a society where people have been expropriated from the
2809300	2814740	capacity to reproduce themselves. At that moment, money function a different way,
2815700	2823460	right? At that moment, money is not just exchange. Money becomes an instrument of exploitation.
2823460	2829780	It becomes an instrument of, because then those people can be forced to work,
2830500	2836980	can be forced because their sustenance belongs to them. The moment that whatever allowed you to
2836980	2845300	survive is sucked away from you, then money becomes really the way that basically takes your
2845300	2851860	blood away, can take your blood and your life away. So I think it's very important. So when we say
2851860	2857300	there will be a future without money, maybe there will be money, but we will be functioning in a
2857300	2862900	very, very different way. Maybe it will be like maybe a token that you go to a movie theater
2862900	2869060	and you have a token that you show and with that token you enter the, you know,
2869060	2877460	you can enter, gives you the right to enter it. But I agree with Mark's view that the last,
2878260	2886980	you know, communism as from each according to their ability and to each according to their need
2887700	2895460	and decision made by the association of the community. That to me, it's a good model to look
2895460	2902500	at and what could be a money, but certainly not money. Money will not be able to function
2902500	2909700	because it will be a society in which the wealth, the material condition of reproduction
2910340	2913620	will be accessible to everybody in the community.
2916340	2924660	And that's the basis of democracy. A democracy without that access is nothing. It's a world as
2924660	2930340	it has become. Today the market, you know, the big democracy of the United States, we have people
2930340	2937940	sleeping in the street, you know, where you have, you know, pharmaceutical companies, you know, who
2937940	2945380	have killed the millions of people with this, you know, narcotic medicine and so on, you know,
2945380	2952580	can go scoff free by paying a few, a billion dollars and are not held to the same standard,
2952580	2960420	you know. So you can go to jail for 20 years, you know, for a little theft, but you have big companies
2960420	2964820	who are devastating the life of people. So that's not democracy.
2964820	2974180	I just wanted to maybe clear up a form of misunderstanding that might be in place,
2974180	2979460	because I just wanted to state that I'm absolutely with you that within a, like,
2979460	2986900	let's say early transition phase or within the immediate future, it's of course necessary to
2986900	2993860	fight for higher wages and not kind of dismiss money as something that we would not need in order
2993860	3000740	to live within the context that we live in right now. The thing is that within these models that
3000740	3007780	I study, these models for democratic economic planning, they argue that even though a situation
3007780	3015060	is already in place in which there is democratic control over the economy, that still then there
3015060	3022980	would need to be some form of connection between work and pay in place in order to, let's say,
3022980	3029780	discipline its subjects, at least for a certain period of time, because it is assumed that this
3029780	3037700	would still need to be necessary, actually at the end, for reasons of efficiency, so to speak,
3037700	3045860	you know. So in order to be able to reproduce a certain type of wealth in material terms,
3045860	3051300	it would still be necessary to, you know, have these mechanisms in place. And that's why I said
3051300	3057540	there is a connection between this idea of a two-phase model and this idea of progress,
3057540	3064900	because then the argument is essentially we do not yet have enough capacity when it comes to
3064900	3072260	the forces of production in order to have full communism. And until then, we would need to kind
3072260	3078340	of discipline our subjects in order to get to this place of fully developed forces of production.
3078340	3083140	And that's why I meant that there is a certain connection between the two ideas, you know.
3083140	3092820	I understand, but I'm very suspicious of the discipline. Who's going to do the discipline?
3092820	3102500	Who's going to be disciplined? So that to me, that plan, that democratic planning is not something
3102580	3110180	that I would, you know, sign up for, because when I hear discipline, all my, you know,
3111140	3120020	practice say run for the gun when you hear these words, because very dangerous. This sounds like
3120020	3126980	capitalism. You need to actually whip people to work, decide who's valuable, who's not valuable,
3127620	3137140	and reproduce, you know, the whole mark, as Mark should say, the hierarchies, the control system,
3137140	3141620	the two-tier society. That's exactly what we are fighting against.
3142660	3147300	Yeah. I mean, to be fair, I think the people developing these models, they would, of course,
3147300	3154100	argue that there is a base income for everybody. And on top of that, you would have these
3154100	3160980	remuneration schemes that would allow to, as I said, kind of discipline its subjects.
3161620	3168420	I think they wouldn't call it disciplining. In my eyes, it is still disciplining, and I'm against
3168420	3176260	this kind of approach, but I just have to be fair in terms of showcasing their arguments for that.
3176260	3181780	And there's another argument that maybe complicates the whole thing a bit more,
3181780	3187460	and this argument is actually coming from a feminist perspective, in which the argument
3187460	3196260	goes that within a totally voluntarist societal organization, there might be a danger of running
3196260	3205380	into a situation where, again, people who are most vulnerable are kind of having a worse situation
3206020	3211300	when trying to organize this reproduction of societies. In this feminist critique,
3211300	3217620	I think the argument would be that the transparency that comes along with forms of remuneration and a
3218580	3226020	general obligation to work is seen as a guard against a continuation of unjust relations
3226020	3231220	in the sphere of reproduction within post-capitalist configurations. So this would be,
3231220	3233620	I think, the argument. I don't see anything
3233620	3237940	voluntaristic in what I'm talking about. I'm not seeing anything. I'm seeing a transformation
3237940	3243460	of social relation that occurs in the process of the struggle. I mean, look, if we want to look,
3243460	3250180	for instance, at societies that are running now on a more communal system, right? I mean, yeah,
3252820	3258900	look, there is a Guatemalan-taken feminist who has written a very beautiful book,
3258900	3267060	Gladys Tsutsun, where she discusses what has been the history and the organization
3267060	3275540	of communal work, society, of Totonicapan, which is in the Highlands of Guatemala.
3276260	3281860	And she describes a situation where there is a culture, there is a collective agreement.
3281860	3287140	Collective agreement, because it's stipulated through assemblies, is the assembly. The assembly
3287140	3292580	is the whole. You make the decision, but you have to contribute to the reproduction of the society.
3293140	3299780	So you may call that disciplining, but the fact is that you cannot, if you don't actually,
3299780	3306260	there is a general agreement that in order to keep the society going, something, you know,
3306260	3311780	you have a little responsibility, you have to do something, you know? And even if you migrate,
3312340	3318340	even if you migrate, you have to have something. And even when you return as a migrant after many
3318340	3323700	years, you can return as a tourist or you can return as a participant. Participating means that
3323700	3330100	you begin to take responsibility again. That seems to me very, very fair, very democratic.
3330900	3336660	By the time you are a child, nine or 10, there's little things that you're given to do, and you're
3336660	3343140	understood that you're part of a collective and you have to do, etc. That seems to me as nothing
3343140	3350500	voluntaristic. There is nothing voluntaristic. It's a collective decision-making on the basis,
3351060	3357780	calculated on the basis of the resources that are available, not out of some imagination,
3357780	3365060	but on the basis of this is like a high mounting place, but where there is a culture of collectivity
3365780	3372020	and is a culture that gives a tremendous protection. You're not born in, you know,
3372020	3378820	that the community will support you and where there's an immense solidarity also with the
3378820	3384420	people who die. You know, the dead, there is a cult of the dead, the dead are present.
3384980	3390580	You know, as soon as somebody dies, there's enormous amount she described by everybody. So
3390580	3397540	the death is not as fear as the end. The sense of belonging to something is something that you
3397540	3405700	understand, extend your life beyond your physical life, which is a great sense of power. Instead of
3405700	3412340	the sense of desperation and finitude, thinking, oh my God, all is lost, because you are actually
3412340	3417060	part of a collective body. You're beginning to feel that there's a collective breath and a
3417060	3424900	collective body, very powerful. And, but there are, you know, from the very early age, the idea
3424900	3429860	that, yeah, you have to do something. And if you don't, if you don't do anything, then you should
3429860	3434420	not make the decision. You don't speak in the assembly unless you've done the work. I think
3434420	3440740	it's a great idea, by the way. I think it's a great idea that we should use and it's not
3440740	3448260	voluntaristic. Yeah, I understand. And, but would you say then that this is always tightly coupled
3448260	3458260	to a contextual idea of community? Because this agreement, so to speak, is more or less based on
3458260	3467300	rules that are part of a cultural socialization, so to speak. And do you think that this can be
3468020	3476180	achieved in larger context as well, or in a really large scale context as well? Or does it need to be
3476740	3486340	kind of more or less tied to a community that has a certain size and is therefore able to,
3487060	3494020	let's say, put practice behind this ideal so that it is not just an abstract rule?
3494660	3499380	Yeah, but this is the idea, right? First of all, I think there's a struggle also in these
3499380	3504260	indigenous communities, and what I understand talking to women from indigenous communities,
3504260	3511220	to expand the community so that, for example, people who are not being raised in that culture
3511220	3518980	can also be part of it, for example, through marriage and other forms. And so these communities
