start	end	text
2489440	2494200	Vielleicht magst du uns noch andere politische Gefühle aufzeigen,
2494200	2498560	mit der es sich zu bedienen gilt, denn allein der Hass wird es ja nicht sein.
2498560	2500480	Das hast du ja auch schon herausgestellt.
2500480	2505040	Aber was gibt es denn sonst noch so im Spektrum der politischen Gefühle, wo du sagen würdest,
2505040	2509400	okay, das sind KandidatInnen, die sollte man auf jeden Fall nicht vergessen.
2510280	2511760	Das finde ich eine schöne Frage.
2511760	2517280	Ich meine, wir haben ja ganz kurz über die letzte Ausgabe dieser Reihe gesprochen,
2517280	2518320	die du hier im Zollo machst.
2518320	2521440	Und ich glaube, letztes Jahr war ja Benny Adamczak da und hat zum Beispiel auch über
2521480	2528520	sowas wie Trauer, also auch so eine politische kollektive Trauer über wie sie das genannt hat,
2528520	2531720	vergangene Zukunft, glaube ich, hat sie das so formuliert.
2531720	2533120	Du müsstest es noch wissen, ne?
2533120	2534080	Ja, genau.
2534080	2538480	Also was es eigentlich auch bedeutet in politischen Kämpfen mit auch sowas wie
2539040	2542240	politischer Kampf ist halt nicht einfach immer, sondern so ein gradliniger
2542240	2547160	Erfolgsgeschichte in den wenigsten Fällen, vor allem wenn es um linke politische Kämpfe geht.
2547200	2550400	Es geht sozusagen auch um Scheitern aus sich heraus,
2550400	2552120	Scheitern an den eigenen Ansprüchen,
2552120	2554560	Scheitern an der eigenen Gewalt, die man hervorgebracht hat,
2554560	2556840	aber auch ein ständiges Scheitern an den Verhältnissen,
2556840	2559640	Scheitern auch an materieller Armut,
2559640	2563800	die Linke natürlich auch immer wieder verspüren und haben auch in ihren Bewegungen.
2563800	2568760	Also ich finde diesen Moment der Trauer sehr schön und auch sehr, sehr transformativ,
2569520	2573360	wo dann auch vielleicht eine gewisse diese, diese Bindung, mit der du
2573360	2575440	ich weiß nicht, ob du ein Problem hast mit der Bindung.
2575680	2578480	Habe ich eben so ein bisschen rausgelesen aus dieser Fixierung,
2578480	2581400	weil vielleicht dieser Trauermoment kann ja auch so ein,
2581400	2584200	meine Therapeutin würde sagen, Trauer, da ist man mehr bei sich.
2584200	2586880	Und sie macht auch immer diese Geste dabei, sagt so
2587800	2590600	Scheiter, sie müssen mehr trauern, sie müssen mehr bei sich sein.
2591760	2594480	Das finde ich irgendwie ganz schön sozusagen, sich mal kurz herauszunehmen
2594480	2597080	und diesen Raum auch der Reflektion zu schaffen.
2597080	2599560	Das kann irgendwie Trauer sein, aber ich finde auch Demut
2599560	2602360	vor allem sehr interessant als politisches Gefühl.
2602360	2607720	Ich bin ja in den vergangenen Jahren öfter zu Gottesdiensten
2607720	2611360	zu einer evangelischen Gemeinde in Kreuzberg gegangen.
2611360	2614320	Sie ist so eine relativ politische Gemeinde, die auch so viel
2614320	2618240	in Richtung Asyl in der Kirche etc. gemacht hat.
2620000	2623800	Obwohl das bei den Protestanten ja glaube ich nicht so ausgeprägt ist,
2623800	2628440	aber ich finde diese Momente der Demut in der Kirche extrem interessant.
2628440	2630840	Also wo es diese diese Situation gibt.
2631160	2634640	Ich gebe die Deutungshoheit über mich ab.
2635080	2640040	Also klar, in der Kirche sozusagen an dieses übernatürliche Wesen.
2640040	2642240	Also Gott, Gott nennt man das ja immer.
2643520	2647680	Aber diese diese diese Geste der sozusagen sich Auflösung
2647680	2651360	in dem Sinne, also das einfach abzugeben, das finde ich sehr, sehr spannend
2651360	2652600	und auch sehr, sehr wichtig.
2652600	2656680	Aber es passiert, glaube ich, im Alltag in zwischenmenschlichen Beziehungen,
2657400	2662480	aber auch in der Beziehung zwischen Mensch und Natur oder Tieren viel zu selten.
2662760	2665680	Und ich bin immer extrem fasziniert, wenn ich beim Gottesdienst bin
2665680	2669320	und das so beobachten kann, wie Menschen auch um Verzeihung bitten,
2669440	2671280	was die wenigsten Menschen ja können.
2671280	2672840	Also es ist ja für sehr viele Menschen.
2672840	2677000	Deswegen gibt es so viele Ratgeber zu dem Thema, wie man sich richtig entschuldigt.
2677000	2680280	Also dass man nicht sagt, ich entschuldige mich, sondern es ist eine Geste.
2680280	2682120	Es ist immer eine Form von Kooperation.
2682120	2685680	Es ist immer eine Form von Bitte und Abwarten
2685680	2689120	und auch gewisse eine Beziehung aufrecht erhalten
2689120	2692960	und diese Beziehung eben nicht abbrechen zu lassen, indem man sich selbst entschuldigt hat.
2693320	2699280	Und auch das, also dieses um Verzeihung bitten, sich als auch als schuldig
2699800	2702280	kann ja auch irgendwie schnell in so einen unangenehmen Schuld
2703280	2708160	Kult abdriften, aber sich verantwortlich zu fühlen und sich demütig zu machen.
2708160	2711800	Das finde ich eine sehr spannende Geste, die ich auch gerne politisch
2711800	2714400	irgendwie weiter denken würde gerne.
2715240	2717280	Hast du da noch eins?
2717280	2720200	Oh, da müsste ich jetzt länger drüber nachdenken.
2720200	2724920	Also für mich ist schon so, dass natürlich also im Utopisieren
2724920	2730320	schon auch quasi eine Sehnsucht in es möge doch anders sein.
2730320	2734920	Die Verhältnisse mögen doch sollten doch sagen zärtlicher sein, wenn man so will,
2735600	2738640	dass das quasi auf jeden Fall irgendwie ein wichtiges Element ist,
2738640	2741600	weil das natürlich dann auch einen positiven Bezug Rahmen hat, so zu sagen.
2742560	2744240	Aber es gibt sicher noch viele.
2744240	2746000	Müsste ich jetzt vielleicht ein bisschen drüber nach.
2746000	2747680	Du wolltest noch was sagen dazu?
2747680	2750040	Ja, ein Gefühl ist mir noch eingefallen. Trotz.
2750040	2754480	Also ich es gibt ja auch bei Linken so eine extrem
2754480	2758720	auch so in linker Rhetorik und so immer diese Bezugnahme auf Hoffnung.
2759200	2762200	Und ich kann damit überhaupt nichts anfangen, weil ich bin ein extrem
2762200	2764080	hoffnungsloser Mensch.
2764080	2768200	Also in dem Sinne, dass ich weiß, dass die Dinge, für die ich arbeite und kämpfe,
2768600	2772440	ich habe nicht im Ansatz die Hoffnung, dass ich das auf irgendeine Art und Weise
2772440	2776360	in unmittelbarer Zukunft realisieren wird oder dass ich das noch miterleben werde.
2776680	2780080	Und ich kenne auch aus politischer Arbeit oder auch journalistischer,
2780080	2782280	publizistischer Arbeit
2782280	2786360	diese diese Erfahrung von Man macht sich Hoffnungen und der Rückschlag ist dann
2786360	2789320	umso schmerzhafter und umso lähmender.
2789440	2792240	Und ich bin eigentlich immer dafür, sich keine Hoffnung zu machen.
2793080	2797680	Hab auch so etwas misstrauisches Gemüt, aber ja,
2797840	2799680	nicht auch nicht immer vom Schlimmsten ausgehen.
2799680	2801160	Würde ich auch nicht für plädieren.
2801160	2803840	Aber Hoffnung kann halt irgendwie auch, wenn sie zerbricht,
2803840	2807240	einfach dich echt mies darunter begraben.
2807520	2811680	Und dann werde ich manchmal gefragt, ob okay, aus welchem Antrieb heraus
2811680	2816200	arbeitest du denn? Und für mich ist es trotz trotz der Hoffnungslosigkeit,
2816200	2819040	trotz der Verhältnisse, trotz der Einsicht.
2819120	2821600	Das ist wahrscheinlich einfach in den nächsten Jahren
2821600	2824000	zumindest sehr viel schlimmer werden wird als jetzt.
2824000	2826600	Und das ist irgendwie auch gut,
2826600	2829960	weil es es macht auch demütig auf eine gewisse Art und Weise.
2830920	2833400	Aber ich glaube, wenn ich den Trotz nicht hätte,
2833400	2836960	dann würde ich sehr viele Sachen nicht tun, die ich tue
2837720	2840720	und vielleicht auch aus einer gewissen Disziplin heraus auch tue
2840720	2843400	oder aus einer gewissen Überzeugung heraus, weil ich weiß, dass die
2843720	2846240	Sachen richtig sind und ich da nicht irgendwie so eine Hoffnung
2846240	2849560	dran koppeln möchte, die sich wahrscheinlich eh nicht erfüllt.
2850840	2853920	Ja, ich will ja jetzt das nicht spoilen, weil das ist total schön mit dem Trotz,
2853920	2856960	aber gleichzeitig auf eine Art hilft dort ja eigentlich dann
2857360	2859560	diese Gleichzeitigkeit des Abolitionismus nicht.
2859720	2863200	Also dieses Präfigurative, weil eben das ja nicht dieses Verhältnis aufmacht,
2863480	2867240	wo es quasi irgendeine idealisierte Zukunft gibt, auf die es hinzuarbeiten
2867240	2870720	gelte und dann irgendwann in der Zukunft, wenn das vielleicht dann eintritt,
2870720	2871880	dann wird alles fein.
2871880	2876480	Dann hätte man quasi diese Fallhöhe, die dann auch verletzbar macht.
2876720	2879120	Also das verstehe ich total.
2879120	2882160	Aber gleichzeitig ist ja eigentlich der Move dann, dass gar nicht
2882400	2885360	in dieser Konstellation von vornherein aufzubauen, sondern quasi
2885720	2889680	in dieser vorwegnehmenden Praxis eigentlich im Hier und Jetzt
2889680	2894160	das, was es später mal zu erkämpfen gilt, auch schon wirklich werden zu lassen.
2894600	2897000	Oder sind wir uns dann nicht einig?
2897000	2898520	Also da sind wir uns super einig.
2898520	2902200	Ich meine nur, ich meine nur im Bezug auf man braucht das nicht so aufbauen,
2902400	2906200	dieses Verhältnis, weil du jetzt quasi das so, du brauchst den Trotz,
2906200	2911160	weil quasi du die Hoffnung kacke findest, weil die halt dieses Verhältnis
2911160	2914920	aufspannt. Aber so muss man ja gar nicht über über das Nachdenken.
2914920	2919160	So denkst du auch nicht darüber nach, wenn ich also insofern nicht unbedingt.
2919160	2922240	Ja, aber trotzdem ist es natürlich manchmal sehr verführerisch,
2922240	2926200	in so eine Hoffnung zu verfallen, die auch so eine gewisse Konkretheit
2926200	2927480	der Zukunft irgendwie vorweg.
2927480	2932920	Also zuletzt hatte ich das jetzt im Zuge der Wahlen in der Türkei.
2933440	2934840	Also kompletter Bullshit.
2934840	2938520	Ich habe mich da einfach von so einer ganz merkwürdigen Hoffnung,
2938560	2942640	die da so vermeintlich aufgekeimt ist und woran sich Menschen auch so
2943800	2945760	in der Not so
2945760	2947120	dran festgeklammert haben.
2947120	2949440	Und ich habe mich davon einfach total anstecken lassen.
2949440	2952360	Und später dachte ich, was zur Hölle war das?
2952360	2954760	Also und da gab es natürlich so eine ganz konkrete Hoffnung.
2954760	2957600	Also die konkrete Hoffnung war Erdogan wird abgewählt.
2957800	2960360	Aber selbst das ist ja schon eine bescheuerte Vorstellung.
2960360	2961480	Weil was kommt danach?
2961480	2965080	Also dann ist ja nicht so, dass die Türkei vor Erdogan jetzt
2965800	2969920	anders war und ein nicht faschistisches Regime war
2969920	2971720	und nicht in dieser Kontinuität ist.
2971720	2976160	Aber da gab es so ein Konkretmachen der Hoffnung.
2976160	2979120	Und das war dann einfach ein umso krasserer
2980200	2981960	Fail, würde ich sagen, am Ende.
2981960	2985120	Und da war die Fallhöhe dann sehr groß.
2987880	2991200	Ich würde dich gerne noch, weil du das jetzt so schön in deinem Buch
2991200	2994280	eben geschafft hast, quasi diesen Facettenreichtum des Hasses
2994600	2996480	dir anzugucken und eben zu versuchen,
2996480	2998800	sagen, Elemente daran fruchtbar zu machen.
2999560	3003720	Jetzt würde ich das gerne, diese Form der Perspektive auf ja,
3003720	3006680	also auch zum Teil quasi tabuisierte,
3007200	3009200	ich sag mal, Gefühlshorizonte vielleicht auch,
3009200	3011120	würde das gerne noch mal auf was anderes lenken,
3011120	3013480	nämlich auf die Frage der Zerstörung.
3013480	3016520	Weil das ist was, was ich mich immer wieder mal gefragt habe.
3016720	3019200	Ich glaube, es lässt sich nicht bestreiten, dass es auch so ein
3019200	3021880	quasi libedenöses Element an der Zerstörung gibt.
3021920	3025400	Und ich glaube, dass der Kapitalismus darum sehr wohl weiß
3025400	3029400	und das auch zu nutzen weiß als eben ein politisches Gefühl,
3029400	3030440	wenn man so will.
3030440	3032280	Ein destruktives natürlich.
3032280	3033840	Aber dass das existiert.
3033840	3036640	Ich glaube, darum sagen weiß der Kapitalismus.
3036880	3039520	Und ich habe mich schon ein paar Mal gefragt,
3039520	3042360	wie man mit diesem politischen Gefühl
3042360	3046080	sozusagen anders um oder was man da, was man,
3046080	3048600	wie man das anders kanalisieren kann oder so.
3048880	3050440	Also, weil wenn man sich jetzt überlegt,
3050440	3053080	okay, in zukünftigen Gesellschaften,
3053080	3056200	die grundlegend andere Ordnungen sind,
3056200	3059760	aber es existiert sozusagen ja immer noch dieser Aspekt
3059760	3062240	und der lässt sich wahrscheinlich auch nicht gänzlich
3062240	3065280	nur im Spiel sublimieren, würde ich jetzt denken.
3065280	3067200	Aber fällt dir da vielleicht was ein,
3067200	3070080	was man mit diesem politischen Gefühl machen könnte,
3070080	3072680	damit es nicht weiterhin so destruktiv ist?
3073800	3076400	Das politische Gefühl der Zerstörung oder
3076440	3077560	der Lust an der Zerstörung?
3077560	3079280	Der Lust an der Zerstörung.
3082360	3084720	Ja, das könnte jetzt ein bisschen pädagogisch werden,
3084720	3086400	die Herankindsweise.
3090080	3091560	Ich meine, am Ende ist ja die Frage,
3091560	3094480	woher kommt die Lust der Zerstörung und würden wir nicht
3094480	3096560	irgendwie in anderen gesellschaftlichen Verhältnissen
3096560	3098280	eine andere Lust auch an Zerstörung,
3098280	3100520	aber könnte sie nicht anders kanalisiert werden?
3101600	3104720	Es gibt ja auch immer wieder diese,
3104800	3108440	ich glaube, das bezieht sich auch auf Mark Fischer.
3108440	3110600	Mark Fischer, so heißt er doch, ne?
3110600	3116000	Genau dieses so, zu misstrauen, was man möchte im Kapitalismus.
3116000	3118520	Also nicht alles, was du möchtest und nicht alles,
3118520	3121280	von dem du denkst, dass es sozusagen deiner Freiheit
3121280	3122640	und deiner Lust entspricht.
3122640	3124520	Also klar, irgendwie Lust ist auch etwas,
3124520	3127240	was eine extrem natürlich körperliche Erfahrung,
3127240	3129360	die von Mensch zu Mensch sehr, sehr unterschiedlich ist
3129360	3131400	und auch sehr viel mit Begehren zu tun hat.
3131440	3136240	Aber letztendlich empfinden wir ja auch Lust nach Begriffen
3136240	3138920	von Lust und nach Begriffen von Begehren
3138920	3141160	in herrschenden gesellschaftlichen Verhältnissen.
3141160	3144080	Und ich glaube, dass auch die Lust am Zerstören
3144080	3147720	nicht unbedingt eine Lust am Zerstören im Sinne von
3147720	3150480	Natur zerstören, Lebensverhältnisse zerstören,
3150480	3152200	Beziehungen zerstören sein kann,
3152200	3154920	sondern eben auch anders umgelenkt werden kann.
3154920	3158560	Aber das ist auch vielleicht so ein bisschen sehr abstrakt am Ende.
3158560	3160480	Ich weiß nicht, ob das deine Frage beantwortet.
3160480	3163640	Oder hast du da was Konkretes vor Augen?
3163640	3166880	Nö, ich habe das eher als ein größeres Fragezeichen in meinem Kopf.
3166880	3169440	Ja, also ich würde dem natürlich total zustimmen,
3169440	3171000	dass man das irgendwie anders kandalisieren muss.
3171000	3173920	Ich habe nur gedacht, nachdem du das beim Hass
3173920	3178040	so mustergültig geschafft hast, den quasi in dieser Hinsicht zu sezieren,
3178040	3179880	dass man das vielleicht auch mit dieser Frage der Lust
3179880	3181000	an der Zerstörung machen kann.
3181000	3185320	Aber vielleicht lässt sich das sagen jetzt auch nicht beantworten.
3185320	3190600	Ja, ja, wahrscheinlich nicht.
3190600	3192840	Dann würde ich nämlich noch mal drüber nach.
3192840	3197600	Dann würde ich nämlich in dem Fall zu der letzten Frage,
3197600	3199760	die ich immer stelle, übergehen, die da heißt,
3199760	3202880	wenn du dir Zukunft vorstellst, was stimmt dich freudig?
3202880	3205000	Was stimmt mich freudig?
3205000	3212880	Ach, was stimmt mich freudig?
3212960	3216960	Ich glaube, so eine Vorstellung von Zukunft,
3216960	3221000	in der ich Zeit und Energie habe, zu puzzeln
3221000	3223280	und diese Fragmente, von denen ich schon gesprochen habe,
3223280	3225480	in irgendeiner Art von Beziehung zueinander zu bringen,
3225480	3228200	um damit meinen Frieden zu schließen auch,
3228200	3230800	dass es das Trauma gibt, dass es die Zerstöckelung gibt
3230800	3232680	und dass es die Wiederholung gibt,
3232680	3235840	aber sie in einem anderen Referenzrahmen
3235840	3238400	wieder in Beziehung zueinander zu setzen.
3238400	3240240	Und das mache ich manchmal so beim Puzzlen,
3240280	3243560	obwohl Puzzlen ja auch für sich so eine Arbeit ist,
3243560	3245440	da weißt du schon, was das Ziel ist.
3245440	3249600	Also es ist ja so eine sehr geradlinige Tätigkeit.
3249600	3251960	Deswegen ist es vielleicht so vom utopischen Denken
3251960	3254520	oder von utopischer Arbeit jetzt nicht so ganz ähnlich.
3254520	3260960	Aber ich liebe diese Arbeit der Puzzleteile,
3260960	3263200	die sich irgendwie so zusammenfügen und die Magie,
3263200	3265360	die daraus hervorkommt.
3265360	3269920	Und dann aber gleichzeitig auch diese Puzzleteile wieder da,
3269920	3272640	vielleicht die Lust zur Zerstörung an diesem Puzzle,
3272640	3276040	was dann vollständig ist, herauszulassen
3276040	3279320	und sie wieder in diesen 1000 Puzzleteilen,
3279320	3280680	so schreibe ich das ja auch in dem Buch,
3280680	3281960	wieder über den Tisch zu streuen,
3281960	3283960	auch als Einladung und als Verheißung.
3283960	3285840	Und auch das kann vielleicht
3285840	3287840	die Lust an der Zerstörung auch bedeuten.
3287840	3290760	Dann wieder sozusagen aus einer,
3290760	3293080	aus einer nicht unbedingt intrinsischen,
3293080	3295120	aber aus einer gemeinschaftlichen,
3295120	3298160	aus einer individuellen Lust heraus auch Sachen zu zerstören
3298200	3301040	im Sinne von Totalitäten anzugreifen
3301040	3303600	und Ganzheiten anzugreifen.
3303600	3306080	Aber weil man weiß, dass man auch die Ruhe und die Zeit
3306080	3307880	und die Ressourcen dazu haben wird,
3307880	3310440	sie wieder zusammenzufügen, wie man das möchte.
3310440	3315080	Das ist vielleicht meine Sehnsucht nach der Zukunft.
3315080	3316080	Wunderbar, Shader.
3316080	3317560	Vielen Dank für das Gespräch.
3317560	3318720	Vielen Dank. Danke dir.
3318720	3320720	Danke fürs Zuhören. Danke.
3320720	3328720	Publikumsdiskussion.
3328720	3332320	Heißt das, dass das Publikum diskutiert und wir zuhören oder?
3332320	3333760	Also das wäre eine Möglichkeit,
3333760	3335600	aber eine andere Möglichkeit wäre,
3335600	3338880	dass ihr jetzt noch den Raum habt, Fragen zu stellen.
3338880	3339880	Ja, okay.
3339880	3341240	Ist das okay?
3341240	3343960	Es ist heiß hier.
3343960	3346160	Wenn ihr nicht auf der Aufnahme drauf sein wollt,
3346160	3347640	dann sagt das einfach kurz vorher
3347640	3350640	und dann würde ich das halt rausschneiden später.
3350680	3354840	Ich wollte nur fragen, woher die Inspiration kam,
3354840	3358920	also die Transformationskraft von dem Gefühl des Hasses zu erkennen,
3358920	3363160	weil es ja eine große Verpöhnung hat.
3363160	3366680	Und ich glaube, wir kennen das alle oder einige.
3366680	3369040	Und wie du das durchgebrochen hast,
3369040	3372560	um die Qualität, also wie der erste Impuls kam,
3372560	3375760	das zu erkennen an dem Gefühl.
3375760	3379840	Vielen Dank für die Frage.
3379880	3382360	Ich glaube, das ist so ein bisschen in der Kontinuität zu dem ersten Buch,
3382360	3383840	wo es ja um Liebe ging.
3383840	3386920	Und ich dann nach dem Buch das Bedürfnis hatte,
3386920	3388880	vielleicht aus einer gewissen Eitelkeit
3388880	3392680	oder auch aus einem anderen Wissensstand heraus
3392680	3395600	oder auch einer anderen analytischen Schärfe,
3395600	3396760	die ich vornehmen wollte,
3396760	3399320	nochmal gewisse Dinge, die ich im ersten Buch aufwerfe,
3399320	3404000	nochmal auch vielleicht auch radikal zu ergänzen,
3404000	3405680	aber auch abzugrenzen.
3405680	3408480	Und ich fand das interessant, mich dem Hass zuzuwenden.
3408480	3410320	Erst einmal, weil es ja in den vergangenen Jahren
3410320	3412280	auch schon in so einem feministischen Mainstream
3412280	3415880	so ein Comeback auch der Wut gab.
3415880	3417520	Aber mir hat da immer dieser Moment
3417520	3420480	eben dieser radikalen Infragestellung gefehlt.
3420480	3423920	Und es kam mir immer so ein bisschen reformistisch vor.
3423920	3426840	Und es wurde ja auch sehr gut wieder so einverleibt in so,
3426840	3430160	ja, Frauen sind mal irgendwie zwischendurch wütend.
3430160	3434760	Aber dann gibt es halt wieder so ein Zurück zur Normalität.
3434760	3436280	Und ich bringe da auch immer so,
3436280	3437120	ich werde auch manchmal gefragt,
3437160	3439560	was der Unterschied zwischen Hass und Wut ist zum Beispiel
3439560	3442320	und warum ich nicht über die Wut geschrieben habe.
3442320	3444720	Und ich glaube, da kann man sich ganz gut
3444720	3446520	so eine konkrete Situation anschauen,
3446520	3448840	in so einer zum Beispiel romantischen Beziehung,
3448840	3450600	dass es schon einen Unterschied macht,
3450600	3453160	wenn Partner in sich sagen, dass sie wütend sind aufeinander
3453160	3455640	oder ob sie sich sagen, dass sie sich hassen.
3455640	3457200	Also ich glaube partherapeutisch
3457200	3459560	würde man eh wahrscheinlich eher dazu tendiert sagen,
3459560	3462000	es ist nicht so gut, sich zu sagen, dass man sich hasst.
3462000	3463600	Aber man kann sich natürlich die Frage stellen,
3463600	3466000	warum das derart verletzend ist auch oftmals
3466000	3468360	und derart auch so den Boden unter den Füßen wegzieht,
3468360	3471120	weil es eben dieser Moment der absoluten Entfragestellung ist
3471120	3473000	und des absoluten Zweifels.
3473000	3475760	Und das finde ich sehr, sehr spannend am Hass
3475760	3478800	und ich auch als Mensch, der sehr, sehr viel zweifelt
3481360	3483600	und das sozusagen in so einem Spannungsfeld
3483600	3486920	auch sich immer bewegt von, ich weiß, was die Lügen sind.
3486920	3490000	Ich weiß nicht immer, was die Wahrheiten sind.
3490000	3492040	Ich weiß, woran ich zweifle.
3492040	3493840	Ich weiß auch, wo ich mir glauben möchte.
3493840	3494960	Deswegen schreibe ich auch.
3495000	3498240	Ich schreibe auch, weil ich mir bis zu einem,
3498240	3501200	ja zum Teil auch einfach wieder selbst glauben möchte
3501200	3503320	und irgendwie auch Gedanken, die ich habe,
3503320	3505960	Erfahrungen, die ich gehabt habe, zu materialisieren
3505960	3507360	und mich auf sie beziehen zu können
3507360	3508920	und auch mir selbst sagen zu können,
3508920	3510960	das ist wirklich passiert, das habe ich wirklich geschrieben,
3510960	3512040	das habe ich wirklich erfahren.
3512040	3513800	Aber gleichzeitig schreibe ich auch,
3513800	3515760	um auch wieder an mir selbst zweifeln zu können.
3515760	3517040	Also es ist dieses Spannungsfeld
3517040	3519520	und ich finde so in einem Hass
3519520	3521440	kann man das sehr, sehr gut auffächern.
3521440	3524480	Und dann gibt es auch so eine alberne Anekdote,
3524520	3525840	die ich auch in dem Buch erzähle,
3525840	3527680	ich glaube im Prolog,
3527680	3529440	nee eigentlich später erst im Dank,
3529440	3532960	so wo ich eigentlich ein anderes Buch hätte schreiben sollen,
3532960	3535160	also ein ganz anderes Buch als zweites Buch.
3535160	3536680	Und der Vertrag war schon unterschrieben
3536680	3538080	und ich wollte das nicht.
3538080	3540160	Ich hatte den ganzen Sommer über,
3540160	3541240	wo ich eigentlich mich schon
3541240	3543680	an die Recherche hätte setzen sollen,
3543680	3545280	wirklich so eine körperliche Reaktion
3545280	3546800	und habe mich die ganze Zeit wiederholt
3546800	3548440	und die ganze Zeit gesagt, ich hasse das,
3548440	3549320	ich will das nicht,
3549320	3551520	ich hasse die Vorstellung, dieses Buch zu schreiben.
3551520	3553240	Und irgendwann dachte ich, ich schreibe über den Hass
3553240	3554840	oder ich schreibe gar nichts.
3554840	3557400	Und bin dann auch so in das Gespräch gegangen
3557400	3559440	und habe dann alle davon überzeugen können.
3559440	3562080	Also es hat mir selbst auch ganz konkret
3562080	3564760	in dem Moment der Hass auch eine Stärke
3564760	3566680	in meiner Verhandlungsposition gegeben,
3566680	3567680	würde ich sagen.
3570800	3571800	Weitere Fragen.
3574280	3575280	Moin, hi.
3575280	3577840	Du hast vorhin, wenn ich es richtig verstanden habe,
3577840	3579880	irgendwie über ja,
3581000	3582920	als du über Transformation gesprochen hast,
3582920	3585560	über auch militante Sachen gesprochen,
3585560	3587600	ob du das noch mal ein bisschen
3587600	3588920	ausformulieren könntest,
3588920	3591360	weil du hast das dann gar nicht weiter aufgegriffen,
3591360	3593120	sondern es war so ein bisschen im luftleeren Raum
3593120	3594240	und ich wusste jetzt nicht genau,
3594240	3595800	was du damit meinst.
3595800	3596560	Ja.
3596560	3597560	Danke dir.
3599400	3600400	Ja.
3603240	3604240	Ich meine,
3605080	3607680	wenn wir zum Beispiel im Zusammenhang mit Aboluzionismus
3607680	3609400	über auch Militanz sprechen,
3609400	3610920	müssen wir von einer großen Vielfalt
3611000	3612200	von politischen Kämpfen,
3612200	3613600	von politischen Praktiken
3613600	3614880	und auch Philosophien sprechen.
3614880	3617200	Und wir hatten erst vergangene Woche
3617200	3619400	in Köln eine Aboluzionismuskonferenz
3619400	3620080	beanstaltet.
3620080	3622400	Und ich finde, so am Programm kann man ganz gut ablesen,
3622400	3623800	was es da so eine Multitüde
3623800	3626400	eigentlich an Bewegungen und an Ansätzen
3626400	3627480	auch gibt,
3627480	3629400	zum Beispiel in einem aboluzionistischen Kampf.
3629400	3631080	Und das kann auf einer Militantenebene
3631080	3633720	zum Beispiel bedeuten
3633720	3636400	Praktiken des zivilen Ungehorsams,
3636400	3637640	Abschiebungen verhindern,
