start	end	text
0	4640	Herzlich willkommen bei Future Histories, dem Podcast zur Erweiterung unserer Vorstellung
4640	5640	von Zukunft.
5640	10680	Mein Name ist Jan Groß und ich freue mich sehr, heute Shader Kurt begrüßen zu dürfen.
10680	15240	Sie ist Buchautorin, Journalistin, Moderatorin und vieles mehr.
15240	20840	Diese heutige Folge, die setzt eine meiner liebsten Traditionen fort, nämlich das jährliche
20840	25640	Future Histories Live-Gespräch beim Zollo Kollektiv in Hamburg.
25640	31480	Angefangen hat diese überaus schöne Tradition 2020 mit Eva von Redeker zu Gast.
31480	36040	2021, da durfte ich dann Katharina Hoppe bei den Zollos begrüßen.
36040	43560	2022 bin ich Adamczak und dieses Jahr ist die großartige Shader Kurt zu Gast gewesen.
43560	47460	Ich freue mich wirklich jedes Mal sehr, bei den Zollos sein zu dürfen und sende hiermit
47460	49600	meine liebsten Grüße nach Hamburg.
49600	50600	Vielen Dank für alles.
50600	53800	Das ist wirklich ganz großartig, dass wir das jedes Jahr machen.
53960	60080	Und nachdem ich diese Folge hier vorproduziert habe, bleibt mir auch nichts weiteres, als
60080	65400	euch viel Freude zu wünschen mit der neuen Future Histories Live-Episode mit Shader
65400	67840	Kurt zu strategischem Hass.
73720	74720	Herzlich willkommen, Shader!
74720	78040	Hallo, es ist sehr schön, hier zu sein.
78040	79560	Wunderbar, ich freue mich sehr.
79640	83680	Shader, ich habe in der Vorbereitung beide deine Bücher gelesen, Radikale Zärtlichkeit
83680	84680	und Hass.
84680	87800	Und das sind beides wirklich tolle Bücher, muss ich sagen.
87800	90080	Ich kann es euch allen nur empfehlen, sie zu lesen.
90080	96840	Aber mir ist extrem aufgefallen, dass ich bei Hass viel unmittelbarer sofort involviert
96840	98520	war, als ich mich involviert gefühlt habe.
98520	102280	Ich habe mir nämlich auf der ersten Seite dann schon mit großen Ausrufezeichen dazu
102280	108880	geschrieben, sofort, ganz laut, Doppelpunkt, mein Privileg, nicht hassen zu müssen.
108920	112400	Es gibt bei mir schon definitiv auch einen sehr ausgeprägten Dissens mit dem Status
112400	117640	Quo, also das ist sicher so, aber das speist sich sozusagen meiner Energie, glaube ich,
117640	122400	aus einem anderen, aus einem anderen Gefühlsamalgam, wenn man so will, ja.
122400	126640	Und ich finde es ganz großartig, wie du dann im Buch so darauf eingehst, was es für unterschiedliche
126640	131840	Facetten des Hasses gibt und herausarbeitest, wie eben der Hass mitunter auch als eine notwendige
131840	135920	Kraft und als einen Selbstschutz und als eben auch ein Energiereservoir vielleicht
135920	137720	anzusehen ist, wenn man so will.
138000	141440	Ich möchte auf jeden Fall nochmal betonen, wie auffällig das für mich auch war, dass
141440	147520	ich das als ein ganz starkes Privileg empfunden habe, also vielleicht auch im Schlechten
147520	149480	eigentlich nicht hassen zu müssen.
149480	154920	Aber bevor wir vielleicht jetzt da diese Frage noch ein bisschen weiter in diese Richtung
154920	159000	ausschloten, vielleicht magst du uns erst mal vorstellen, einen Überblick darüber
159000	162880	geben, was für dich diese Auseinandersetzung mit dem Hass eigentlich bedeutet.
164000	167560	Sehr gerne. Aber ich glaube, das schließt auch unmittelbar an deine Beobachtung oder
167600	170680	an deine Erfahrung an, die du gerade mit uns geteilt hast.
173000	177240	Ich würde es gar nicht mal als Privileg bezeichnen, nicht hassen zu müssen.
178080	181560	Ich werde auch oft gefragt, ja, wie ist das denn?
181600	183120	Wer darf denn eigentlich hassen?
183160	187640	Und die Frage werfe ich ja auch schon in dem ersten Kapitel auf und erzähle das entlang
188200	194320	eben von Ordnungssystemen, Unterdrückungsstrukturen, Rassismus, Kolonialismus,
194320	195600	Patriarchat etc.
195920	199240	Aber gleichzeitig ist das Ambivalente ja am Hass, dass er eigentlich überhaupt erst
199240	200480	gar nicht existieren soll.
200520	205280	Also die Frage, wer überhaupt hassen darf, stellt sich nur auf den zweiten, dritten
205280	208960	Blick, weil eigentlich ist der Hass ja so verpönt, dass er eigentlich überhaupt niemandem
208960	211120	zur Verfügung stehen sollte.
211400	216520	Obwohl es ja auch gleichzeitig da natürlich, wenn wir uns jetzt auch nicht unbedingt
216520	221040	tagesaktuelle Entwicklungen, obwohl auch da, aber wenn wir uns zum Beispiel Pegida etc.
221080	226720	anschauen, die rechten Proteste vor einigen Jahren, wo der Hass tatsächlich einfach
226720	231560	symptomatisch, der sich auf der Straße geäußert hat, dann im Mainstream umgedeutet wurde
231560	234640	in Besorgnis, also besorgte Bürger in etc.
234960	240320	Dann sehen wir ja schon, auf welche Art und Weise Hass bei manchen eher dazu führt,
241720	248680	dass sie eher vermenschlicht werden, also dass der Hass, den sie zutage tragen, sozusagen
249400	256040	dazu führt oder dazu genutzt wird, um ihnen urmenschliche Angst, Sorge zuzusprechen und
256040	261720	wo der Hass auf der anderen Seite benutzt wird, um Menschen, die sowieso immer per se
261720	268600	qua Herkunft, qua Aussehen, qua Existenz überhaupt immer als AggressorInnen markiert
268600	272680	werden, um denen sozusagen den Hass zuzuschreiben, um sie zu entmenschlichen.
272680	276080	Und da gibt es ja auch eine lange koloniale Tradition, die ich mir auch anschaue in dem
276080	282440	Buch zum Teil, aber gleichzeitig würde ich sagen, es ist ja schön vielleicht, dass du
282440	285760	nicht hassen musst in dem Sinne, das Gefühl hast, dass du das nicht tun musst.
285760	287760	Ich würde auch nicht sagen, alle müssen hassen.
287760	289880	Das ist ja auch immer so ein Missverständnis aus dem Buch.
289880	295360	Das ist ein großes Manifest, Pamphlet ist, das den Hass sozusagen bespürt.
295360	298760	Und ich glaube, dass der Hass ja auf eine gewisse Art und Weise strategisch und sinnvoll
298760	300240	eingesetzt werden kann.
300560	306040	Aber letztendlich weiß ich auch aus persönlicher Erfahrung, wie nah der Hass auch am Trauma
306280	310720	dran ist. Und letztendlich ist es ein Buch, das sehr viel von Trauma handelt und deswegen ja
310720	316120	auch eine Form hat, auch im zweiten Kapitel eine sehr fragmentierte Form, also auch das
316120	323160	Trauma ja auch als ein Unmöglichwerden von linearen Erzählungen, von Sinnzusammenhängen,
323160	324840	die plötzlich auseinanderreißen.
325240	333720	Und meine ganze Arbeit besteht ja auch so mehr oder minder so aus dem Drang, die Fragmente
333720	339560	auch wieder in einer Beziehung zu einander zu setzen, ohne der Vorstellung anheim zu
339560	343320	fallen, dass es irgendwie wieder eine Ganzheit geben könnte, aber wieder eine Beziehung
343320	348520	herzustellen und auch aus dem ewigen Loop, aus der ewigen Wiederholung auch des Traumers,
348520	349640	was es ja im Wesen ist.
349640	353960	Also das Trauma ist ja eine zeitlose Welt, wo es auch keine Zukunft gibt am Ende.
354920	358560	Das passt ja wieder so ein bisschen zu dem Titel deines Podcasts, also Future Histories.
358760	361960	Aber wenn du die ganze Zeit im Trauma gefangen bist, auch wenn man das psychologisch
361960	366520	erklärt, ist es ja eine zeitlose Welt, in der es eigentlich nur die Vergangenheit gibt und
366520	371680	irgendwie vielleicht ein Einblick in eine Gegenwart, die aber auch eigentlich immer nur
372360	376480	unmittelbar gekoppelt ist an etwas, was du in der Vergangenheit erlebt hast.
376760	380480	In dem Sinne würde ich gar nicht sagen, alle müssen jetzt hassen und alle müssen in dem
380480	381960	Sinne traumatisiert sein.
382280	387880	Und am Ende ist das Buch auch für mich persönlich auch der Versuch, mich aus dem Trauma auch
387920	392440	herauszuarbeiten, also mich in der Bewegung des Traumers vielleicht auch zwischendurch mitreißen
392440	397880	zu lassen. Aber letztendlich geht es schon immer auch um die Frage nach der Zukunft und wo auch
397880	402200	der Hass vielleicht in der Zukunft überhaupt noch einen Platz haben kann oder sollte.
402240	407320	Und das ist dann die Frage, die sich dann anschließt und wo dann vielleicht sich der Bogen
407320	411320	schlägt zum ersten Buch der Frage nach einer radikalshertlichen Gesellschaft.
412000	416720	Ja, sehr schön. Da kommen wir in jedem Fall auch noch zu, zu dieser Frage, was nach dem Hass
416720	418400	liegen kann und auch wie man dahin kommt.
418800	424040	Aber vielleicht zunächst noch ein bisschen zu dem Gefährt oder dem Träger, den du aufmachst,
424040	428800	um das, dieses Gefühl, das da in der Welt ist, sozusagen anders zu kanalisieren.
428800	431280	Und das ist, was du strategischen Hass nennst.
431600	436120	Also du hast ja verschiedene Modi, die du sagen analytisch quasi da
436760	442000	feststellst, unterschiedliche Modi des Hasses und das, was aber das größte Potenzial hat,
442040	445160	dass es vielleicht auch noch zu bergen gilt, das ist der strategische Hass.
445200	447560	Vielleicht kannst du da ein bisschen drauf eingehen, worum es da geht.
447880	454760	Gerne. Also eigentlich ist der strategische Hass als Idee eine Antwort
454840	459880	auf Publizistinnen, auch wie Caroline Emke, die ich ja in dem ersten Buch, in dem ersten
459880	464240	Teil des Buchs, im ersten Kapitel, also das Buch hat zwei Kapitel, Hass und Hassen.
464680	472160	Und Hass, das erste Kapitel ist mehr oder minder so ein Versuch, eine Ideengeschichte,
472280	475720	eine westliche Ideengeschichte des Hasses aufzumachen, das auch nicht immer so einfach
475720	478640	ist, weil der Geschichte, weil der Hass eigentlich so verpönt ist, dass er nicht mal
478640	480480	in einer eigenen Geschichte würdig zu sein scheint.
481200	485240	Aber es gibt dieses Buch von Caroline Emke, das ihr vielleicht kennt, Gegen den Hass,
485240	488680	wo sie sich gegen den Hass von Pegida, den Rechten und Co.
488680	493440	positioniert und auch in ihrem Buch aber der Hass eigentlich immer nur als das Phänomen
493440	498840	der kategorisch anderen auftaucht und es überhaupt nicht denkbar zu sein scheint
498840	502400	in dem Buch, dass auch Menschen, die von Rassismus betroffen sind, die von rechter
502400	506120	Gewalt betroffen sind, auch hassen können, also dass sie auch Subjekte des Hasses sein
506120	508440	können und nicht immer Objekte des Hasses sein müssen.
509360	516040	Und es gibt so ein sehr monolithisches Menschenbild, was aber Liberale oft haben.
516480	520440	Also wenn man Caroline Emkes Buch liest, könnte man denken, Menschen, die hassen, sind
520560	523920	Zombies und die können nichts anderes als zu hassen.
523920	528200	Also es gibt ja dann auch immer diese biblisch anmutenden Passagen.
528200	533400	Also wer auf Hass mit Hass reagiert, hat sich schon verformen lassen etc.
533680	536480	Auch wenn das natürlich auf eine gewisse Art und Weise stimmt, weil wir ja immer in
536480	542040	einer gewissen Reaktion, Identität, Körperlichkeit, immer in einer gewissen Reaktion, auch Wechselbeziehung
542240	545520	natürlich mit der Gewalt auch passiert, die um uns umgibt.
545920	550600	Aber es gibt diese Vorstellung von Menschen, die hassen, sind einfach durchdrungen von
550600	555440	Hass, das sind einfach Zombies und es gibt keine Gleichzeitigkeit, es gibt keine Ambivalenz,
555480	560240	keine Widersprüchlichkeit von unterschiedlichen Emotionen, die Menschen auch als Ressourcen
560240	561240	anzapfen können.
561640	567200	Und es ist natürlich auch eine Vorstellung von Gefühl von vor allem Hass und einer extremen
567200	573760	Naturalisierung von Hass, dass der Hass sozusagen eine Natur hat, eine überwältigende wie
573760	577360	so eine Naturgewalt eigentlich über Menschen hinein bricht.
577360	580240	Und das gibt es ja auch in ähnlicher Weise auch über die Liebe.
580240	584120	Deswegen ist die Liebe auch im ersten Buch das Gegenstand der Analyse.
584840	588120	Aber es gibt sozusagen, da frage ich mich dann, wo ist dann die Handlungsfähigkeit
588120	589320	eigentlich auch des Menschen?
590280	596000	Und der strategische Hass ist in dem Sinne eine Form der Entscheidung vielleicht auch
596000	603320	zu Hass, was auch oftmals für viele Menschen erst mal so nicht so intuitiv, also erst mal
603320	606680	ist so, was bedeutet es, sich zu einem Gefühl entscheiden zu können?
606680	610880	Aber das ist auch angelehnt an das erste Buch und auch an Gedanken, die ich mir da so ein
610880	614960	bisschen bei Denkerin wie Belle Hooks auch abgeschaut habe, die zum Beispiel über die
614960	622840	Liebe sagt, Liebe ist eine Praxis, eine fürsorgliche Praxis, eine Praxis, dass sich gegenseitig
622840	623840	wachsen sehen wollen.
623840	627680	Es ist nicht etwas, was einfach in den Schoß fällt, sondern etwas, wozu sich Menschen
627680	631320	gemeinsam entscheiden, eine Arbeit, zu der sie sich gemeinsam entscheiden.
631560	633160	Und so ähnlich ist es mit dem Hass.
633160	640800	Und auch ist es eine Antwort auf Erich Fromm, den ich auch in dem Buch dann nochmal so
640800	641800	kritisch beleuchte.
641800	644800	Und er hat in dem Buch, wie heißt es nochmal?
644800	650520	Die Antworten der Liebe heißt es, glaube ich, hat er sich auch den Hass angeschaut und
650520	654040	hat dann diese zwei Formen des Hasses ausfindig gemacht.
654040	658440	Einmal diesen reaktiven Hass, der sozusagen manchmal eine sehr existenzielle Reaktion,
658440	661000	vielleicht auch eine Form der Selbstverteidigung ist.
661000	665680	Also mir wird Gewalt angetan und ich fange an gegen zu hassen, was ich auch sehr, sehr
665680	669200	spannend finde und auch wichtig finde und so im Feld von Selbstverteidigung auch so
669200	670480	abstecke in dem Buch.
670840	674280	Und dann unterscheidet er davon auch mal den charakterbedingten Hass.
674320	678600	Also da, wo ich sozusagen, wo das Trauma vielleicht auch letztendlich zu meiner
678880	683760	tatsächlich zu meiner einzig möglichen Realität wird und der Hass zu meinem
683760	688400	Wesenszug. Aber es fehlt halt eine politische Herangehensweise und es fehlt auch die
688400	692360	Herangehensweise, die dem Menschen eine gewisse Handlungsfähigkeit auch zuspricht und
692360	693720	vor allem auch im Kollektiven.
694280	697720	Es ist natürlich eine sehr psychoanalytische Herangehensweise bei Erich Fromm.
698280	700240	So berufsbedingt auch.
700440	703800	Und ich habe mich gefragt, aber wie kann der Hass sozusagen auch in kollektiven
703800	708320	Kämpfen, in Klassenkämpfen, in antikolonialen Kämpfen auf eine gewisse Art und Weise
708320	709920	auch instrumentalisiert werden?
710240	715920	Aber ohne dass er sozusagen auch nur sich auf die Kämpfe der Gegenwart bezieht.
715960	717160	Auf welche Art und Weise?
717200	720920	Und das ist das, was wir eben schon kurz angerissen haben.
721200	724840	Kann er sich auch transformieren in eine Kraft, die auf eine gewisse Art und Weise
724840	729040	auch Zukunft mitgestaltet oder etwas vorwegnimmt, was wir uns eigentlich für die
729040	730760	Zukunft versuchen zu erarbeiten?
731080	735640	Letztendlich ein Hass, der eine Form von Zärtlichkeit hervorbringt.
736600	740520	Ich bin ein bisschen am Schwanken, aber ich glaube, lass uns doch noch mal ein bisschen
740520	746040	kurz bei dieser Frage der Selbstbestimmtheit oder des Wählens dieser Form des Hasses
746040	749840	verbleiben, weil ich bin da so ein bisschen drüber gestolpert, weil du eben im Rahmen
749840	753240	des strategischen Hasses dieses Wort verwendest, selbstbestimmt.
753600	761040	Und dann gibt es so eine Passage, wo du dann auf Sisyphos eingehst und Camus zitierst.
761040	765480	Und da ich zitiere das jetzt auch mal, da heißt es, darin besteht die verborgene Freude
765480	768960	des Sisyphos. Sein Schicksal gehört ihm, sein Fels ist seine Sache.
769080	774040	Zitat Ende. Also da gehst du so ein bisschen eigentlich auf die Frage ein, wie kann man
774040	779120	sich eben dieses Gefühl, das ja auf eine Art auch unfreiwillig da ist, wie kann man sich
779120	782720	dessen sozusagen bemächtigen und das eben für sich, wie du jetzt eben auch dargelegt
782720	787800	hast, nutzbar machen. Und aber in diesem Beispiel des Sisyphos und auch gerade in
787800	791840	Bezug auf die Frage der Selbstbestimmtheit bin ich da so, das habe ich nicht so ganz
791840	797280	gecheckt, wie das aufgehen soll, weil also insofern als das der Hass auf die Herrschaft
797280	802640	ja eigentlich auch Teil der Herrschaft ist, kommt man da aus dieser Bindung nicht heraus.
803000	807160	Und du betontst auch gerade diese Frage der Bindung beziehungsweise du verwendest das
807160	811680	Wort Fixierung. Du betontst das eigentlich auch als eine Form von Qualität so.
812240	816920	Aber gerade wenn man jetzt wieder zu Camus zurückgeht und sagt, ok, der Sisyphos hat
816920	821280	sich das Hochrollen des Steines quasi zu eigen gemacht, in dem das jetzt seins ist, dann
821280	824720	denke ich mir dann nachher, ok, sehr schön und fein, dass er sich das jetzt so zu eigen
824720	829720	macht. Aber am Ende rät er immer noch den Stein da hoch so und die Grundstruktur und
829720	834600	diese Aufstellung haben sich nämlich genau gar nicht geändert, sondern am Ende eben geht
834600	838840	es ja eigentlich nicht darum, ob ich das jetzt irgendwie mir so mache, dass ich darauf
838840	844520	klar komme, sondern am Ende geht es eigentlich darum, diese gesamte Konstellation aufzulösen,
844520	847360	in der dieser Stein immer wieder hochgerollt wird.
847800	852560	Und ob ich mir jetzt selber erzähle, ich mache das selbstbestimmt, ist dann zwar ganz
852560	855400	cool und so, aber nicht alles.
855440	860720	Total genau. Deswegen stelle ich ja auch irgendwann auch, ich glaube, unmittelbar im
860720	864840	Anschluss auch an diese Passage, auch aus dem Mythos des Sisyphos, auch die Frage
864880	868720	reicht eigentlich das Überleben, weil was ja eigentlich da passiert ist, dass ja Sisyphos,
869680	873840	ich glaube Camus nennt das ja gar nicht Hass, sondern Verachtung, diese Verachtung sich zu
873840	880760	eigen macht und sich sozusagen in der Verachtung auf sein Schicksal oder auch gegen
880760	883840	die Herrschaft sich sozusagen letztendlich am Leben hält.
883880	886800	Aber die Frage ist ja natürlich, reicht einfach das Überleben?
887080	891080	Und es geht ja auch so ein bisschen in eine ähnliche Richtung von Dirty Care, was ja auch ein
891080	895040	zentraler Begriff aus dem ersten Kapitel ist, ein Begriff der französischen.
895040	900960	Also sie hat sie jetzt vor allem mitgeprägt, auch für mich in der Lektüre der
900960	904840	französischen Philosophin Elsa Dorland aus dem Buch Selbstverteidigung, Eine Philosophie der
904840	911440	Gewalt. Und sie beschreibt Dirty Care eben als eine Art der eine Praxis der
911440	918120	Selbstverteidigung, aber in dem Sinne, dass es eine Fürsorgearbeit ist, die immer sehr,
918280	920880	sehr nah an der Herrschaft ist, an den Herrschenden heran.
920920	928480	Also eine Form des am Leben bleibens, eine Form des Unterdrückte werden zu ExpertInnen
928480	931680	ihrer Herrschenden, um ihre eigene Haut zu retten.
931720	933920	Und es ist sozusagen eine Selbstverteidigungsform, eine
933920	938280	Selbsterhaltungsform vor allem, eine Fürsorge, nicht sozusagen um Leben zu
938280	943120	erschaffen und damit Leben floriert, sondern um eigentlich einfach nur die eigene
943120	948000	Haut zu retten. Und sie beschreibt das aber auch als gleichzeitig eine Form auch
948000	952160	des Widerstandes, weil sie sagt z.B. im kolonialen Kontext, den sie sich vor allem
952160	959440	anschaut, wo Dirty Care sozusagen in Form von einem Widerstand sich artikuliert, der
959440	965240	eben nicht mit der offenen erst mal zu Beginn zumindest keine offene Konfrontation
965240	970080	bedeutet mit den Kolonialherren, keine Widerworte, weil kolonisierte Menschen
970080	976000	wissen, dass jede Art der Gegengewalt die Auslöschung ihrer Existenz bedeuten
976000	980400	kann und die Fürsorgearbeit, die sie dann eher machen müssen, ist sozusagen die
980400	985120	herrschenden Minoziös zu studieren und sie irgendwann so gut zu kennen, dass sie
985120	991240	eben gewisse Dinge antizipieren können, dass sie die Bahnen der Gewalt, dass sie
991240	996440	die Bahnen der Gefahr, also eigentlich dieses Leben auf dem Minenfeld meistern
996440	1001120	können. Und es ist ja in Form sozusagen einfach der reinen Selbsterhaltung, die
1001200	1004320	sozusagen die Bahnen der Herrschaft nicht bricht und die Normalität auch nicht
1004320	1008600	unterbricht. Aber Elsa Dolan deutet es gleichzeitig eben auch als eine Form der
1008600	1012680	Vorbereitung des Widerstandes, weil gerade eben da in diesen Zwischenräumen,
1012680	1017840	manchmal auch im häuslichen, also da wo auch eben auch in der Gegenwart, zum
1017840	1022080	Beispiel wenn wir uns häusliche Gewalt anschauen, Widerstand eben nicht offen und
1022080	1027520	konfrontativ gelebt werden kann, aber da eben Menschen sind, die ja qua ihrer
1027520	1033960	Situation ihre, die Herrschende sehr, sehr gut kennen müssen zu ExpertInnen dieser
1033960	1037280	herrschenden Wissen und auf diese Art und Weise auch wissen, wo sie Zwischenräume
1037280	1042600	eröffnen können, um den aktiven, direkten Widerstand mit vorzubereiten und im
1042600	1047880	kolonialen Kontext zum Beispiel, um, weiß ich nicht, Flugblätter zu schreiben oder
1047880	1053040	konspirative Treffen abzuhalten etc. Deswegen unterstreicht Elsa Dolan auch
1053040	1056480	diese Ambivalenz von Dirty Care und ich glaube, sie wird auch wahrscheinlich die
1056480	1060000	Ambivalenz von einem Sisyphus, obwohl das ist schon nochmal eine andere
1060000	1065640	Situation, weil Sisyphus fehlt natürlich ja der Ausbruch auch aus der
1065640	1070160	Isolation letztendlich und ich glaube, dass letztendlich ein strategischer Hass
1070160	1075160	und strategisch im Sinne von ein antizipierender Hass einer, der weiß, wann
1075160	1078880	der Hass gesät werden muss, wo nötig, aber auch wieder begraben werden muss, wo
1078880	1082160	nötig, immer das Kollektive braucht, immer auch ein Schöpfen aus der
1082160	1086400	Geschichte, aus dem Wissen, dass unterschiedliche Menschen mitbringen, aus
1086400	1090120	den Ritualen, aus Geschichten, die Menschen sich einander erzählen, aus
1090120	1094360	Erfahrungswerten, die sie sammeln und das ist für mich glaube ich so das Moment
1094360	1098920	auch von strategischem Hass, wo er vor allem aus der Isolation herausführt und
1098920	1103920	diese Chance hat ja ein Sisyphus jetzt qua Mythos nicht unbedingt.
1103920	1107480	Ja ich habe mich glaube ich auch einfach ein bisschen gefragt, inwiefern dann der
1107480	1111760	Hass das richtige Trägermedium ist, wenn man so will, weil in deinem Buch, da
1111760	1117040	kommt irgendwann Bugs Bunny vor und ich fand es eine superschöne Passage ja und
1117040	1122000	den Bugs Bunny, den findest du irgendwie cool, merkt man so und man merkt auch so du
1122000	1125600	möchtest ein bisschen gerne so sein wie Bugs Bunny und aber was Bugs Bunny hat ist
1125600	1129800	eben nicht Hass, sondern was Bugs Bunny hat ist quasi so eine kühle Verachtung,
1129800	1134200	Narroganz und ich hatte das Gefühl, dass das eigentlich doch das viel bessere
1134200	1138800	Trägermedium wäre, insofern als dass es eben nicht wie der Hass diese Fixierung
1138800	1142560	hat, die einen dann eben auch an das Hassende, an das was man hasst bindet,
1142560	1148840	sondern dass eigentlich das Trägermedium, was mir dann irgendwie intuitiv tauglicher
1148840	1153040	erschien, sagen diese kühle Arroganz gegenüber den
1153040	1158360	Herrschenden, diese diese Verachtung sozusagen vielleicht sein könnte, dass
1158360	1159840	es eigentlich vielleicht gar nicht darum geht,
1159840	1165680	sagen strategischen Hass zu kultivieren, sondern strategische Verachtung.
1165680	1169760	Schrenne, aber die Frage ist ja, was eigentlich passiert, wenn es die Fixierung
1169760	1173880	nicht mehr gibt und inwiefern sich auch Menschen in gewissen Kämpfen überhaupt
1173880	1178400	leisten können, die Fixierung, also sich abzuwenden und ob das nicht auch eine
1178400	1184160	gewisse Form von Privileg ist. Also die Philosophin Helge Landwehr, die ich auch
1184160	1187360	in dem Buch zitiere, die unterscheidet ja tatsächlich zwischen Verachtung und
1187360	1191360	Hass und sie sagt, in einer Klassengesellschaft, in einem
1191360	1195080	Gesellschaftsgefüge aus Hierarchien wird von oben verachtet und von unten
1195080	1199800	gehasst, weil die Menschen, die obere Klasse, sagen wir jetzt mal die oberen
1199800	1204880	ein Prozent, die verachten, weil das bedeutet eben verachten, das steckt
1204880	1210440	ja schon in dem Wort drin, es ist eine Form des nicht Beachtens
1210440	1213920	letztendlich, also aber die haben auch die Chance sozusagen die Menschen, die sie
1213920	1217360	unterdrücken, die sie ausbeuten etc. nicht zu beachten und sich dieser
1217360	1222360	abfälligen Geste der Ignoranz abzuwenden, aber die untere Klasse, die hat diese
1222360	1226320	Chance nicht, weil letztendlich diese Bindung ja herrscht zwischen ihnen und
1226320	1229560	der Herrschaft, selbst wenn sie es nicht wollen, dann ist ja eher die Frage, auf
1229560	1235400	welche Art und Weise diese Bindung auf eine produktive Art und Weise gebrochen
1235400	1239160	werden kann oder gestört werden kann oder die Bahnen umgelenkt werden können, aber
1239160	1243640	die Bindung zwischen Herrschaft und Beherrschten gibt es ja einfach, also
1243640	1247280	die können wir ja nicht einfach wegdenken und Helge Landwehr sagt
1247280	1251520	sozusagen, dass der Hass, der von unten kommt, der zwar oftmals mit einem
1251560	1255720	Vernichtungsimpuls einhergeht, aber eben diese starke Fixierung hat, die auch
1255720	1260000	Carolin Emke ausmacht in ihrem Buch, obwohl sie das ja eher negativ einordnet,
1260000	1263280	aber Helge Landwehr sagt, dass gerade die Fixierung und auch in diesem
