start	end	text
3637640	3640440	sich sozusagen in seiner Körperlichkeit,
3640440	3642200	in die Normalität hereinschmeißen
3642200	3643240	und auf eine gewisse Art und Weise
3643240	3646040	diese Normalität dadurch zu brechen.
3646040	3648600	Aber es kann natürlich auch auf der anderen Seite
3648600	3649360	eben das bedeuten,
3649360	3650360	was ich eben angesprochen habe,
3650360	3653560	Fürsorgenetzwerke, Gesundheitsnetzwerke etc.
3653560	3654480	Das ist vielleicht das,
3654480	3655760	was wir jetzt im herkömmlichen Sinne
3655760	3657720	nicht als Militant verstehen würden.
3657720	3659280	Und ich glaube, so Militant
3659280	3661120	gehört auch in dem Sinne dazu,
3661120	3662840	auch als eine politische Arbeit,
3662840	3664960	die in dem Sinne auch körperlich ist.
3664960	3667120	Ja, ohne das jetzt groß ausführen zu wollen,
3667120	3667960	weil ich weiß ja nicht,
3667960	3672360	wer hier noch so heute zugegen ist.
3672360	3673000	Ja.
3673000	3677080	Im persönlichen Gespräch dann mehr Details.
3677080	3679920	Weitere Fragen?
3679920	3681480	Mein Gehirn ist ein bisschen gekocht,
3681480	3687240	aber den Hass als aktivierendes Moment,
3687240	3690680	das kann ich mega gut verstehen und kenne selber.
3690680	3692000	Und ich glaube, sehr, sehr viele Menschen
3692000	3695280	kennen das, dass sich Gruppen konstituieren
3695320	3699720	durch ein gemeinsames Hassobjekt.
3699720	3704000	Und dass da was Aktivierendes drin liegen kann,
3704000	3708080	dass es Teil einer Vielzahl von Gefühlen sind,
3708080	3711120	die nicht abgespalten werden müssen vom Selbst,
3711120	3713840	um ein richtiger Mensch zu sein,
3713840	3714720	sondern im Gegenteil.
3714720	3716440	Das macht für mich mega Sinn.
3716440	3722240	Und das, wo ich mich gerade die ganze Zeit im Kreis drehe,
3722240	3725600	ist aber so um die Frage von dem Produzieren
3725600	3728120	von Retraumatisierung durch Hass.
3728120	3729920	Magst du dazu was sagen?
3729920	3733600	Oder vielleicht hast du auch was dazu geschrieben?
3733600	3735440	Danke dir.
3735440	3740880	Ich habe darüber geschrieben, so konkret habe ich nicht.
3740880	3742600	Ich kann das total gut nachvollziehen.
3742600	3744840	Und das ist auch eine Frage, die mich auch beschäftigt,
3744840	3749200	aber auf die ich jetzt noch keine endgültige Antwort habe.
3749200	3751160	Ja.
3751200	3753000	Ich müsste noch mal drüber nachdenken,
3753000	3756920	weil, als du jetzt gerade angesprochen hast,
3756920	3760040	irgendwie auch sich in der Erfahrung von Hass
3760040	3761600	zum Beispiel zusammenzufinden,
3761600	3762840	birgt natürlich die Gefahr,
3762840	3765320	dass da Menschen vor allem zusammenkommen,
3765320	3767720	die alle auch ein gewisses Trauma miteinander teilen.
3767720	3769040	Und dann ist natürlich die Frage,
3769040	3771240	auf welche Art und Weise diese Menschen miteinander
3771240	3774640	sich auch aus der ständigen Wiederholung
3774640	3776560	auch herausarbeiten können gemeinsam.
3776560	3778560	Also ich verstehe das total.
3778560	3779240	Ich würde auch zum Beispiel,
3779240	3782960	wir haben ja eben kurz über Dirty Care gesprochen.
3782960	3784760	Ich denke manchmal auch,
3784760	3787560	dass so gewisse Identitätspolitiken
3787560	3790080	auch so eine abgefuckte Form von Dirty Care sind.
3790080	3792400	Also, dass sich da Menschen zusammenfinden,
3792400	3796280	die aus einer Erfahrung auch der Gewalt und des Traumas heraus,
3796280	3798280	weil sie auf eine gewisse Art und Weise aussehen,
3798280	3800120	Staatsangehörigkeit, et cetera,
3800120	3805440	eben in diesem Gewaltsystem von Patriarchat, Rassismus, et cetera,
3805440	3808920	dazu gezwungen sind, zu ExpertInnen ihrer Herrschenden zu werden.
3808920	3811040	Und das ist so eine abgefuckte Form von Dirty Cares.
3811040	3812280	Und dann immer noch die Frage,
3812280	3816120	die sich ja auch bei gewissen identitätspolitischen Bewegungen stellt.
3816120	3817520	Was kommt sozusagen danach?
3817520	3820840	Und wo ist dann der Ausbruch und wo ist so die transformative Kraft?
3820840	3823240	Aber in dem Sinne habe ich da eigentlich nur noch mehr Fragen,
3823240	3827520	die anschließen würden, als Antworten.
3827520	3831080	Aber vielleicht haben ja andere Menschen noch Gedanken dazu.
3831080	3833840	Würde ich so mal zurückspielen, wenn ich darf.
3833840	3837200	Gut, angesichts dessen, dass es eine Folgeveranstaltung gibt
3837200	3841040	und dass es hier mega heiß ist,
3841040	3844000	danke ich euch vielmals, dass ihr da wart.
3844000	3846200	Es war mir eine große Freude, Schäder.
3846200	3847840	Mir auch, vielen Dank.
3847840	3850680	Vielen Dank fürs Ausharren in der Sonne, in der Hitze
3850680	3854200	und fürs Mitdenken, Mitfühlen.
3854200	3855360	Gut. Danke, Jan.
3855360	3856520	Danke euch allen.
3856520	3857520	Dankeschön.
3868200	3870480	Das war Future Histories für heute.
3870480	3872480	Vielen Dank fürs Zuhören.
3872480	3878000	Show-Notizen und vieles mehr findet ihr auf www.futurehistories.today.
3878000	3881760	Diskutiert mit auf Twitter unter dem Hashtag Future Histories
3881760	3883760	oder im eigenen Subreddit.
3883760	3888120	Ihr könnt Future Histories nicht nur auf allen großen Podcast-Plattformen
3888120	3891320	hören und abonnieren, sondern auch auf YouTube,
3891320	3895760	wo ihr neben den Episoden dann auch Kurzvideos zu Kernbegriffen
3895840	3897840	einzelner Episoden findet.
3897840	3901840	Schreibt mir gerne unter jan at futurehistories.today.
3901840	3906600	Ich freue mich immer sehr über interessante Rückmeldungen und Hinweise.
3906600	3908920	Wenn ihr Future Histories unterstützen wollt,
3908920	3913440	dann könnt ihr das auf patreon.com schrägstrich Future Histories
3913440	3916320	oder auch via Spende auf unserer Homepage.
3916320	3919720	Future Histories ist eine Produktion von MetaLapses
3919720	3922840	zu finden auf meta-lapses.net.
3922840	3925920	Bis zum nächsten Mal. Ich freue mich.
