start	end	text
0	6000	Herzlich willkommen bei Future Histories, dem Podcast zur Erweiterung unserer Vorstellung von Zukunft.
6000	12000	Mein Name ist Jan Groß und ich freue mich sehr, heute Max Franz-Johann Schnettker begrüßen zu dürfen.
12000	20000	Max ist Autor des Buches Transhumanistische Mythologien, in dem er sich kritisch mit bestimmten Strömungen des Transhumanismus auseinandersetzt.
20000	26000	Vielen, vielen Dank an Fabian für deine Unterstützung und vielen Dank auch für den Hinweis zu Maxes Buch.
26000	29000	Das war wirklich jetzt ein interessantes Interview und Gespräch.
29000	34000	Denn auch für mich waren einige der Bezüge, die Max da herstellt, durchaus neu.
34000	45000	Und als Max dann am Ende warnt, dass sich diese Formen des Denkens auch gerade anschicken, ganz konkret Nähe zu klassischen politischen Machtzentren zu suchen, da war ich erstmal ein bisschen erstaunt.
46000	67000	Aber ein paar Tage nach unserem Interview hat mir Max dann einen Artikel geschickt über einen Skandal um einen Berater von Boris Johnson, der öffentlich für Eugenik eingetreten ist und zum Beispiel die universelle Einführung von Langzeitverhütungsmitteln zu Beginn der Pubertät vorgeschlagen hat, um eine, Zitat, dauerhafte Unterschicht zu verhindern.
67000	80000	Das ist jetzt natürlich ein Extrembeispiel, muss man sagen, aber ganz im Sinne einer kritischen Analyse, auch von zukünftigen Herrschaftsverhältnissen, gilt es unbedingt, den transhumanistischen Diskurs kritisch zu befragen.
80000	83000	Genau das machen wir im heutigen Gespräch.
83000	93000	Wenn euch Future Histories gefällt, dann erzählt es doch bitte einem Freund oder einer Freundin, von der ihr glaubt, dass ihm oder ihr Future Histories vielleicht auch gefallen könnte.
93000	100000	Vielen Dank und ich wünsche euch viel Spaß bei dieser Episode mit meinem Gast Max Franz-Johann Schnettger.
106000	108000	Herzlich willkommen, Max.
108000	109000	Hallo.
109000	119000	Es gab schon einmal eine Folge Future Histories, in der der Transhumanismus zur Sprache kam, nämlich Folge 13 mit Julia Grillmeier zu Transhumanismus, Posthumanismus und Kompost.
119000	126000	Nicht alle werden aber diese Folge, die übrigens sehr empfehlenswert ist, möchte ich da noch anmerken, gehört haben.
126000	129000	Und so mag ich auch dich um eine Begriffsdefinition bitten.
129000	132000	Was ist das? Was ist Transhumanismus?
132000	146000	Ja, das auch ein ganz guter Einstieg, den ich vielleicht auch nutzen sollte, denn ich habe mir erlaubt, dadurch, dass ich mich kritisch mit dem Thema beschäftige, auch eine Begriffsdefinition vorzunehmen,
146000	150000	die sich von der Eigenbezeichnung von Transhumanisten ein bisschen unterscheidet.
150000	165000	Das ist ja vordergründig, sagt man, oder wenn man mit Transhumanisten redet, hört man oft, es ginge eigentlich nur um eine Verbesserung des Menschen durch Technologie und es könnte jede Form von Verbesserung käme da in Frage.
165000	178000	Ich bin aber der Meinung, dass sich da durchaus ein sich in einer Institutionalisierung befindendes ideologisches Narrativ ausmachen lässt.
178000	192000	Und dass es eben nicht nur um eine reine technologische Verbesserung des Menschen geht oder jede technologische Verbesserung des Menschen Transhumanismus wäre, sondern dass sich das recht genau umreißen lässt.
193000	213000	Um ein Beispiel zu geben, was es nicht ist, ich hatte bei einem kürzlichen Vortrag, da war jemand, der leidet an Parkinson und er hat noch gehts, aber er hat als langfristige Therapieform in Aussicht, dass er einen Hirnschrittmacher kriegt.
213000	233000	Da ist es dann ein kleiner Draht, der ins Gehirn implantiert wird, der an bestimmten Nervenzellen einen schwachen Strom abgibt, diese dadurch polarisiert und irgendwie, man weiß es nicht so genau, dafür sorgt, dass Parkinson Symptome unterdrückt werden.
233000	241000	Und der sah sich quasi schon, fing dann halt, hatte für sich die Fragestellung, ja damit bin ich doch Transhuman, das ist es doch.
241000	257000	Draht im Kopf und Implantat und das reguliert irgendwie, wo ich dann sagen würde, genau das ist tatsächlich nicht Transhuman, das ist zutiefst menschlich, weil er ausgeliefert bleibt an seinen Körper die Verhältnisse.
257000	274000	Und wenn man sich ein bisschen mit transhumanistischer Literatur beschäftigt, läuft es immer darauf hinaus Kontrolle zu erlangen, über die Eventualitäten des Lebens, Kontrolle über den Körper, Kontrolle über Krankheit und am Ende auch über den Tod.
274000	286000	Also es wäre zum Beispiel jemand, der auf medizinischen Wege eine neue Anwendung zur Bekämpfung einer Krankheit kriegt, den würde ich zum Beispiel nicht Transhuman nennen.
286000	295000	Das heißt, wir haben festgestellt, was es nicht ist. Was wäre dann aus deiner Perspektivierung das, was es schon ist?
295000	322000	Das, was es schon ist, das ist eine recht spezifische Ideologie, die also, der hat diverse Ursprünge, aber sie hat sich in den letzten 20 Jahren, würde ich sagen, gibt es einen Mainstream, der sehr viel zu tun hat mit dem Silicon Valley bzw. den dort neu entstandenen Geld- und Machteliten, die die Digitalisierung hervorgebracht hat.
322000	349000	Die immer wieder in ein Projekt des Fortschritts, der da ja irgendwie so das Leitbild gibt, dann halt auch die Verbesserung des Menschen mit einbeziehen und schlussendlich auf eben die Überwindung von Leid und so weiter abzielen, aber in einer Art und Weise, die, wenn Sie Mensch sagen, eigentlich so eine ganz spezifisch bürgerliche Subjektvorstellung zugrunde legt.
349000	357000	Und die quasi auf technologischen Säge sichern und verstetigen möchte.
357000	375000	Und da das Ganze nicht so sehr eingebettet ist in geisteswissenschaftliche Diskussionen, sondern zumeist irgendwie aus dem Techsektor kommt, gruppiert sich der Transhumanismus dann auch gar nicht so sehr nach irgendwelchen spezifischen Anthropologien,
375000	383000	sondern es geht dann, zum Beispiel gibt es da den Vorschlag einer Einteilung in Silizium-basierten, Kohlenstoff-basierten Transhumanismus.
383000	399000	Der Silizium-basierte würde darum kreisen, Menschen elektronische Implantate einzubauen und schlussendlich ihren Geist in Computer hochzuladen und auf diesem Wege mit Computern zu verschmelzen.
399000	411000	Der Kohlenstoff-basierte Transhumanismus kreist dann um Vorstellungen von genetischem Enhancement, genetischen Verbesserungen und der Überwindung des körperlichen Alterns.
411000	416000	Und da gibt es schon so unterschiedliche Strömungen und Institutionen tatsächlich auch.
416000	431000	Also in dem Kohlenstoff-basierten haben wir dann eher die Leute, die diese Bewegungen rund um MaxMor, die Wert darauf legen, sich einfrieren zu lassen, bis eben neue medizinische Technologien da sind,
431000	441000	während wir in dem Silizium-basierten eben die Erlösungsvorstellungen rund um KI und so weiter haben, mit denen ich mich dann auch spezifisch beschäftigt habe.
442000	451000	Das ist interessant, weil das war nämlich was, was in den Texten, die ich von dir jetzt gelesen habe, was ich mich da gefragt habe.
451000	461000	Es schien mir da phasenweise so, als ob du den Transhumanismus fast schon gleichsetzen würdest mit einer bestimmten Richtung der KI-Forschung, der künstlichen Intelligenzforschung,
461000	469000	die sich nämlich speziell mit den potentiellen existenziellen Risiken zukünftiger künstlicher Intelligenzen auseinandersetzt.
469000	483000	Aber so, wie du das jetzt gerade aufgemacht hast, ist das quasi ja dann nur eine Richtung unter dem Überschirm des Transhumanismus und dann wiederum auch nur eine Unterrichtung unter eigentlich dem Sektor,
483000	487000	den du jetzt Silikon-basiert genannt hast. Oder sehe ich das richtig?
487000	502000	Genau. Das liegt einfach im Fokus meiner Arbeit. Ich habe nicht den Anspruch, mit meinem Buch eine Gesamtkritik jeder transhumanistischen Strömung vorgelegt zu haben,
502000	516000	sondern ich habe mich spezifisch auf diese eingeschossen, allerdings auch unter der Prämisse, dass ich sie für dominierend halte oder zumindest das Potenzial dominierend für transhumanistische Diskurse,
516000	524000	weil sie so stark verflochten ist mit gesellschaftlichen Geld- und Machtstrukturen.
524000	536000	Also sprich, gerade bei einem Top-Hoster, der immer auftaucht, oder was ich vielleicht noch anmerken sollte, es gibt Autoren, die diese Strömung aus dem Transhumanismus ausklammern.
537000	554000	Dem würde ich widersprechen. Durchaus auch diese Idee der Superintelligenz, respektive des parallelen Menschen in Computer hochladen, sehe ich in einer expliziten transhumanistischen Dynamik oder Teleologie verortet.
554000	577000	Als es darum ging, woran ich arbeite, diese Form von Transhumanismus, die eine ist, also nicht die einzige, aber die, über die ich ein Buch geschrieben habe, hat Vertreter an Institutionen wie der Universität Oxford.
577000	591000	Oxford hat Fans unter Milliardären wie Elon Musk und Peter Seale, die einschlägige Forschungsinstitute zum Thema mit Millionenbeträgen zum Teil fördern.
591000	599000	Es gibt diesen Start-up-Incubator, der sich Singularity University nennt, wo die Singularität dann auch wieder im Namen steckt usw.
599000	617000	Für meinen Unterfangen jetzt eine Kritik des Transhumanismus zu unternehmen, die auch jetzt nicht nur rein akademischer Selbstzweck sein soll, sondern sollte, sondern sich mit neu aufkommenden Herrschaftsideologien beschäftigt.
617000	631000	Und das ist meine Stoßrichtung, dass ich diese Form von Transhumanismus zumindest potentiell für eine neu aufkommende Herrschaftsideologie halte, dadurch dann ja Fokussierung auf diese Form von Transhumanismus.
631000	636000	Zeichnen wir das doch mal für die Zuhörerinnen und Zuhörer ein bisschen nach.
636000	645000	Also du hattest schon angesprochen, einer der ganz prominenten Vertreter dieser spezifischen Richtung sitzt in Oxford.
645000	656000	Ganz konkret ist das Nick Bostrom, der das dortige Future of Humanity-Institut gegründet hat und dort eben Forschung zu existenziellen Risiken betreibt.
656000	667000	Er ist aber auch gleichzeitig, ich glaube mal Vorsitzender der World Transhumanist Association gewesen oder so, hat auf jeden Fall auch publiziert zum Thema Transhumanismus.
667000	677000	Also in ihm als Person vereinen sich diese beiden Stoßrichtungen, die du da beschreibst, auf jeden Fall mal ganz konkret.
677000	682000	Was sind denn seine grundlegenden Thesen?
682000	690000	Seine grundlegenden Thesen, er ist sehr produktiv, das auf jeden Fall, das kann man auf gar keinen Fall in Abrede stellen,
690000	697000	dass die Phase, in der er sich als Transhumanist bezeichnet hat, das war eher so vor 15 Jahren.
697000	710000	Ich würde sagen, aber sein Denken hat mit diesem Transhumanismus nie gebrochen, sondern er macht ihn dann zur weiteren Grundlage seines Nachdenks über andere Themen.
710000	717000	Das aktuelle Thema, zu dem er arbeitet, ist eben der Begriff des existenziellen Risikos.
717000	730000	Das sollen menschheitsvernichtende Risiken sein und er nähert sich der Thematik dann an mit den Werkzeugen des Utilitarismus und der analytischen Philosophie
730000	742000	und versucht da eine Philosophie zu entwickeln, die fast mathematischerweise, aber mit einer gewissen Genauigkeit, Risiken für die Menschheit abschätzt.
742000	750000	Mit auch durchaus einem politischen Impetus, der dafür sorgen soll, dass wir jetzt mal etwas unternehmen müssen an bestimmten Stellen usw.
750000	758000	Jeder Hörer wird jetzt natürlich denken, ja natürlich der Klimawandel, der ist es genau nicht tatsächlich,
758000	767000	sondern das Risiko, das ihn am meisten umtreibt und das sein anderer großer Forschungsgegenstand ist, ist die Superintelligenz.
767000	781000	Das soll salopp formuliert eine die Welt beherrschende künstliche Intelligenz sein und man nimmt so eine gewisse eindeutige Kontinuität von Fortschritt an,
781000	788000	die das zu einer Zwangsläufigkeit macht, oder fast zu einer Zwangsläufigkeit, dass so etwas entsteht.
788000	800000	Darum kreisen dann auch die meisten Abwägungen um das Thema existenzielle Risiken für die Menschheit.
800000	813000	Und dann hat das Ganze noch einen ganz spannenden Dreh, der auch dann zum Thema des Podcasts passt, dass es nicht nur um die jetzige Menschheit geht,
813000	823000	sondern auch immer um die potenziell in der Zukunft vorhandene Menschheit, der im Zweifelsfall auch, weil man annimmt,
823000	835000	dass wenn man es richtig macht, die Bevölkerungszahlen explodieren und man ja auch Utilitarist ist, man also dann in der Zukunft eine größere Zahl von Menschen,
835000	846000	die ein Wohl haben, die relevant sind für utilitaristische Erwägung und deren Glück und Wohl bestimmt werden kann, dass das sogar das größere Gewicht hat
846000	857000	und dass wir unsere politischen Aktivitäten, unser Handeln hier und jetzt quasi an der Maximierung dieses zukünftigen Menschheitsglücks ausrichten müssen.
857000	865000	Das fand ich interessant, dass das quasi gleichgestellt wird. Also um das nochmal vielleicht kurz zusammenzufassen, das heißt nämlich tatsächlich,
865000	873000	dass sie quasi in dem Glauben, also zum einen es gibt ein Glauben, man könne das quasi berechnen, also das Glück und Wohl der Menschen,
873000	889000	das ist ja eine Annahme, die dem Utilitarismus auch zugrunde liegt und dass dann aber in dieser Berechnung zukünftige Generationen Menschen mit hineingenommen werden,
889000	899000	aber eben nicht in einer Logik, in der man jetzt zum Beispiel aus der Ökologieströmung kommend irgendwie sagen würde, okay, wir müssen jetzt, was weiß ich,
899000	910000	ressourcenschonend vorgehen mit der Welt, weil wir müssen ja schauen, dass wir das Bestehende nicht für zukünftige Generationen zerstören,
910000	923000	sondern das Kalkül ist quasi ein anderes, das ist tatsächlich so ein im Grunde sich wertfrei gebendes quantitatives Kalkulieren, oder?
923000	933000	Ja, ziemlich genau, da hat er auch drüber promoviert quasi, dass es seine Doktorarbeit entworft, also so eine Aktualisierung,
933000	941000	und die literistische Moralphilosophie soll das sein, er übernimmt eigentlich aus der Physik, unter anderem, also in verschiedenen Wissenschaften,
941000	954000	nicht Physik, in der Kosmologie, gibt es das sogenannte anthropische Prinzip, das sich mit Fragestellungen greift, bei Fragestellungen der Eingerichtetheit des Universums,
954000	971000	also warum sind die Grundgrößen des Universums, die wir beobachten so und nicht anders, und dann gibt es da diesen Punkt, dass es sehr viele physikalische Konstanten,
971000	980000	wenn sie nur ein bisschen anders wären, aus verschiedenen Ebenen die Existenz menschlichen Lebens unmöglich machen würden,
981000	988000	Temperatur, Bindungsenergie zwischen Teilchen, was weiß ich was, dann können sie keine komplexen Strukturen mehr formen, nur noch kein Leben oder so,
988000	995000	oder Gravitation, plötzlich wären Himmelskörperdynamiken anders, ganz viel ihrer Kram, der vordergründig erst mal darauf drängt,
995000	1006000	dass man sich denkt, okay, oder wo so Argumente denkbar wären im Sinne von okay, es scheint so, als wäre das Universum feingetunt auf menschliches Leben,
1006000	1018000	wo man dann mit einem anthropischen Prinzip antwortet, nee, ist es nicht, das ist ein statistisches Artefakt quasi, ein Universum, das menschliches Leben verunmöglicht,
1018000	1030000	könnten wir ja gar nicht beobachten, wir wissen also, wir können davon da aus nicht schließen, ob das jetzt wahrscheinlich ist, dass Universen so aussehen oder nicht,
1030000	1040000	sondern wir können ja, also unser Sample ist eingeschränkt auf die, die wir wahrnehmen können, ein ähnliches Denken überträgt dann eine utilitaristische Moralfilosophie und sagt,
1040000	1056000	man solle in der utilitaristischen Philosophie also erst mal mitdenken, die eigene Situiertheit, und dann solle man, wenn man moralische Urteile fällt in diesem System,
1056000	1066000	systemanalytische Philosophie bzw. sich dabei üblicherweise zum Utilitarismus bedienen, dann solle man so schließen, nicht als sei man man selber,
1066000	1076000	sondern Teil einer zufälligen Referenzklasse von Beobachtern, und da bezieht er dann Zeitlichkeit mit ein.
1076000	1087000	Wenn wir also ein moralisches Urteil fällen wollen, sollten wir nicht voraussetzen, dass Moral sich irgendwie am Jetzt an unserer gegebenen Situation zu orientieren hat,
1087000	1098000	sondern wir sollten, wenn wir beurteilen, was richtig ist, dann sollten wir das so schließen, als seien wir zufällig über die Zeit gestreut,
1098000	1102000	als seien wir zufällig über die sich irgendwo in der Zeit befindliche Beobachter.
1102000	1109000	Da steckt natürlich dann die Vorstellung drin, dass man Vergangenheit und Zukunft auch irgendwie genau mathematisierbar erfassen kann,
1109000	1117000	um dann solche Aussagen zu machen, was denn bzw. dann Schlussfolgerungen darüber zu treffen, was moralisch ist und was nicht.
1117000	1123000	Und so kommt es dann auch, dass es eben nicht darum geht, irgendwie die Umwelt zu schützen oder einen Planeten zu erhalten oder so,
1123000	1127000	denn es soll ja quantifizierbar sein, es sind verschiedene Zukunften möglich.
1127000	1142000	Und ironischerweise ist in dem Aufsatz, indem man diese Idee des existenziellen Risikos entwickelt, die globale Dominanz einer ökologischen Bewegung ein existenzielles Risiko.
1142000	1149000	Also das ist die Katastrophe, die wir verhindern müssen, weil das einzig moralische ist, auf gar keinen Fall auf die Bremse zu treten,
1149000	1160000	den technischen Fortschritt so richtig durchzuballern, mehr Kapitalismus und so weiter, weil er davon ausgeht, dass sich dann zwangsläufig recht schnell dieser Zustand einstellen wird,
1160000	1169000	dass erstens eine Superintelligenz entsteht, die eh alles regelt und dann haben wir auch keine ökologischen Probleme mehr und Menschen ihre Körper verlassen.
1169000	1178000	Und das ist der Punkt, auf den wir raus müssen, die technologische Singularität, indem wir uns in Computer hochladen können
1178000	1187000	und dann verändern sich ja plötzlich die Ressourcen. Also wenn Menschen Computerprogramme sind, dann kann man viel mehr Menschen haben und man kann auch viel besser regulieren, wie es denen geht.
1187000	1201000	Und er kommt dann mit dieser auf den ersten Blick erstmal so, also wirkt jetzt nicht, erstmal zumindest schlüssigen Idee, dass man gucken sollte,
1201000	1210000	dass man die Zukunft mitbedenkt in seinen moralischen Handlungen, dann eben immer auf dieses sehr spezifisch transhumanistische Ergebnis.
1210000	1224000	Und das würde ich sagen, ist etwas, das sich durchzieht durch seine aktuelle Philosophie, dass er verschiedene, also durchaus erstmal zu griffigen Themen sehr einleuchtende Überlegungen erst mal anstellt,
1224000	1230000	die aber immer so konstruiert sind, dass man am Ende beim Transhumanismus landet.
1230000	1243000	Und ich glaube, was vielleicht wichtig ist herauszustellen ist, das funktioniert ja nur, wenn man eine bestimmte zu maximierende Zielgröße annimmt.
1243000	1259000	Also es muss ja, es wird dafür implizit etwas vorausgesetzt, was es zu maximieren gilt. Also das, was quasi als positiv angenommen wird, ist da schon eingeschrieben.
1259000	1278000	Wie würdest du das definieren? Also ist das, woran ist das orientiert? Ist das immer so ein zirkrationales, vielleicht auch an so Anthropologien wie dem Homo economicus orientiertes eigentlich Optimierungs- und Profitstreben?
1278000	1286000	Also was ist das, was es quasi zu mehrern gilt und woran wird es bemessen?
1286000	1301000	Ja, da ist ganz spannend, dass das gar nicht so wirklich diskutiert wird, sondern bei Bostrom, aber auch bei anderen Autoren, die sich in diesem Superintelligenztranshumanismus bewegen,
1301000	1310000	ist immer schon vorausgesetzt, dass so ein spezifischer Utilitarismus halt einfach die richtige Moralfilosophie ist.
1310000	1321000	So, also da ist das geklärt. Sie nennen es Glück oder sie nennen es Nützlichkeit. Utility ist dann immer der Begriff.
1321000	1332000	Das aber in der Geschichte des Utilitarismus immer so, eigentlich ist das eine Debatte. Also was soll es denn jetzt überhaupt sein? Die kann ich auch nicht beantworten, weil ich kein Utilitarist bin.
1332000	1343000	Wenn man zurückgeht bis Jeremy Bentham, bei dem gibt es Stellen, wo der dann irgendwann sagen muss, ja, also eigentlich ist es Geld. Also Glück kann man ja wohl in Geld bemessen.
1343000	1353000	Und da haben wir, weil sehr viele Leute dann mit der KI-Forschung auch zu tun haben, die irgendwie sich als Teil dieser Bewegung sehen.
1353000	1362000	Und da haben wir ja tatsächlich auch zur Steuerung von KI-Systemen diese Idee der Utility Function.
1362000	1372000	Also, dass man das definiert in gewisses Maße, numerisch bestimmbare Nützlichkeit, damit das System sich ausrichten kann.
1372000	1379000	Und dann können wir damit durchaus auch Systeme bauen, die sich irgendwie in der Welt orientieren können.
1379000	1384000	Wir haben dann aber das Ding, das setzt eigentlich immer am Ende gelabelte Daten quasi voraus.
1384000	1394000	Die philosophische Frage, was Utility ist, habe ich zumindest in dem, was ich bis jetzt vom Bostrom gelesen habe, nicht wirklich detailliert beantwortet gesehen.
1394000	1403000	Und auch bei anderen Transhumanisten nicht, die sich aber dieses Weltbild, das eigentlich darauf rekurriert, alle einkaufen.
1403000	1409000	Und das macht das Ganze auch so ein bisschen fragil, sage ich jetzt mal.
1409000	1415000	Also sobald man, weswegen ich dann auch darauf kam, mich damit so kritisch zu beschäftigen.
1415000	1424000	Es wird da sehr viel als selbstverständlich vorausgesetzt, dass sobald man nicht in so einer spezifischen,
1424000	1434000	Babel aus analytischer Philosophie und angelehnten KI-Sachen sich bewegt, eigentlich gar nicht mehr so einleuchtend wird.
1434000	1443000	Wir kommen sicher noch mal zu artverwandten Fragestellungen zurück, wie das, worüber du gerade gesprochen hast, nämlich,
1443000	1446000	auch dann in Bezug auf die Frage der Ideengeschichte.
1446000	1451000	Aber da lassen sich ja vielleicht dann manche Sachen noch anders vororten.
1451000	1460000	Aber bevor wir das machen, vielleicht noch mal kurz zur Orientierung dieser Ablauf, der da auch gedacht wird.
1460000	1463000	Nur, dass man sich das auch vorstellen kann als Hörer und als Hörer.
1463000	1468000	Der Gedanke ist, es gibt eine exponentielle technische Entwicklung.
1468000	1475000	Das heißt, es gibt einfach einen wirklich rapiden Anstieg an dem technologisch möglichen.
1475000	1482000	Und annehmend, dass sich das weiter so entwickeln wird, geht man davon aus,
1482000	1488000	dass irgendjemand, der sich so einen technologischen Anstieg anstellt,
1488000	1499000	dass sich das weiter so entwickeln wird, geht man davon aus, dass irgendwann die Rechenleistung so groß sein wird,
1499000	1508000	dass es zu einem Punkt gibt, wo eine künstliche Intelligenz eigentlich die eigene Leistung auf sich selbst anwenden kann.
1508000	1515000	Und sobald dieser Punkt erreicht ist, kommt es dann zu einer Art Intelligenz-Explosion, oder?
1515000	1521000	Vielleicht kannst du das noch mal kurz, diesen Gedanken gann, wie es zu dieser Singularität ja dann auch kommt.
1521000	1523000	Vielleicht kannst du das mal kurz noch mal beschreiben.
1523000	1529000	Was ist Singularität und wie wird das konzeptionalisiert, dass die entstehen kann?
1529000	1533000	Genau, also es sind zwei Topoi, die sich sehr eng aufeinander beziehen.
1533000	1536000	Das eine ist die Singularität.
1536000	1550000	Die technologische Singularität kommt eigentlich ursprünglich mal bestimmt in einem Aufsatz von Werner Winsch aus dem Jahr 1993.
1550000	1556000	Wurde dann in ähnlicher Weise aufgegriffen von Ray Kurzweil, der heute Chefentwickler bei Google ist
1556000	1562000	und einige Bücher geschrieben hat wie The Age of Spiritual Machines,
1562000	1576000	wo er quasi utopisch, quasi eschatologisch vorhersagt, was für eine Wunderwelt wir eintreten werden,
1576000	1578000	wenn erst die technologische Singularität da ist.
1578000	1583000	Die wird immer von Autor zu Autor ein bisschen unterschiedlich beschrieben.
1583000	1588000	Meist als eben ein Punkt, an dem der technische Fortschritt so groß ist, dass man es gar nicht mehr vorhersagen kann.
1588000	1594000	Und dass es selbstverstärkende Systeme sind, dass es immer weiter beschleunigt wird.
1594000	1605000	Und dass wir dann einen Punkt kriegen, wo die materielle Welt durch die Macht der Technik fundamental transformiert wird und wir auch.
1605000	1615000	Und zwar, da geht es dann um so Ideen wie Nanotechnologien, dass man da hinkommt, Materie auf Atomara-Ebene beliebig gestalten zu können.
1615000	1625000	Dass man diverse Energieprobleme einfach löst und natürlich, dass man den menschlichen Geist auch vollständig versteht,
1625000	1630000	wie er vom Gehirn instanziert wird und auf dem Computer reproduzieren kann.
1630000	1638000	Und praktisch ist es das technologische Himmelreich, deswegen wird es ironisch auch manchmal Rapture of the Nerds genannt.
1638000	1646000	Also dass wir an den Punkt kommen, einer technologischen Allmacht, die uns, wenn sie gut verläuft, in ein technologisches Himmelreich überführt.
1646000	1659000	Damit zusammenhängt dann bei denjenigen, die so eine Singularität am ehesten realisiert durch eine Superintelligenz vermuten, die Idee der Intelligenz-Explosion.
1660000	1674000	Das ist eine Voraussage über die Zukunft der Entwicklung künstlicher Intelligenz, die davon ausgeht, dass wir da einen plötzlichen Bruch erleben werden.
1674000	1682000	Nämlich in dem Moment, wenn es uns erst einmal gelingt, eine künstliche Intelligenz zu entwickeln.
