start	end	text
3335000	3354000	durch die, weil Menschen dazu neigen, zu viel Nachkommenschaft zu produzieren, gerade auch die falschen Leute, und man halt dann zu einem Homophiloprogenitus, also das sich fortpflanzenliebend degenerieren würde.
3354000	3362000	Was dann auch, weil wir dann nicht mehr genug intelligente Leute haben, den Weg in das technologische Paradies verstellt.
3362000	3376000	Im Superintelligenz Buch werden eugenische Maßnahmen als einer der Wege überhaupt dahin zu kommen, dass wir solche superintelligenten Maschinen haben verhandelt.
3376000	3398000	Eine Sache, die ich jetzt beschrieben habe, war der Take-off. Es gibt aber auch ein einziges Unterkapitel zu biologischer Kognition, da geht es dann um IQ, und dann, wie wir mit ganz einfachen Maßnahmen dafür sorgen, dass sich besonders kluge Leute und besonders klugen Leute fortpflanzen,
3398000	3425000	da so eine Dimension haben, weil wir das am besten in vitro machen, eine Dimension von Selektion drin haben, und dann eben in sehr wenigen Generationen dazu kommen, dass wir durch genetische Selektion erstmal eine Elite an Forschern aufbauen, die in der Lage sind, dann uns dahin zu bringen, dass wir die nötigen technologischen Schritte machen können.
3425000	3434000	Also, das steht nicht im Vordergrund, aber ist jetzt auch nicht, dass da was implizit ist.
3434000	3451000	Wow, wild. Okay, da muss ich dann jetzt nochmal bei dem, du hattest das zwar eh schon angesprochen, aber da muss ich jetzt trotzdem nochmal nachhaken, wie einflussreich ist denn transhumanistisches Denken und was bedeutet das dann quasi für uns.
3451000	3463000	Ich meine, in dem, was du gerade gesagt hast, schimmert es ja schon durch, aber also Ray Kurzweil, du hattest ihn angesprochen, ist bei Google, ich kann mich erinnern, der leitet da glaube ich jetzt auch irgendeine Art von internem Think Tank oder sowas.
3463000	3484000	Peter Thiel, vielleicht für die Hörerinnen und Hörer, der hat mit Elon Musk zusammen PayPal gegründet und Palantir auch, nicht mit Elon Musk zusammen, aber Palantir ist eine Daten-Harvesting-Maschine, die auch mit Geheimdiensten zusammenarbeitet, mit dem Pentagon und so weiter.
3484000	3489000	Also der ist auf jeden Fall auch eine schillernde Figur, der, versteht er sich auch als transhumanist?
3489000	3498000	Ich bin mir nicht ganz sicher, ob es irgendwie ein Zitat von ihm gibt, dass er sich explizit selber als transhumanist bezeichnet, aber er fördert Projekte in dieser Richtung.
3498000	3521000	Er fördert vieles, aber er ist, wenn man sich dann in die entsprechenden Communities und so weiter begibt, ist auf jeden Fall immer, ist ein Ziel, das diskutiert wird, kann ich fördern, ist so eine Möglichkeit, wenn man so ein Projekt hat, das irgendwie so in einem transmonistischen Umfeld, ob man nicht von Peter Thiel auch irgendwie Förderung kriegen könnte.
3521000	3526000	Stimmt, das kann ich mich erinnern, da habe ich auch mal bei einem Podcast gehört, dass das diskutiert wurde.
3526000	3538000	Gut, also die Frage wäre, für wie einflussreich hältst du das, sagen diese Formen des Denkens und was bedeutet das für uns?
3538000	3560000	Ja, da stellt sich dann die Frage, deswegen sprach ich ja schon am Anfang von einem Mainstream, es gibt offensichtlich sehr einflussreiche Leute, die diesem Gedanken gut mindestens nahe stehen oder die große Möglichkeiten haben, auch Einfluss auf die Gesellschaft zu nehmen, weil sie eben über sehr viel Geld verfügen.
3560000	3589000	Und es hat jetzt in letzter Zeit, also es ist jetzt gerade passiert, es ist eine spannende Sache, was daraus wird, es ist ja jetzt Brexit und Boris Johnson ist Premierminister von Großbritannien und er hat ja diesen auch etwas schillernden Berater Dominic Cummins, der in der transhumanistischen Szene vernetzt ist und der in seiner Zeit schon mal im Bildungsministerium einen recht langen Aufsatz gemacht hat.
3590000	3605000	Er hat uns geschrieben, einer der Kernaussagen war, dass es bei dem Erfolg von Schülern wesentlich mehr auf ihr genetisches Potenzial ankäme als auf die Umstände ihrer Bildung.
3605000	3633000	Genau, der ist im Beraterstab des Premierminister von Großbritannien und hat kürzlich auf seiner Webseite Stellengesuche veröffentlicht, bei denen es darum geht, die Verwaltung der englischen Regierung zu optimieren, indem man sich eben Data-Scientists, Leute aus der KI-Programmierung, Unternehmer und was weiß ich was ins Boot holt, eben all diese Personen, die in der Transhumanistischen Szene vernetzt sind.
3635000	3660000	Dass die in der Transhumanismus so ein bisschen fundierenden, weltsichtentscheidenden Personen sind und da ist die Frage, wo ich jetzt mit etwas Spannung gucke, ob es tatsächlich passiert, dass sich in England transhumanistische Kreise in der Regierungsverwaltung etablieren.
3660000	3681000	Also das ist nicht ausgemacht, das ist eine völlig chaotische Situation, war aber auf jeden Fall auch so eine Sache, wo ich mir gedacht habe, hui, steht man da vor Stellengesuchen für die Downing Street Number Ten, die so einen transhumanistischen Vibe haben.
3681000	3699000	Und das ist aber nicht nur jetzt, weil Data-Scientists gibt es ja überall, also das ist ja jetzt noch nicht transhumanistisch irgendwie, da gab es da noch andere Hinweise, die jetzt quasi konkret in diese Richtung deuten, weil jetzt Big-Data-Nutzung gilt ja jetzt quasi schon als, muss man quasi drauf schreiben.
3699000	3719000	Ich habe jetzt hier die Stellenausschreibung. Das erste Zitat der Stellenausschreibung, also an erster Stelle wird Elisabeth J. Kauski zitiert als KI-Experte, das ist der Leiter des Machine Intelligence Research Institutes.
3719000	3735000	Das heißt, das hat eine spezifische Richtung aus, wer da abgefragt wird. Und das würde ich schon als einen, also es würde nicht schaden auf diese Stellenausschreibung zu antworten und man hätte schon seine Credentials als Transhumanist, sagen wir es so.
3736000	3742000	Max, als letztes stelle ich immer noch die Frage, wenn du dir Zukunft vorstellst, was stimmt dich freudig?
3742000	3768000	Was stimmt mich freudig? Ich sehe gerade, also tatsächlich interessiert mich gerade diese globale Welle, die es ja jetzt irgendwie im letzten Jahr gab von basisdemokratischen Protestbewegungen gegen ökonomische Ungleichheit,
3768000	3780000	die sich auch in Ländern abgespielt haben, wo man tatsächlich erwartet würde, das landet alles in irgendeinem Islamismus oder was weiß ich was oder in irgendwelchen anderen autokritären Ideologien.
3780000	3807000	Und dass es zumindest schon mal so aussah, als würde das nicht passieren und das lässt mich mit einer gewissen Erwartung darauf blicken, ob sich nicht die ja doch sehr solide wirkenden Vergesellschaftungsformen der Globalisierung auf so einer wirtschaftlichen Ebene
3807000	3823000	radikal in Frage stellen lassen. Es gibt ja von Mark Fischer diese Formulierung über capitalist realism, von David Graeber diese Formulierung, dass wir eigentlich für Zukunft wieder kämpfen müssen, Zukunft zu eröffnen, sowas wie Zukunft zu haben.
3824000	3835000	Und ich glaube, dass da in nächster Zeit sehr viel passieren wird, was den Blick auf Zukunft wieder öffnet, weil sich Möglichkeitenräume plötzlich eröffnen in kollektivem Handeln.
3836000	3841000	Wunderbar. Das ist doch ein schöner Ausblick. Max, vielen Dank für das Gespräch.
3842000	3843000	Ich danke dir, dass ich bei dir sein durfte.
3865000	3872000	Was ihr zu dem Ganzen denkt und wie euch diese Folge hier gefallen hat, unbedingt gut bewerten auf allen Podcast Plattformen, die ihr nutzt.
3873000	3880000	Für unsere Patreon Unterstützerinnen und Unterstützer gibt es auf www.patreon.com schrägstrich future histories vieles an Zusatzmaterial.
3881000	3884000	Da könnt ihr also auch vorbeischauen. Bis zum nächsten Mal. Ich freue mich.
