start	end	text
0	5800	Herzlich Willkommen bei Future Histories, dem Podcast zur Erweiterung unserer Vorstellung von Zukunft.
5800	11000	Mein Name ist Jan Groß und ich freue mich sehr, heute Rahel Süß begrüßen zu dürfen.
11000	16000	Rahel ist Politikwissenschaftlerin und Mit-Herausgeberin der Zeitschrift Engagé
16000	22200	und wird demnächst im Rahmen eines Humboldt Research Fellowships für Post-Docs an der Humboldt-Universität Berlin
22200	26800	zu Demokratie im Zeitalter der Überwachungstechnologien forschen.
26800	33800	Wir werden heute sprechen über ihr neues Buch, Demokratie und Zukunft, was auf dem Spiel steht.
33800	40800	Ich darf, bevor es losgeht, noch Aris Tip und Brinky Pie ganz herzlich als Patreon-UnterstützerInnen begrüßen
40800	44300	und ich möchte Carmen und Fabian für ihre Spenden danken.
44300	48800	Vielen, vielen Dank, das freut mich wirklich sehr und das ist auch einfach eine große Hilfe.
48800	54300	Und jetzt wünsche ich euch viel Freude bei der heutigen Folge Future Histories mit Rahel Süß
54300	57300	zu Demokratie und Zukunft.
63300	65300	Herzlich willkommen, Rahel.
65300	67300	Vielen Dank für die Einladung.
67300	70300	Rahel, ich fange ja ganz gerne mit Begriffsdefinitionen an.
70300	73300	Das ist mal leichter, mal schwerer zu beantworten.
73300	77300	Ich würde sagen, in deinem Fall ist es eher schwerer, denn unter Demokratie
77300	82300	dafür stehen viele Vieles, aber dennoch, was ist Demokratie?
82300	88300	Ja, da beginnen wir auch schon, wie du gerade meintest, mit einer nicht so ganz einfachen Frage.
88300	96300	Denn das, was Demokratie ist und auch, ob wir sie schon haben oder nicht, ist ein ganz langes Streitthema.
96300	100300	Und ich glaube, das, was man vielleicht sagen kann, ist, vielleicht sogar mit Wendy Brown,
100300	106300	der Politikwissenschaftlerin Wendy Brown, ist, dass wir derzeit eine ungemeine Demokratiebegeisterung
106300	108300	eigentlich erleben können.
108300	115300	Wir sehen eigentlich, dass Parteien entlang des gesamten Spektrums sich zu Rättern der Demokratie erklären.
115300	121300	Und das wirft natürlich die Frage auf, was wir eigentlich meinen, wenn wir von Demokratie sprechen.
121300	126300	Und das war auch das Anliegen des Buches, im Grunde zu klären, was wir unter Demokratie verstehen können.
126300	132300	Und zwar nicht, wie das oft gemacht wird, ausgehend von einem Krisendiskurs.
132300	137300	Also zu sagen, die Demokratie ist an einer großen Krise und jetzt müssen wir darüber nachdenken,
137300	142300	wie die Zukunft der Demokratie aussehen kann. Denn dann stehen wir vor dem Problem,
142300	147300	was ich gerade schon beschrieben habe. Dann sehen wir, dass entlang des gesamten Parteien-Spektrums
147300	154300	alle eigentlich begeistert sind von der Demokratie und sagen, dass sie eigentlich die besseren Demokratinnen sind.
154300	159300	Sondern das, was ich mit dem Buch versuche, ist nicht so sehr nach der Zukunft der Demokratie zu fragen,
159300	165300	sondern das Verhältnis von Demokratie und Zukunft selbst zu untersuchen.
165300	173300	Denn ich argumentiere, dass wir Demokratie und das, was wir darunter verstehen können, besser begreifen werden können,
173300	176300	wenn wir uns dieses Verhältnis anschauen können. Also das heißt, wir können besser verstehen,
176300	180300	was das Problem mit der Demokratie heute ist, aber auch wie wir sie erneuern können,
180300	189300	wenn wir dieses Verhältnis von Demokratie und Zukunft ein bisschen mehr uns anschauen,
190300	196300	als das oft gemacht wird, eben unter dieser Debatte von der Zukunft der Demokratie.
196300	200300	Und was ist das für ein Verhältnis zwischen Demokratie und Zukunft?
200300	207300	Ich würde sagen, dass die Aufgabe von Demokratie, und hier spreche ich von moderner Demokratie,
207300	214300	ist immer schon wahr, die Zukunft offen zu halten. Also wenn wir uns anschauen,
214300	224300	was das Versprechen der Demokratie war und auch immer noch ist, also Versprechen auf Freiheit, Gleichheit, Rechtsstaatlichkeit, Gerechtigkeit und vieles andere mehr,
224300	231300	dann sehen wir, dass es eigentlich in gewisser Weise synonyme dafür sind, eine offene Zukunft zu versprechen.
231300	241300	Und die Idee dahinter ist, dass sich Herrschaft in einer Demokratie ja nicht legitimiert mehr über zum Beispiel Gottes Gnaden oder Geburt,
241300	247300	sondern Herrschaft in heutigen demokratischen Gesellschaften legitimiert sich über zum Beispiel periodische Wahlen.
247300	252300	Und periodische Wahlen haben die Aufgabe, eben die Zukunft offen zu halten.
252300	259300	Also sie haben die Aufgabe, nicht vollständig festzulegen, was wir zum Beispiel unter Freiheit verstehen,
259300	263300	was wir unter Gleichheit verstehen, was wir unter Gerechtigkeit verstehen.
263300	270300	In gewisser Weise, ja, in gewisser Weise deutet die Idee der Wahlen und der regelmäßigen Wahlen,
270300	275300	deutet eigentlich an, dass diese Prinzipien, diese demokratischen Prinzipien immer nur vorläufig sind.
275300	282300	Also wir können sagen, Demokratie und Rechtsstaat ist immer nur der Versuch, diese demokratischen Prinzipien umzusetzen.
282300	289300	Und dieser Versuch ist immer imperfect. Und es ist gerade dieses Fehlbarkeitsbewusstsein von Demokratie,
289300	297300	dass wir immer wieder neu verhandeln müssen, was wir eigentlich unter demokratischen Prinzipien verstehen wollen und wie wir sie umsetzen wollen.
297300	302300	Und das ist das, was ich zu Beginn versucht habe zu sagen, diese große Offenheit des Begriffs selber,
302300	309300	also von Demokratie als Volksherrschaft, wirft eigentlich mehr Fragen auf, als dass sie beantwortet.
309300	316300	Denn wir können immer fragen, wer ist eigentlich das Volk, das sich selbst regiert, über welche Institutionen regiert es sich
316300	320300	und auch, ja, welche Regeln des Zusammenlebens will es sich geben.
320300	323300	Das sind alles Fragen, die immer wieder neu ausgehandelt werden müssen.
323300	329300	Und das ist eine der zentralen Aufgaben von Demokratie. Und deshalb wäre meine Definition von Demokratie wäre,
329300	335300	ja, meine Definition von Demokratie wäre deshalb zu sagen, Demokratie muss immer darauf abzielen,
335300	340300	Möglichkeiten offen zu halten, um Alternativen aushandeln zu können.
340300	345300	Was ich da unglaublich gut fand in deinem Buch, nämlich genau zu diesem Punkt eigentlich,
345300	349300	war ein Zitat von Sigmund Baumann, den du da anbringst.
349300	356300	Und der finde ich fast da eigentlich so ein bisschen so einen konservativen, eigentlich zutiefst konservativen Kern unserer derzeitigen Auffassung
356300	360300	eben dieses Verhältnis zwischen Demokratie und Zukunft, zwischen Freiheit und Zukunft.
360300	365300	Der fängt das da eigentlich ziemlich gut ein. Ich mag das mal kurz vorlesen. Es war nämlich wirklich großartig.
365300	371300	Das Zitat lautet, heute ist es die Zukunft, auf die man nicht mehr vertrauen kann, da sie vollkommen unbeherrschbar erscheint.
371300	377300	Sie wird auf der Soll-Seite verbucht. Dafür erscheint jetzt die Vergangenheit auf der Haben-Seite.
377300	382300	Dank ihres, in Klammern verdienten oder unverdienten Rufs, ein Hort der Freiheit gewesen zu sein,
382300	386300	auf den sich noch nicht diskreditierte Hoffnungen setzen lassen.
386300	391300	Das fand ich wirklich richtig gut, denn da kommt es ja eigentlich zu einer totalen Verkehrung der Zeitlichkeiten.
391300	398300	Früher hat man die Zukunft eben als Reich der Freiheit gesehen, wofür du jetzt im Grunde auch argumentierst und die Vergangenheit als fixiert.
398300	404300	Und heute sieht man dann die Zukunft quasi als dem Untergang geweiht, jetzt ein bisschen polemisch zugespitzt
404300	408300	und projiziert seine Freiheitswünsche auf idealisierte Vergangenheiten.
408300	414300	Das fand ich eigentlich eine interessante Feststellung und die steht aber jetzt wiederum ein bisschen eigentlich dem entgegen,
414300	419300	was du vorhin meintest, in Bezug auf diesen Enthusiasmus der Demokratie gegenüber.
419300	425300	Weil ich finde, es gibt beides. Es gibt auf der einen Seite eben diese Haltung, in der alle so tun, als könnten sie quasi besser Demokratie.
425300	433300	Aber es gibt auch eine weit verbreitete Enttäuschung mit dem, was uns eben bis dato als Demokratie verkauft worden ist.
433300	441300	Und ich finde, beide Elemente spielen auch in dieser Neudeutung des Verhältnisses von Freiheit und Zukunft, die die Baumann da anspricht.
441300	442300	Wie siehst du das?
442300	451300	Ja, ich denke, das ist eines der Spannungsfelder, das mit Demokratien oder mit dem Begriff jetzt auch erstmal immer einhergehen.
451300	455300	Also Wendy Brown sagte einmal, wir sind alle heute Demokraten.
455300	459300	Das ist das, was sie mit der gegenwärtigen Demokratiebegeisterung auch meint.
459300	467300	Und gleichzeitig sehen wir, dass natürlich viele Menschen das Gefühl haben, dass die etablierte Politik ja zum Beispiel es nicht schafft,
467300	476300	sich an zukunftentscheidende Fragen zu wagen. Wir sehen das mit Bewegungen wie Fridays for Future und Extinction Rebellion, aber auch Black Lives Matter,
476300	482300	aber auch Initiativen, die die Rückgewinnung der Datenhoheit von Bürgerinnen zum Beispiel freuen.
482300	487300	Also wir sehen, dass das Thema Zukunft ungemein politisiert wird, also Zukunft der Demokratie.
487300	494300	Also wer ist eigentlich am besten in der Lage zu sagen, wo die Reise hingehen kann?
494300	502300	Und das ist ja auch der Versuch oder das ist mein Versuch, wenn ich oder der Versuch des Buches, indem ich mir dieses Verhältnis von Demokratie und Zukunft anschaue,
502300	506300	versuche ich eine Blickverschiebung.
506300	513300	Also ich versuche zu sagen, dass wir einerseits sehen, dass Demokratie und die Zukunft der Demokratie ungemein politisiert ist.
513300	520300	Also wir erleben ungemeine politische Mobilisierung um die Zukunft der Demokratie, einerseits von Demokratiebewegungen,
520300	526300	aber auch von rechten und nationalistischen Parteien interessanterweise, wobei das auch jetzt kein neues Phänomen ist.
526300	534300	Also genau, die faschistische Möglichkeit ist immer Teil eines demokratischen Experiments und die Geschichte hat es auch schon deutlich gezeigt.
534300	542300	Außerdem sehen wir, dass Imperialismus, Kolonialismus jetzt nicht etwas ist, was losgelöst von auch der Geschichte der liberalen Demokratie sich ereignet hat,
542300	549300	sondern immer im Rahmen auch dieser unter in Anführungsstrichen Demokratisierungsversprechen.
549300	560300	Genau, aber was ich sagen wollte, ist, dass es ein ungemeines Spannungsfeld gibt in dem, wie wir uns auf Demokratie beziehen.
560300	567300	Und dass es oft doch so scheint, dass es einfacher ist, die Vergangenheit zu projizieren, als eigentlich die Zukunft zu projizieren.
567300	570300	Ja, und du hattest das gerade auch schon gesagt, im Hinblick auch so Nostalgiebewegungen.
570300	575300	Also man versucht oder das ist das, was versucht, ja auch glaube ich Baumann zu unterstreichen.
575300	577300	Also wir leben in dem Zeitalter der Nostalgie.
577300	583300	Es ist einfacher, sich die Vergangenheit als rosig vorzustellen, als sich eine rosige Zukunft vorzustellen.
583300	587300	Und zurück zu dem Anliegen meines Buches eigentlich.
587300	592300	Wenn ich versuche, die Zukunft zu politisieren und das Verhältnis von Demokratie und Zukunft,
592300	600300	dann versuche ich den Blick darauf zu lenken, wie eigentlich Bewegungen heute versuchen, die Zukunft zu demokratisieren.
600300	602300	Also ich nenne es die Zukunft zu demokratisieren.
602300	612300	Und damit meine ich, dass sie eigentlich problematisieren, dass der Zugang zur Zukunftsgestaltung ungleich verteilt ist in unserer Gesellschaft.
612300	618300	Und es aber heutzutage so ungemein wichtig ist, wer daran partizipieren kann an der Entwicklungsrichtung der Gesellschaft.
619300	624300	Also wir sehen das bei Investitionsentscheidungen, wir gehen Technik, aber besonders auch technologischen Innovationen.
624300	627300	Wir sehen das bei Umweltschutz natürlich.
627300	634300	Wir sehen das aber auch jetzt im Zusammenhang mit zum Beispiel Corona-Maßnahmen jetzt im kleineren Maßstab.
634300	641300	Und es wirft die Frage auf, wer hat eigentlich die Möglichkeit, nicht nur Freiheit und Gleichheit zu genießen.
641300	646300	Also im Sinne von diese formalen Rechte, wo wir wissen, dass die in Wirklichkeit oft gar nicht so gegeben sind.
646300	653300	Aber die andere Frage ist, wer partizipiert eigentlich daran, mitzuentscheiden, in welche Richtung sich die Gesellschaft entwickelt?
653300	662300	Also wer hat Zugang zur Handlungsfähigkeit im Hinblick oder wer hat Handlungsfähigkeit, wenn es darum geht, die Zukunft mitzugestalten?
662300	670300	Und hier geht es einerseits darum zu partizipieren, also ganz konkret zu partizipieren daran, auch Ideen zu entwickeln und so weiter.
670300	678300	Aber es geht auch daran, diejenigen, die ungemein großen Einfluss haben auf die Entwicklungsrichtung der Gesellschaft, diese auch demokratisch zu kontrollieren.
678300	683300	Und wir sehen das an den großen Tech-Unternehmen, die sich demokratischer Kontrolle entziehen.
683300	695300	Das wäre zum Beispiel ein Beispiel für Player, die einen ungemeinen Einfluss darauf haben, wie sich zukünftige Gesellschaften positionieren werden im Hinblick auf,
695300	707300	wie wir miteinander kommunizieren wollen, wie wir uns fortbewegen wollen, wie wir wohnen wollen, also im Sinne von, wie sagt man, Haus, Wohnraum,
707300	711300	also im Hinblick auf Wohnraum, wie Gesundheitsverpflegung ausschauen soll und so weiter und so fort.
711300	719300	Das sind alles drängende Fragen. Und anstatt die dem Markt zu überlassen oder anderen privaten Interessen wäre zum Beispiel der Appell oder das,
719300	727300	was wir bei diesen Demokratiebewegungen sehen, ist, dass sie eigentlich versuchen zu sagen, hey, die Zukunft muss demokratisiert werden und damit meinen wir,
727300	735300	dass wir wieder mehr mitreden können sollen darüber, in welche Richtung wir gehen wollen, wenn wir über die zukünftige Gesellschaft nachdenken,
735300	740300	die natürlich sich immer auch um hier und jetzt abspielt. Also es geht nicht nur darum, zu überlegen, wie das Morgen ausschaut,
740300	747300	sondern es geht darum, was hier und jetzt getan wird, damit auch das Morgen ein lebenswertes Morgen sein kann.
748300	758300	Und bevor wir uns der Frage zuwenden, wie denn genau dann die Vorschläge aussehen, die darauf abzielen, eben eine größere Demokratisierung der Zukunft auch zu ermöglichen,
758300	770300	vielleicht nochmal ganz kurz zu den Dingen, die dem auch im Wege stehen. Und einer der größten Hürden, die jetzt mal, wenn man so eine imaginierte Gesamtbevölkerung annimmt, da aufkommt,
770300	778300	würde ich sagen, ist, dass es nochmal eine kritische Auseinandersetzung mit der Frage der liberalen Demokratie geben muss, weil das ist einfach das,
778300	789300	womit wir sozialisiert werden, erstmal als Demokratie, also oft ist das dann synonym gesetzt. Und ich glaube, es wäre wichtig, dass wir da vielleicht nochmal kurz darauf eingehen,
789300	797300	wie das zu verstehen ist, warum Elemente dieses Demokratieverständnisses eben auch unbedingt problematisiert gehören. Du schreibst da in deinem Buch zum Beispiel,
797300	806300	dass die Erfolgsgeschichte der liberalen Demokratie nicht von ihrer neoliberalen Zuspitzung getrennt werden kann. Kannst du uns diese Diagnose vielleicht nochmal etwas näher bringen?
807300	818300	Das, was ich versuche, damit zu beschreiben, ist im Grunde auch wieder im Hinblick auf das Verhältnis von Demokratie und Zukunft schaue ich mir an,
818300	828300	wie Versprechen auf Freiheit, Gleichheit und Solidarität, das sind sozusagen die strukturellen Momente des Aufbaus auch des ersten Teils des Buches, wie diese Versprechen,
828300	845300	diese demokratischen Versprechen auf eine offene Zukunft eigentlich beständig ja ausgehöhlt werden. Und das verknüpfe ich dann auch mit der neoliberalen Idee einer Gesellschaft oder mit der neoliberalen Ausgestaltung unserer Gesellschaft.
845300	858300	Und in diesem Zusammenhang schlage ich drei Betrachtungsweisen vor auf das, was ich dann Zukunftsverlust nenne. Und ich sage, dass einerseits sehen wir, dass dieses Versprechen auf Freiheit,
858300	871300	also das demokratische Versprechen auf Freiheit in der derzeitigen Ausgestaltung einer neoliberalen Gesellschaft eben reduziert wird eigentlich auf ein Versprechen auf individuelle Selbstverwirklichung durch Konsum.
871300	884300	Und hier sehen wir beispielsweise, dass es eigentlich also was dominierend ist in diesem in dieser Imagination ist im Grunde die Vorstellung einer lebenslangen lebenslangen Erprobung und Ausarbeitung der eigenen Individualität.
884300	893300	Ja, also es gibt da gibt es auch ein Zitat, wenn ich mich jetzt recht erinnere von Baumann, dass ich anführe, wenn ich genau ich hoffe, ich gebe das jetzt richtig wieder.
893300	905300	Aber ich glaube, er sagt so was wie Es ist es ist einfacher oder ist es ist es quasi unmöglich, heutzutage sich vorzustellen, dass die Gesellschaft eine bessere werden kann, weil man irgendwie so sehr damit beschäftigt ist,
905300	913300	sich selber die ganze Zeit zu verbessern. Aber dass das losgekoppelt ist von eben der Vorstellung, dass die ja, dass die Gesellschaft verbessert werden kann.
913300	921300	Also ich glaube, selbst so er sagt so etwas wie Selbstverbesserung in einer Zeit, wo man annimmt, dass die Gesellschaft unverbesserlich ist oder so.
921300	929300	Wenn du noch darauf stößt, dann kannst du es gerne noch nachfragen. Genau, also das ist sozusagen das erste demokratische Versprechen auf Freiheit,
929300	940300	dass im Kontext einer neoliberalen Gesellschaft eben reduziert wird auf individuelle Selbstverwirklichung und Konsum und ja, dieses Wohlstandsversprechen.
940300	953300	Ihr könnt konsumieren und darüber auch dann partizipieren. Das zweite demokratische Prinzip und auch Versprechen, wie ich es nenne, auf eine offene Zukunft begegnet uns dann oft als Versprechen auf Gleichheit oder auch gleiche Teilhabe.
953300	964300	Und hier argumentiere ich, dass dieses Versprechen auf politische Teilhabe oft derzeit uns begegnet über eben so Versprechungen auf digitalen Fortschritt.
964300	973300	Also wir sehen eigentlich, dass in der Praxis eben eine formale Gleichheit beispielsweise vor dem Gesetz und wir müssen nur an Polizeigewalt beispielsweise denken oder Policing,
973300	985300	dass das in der Wirklichkeit selten garantiert ist und man versucht eigentlich heutzutage diese Kritik aus dem Weg zu räumen, indem man sagt,
985300	995300	über neue digitale Beteiligungsformen können wir es ermöglichen, dass alle Menschen in gleicher Weise partizipieren können, wenn sie denn partizipieren wollen.
995300	1005300	Und ich versuche dieses Versprechen auf politische Teilhabe durch digitalen Fortschritt als ein Versprechen zu entlarven, das eigentlich eine offene Zukunft untergräbt.
1005300	1017300	Und das dritte ist dann, dass ich versuche zu zeigen, wie in der heutigen, ja, wieder im Kontext einer neoliberalen Gesellschaft dieses Versprechen auf Solidarität und Gemeinschaft ein Versprechen ist,
1017300	1035300	das reduziert wird auf nationale Zugehörigkeit. Also wir sehen eine jahrzehntelange Entsolidarisierungseffekte, auch die was damit zu tun haben natürlich mit diesen Umstrukturierungsmaßnahmen von immer mehr Privatisierung,
1035300	1047300	immer mehr Deregulierung, immer mehr Abbau des Sozialstaates etc. Also die Gemeinschaft wird sozusagen wirklich zurückgefahren und wir sehen Entsolidarisierungseffekte und gleichzeitig sehen wir,
1047300	1060300	dass diese Entsolidarisierungseffekte aufgefangen werden, nicht so sehr von links, also von linken Strömungen beispielsweise, sondern insbesondere von rechts und nationalistischen Bewegungen.
1060300	1073300	Hier wieder dieser Sehnsucht auch nach Gemeinschaft und Solidarität begegnet wird, indem dieses Versprechen nach Solidarität eben ein Versprechen wird zu einer nationalen Zugehörigkeit.
1073300	1081300	Und das Prinzip, was dem zugrunde liegt, ist natürlich, Zugehörigkeit und Solidarität ist dort am stärksten, wo wir uns am ähnlichsten sind.
1081300	1089300	Und das hat natürlich nichts damit zu tun, was die Demokratiebewegungen eigentlich versuchen. Die Demokratiebewegungen wollen eine Pluralität der Zukunft,
1089300	1103300	während wir sehen, dass nationalistische Bewegungen, die beklagen eigentlich den Verlust einer nationalen Zukunft und wollen die Zukunft eben für ihre definierte Gruppe eines,
1103300	1115300	wie sie sich das vorstellen, bestimmten Volkes, während die Demokratiebewegungen im Unterschied sagen, wir wollen eigentlich Zukunft demokratisieren, wir wollen Zukunft pluralisieren.
1115300	1125300	Eine Sache, die mich interessieren würde, ist, wie du das siehst, ob eigentlich die bisherigen Narrative, also diese klassischen neoliberalen Narrative,
1125300	1133300	ob die nicht eigentlich mittlerweile ausgedient haben und inwiefern das in einem Verhältnis steht zu diesen verschiedenen Interpretationen dessen,
1133300	1138300	was denn Demokratie jetzt ist oder auch sein sollte, die jetzt derzeit auch wieder mehr an Aufmerksamkeit bekommen.
1138300	1146300	Weil ich hätte ja eigentlich das Gefühl, dass im Grunde diese klassische neoliberale Erzählung eigentlich ausgedient hat, gerade im Zuge der Corona-Maßnahmen,
1146300	1156300	in denen ja ein spezifischer Aspekt dieses neoliberalen Narratives komplett zusammengebrochen ist, also ganz viele mittelständische Betriebe und so weiter,
1156300	1163300	können ja gar nicht mehr jetzt innerhalb dieses klassischen Narratives von sei du deines Glückes Schmied irgendwie agieren.
1163300	1170300	Also ich persönlich hätte das Gefühl, es gibt eigentlich gar kein Zurück dahin und verschiedene Kandidaten haben sich schon platziert,
1170300	1177300	um da jetzt irgendwie die nächsten Anwärter für eine Legitimationsgrundlage eines dann gewandelten Kapitalismus zu werden,
1177300	1187300	zum Beispiel das von die angesprochene stark nationalistisch-völkisch-gedachte Wohlfahrtsstaatsdenken, das dann vielleicht auch ein Grundeinkommen etabliert oder so.
1187300	1194300	Das nennen die dann vielleicht Volkstaler oder so was und binden das dann ganz stark an so einen als homogen gedachten Volkskörper,
1194300	1203300	aber auch sowas wie Techfeudalismus oder Finanzfeudalismus oder auch grüne kapitalistische Planwirtschaft während der heiße Kandidaten, glaube ich.
1203300	1213300	Wie sehr, glaubst du, ist dieses Narrativ, was wir jetzt über die letzten 20, 30 Jahre gefüttert bekommen haben, eigentlich auch an einem Ende und wird gerade abgelöst?
1213300	1221300	Und wie steht das in einem Verhältnis zu den bisher dominanten Erzählungen davon, was denn Demokratie sei?
1222300	1229300	Ja, ich denke, das ist keine ganz einfache Frage oder zumindest eine Frage, die sehr voraussetzungsvoll ist.
1229300	1237300	Ich verfolge diese Debatten auch darüber, also besonders hier im Kontext von Großbritannien,
1237300	1249300	nämlich die Frage, ob wir ein Ende des Neoliberalismus sehen und was das bedeutet dann auch für demokratische Gesellschaften.
1249300	1261300	Ich denke, es ist einerseits zu früh da wirklich etwas entscheidendes darüber zu sagen, also hier schon eine Feststellung zu äußern.
1261300	1272300	Ich denke, was man vielleicht auf jeden Fall anerkennen kann, ist, dass wir an einem interessanten Scheidepunkt stehen,
1272300	1283300	wo wir entweder möglicherweise eine Zuspitzung erleben werden, also eine Zuspitzung von neoliberalen Politikern oder eben auch etwas anderes.
1283300	1293300	Und dann stellt sich die Frage, was ist dieses andere? Und ich muss sagen, dass ich doch eher pessimistisch bin.
1293300	1300300	Genau, ich sehe die Maßnahmen, die jetzt getroffen werden im Zusammenhang mit Corona, mit der Corona-Pandemie,
1300300	1313300	sehe ich eher als eine Ausnahmeentscheidung, also als etwas, was jetzt, glaube ich, nicht in eine neue Gesellschaftsform unbedingt prägen werden.
1313300	1325300	Also hier im Kontext von Großbritannien beispielsweise ist man etwas fasziniert darüber, dass viele der langjährigen Forderungen der Labour-Partei beispielsweise jetzt Umsetzung finden.
1325300	1330300	Aber es ist natürlich der Kontext der Corona-Pandemie, das ist wichtig nicht zu vergessen.
1330300	1337300	Und gleichzeitig ist es natürlich auch wichtig zu sehen, warum befinden wir uns in der Situation, in der wir uns gerade befinden.
1337300	1346300	Also wenn wir sehen, dass Corona ein Brennglas ist, das soziale Ungleichheiten offenlegt, dann stellt sich natürlich die Frage, wie sind wir da reingekommen?
1346300	1354300	Und dann können wir sagen, okay, das war Sparpolitik und Privatisierungs- und Deregulierungsmaßnahmen etc.
1354300	1361300	Und die Frage stellt sich dann, wenn die Corona-Pandemie jetzt erst mal vorbei ist, dann muss das Ganze ja auch aufgeräumt werden.
1361300	1371300	Und da gibt es dann schon Prognosen, die eher pessimistisch ausfallen und die sagen, das wird jetzt nicht unbedingt die, die am meisten benachteiligt sind in unserer Gesellschaft jetzt,
1371300	1375300	also das wird möglicherweise die nochmal mehr treffen.
1375300	1383300	Also die Maßnahmen treffen jetzt schon diejenigen, die am benachteiligsten sind in unseren Gesellschaften am meisten.
1383300	1390300	Und dann, wenn es darum geht, die Gelder wieder reinzubekommen, dann stellt sich natürlich die Frage, wo wird da wieder gespart?
1390300	1393300	Und da bin ich jetzt auch nicht unbedingt so optimistisch.
1393300	1399300	Das, was mich im Zusammenhang interessiert, also mit der Frage von, was bleibt wirklich möglicherweise?
