start	end	text
2880300	2893300	Und da wird zum Beispiel die Geschichte das Ende des Empires und der Kolonien so dargestellt als eine Errungenschaft der liberalen Demokratie hier und der britischen Regierung.
2893300	2901300	Und diese Wissenschaftlerinnen machen darauf aufmerksam, dass das eine Verschleierung der Wirklichkeiten darstellt,
2901300	2908300	weil eben die Provokationen, die das, was ich nenne, demokratischen Provokationen, völlig ausgelassen werden aus dieser Erzählung.
2908300	2919300	Also dass es eben nicht der Wohlwollen war einer britischen Regierung zu sagen, so wir beenden jetzt das Empire und wir beenden unsere Kolonien,
2919300	2931300	sondern dass dahinter ganz massive Bewegungen entstanden, die eben sozusagen einen ganz eindeutigen Druck ausgeübt haben, dass es zu diesen Entwicklungen auch gekommen ist.
2931300	2941300	Das heißt, wenn ich versuche, Provokation und Demokratie zusammenzudenken, dann ist das auch der Versuch zu zeigen, dass Demokratien halt immer auf Provokation angewiesen sind,
2941300	2948300	um sich selbst zu regulieren, weil, wie vorhin auch schon gesagt, Demokratien immer Ausschlüsse produzieren.
2948300	2955300	Also das ist das Spannungsverhältnis von Demokratie. Demokratie schließt immer ein und gleichzeitig schließt Demokratie immer aus.
2955300	2963300	Und ein Beispiel dafür ist zum Beispiel das Wahlrecht. Also wir können an der Geschichte des Wahlrechts beispielsweise sehen, dass das Versprechen auf Freiheit und Gleichheit
2963300	2980300	erst mal einer ganz kleinen Besitzbürgertum, männlich, weißen Gruppe ein Recht war und dann erst systematisch mithilfe von vielfachen Kämpfen überhaupt erst sich ausgeweitet hat.
2981300	2992300	Und das ist das, was die Idee der Provokation eben versucht zu zeigen, auch in dieser radikaldemokratischen Tradition, nämlich zu zeigen, dass die Ausweitung von demokratischen Prinzipien,
2992300	3003300	also die Ausweitung von demokratischen Prinzipien von Freiheit, Gleichheit, Solidarität auf immer mehr soziale Bereiche und sozialen Beziehungen eine Aufgabe ist,
3003300	3017300	die auf außerinstitutionelle Provokationen angewiesen ist. Also diese Transformationen können nicht ausschließlich im Rahmen von bestehenden Institutionen passieren.
3017300	3029300	Also wir können nicht darauf warten, dass Reformen von den Institutionen, die auf bestimmten Ausschlüssen basieren, angestoßen werden, sondern es braucht die Provokationen,
3029300	3041300	die außerhalb der Institutionen spielen, die eben bestimmte Stimmen in den Diskurs einspeisen, die sonst nicht gehört werden würden, die bestimmte Gruppen sichtbar machen und Themen auf die Agenda setzen,
3041300	3051300	die sonst oft übergangen werden. Und natürlich ist eine Annahme hinter dieser Idee der Provokation und auch der, ich nenne das Politik der Provokation oder auch provokierten Demokratie,
3051300	3060300	ist es auch zu sagen, dass bestimmte Leute von dem Status Quo profitieren und dass man jetzt nicht darauf warten kann oder nicht davon ausgehen kann,
3060300	3070300	dass diese Leute oder auch bestimmte soziale Gruppen jetzt bereitwillig ihre Privilegien abgeben. Zumindest war das in der Geschichte jetzt nicht unbedingt so.
3070300	3082300	Das ist nicht unbedingt so. Und wenn das in der Geschichte nicht so war, dann kann man doch sehr auch davon ausgehen, dass wir auch in Zukunft weiterhin diese Provokationen brauchen,
3082300	3093300	um eine Demokratisierung der Demokratie anzustoßen. Und zwar nicht nur in der politischen Sphäre, sondern das, was die radikale Demokratie ja auch versucht,
3093300	3105300	die demokratischen Prinzipien auf andere Bereiche wie zum Beispiel die Wirtschaft anzuwenden oder die, also im Grunde geht es darum zu sagen, diese Prinzipien müssen in allen gesellschaftlichen Bereichen wirksam werden.
3105300	3116300	Also wir brauchen Demokratie am Arbeitsplatz, wir brauchen Demokratie in den Bildungsinstitutionen, in den Gesundheitsinstitutionen, in den Pflegerinstitutionen und so weiter und so fort.
3117300	3126300	Ja, das finde ich hochinteressant, muss ich sagen. Ich glaube, es wäre wichtig, dass wir jetzt das, was wir am Experiment exerziert haben,
3126300	3134300	nämlich eine wohlwollende Kritik, wenn man so will, dass wir das vielleicht auch in Bezug auf das Provozieren durchspielen, denn mir sind manche Sachen noch nicht so ganz klar.
3134300	3143300	Zum einen vielleicht mal ganz vorausgeschickt die Frage, irgendwie habe ich immer noch das Gefühl, dass diese Art und Weise, das Provozieren zu denken,
3143300	3154300	in letzter Instanz dann doch sehr stark gebunden ist an die Vorstellung, dass das Grundgerüst, was es da zu provozieren gilt, dass das, also nicht, dass das in Ordnung sei,
3154300	3161300	weil das ist ja so ein bisschen der Tenor, den du überhaupt einschlägst, dass man eben durch das Provozieren den ja ändern können soll,
3161300	3172300	aber allein durch die primäre Bezugnahme auf dieses Konstrukt legitimiert man es ja indirekt dann doch wieder als den primären Adressaten der Provokation in dem Fall.
3173300	3188300	Und dieses Tandem, was da draus entsteht, das erzeugt bei mir so ein bisschen ein Gefühl von, als ob man im Grunde das, was du berechtigterweise in deinem Buch, finde ich, auch an den Experimenten kritisierst,
3188300	3201300	nämlich dass man so ein bisschen in eine Position des Anhängsels hineinrutscht, dass im Grunde diese Gefahr beim Provozieren auch besteht, nur halt vielleicht auf einer anderen Abstraktionsebene oder so.
3201300	3212300	Und ich finde, dass man das bei den Beispielen, die du im Buch dann gibst, als Beigeschmack zumindest vielleicht ein bisschen besser sich da schon ein wenig transportiert,
3212300	3219300	weil du führst zum Beispiel eben Fridays for Future oder auch Extinction Rebellion an als Beispiele des Provozierens,
3219300	3226300	die über dieses Provozieren eben versuchen, quasi eine Änderung des Systems herbeizuführen.
3226300	3234300	Aber man kann sich ja also relativ leicht eigentlich Situationen vorstellen, in denen diese Provokation eben entweder in etwas endet,
3234300	3239300	wo wieder dann nur Empfehlungen gegeben werden, die aber in keinster Form irgendwie bindend sind.
3239300	3247300	Dann hat man wieder so eine ganz konkrete Anhängsel-Sache oder eben, dass die Provokation dann als Ideengeber gilt,
3247300	3253300	der dann in bester gybernetischer Form eigentlich zur Anpassung und Optimierung des Systems genutzt wird.
3253300	3259300	Die grüne Partei könnte man vielleicht in ihrer Geschichte so lesen, wenn man so will.
3259300	3262300	Also vielleicht fangen wir da mal an.
3262300	3273300	Also inwiefern tritt denn dieser Akt der Provokation aus diesem durchaus problematischen Spannungsverhältnis des Anhängsels hinaus
3273300	3281300	und kann wirklich zu einem tatsächlich anderen Modus operandi führen?
3282300	3290300	Das, was diese Idee der Provokation oder auch der Politik der Provokation versucht, ist auf zwei Ebenen anzusetzen.
3290300	3296300	Also einerseits auf dieser abstrakten konzeptionellen Ebene und dann gibt es natürlich auch ein normatives Argument.
3296300	3303300	Auf dieser abstrakten konzeptionellen Ebene ist es der Versuch, diese drei Begriffe, die wir jetzt schon kennengelernt haben,
3303300	3310300	nämlich Demokratie, Zukunft und Ungewissheit und Experiment, also es sind eigentlich vier, zusammenzudenken.
3310300	3315300	Und ich werde es versuchen, nochmal vielleicht kurz zusammenzufassen und dann einem Beispiel deutlich zu machen.
3315300	3320300	Und das Argument hier ist zu sagen, Provokation ist eben kein Anhängsel von Demokratie,
3320300	3326300	sondern Provokation ist die Voraussetzung für eine funktionierende Demokratie.
3326300	3338300	Also das, was eine funktionierende Demokratie ausweist, ist, dass sie Räume öffnet und offen hält für fortlaufende Provokationen.
3338300	3344300	Das ist sozusagen das Argument. Und die Notwendigkeit dafür ergibt sich daraus, dass ich sage,
3344300	3354300	die Offenheit der Demokratie oder die offene Zukunft, die Demokratie verspricht, die ergibt sich nicht aus demokratischen Institutionen per se.
3354300	3361300	Und das ist das Beispiel hier, was ich ganz zu Beginn genannt habe, nämlich das von formale Gleichheit vor dem Gesetz.
3361300	3369300	Das ist etwas, was in der Praxis oft gar nicht tatsächlich so existiert.
3369300	3378300	Das heißt, die Offenheit folgt nicht automatisch demokratischen Institutionen und mein Argument geht dann weiter und sagt,
3378300	3387300	sondern ist darauf angewiesen, also Demokratien, um die Zukunft offen zu halten, sind darauf angewiesen, dass sie sind auf Provokationen angewiesen.
3387300	3396300	Das ist sozusagen das konstitutionelle Moment, also das Moment, wo ich sage, Provokationen sind die Voraussetzungen, sind eine Bedingung für Demokratie.
3396300	3402300	Und der Hintergrund ist zu sagen, Demokratie ist nicht notwendigerweise progressiv.
3402300	3410300	Also das, was ich auch schon gesagt hatte, die faschistische Möglichkeit ist immer Teil des demokratischen Experiments.
3410300	3419300	Und das hat was damit zu tun, und da gehe ich nochmal ganz zurück zum Ausgangspunkt und zu etwas, was Lefort gesagt hat, mit diesem Demokratie ist der leere Ort der Macht.
3419300	3424300	Das hat was damit zu tun, dass Ungewissheit eben der Wesenskern von Demokratie ist.
3424300	3440300	Also Demokratie muss, oder zumindest in dieser radikaldemokratischen Version, wenn man davon ausgeht, wenn man Demokratie nicht auf so essenzialistische Vorstellungen von Herrschaft und Volkssouveränität aufbauen möchte,
3440300	3448300	dann muss man es ermöglichen, dass die Prinzipien von Demokratie immer wieder hinterfragt werden können.
3448300	3460300	Und etwas, was oft, und jetzt möchte ich zum Beispiel kommen, um das ein bisschen anschaulicher zu machen, weil mir natürlich bewusst ist, dass es erst mal so ein konzeptionelles, eine sehr abstrakte Ebene ist, die ich hier anspreche.
3460300	3478300	Und deshalb ist es so wichtig, für eine provozierte Demokratie erkennt die Notwendigkeit von Ungewissheit und Konflikt an für eine lebendige, funktionierende Demokratie und für die Möglichkeit, den Status quo zu verändern durch Demokratie.
3478300	3492300	Also radikale Demokratie ist ja auch eine andere Art und Weise zu sagen, wir können die Demokratie radikalisieren, also wir können den Status quo verändern durch mehr Demokratie.
3492300	3501300	Das wäre so etwas, was bei der radikaldemokratischen Tradition mitschwingt als Argument.
3501300	3512300	Wenn wir jetzt ein Beispiel hernehmen, um zu zeigen, dass Provokation eben keine Anhängnisse sind, dann können wir zum Beispiel uns digitale Technologien anschauen.
3512300	3523300	Also wir können, wenn wir uns zum Beispiel anschauen, so automatisierte Entscheidungen, also all das, was um maschinelles Lernen, Datafication, Data Politics, all diese Begriffe in dem Zusammenhang.
3523300	3534300	Wenn wir uns zum Beispiel anschauen, das Phänomen, das immer mehr, ich bin nicht vertraut mit der Situation Österreich und Deutschland, muss ich zugeben, aber ich sehe das zum Beispiel hier in Großbritannien.
3534300	3550300	Da gibt es, gab es jetzt zum Beispiel im August den Skandal, dass man jetzt offengelegt hat, dass Visa, also Einreise Visa verteilt wurden auf der Grundlage von einem Algorithmus, der diskriminiert hat.
3550300	3560300	Also dieses Phänomen, dass immer mehr öffentliche Aufgaben unterstützt werden durch die Anwendung von Algorithmen, die dann Entscheidungen automatisieren.
3560300	3566300	Und in diesem Fall hat man gesehen, dass diese Algorithmus mit einem Ampelsystem gearbeitet.
3566300	3573300	Und je nachdem, welche Nationalität die Antragstellerin hatte, wurde dann die Farbe Rot, Gelb, Grün verliehen.
3574300	3582300	Und damit wurde man sozusagen zurückgestuft oder vorangestuft und hatte es schwieriger, dann das Visum tatsächlich zu bekommen.
3582300	3587300	Genau, dieser Algorithmus hat ganz eindeutig diskriminiert, das wurde offengelegt.
3587300	3591300	Das ist jetzt ein Phänomen, womit wir es immer mehr zu tun haben.
3591300	3598300	Also wir sehen eine Digitalisierung des Sozialen, wir sehen immer mehr unsere sozialen Beziehungen, auch die Beziehungen von uns als BürgerInnen zu den Regierungsapparaten.
3598300	3604300	Diese Beziehung wird zunehmend digital vermittelt und Entscheidungen werden automatisiert.
3604300	3615300	Das Problem, so argumentiere ich jetzt, dass das, was bei diesen automatisierten Entscheidungen mitschwingt, ist ein Versprechen, das Ungewissheit kontrolliert werden kann.
3616300	3632300	All diese Ideen um digitalen Fortschritt herum, damit einher geht das Versprechen auf mehr Sicherheit, auf mehr Kontrolle und schlussendlich darauf, dass die Ungewissheit, die natürlich eigentlich immer präsent ist.
3632300	3636300	Also wir können keine Gewissheit darüber haben, wie unsere Erfahrungen ausgehen werden.
3636300	3650300	Aber das Versprechen der großen Technologiekonzerne ist, dass wir Ungewissheit vermessen können und wir können Ungewissheit sozusagen operationalisieren und kontrollieren.
3650300	3662300	Und das Problem, was dabei entsteht, ist, dass einerseits nicht nur Ungewissheit, sondern eben auch Konflikt, also Räume für Ungewissheit und Konflikt eben der Wesenskern von Demokratie schwinden.
3663300	3686300	Und je mehr wir jetzt dieses Phänomen erleben, dass automatisierte Entscheidungen unser Leben diktieren oder aber auch unsere Rolle und unsere Beziehungen zu den Repräsentierten und sozusagen unser Verhältnis zu den Regierungsapparaten vermitteln, desto mehr stellt sich die Frage nach der Rolle von Ungewissheit und Konflikt und nach Räumen dafür.
3686300	3708300	Und das ist sozusagen ein Ausgangspunkt meiner Arbeit, dass ich versuche zu zeigen, dass wir diese Technologien nur dann demokratisch kontrollieren können, wenn wir eben deutlich machen, welche Rolle Ungewissheit und Konflikt haben für demokratische Kontrolle, also für Demokratie als solche und für demokratische Kontrolle von Vorhersagetechnologien beispielsweise.
3708300	3732300	Und das ist das, was ich mit dem Begriff der Provokation versuche. Also ganz konkret, wenn Institutionen sich an so einer Idee der Politik der Provokation orientieren würden, und das ist jetzt das normative Argument, dann würde es darum gehen, einerseits zu schauen, inwiefern Vorhersagetechnologien Räume für Ungewissheit und Konflikt bereitstellen oder aber blockieren.
3732300	3745300	Also wir könnten diese Vorhersagetechnologien dann, wir könnten diese Technik auf ihre Demokratiedefizite besser befragen durch diese Brille der Provokation.
3745300	3774300	Und das andere ist, dass wir aber auch überlegen können oder dass man praktisch überlegen könnten, wie zum Beispiel so Feedback-Infrastrukturen, mit denen ja auch digitale Technologien arbeiten, inwiefern die so gestaltet werden können, dass sie es erlauben, dass beispielsweise Alternativen verhandelt werden können und Möglichkeiten offengehalten werden können, anstatt so zu operieren, wie sie es tun, nämlich dann oft zu diskriminieren per Design.
3775300	3796300	Und das, was das Ganze zusammenbringt, also die Idee der Provokation mit der Idee der Demokratie und der Zukunft und diesen Vorhersagetechnologien ist jetzt einfach dieses erstaunliche Phänomen, was sich einfach noch und noch und noch zuspitzen wird in den nächsten Jahren, dass es diesen ungemeinen Wettbewerb gibt, darüber zukünftiges Verhalten vorherzusagen.
3796300	3820300	Also der Profit ist dort, wo wir Verhalten vorhersagen können und es dann auch manipulieren können und kontrollieren können. Und wenn wir in irgendeiner Weise diese Tendenz nicht nur kritisch reflektieren wollen, sondern auch angehen wollen, dann brauchen wir, und das versuche ich mit dem Buch, eine Debatte darüber, welche Rolle Ungewissheit und Konflikt spielen für demokratische Kontrolle.
3820300	3849300	Und ein ganz letzter Gedanke dazu, meine Kritik an zeitgenössischen Positionen der Demokratie ist es, dass man mit diesen Deliberationen beispielsweise, also deliberativen Demokratie Theorien, epistemischen Demokratie Theorien, aber auch liberalen Demokratie Theorien, dass man dieses Problem, was ich Algorithmic Certainty nenne, also so eine algorithmische Gewissheit, dieses Versprechen, dass wir, ja, dass wir Ungewissheit kontrollieren können, dass wir das eigentlich nicht wirklich in den Blick behalten können.
3850300	3876300	Und zwar deshalb nicht, weil die vorrangige Aufgabe von Demokratie verstanden wird als eine, die Probleme zu lösen hat. Und ich gehe dahin zu sagen, die vorrangige Aufgabe von Demokratie ist es nicht Probleme zu lösen, sondern die vorrangige Aufgabe von Demokratie besteht darin, Räume zu öffnen und offen zu halten, dass das provoziert werden kann.
3876300	3900300	Also das sozusagen, dass wir Alternativen verhandeln können und Alternativen können wir dann verhandeln, wenn es eben Möglichkeiten gibt, Konflikte zu provozieren. Also die Idee hinter Provokation ist zu sagen, wir müssen, es muss möglich sein, Konflikte fortlaufend neu provozieren zu können, denn das ist die Voraussetzung dafür, dass die Zukunft offen gehalten werden kann, weil eben mit Alternativen experimentiert werden kann.
3900300	3927300	Da war jetzt wirklich sehr viel drinne, was, wozu ich noch Fragen hätte. Vielleicht fangen wir an mit dem, was da provoziert wird, weil also, wenn ich jetzt versuche, mir das vorzustellen, in Bezug auf ein aktuelles Institutionengefüge, das da ist parlamentarische Demokratie, ja, vielleicht habe ich da auch immer noch was falsch verstanden, weil wenn man nämlich, so wie du das jetzt zumindest in der ersten Hälfte erklärt hast, hatte ich das Gefühl, okay, aber das ist doch jetzt super.
3927300	3942300	Krass konsenstauglich eigentlich mit allen, auch eigentlich klassischen Liberalen sozusagen, die würden, selbst wenn sie von mir aus, wenn man das theoretische Gerüst, was dahintersteht, dann komplett durchdeklinieren würde, an einen Punkt kommen würden, wo man vielleicht da endet, was du zu Recht kritisierst in Bezug auf das Zusammentragen von Wissen und auf eine Art quasi einen technokratischen Zugang.
3942300	3949300	Ja, aber wir brauchen diese Orte der Offenheit, wir brauchen diese Orte des Provozierens, um unsere Demokratie lebendig zu halten.
3949300	3957300	Also dieses Narrativ an sich ist etwas, was, was man auch in so einem ganz klassischen, traditionellen Kontext dann da liberieren kann.
3957300	3964300	Ja, aber wir brauchen diese Orte der Offenheit, wir brauchen diese Orte des Provozierens, um unsere Demokratie lebendig zu halten.
3964300	3974300	Also dieses Narrativ an sich ist etwas, was, was man auch in so einem ganz klassischen, traditionellen Kontext dann der liberalen Demokratie durchaus immer wieder vorgeschoben hat.
3974300	3979300	Ob man das jetzt dann in letztens dann wirklich ernst genommen hat oder nicht, ist ja dann wieder eine andere Frage.
3979300	3986300	Aber also das hat da quasi, finde ich, eigentlich eine große Konsenstauglichkeit mit einem gängigen Demokratieverständnis, sage ich mal.
3986300	3997300	Und was ich mich dann immer noch frage, ist, was für ein Institutionengefüge würde sich denn daraus ergeben, wenn man das in letzter Instanz dann auch auf dieser Ebene durchdekliniert?
3997300	4003300	Weil ich verstehe zu sagen, okay, wir haben hier eine parlamentarische Demokratie, die ist super krass defizitär.
4003300	4008300	Und dieses alle vier Jahre wählen und so, das ist auch überhaupt nicht irgendwie zielführend.
4008300	4014300	Wir müssen auf einer grundsätzlichen Ebene Möglichkeiten offenhalten, das zu ändern.
4014300	4019300	Aber es ist ja, damit haben wir ja auch die Möglichkeit, das zu ändern.
4019300	4024300	Wir müssen auf einer grundsätzlichen Ebene Möglichkeiten offenhalten, das zu ändern.
4024300	4033300	Aber es ist ja damit noch nicht gesagt und ich habe das, ich vermute mal, dass du da wahrscheinlich dich auch nicht festlegen lassen willst.
4033300	4042300	Aber damit ist ja noch nicht gesagt, wie die Dinge in einer Art und Weise aufgebaut sein könnten, auf einer wirklichen institutionellen Ebene zum Beispiel.
4043300	4049300	Damit sie nicht nur diesen Ort der Provokation zulassen, mit erschaffen, offenhalten und so weiter,
4049300	4054300	sondern trotzdem auch quasi die vielen, vielen, vielen anderen Funktionen erfüllen,
4054300	4062300	die jetzt sowas wie ein in dem Fall jetzt aktuell parlamentarisch demokratisches Institutionengefüge jetzt ja auch erfüllt.
4062300	4067300	Also ich finde, da gibt es noch so eine andere Ebene, die damit irgendwie noch überhaupt nicht adressiert ist.
4067300	4072300	Und hätte da das Gefühl, dass man da vielleicht schnell an einen Punkt kommt,
4072300	4081300	wo man sich zu sehr auf dieses Provozieren als ein wichtiges Teilelement konzentriert
4081300	4088300	und dabei aber eigentlich auf eine Art einen Großteil der Fragen irgendwie vertagt oder an einen Punkt verschiebt,
4088300	4093300	der dann vielleicht prozessual erklärt wird oder wie auch immer.
4093300	4097300	Aber ich habe das Gefühl, da ist eigentlich im Grunde die Leerstelle noch zu groß,
4097300	4103300	wenn man das so sehr alleine ins Zentrum setzt, ohne die anderen Fragen dann auch zu adressieren.
4107300	4114300	Ich denke, ein wichtiger Ausgangspunkt für diese Frage der Provokation ist auch die Beobachtung,
4114300	4125300	dass einerseits die Bedeutung von Provokationen für die Demokratisierung der Demokratie oft unsichtbar gemacht wurde.
4125300	4129300	Und ich hatte schon das Beispiel genannt hier im Zusammenhang mit dem Staatsbürgernentest.
4129300	4135300	Und das andere Phänomen ist, das haben wir jetzt hier wieder gesehen in Großbritannien,
4135300	4139300	dass Provokationen oft kriminalisiert werden.
4139300	4146300	Und der Versuch zu sagen und zu betonen, dass Demokratie provozieren muss und auch zu sagen,
4146300	4153300	dass Provokationen ein Wesenskern von Demokratien sind, wenn sie sich selber regulieren wollen,
4153300	4163300	ist auch so zu verstehen, diese Kriminalisierungsmomente versuchen entgegenzuwirken.
4163300	4166300	Und ich sage kurz dazu, was ich damit meine mit Kriminalisierung.
4166300	4176300	Also hier zum Beispiel hat das Innenministerium vor einigen Monaten einen Katalog zusammengestellt für die Schulen,
4176300	4178300	und zwar hier insbesondere für die Lehrerinnen.
4178300	4184300	Und die Idee war es, aufzulisten, Organisationen und Bewegungen und Initiativen,
4184300	4191300	die aus der Sicht des Innenministeriums eben potenziell extreme, extremistische Positionen beinhalten.
4192300	4198300	Und die Lehrerinnen hatten dann die Aufgabe, zu schauen, ob sie Anzeichen sehen können bei den Schülern
4198300	4203300	für ein Interesse an diesen Initiativen und Organisationen.
4203300	4208300	Zum Beispiel wurden in diesem Katalog dann die Logos abgebildet und andere Symbole,
4208300	4215300	die in Extinction Rebellion war beispielsweise auch Teil dieses Katalogs, dieses Schreibens,
4215300	4217300	was an die Schulen weitergereicht wurde.
4217300	4221300	Was das jetzt zeigt, und es kam noch ein zweites Phänomen,
4221300	4230300	was jetzt eher auf so einer theoretischen Ebene aufbaut, aber eigentlich in die ähnliche Richtung stößt,
4230300	4235300	und zwar das Phänomen, dass auch beispielsweise jetzt wieder, es ging wieder um Bildung,
4235300	4243300	dass verboten wurde, antikapitalistische Inhalte beispielsweise zu lehren an den Schulen.
4244300	4249300	Das nur als zwei Beispiele, um zu zeigen, dass es nicht selbstverständlich ist oft,
4249300	4255300	dass Provokationen ziviler Ungehorsam ein legitimes Mittel ist in einer Demokratie.
4255300	4259300	Also wir haben ja noch nicht immer darüber jetzt gesprochen, welche Bedeutung Gewalt haben kann,
4259300	4263300	sondern ich habe das ja noch ein bisschen, also dieses Thema haben wir noch gar nicht gestreift.
4263300	4269300	Aber zunächst einmal ist es wichtig festzustellen, dass anstatt dass Demokratien,
4269300	4273300	und hier jetzt beziehe ich mich gerade auf demokratische Regierungen insbesondere,
4273300	4281300	anstatt dass es ein Selbstverständnis gibt darüber, welche Bedeutung Provokationen haben
4281300	4287300	für die Selbstregulierung von Demokratien, passiert eigentlich das Gegenteil.
4287300	4292300	Also wir sehen entweder, dass sie unsichtbar gemacht werden, dass sie ausradiert werden aus der Geschichte,
4292300	4294300	oder wir sehen, dass sie kriminalisiert werden.
4294300	4298300	Ein anderes Beispiel sind die Corona-Proteste beispielsweise.
4298300	4302300	Also mein Eindruck, vielleicht hast du einen anderen, aber so ein bisschen jemand,
4302300	4306300	der die in London lebt und das jetzt ab und zu aus der Ferne mitverfolgt.
4306300	4311300	Der Eindruck, den ich habe, die Art und Weise, wie über diese Proteste berichtet wird,
4311300	4318300	ist jetzt erstmal einer, der eher delegitimiert, also der eher betont,
4318300	4323300	welche extremistischen Positionen da anwesend sind und unterstützt werden,
4323300	4326300	auch dadurch, dass Leute mitgehen, die vielleicht gar nicht dem Lage angehören
4326300	4329300	und einfach nur ihre Grundrechte einfordern wollen.
4329300	4333300	Und auch das, finde ich, ist so ein Beispiel dafür, zumindest wie dieser Diskurs verläuft,
4333300	4341300	dass es erstmal nicht das Selbstverständnis gibt, dass demokratische Provokationen ein ganz wichtiger Grundpfeiler einer Demokratie sind.
4341300	4343300	Das ist das Erste.
4343300	4347300	Dann die Frage zur Institutionalisierung, und es gibt ja zahlreiche Probleme,
4347300	4351300	und das kann man ja jetzt nicht mit den Provokationen so unbedingt adressieren.
4351300	4354300	Ich denke, dass das eine dem anderen folgt.
