start	end	text
4354300	4362300	Also in dem Moment, wenn es dieses Selbstverständnis eher gibt über die Notwendigkeit von Provokationen,
4362300	4366300	dann gibt es verschiedene Möglichkeiten, das auch zu institutionalisieren.
4366300	4374300	Also eine Möglichkeit, ein Beispiel, ist zum Beispiel das, was in Barcelona passiert, ganz zu Beginn 2015.
4374300	4380300	Also es gab eine ganz starke Zusammenarbeit zwischen der Regierung und aktivistischen Gruppen.
4381300	4387300	Und zwar deshalb auch, weil dann erkannt wurde, dass oft lokale Regierungen gar nicht die Macht zum Beispiel haben,
4387300	4390300	um gegen so ein Unternehmen wie Airbnb vorzugehen.
4390300	4398300	Und dann wird versucht, und dann versucht man aber, also es gibt immer mehr Hausräumungen, es gibt Leerstand,
4398300	4403300	gleichzeitig wird spekuliert und so weiter, und lokale Regierungen sind an ein bestimmtes Regelwerk gebunden.
4403300	4406300	Und dann stellt sich die Frage, wie kann man Druck ausüben?
4406300	4412300	Eine Möglichkeit, das zu tun, ist zum Beispiel, dass lokale Regierungen zum Beispiel hier auch zusammenarbeiten
4412300	4416300	mit aktivistischen Gruppen bzw. dass es eine Form der Arbeitsteilung gibt.
4416300	4422300	Also keine im Sinne von institutionalisierte Zusammenarbeit, obwohl ich sie auch geben kann,
4422300	4428300	weil aktivistische Gruppen sich näher fühlen und dann auch in diesen unterschiedlichen Beteiligungsformaten sich engagieren.
4428300	4432300	Aber auch ganz einfach, dass da eine Kommunikationsfluss überhaupt stattfindet.
4432300	4437300	Und das klar ist, hier konnte die lokale Regierung nicht weiter Druck auszuüben auf Airbnb.
4437300	4445300	Das, was man jetzt versucht, ist irgendwie dann über Proteste zu mobilisieren und das kollektiv zu organisieren.
4445300	4450300	Das ist eine Form der Anerkennung der Rolle von Provokationen beispielsweise.
4450300	4457300	Ein anderes Beispiel ist im Zusammenhang mit der Migrationsbewegungen, besonders 2015,
4457300	4463300	wo wir gesehen haben, dass sich die Europäische Union selbst blockiert hat, also schnell zu agieren.
4463300	4471300	Es wird ja auch oft gesagt, dass diese Versammlungen oft besonders, also sie sind vielleicht demokratisch,
4471300	4474300	jeder kann mitreden, aber sie sind nicht besonders pragmatisch.
4474300	4480300	Und eigentlich hat man hier gesehen, wo sich die Europäische Union da selbst blockiert hat,
4480300	4484300	wo man sich nicht auf irgendeine Quotenregelung einlassen konnte und immer mehr Städte gesagt haben,
4484300	4491300	hey, wir sind bereit, sofort diese Zahl an Neuankimmlingen aufzunehmen.
4491300	4494300	Und das ist auch so ein Beispiel da und das auch mit Hilfe von Aktivistinnen.
4494300	4496300	Also es wird ungemein mobilisiert hier.
4496300	4500300	Und auch da hat man gesehen, es gab einen anderen Politikstil.
4500300	4506300	Das wäre zum Beispiel auch eine Form von ein Resultat, was dem folgen würde,
4506300	4515300	wenn man die Bedeutung von Konflikten und Provokationen anerkennt für Demokratie.
4515300	4521300	Ich glaube, was ganz wichtig ist, ist zu sehen in dem Zusammenhang auch,
4521300	4531300	dass die Anerkennung der Bedeutung von Provokationen für Demokratie ein ganz wesentlicher Beitrag dazu sein könnte,
4531300	4536300	zum Beispiel auch so rechtsnationalistische Bewegungen zu entlarven.
4536300	4543300	Also wenn wir sagen, es gibt nicht die eine universelle Idee von Freiheit, Gleichheit, von Volk,
4543300	4550300	also all die Versuche, so Begriffe, fundamentaldemokratische Kategorien,
4550300	4554300	wie zum Beispiel das Volk oder Volksherrschaft für sich zu reklamieren.
4554300	4557300	Und wir sehen das ja besonders von rechtsnationalistischer Seite.
4557300	4561300	Hier könnte so eine Politik der Provokation eigentlich wieder ins Bewusstsein rufen,
4561300	4566300	dass Demokratie gerade darin besteht, diese Prinzipien immer wieder neu zu verhandeln.
4566300	4574300	Also sie würde es disqualifizieren, diese Anrufungen, die wir hier erleben,
4574300	4581300	wo dann eine Gruppe definiert, wer das Volk ist und wer dazugehört und wer nicht dazugehört.
4581300	4585300	Und ein anderer wichtiger Schritt ist auch, und es ist noch ein letzter Gedanke dazu,
4585300	4590300	ist, dass sich mit dieser Idee der Provokation und der provozierten Demokratie
4590300	4596300	aus meiner Sicht auch unterscheiden lässt zwischen demokratischen Provokationen und Provokationen.
4596300	4599300	Also es gibt ja oft, da haben wir jetzt nicht drüber gesprochen,
4599300	4607300	aber so, dass es oft dann unter rechtem Populismus gefasst wird oder auch rechter Hetze und so weiter.
4607300	4610300	Da kann man ja auch sagen, es ist auch eine Form der Provokation.
4610300	4616300	Das, was mein Vorschlag einer provozierten Demokratie jetzt versucht, ist eigentlich zu sagen,
4616300	4621300	hey, wir müssen wieder besser unterscheiden können, was eine demokratische Position ist
4621300	4628300	und eine demokratische Provokation und was eine solche unterscheidet von einer nichtdemokratischen Provokation.
4628300	4633300	Und hier ist mein Vorschlag zu sagen, eine demokratische Provokation zielt darauf ab,
4633300	4635300	dass die Zukunft offen gehalten wird.
4636300	4641300	Und ganz konkret bedeutet das, dass die Resultate von Konfliktprovokationen
4641300	4645300	immer die Möglichkeit für neue Konfliktprovokationen bieten müssen.
4645300	4650300	Und wir sehen zum Beispiel, dass das bei so rechten nationalistischen Provokationen gar nicht der Fall ist.
4650300	4655300	Also die wollen mit ihren Provokationen von Konflikten erreichen,
4655300	4660300	dass manche nicht den Zugang haben, Konflikte provozieren zu können.
4660300	4665300	Ja, also bestimmte Leute werden ausgespart von dem Recht zu provozieren.
4665300	4671300	Und mein Argument wäre es jetzt zu sagen, damit wir – und jetzt komme ich zum Ausgangspunkt zurück, ganz zu Beginn –
4671300	4675300	wenn ich sage, wir müssen Zukunft demokratisieren, dann bedeutet das,
4675300	4678300	dass wir die Frage nach der Handlungsfähigkeit stellen müssen.
4678300	4682300	Und mein Vorschlag, das zu tun, wäre zu sagen, wir müssen fragen,
4682300	4686300	wer hat eigentlich Zugang dazu, Konflikte provozieren zu können?
4687300	4692300	Und bei Konfliktprovokationen meine ich, demokratische Konfliktprovokationen,
4692300	4699300	nämlich solche, dessen Resultate immer wieder erlauben, neue Konflikte zu provozieren.
4699300	4704300	Ja, und zwar für alle Menschen, also nicht irgendeine kleine Gruppe davon ausnehmen.
4704300	4707300	Das ist ein unglaublich guter Übergang zu meiner letzten Frage.
4707300	4711300	Aber bevor ich die stelle, möchte ich eigentlich nochmal feststellen,
4711300	4715300	ich bin während du sprichst eigentlich darauf gekommen, warum ich mich so schwer getan habe,
4715300	4719300	das in dieser Hinsicht anzunehmen, ist das wahrscheinlich all das, was du gerade sagst,
4719300	4725300	für mich absolut selbstverständlich sein sollte in jeder Demokratie.
4725300	4735300	Und ich eigentlich, ja, also das überhaupt nicht voneinander getrennt denken könnte für mich jetzt,
4735300	4739300	auch wenn ich natürlich weiß, dass es andere Konzeptionen dessen gibt.
4739300	4749300	Aber insofern hatte ich mich wahrscheinlich, ist das der Ursprung all dieser Schwierigkeiten des Einordnens auf meiner Seite jetzt,
4749300	4752300	ich hatte mich, glaube ich, wahrscheinlich immer wieder mal gefragt,
4752300	4755300	okay, aber was ist jetzt der radikale Anteil daran?
4755300	4764300	Das ist doch eigentlich, ja, zum einen auf einer eben so normativen Ebene sollte das total klar sein,
4764300	4768300	dass das ein wichtiger Bestandteil ist, aber auch auf einer letztlich funktionalen Ebene.
4768300	4774300	Also wenn man jetzt dann wieder zurückgehend auf die Frage der kybernetischen Feedback schleifen quasi,
4774300	4780300	wenn man auf diese Ebene zurückgeht, dann wäre das ja auch etwas, was vollkommen selbstverständlich mit dazu gehört,
4780300	4784300	die Provokation und dann letztlich auch die Inkorporation der Provokation,
4784300	4794300	wo ich ja wiederum dann eher eine Achillesferse des Konzepts der Provokation sehen würde.
4794300	4799300	Aber das ist vielleicht dann doch nochmal eine, wäre dann nochmal eine neue Frage.
4799300	4804300	Die Frage, die jetzt wiederum auf das eingehen sollte, was du zuletzt gesagt hast,
4804300	4809300	nämlich dass eigentlich das Entscheidende auch die Auseinandersetzung darüber ist,
4809300	4814300	wer denn Zugang dazu hat, Provokationen einzubringen und zwar Provokationen,
4814300	4817300	die dann wiederum auch in andere Provokationen münden kann.
4817300	4822300	Wenn man sich das anguckt und wenn man dieser Idee folgt,
4822300	4826300	dass Demokratie eigentlich die Hervorbringung von Neuem zur Aufgabe hat,
4826300	4830300	dann muss sie sich, finde ich, ob früh oder lang auch vom Gedanken des Wählens,
4830300	4835300	also gedacht als one homo sapiens, one vote trennen.
4835300	4840300	Es bräuchte also dann auch wirklich eine andere Polis, ein anderes, andersgedachten Demos,
4840300	4844300	und zwar jetzt nicht nur in Bezug auf die gängigen Ausschlussverfahren,
4844300	4849300	die eben auf Nationalstaatlichkeit fußen, sondern tatsächlich auch darüber hinaus.
4849300	4855300	Gibt es da tragfähige Konzepte, hast du in diese Richtung schon schon mal weitergedacht,
4855300	4862300	wie man dieser ja dann eigentlich wirklich explodierenden Polis, wie man der begegnen könnte?
4862300	4871300	Im Zusammenhang mit dem Konzept der provozierten Demokratie habe ich das ja habe ich das noch nicht so systematisiert.
4871300	4876300	Das, was ich noch gar nicht gesagt habe, weil ich das wahrscheinlich auch mal so selbstverständlich angenommen habe,
4876300	4882300	dass das klar ist, ist, dass das Demokratieverständnis, das, was ich bediene,
4882300	4889300	eines ist, dass Demokratie nicht reduziert auf formale Institutionen, Rechtsstaat, Parteienwettbewerb
4889300	4892300	oder selbst diese Idee einer Bürgerin beispielsweise.
4892300	4898300	Das Demokratieverständnis einer provozierten Demokratie oder auch experimentellen Demokratie
4898300	4905300	ist eigentlich eines, was wieder versucht, die demokratische Erfahrung in den Mittelpunkt zu rücken.
4905300	4911300	Also wegzukommen von dieser liberalen Idee, dass Demokratie zuallererst Rechtsstaat ist
4911300	4922300	und Freiheitsrechte bedeutet und uns eben mit formalen Rechten und Gleichheiten ausstattet,
4922300	4930300	hinzukommen zu der Verschiebung, zu sagen, Demokratie ist zuallererst eine Erfahrung.
4930300	4936300	Und wenn wir dann überlegen, wie wir Demokratien demokratisieren wollen,
4936300	4938300	dann würde es nämlich nicht darum gehen, zuallererst zu schauen,
4938300	4945300	ok, wie können wir jetzt die Institutionen versuchen, effizienter zu machen und im Sinne eines mehr Partizipation
4945300	4950300	oder mehr Legitimation, mehr Glaubwürdigkeit, mehr Vertrauen etc.
4950300	4955300	Sondern es würde den Blick darauf verschieben auf die Alltagspraktiken
4955300	4964300	und es würde uns ermöglichen, die Frage zu stellen, wo wir Demokratie und demokratische Erfahrungen,
4964300	4967300	wo es Räume dafür gibt und wo nicht.
4967300	4973300	Ein Beispiel dafür wäre zum Beispiel zu sagen, Öffentlichkeit, also öffentliche Räume,
4973300	4978300	ist eine wichtige Voraussetzung dafür, dass Menschen zusammenkommen können und sich austauschen können
4978300	4982300	und ihre Erfahrung teilen können und sich aber auch organisieren können.
4982300	4989300	Also meine Alternative einer provozierten Demokratie oder einer experimentellen Demokratie,
4989300	4993300	ich verwende das gerade noch ein bisschen synonym, ist eigentlich zu sagen,
4993300	4999300	die Demokratie braucht eine Blickverschiebung oder wir brauchen eine Blickverschiebung von Demokratie
4999300	5007300	zuvorderst gedacht über formale Institutionen hin zu Praktiken und Erfahrungen des kollektiven Organisierens.
5007300	5013300	Und wenn wir diesen Schritt wagen, dann würde das auch dazu führen,
5013300	5021300	dass wir eben all die einzelnen Initiativen der Selbstorganisation oder der kollektiven Organisation auch anerkennen.
5021300	5027300	Also das, was ich versucht habe, ein bisschen mit dieser Begrifflichkeit der Provokation und der Politik der Provokation einzufangen,
5027300	5034300	da würden wir genau zu diesem Schritt kommen und zu sagen, wir würden diese Initiativen anerkennen,
5034300	5042300	weil es sich dabei eben um Initiativen handelt, die versuchen Räume zu öffnen, wo wir die Erfahrung auch machen können,
5042300	5045300	dass Veränderung von uns selbst ausgehen kann.
5045300	5054300	Im Moment befinden wir uns in dieser abstrusen Situation, dass es diesen Wettbewerbsimperativ gibt
5054300	5060300	und dieser Wettbewerbsimperativ eigentlich verhindert, dass wir in ein gemeinsames Handeln kommen.
5060300	5065300	Und ein solches gemeinsames Handeln wäre aber aus meiner Sicht die Voraussetzung dafür,
5065300	5070300	dass wir überhaupt demokratische Erfahrungen machen können, also dass wir die Erfahrung machen können,
5070300	5075300	dass eben Veränderung von uns selbst ausgehen können, dass wir Alternativen verhandeln können,
5075300	5080300	dass wir Konflikte provozieren können, all das wären demokratische Erfahrungen.
5080300	5086300	Und nicht nur die, ich meine das, was vielfach von uns als demokratische Erfahrung wahrgenommen wird,
5087300	5091300	ist wählen zu gehen, was ganz viele Leute gar nicht tun.
5091300	5097300	Und das andere ist es dann vielleicht, sich noch irgendwie zivilgesellschaftlich vielleicht mal hier und dort zu organisieren.
5097300	5102300	Und das ist sicherlich wichtig und gut, aber es ist eben nicht genug.
5102300	5110300	Und ich denke, es ist wichtig, wieder den Blick darauf zu verschieben, auf die Bedeutung auch von kollektiven Organisationen.
5110300	5115300	Wir können einen Streik denken, wir können an gewerkschaftliche Formen der Organisation denken,
5115300	5120300	wir können an eben diese nachbarschaftliche Organisation denken und so weiter und so fort.
5120300	5126300	Und das erscheint mir doch wichtig zu sein, wieder mehr in die Debatte einzuführen, und zwar nicht nur praktisch.
5126300	5131300	Also wir sehen ja vielfach, besonders durch Extinction Rebellion, Black Lives Matter, Fridays for Future,
5131300	5135300	die Bewegungen selber sind ungemein präsent.
5135300	5144300	Das, was ich als meinen Auftrag verstehe, ist in gewisser Weise gleichzeitig auch auf so einer theoretischen Ebene
5144300	5150300	zu versuchen, die Bedeutung von Provokation für Demokratie wieder zu reklamieren.
5150300	5159300	Und was das jetzt konkret bedeutet für global gesehen oder auch für Institutionalisierung oder für die Kategorie der Bürger innen,
5159300	5164300	darüber habe ich mir noch keine Gedanken im Einzelnen gemacht.
5164300	5168300	Das fände ich nämlich persönlich einen unglaublich wichtigen Aspekt dann noch, muss ich sagen.
5168300	5174300	Also ich ertappe mich jedes Mal wieder jetzt hier, wenn du antwortest, ich stimme dir total zu,
5174300	5181300	ich stimme dir total zu in Bezug auf, dass diese Dinge wichtig sind, dass es eine Provozierbarkeit braucht,
5181300	5187300	um auch eben Konfliktträchtigkeit im positivsten Sinne für sich nutzbar zu machen,
5187300	5191300	ist dann wieder natürlich ein problematisches Wort, aber produktiv zu machen, wenn man so will.
5191300	5199300	Ja, aber für mich ist die Leerstelle einfach viel zu groß, die da dann noch mit einhergeht,
5199300	5208300	weil ich glaube sehr wohl, dass es zumindest eine Umschreibung der Wirkungslogiken jenseits des reinen Provozierens gibt,
5208300	5216300	die dann noch notwendig ist, auch um in einer breiten wirksamen Art und Weise überzeugend sein zu können,
5216300	5223300	weil ich persönlich, der ich ja der Sache total wohlgesonnen bin und alle deine Punkte eigentlich argumentativ teile
5223300	5228300	und das total wichtig finde als ein tragendes Element von Demokratien, dass sie provozierbar sind
5228300	5239300	und dass sie das auch ins Zentrum rücken im Sinne der Hervorbringung von neuem als Aufgabe.
5240300	5249300	Also selbst ich, der dem Ganzen total positiv gegenüber gesinnt ist, würde, wenn das jetzt als einen Vorschlag
5249300	5255300	für die Umstrukturierung von Gesellschaften hervorgebracht wird,
5255300	5263300	jenseits des Nachvollziehens der Sinnhaftigkeit von Provokation mit einem riesengroßen Fragezeichen zurückbleiben.
5263300	5267300	Und ich verstehe natürlich, dass das Fragezeichen bis zu einem gewissen Grad dazu gehört,
5267300	5274300	weil es ja auch eine Form des prozessualen Denkens ist und gerade diese Offenheit des zukünftigen,
5274300	5277300	ja ein Kernelement der gesamten Sache ausmacht.
5277300	5281300	Aber ich glaube es ist problematisch, wenn das im Widerstreit gedacht wird.
5281300	5286300	Also wenn das zu einer Art von in Anführungsstrichen Bilder verboten.
5286300	5290300	Ich nehme das Wort jetzt bewusst auch ein bisschen als eine Provokation vielleicht,
5290300	5294300	wenn das quasi miteinander verbunden wird, weil ich glaube nicht,
5294300	5300300	dass das Einsetzen von Provokation als zentralem Element oder Provozierbarkeit
5300300	5308300	als konstituierendes Element von Demokratie auf der einen Seite in einem Widerstreit stehen würde
5308300	5315300	zu dieser Auseinandersetzung mit der Frage von wie denn fundamentale Wirkungslogiken
5315300	5321300	auch institutionaler Gefüge in demokratisch organisierten Gesellschaften aussehen könnten.
5321300	5326300	Also ich persönlich bin jemand, der das andere auf jeden Fall dann auch noch braucht.
5326300	5331300	Und vielleicht verstehe ich dann, vielleicht habe ich dann das Buch deswegen auch ein bisschen
5331300	5339300	oder hat mich das Provozieren als ein Impetus vielleicht deswegen auch so ein bisschen unzufrieden zurückgelassen,
5339300	5347300	weil ich da dann vielleicht auch zu sehr dann so gefahren sehe, dass man vielleicht sich auf das Provozieren als Akt
5347300	5352300	so ein bisschen als eine Art von Übersprungshandlung hineinflüchtet, ja wohl wissend,
5352300	5357300	dass es bei der Provokation dann eigentlich bleibt, dass das dann eigentlich auch
5357300	5361300	und das sehe ich jetzt überhaupt nicht bei dir, aber die Gefahr sehe ich grundsätzlich schon,
5361300	5368300	dass das dann auch eigentlich in dieser Hinsicht vielleicht eine Gefahr birgt
5368300	5373300	als Übersprungshandlung für eigentlich Defetismus, wenn man so will.
5374300	5378300	Ja, das war jetzt nicht wirklich eine Frage.
5378300	5380300	Ja, bitte.
5380300	5384300	Das, was man vielleicht sagen kann, ist, dass diese Idee der Provokation,
5384300	5392300	der Versuch ist, ein Werkzeug an die Hand zu geben, in dem wir institutionelle Praktiken kritisieren können.
5392300	5398300	Also zum Beispiel könnte man sagen, dass Staatsbürgerin schafft,
5398300	5405300	einige Leute mit dem Recht ausstattet, provozieren zu dürfen.
5405300	5409300	Wenn wir das Provozieren verstehen als erstmal einfach nur ganz,
5409300	5415300	also in so einem ganz vereinfachten Sinne als die Handlungsmöglichkeit,
5415300	5419300	also als eine Form der Handlungsfähigkeit, um Alternativen verhandeln zu können,
5419300	5423300	dann könnte man sagen, dass Staatsbürgerin schafft, zum Beispiel mir das Recht gibt,
5423300	5428300	dass ich in Deutschland wählen kann, aber zum Beispiel hier jetzt nicht wählen kann.
5428300	5433300	Und wählen kann auch verstanden werden als ein Akt, Alternativen mit zu verhandeln.
5433300	5437300	Und gleichzeitig sehen wir also ein anderes Beispiel wäre zum Beispiel,
5437300	5445300	dass Menschen, die die Grenzen passieren und das tun ohne Papiere beispielsweise,
5445300	5448300	dass man das auch verstehen kann als ein Akt der Provokation.
5448300	5453300	Allerdings wird diese Möglichkeit zu provozieren immer mehr untergraben.
5453300	5458300	Und das ist etwas, was mich halt interessiert, also zu schauen wie beispielsweise dieses,
5458300	5462300	ich nenne es auch Recht auf Provokation, also es gab in der Antike gab es so ein Recht,
5462300	5467300	ein Recht, was so dafür stand, für so eine plebische Freiheit,
5467300	5473300	oder ausschließlich für Männer, eben dass wenn vom Magistrat eine Strafe verhängt wurde,
5473300	5480300	dann gab es das Recht auf Provokation, nämlich dann die Öffentlichkeit oder die Gemeinschaft
5480300	5487300	um Beistand anzurufen und diese Öffentlichkeit durfte dann diese vom Magistrat verhängte Strafe beurteilen,
5487300	5494300	also nochmal verhandeln. Und ausgehend von diesem Bild, von diesem historischen Moment,
5494300	5499300	bin ich dabei darüber nachzudenken, wie ein solches Recht der Provokation ausschauen könnte.
5499300	5504300	Einerseits im digitalen Kontext, aber eben auch verstanden in der Umkehrung als eine Kritik,
5504300	5512300	also zu schauen, wo derzeit institutionelle Praktiken verhindern, dass manche Zugang zu Konfliktprovokationen haben.
5512300	5516300	Entweder weil sie das Asylrecht radikal zurückfahren oder völlig unterbinden,
5516300	5522300	oder weil sie die Möglichkeit zu provozieren, also Konflikte zu provozieren, an Staatsbürgerinenschaft koppeln.
5522300	5527300	Und aus meiner Sicht ist beides ungemein problematisch und ich versuche darüber nachzudenken,
5527300	5531300	wie so ein Recht der Provokation, und zwar nicht nur im juridischen Sinne,
5531300	5538300	sondern auch durchaus als eine Praxis, die dann aber auch in Institutionen Eingang finden kann.
5538300	5543300	Und zwar im Beispiel im Kontext von Überwachungstechnologien zum Beispiel schlage ich vor,
5543300	5550300	dass wir über ein Recht der Nichtidentität nachdenken sollten, als so ein Beispiel für ein Recht der Provokation.
5550300	5554300	Also zu sagen, im Moment haben wir das Phänomen des Vorhersagetechnologien,
5555300	5561300	die im Grunde den Stempel aufdrücken und sagen im Zusammenhang mit Precrime und dir dann zum Beispiel sagen,
5561300	5569300	wann du oder ob du jetzt eine Straftat begehen wirst.
5569300	5574300	Möglicherweise wird man in diesen Pool dann gefasst.
5574300	5582300	Oder man geht in ein Geschäft rein und dann wird man sozusagen identifiziert als jemand,
5582300	5585300	der was gestohlen hat oder der möglicherweise was stiehlt und so weiter und so fort.
5585300	5589300	Und das, was ich versuche zu argumentieren, demokratietheoretisch, ist zu sagen,
5589300	5595300	dass das Recht auf Nichtidentität, also das Recht nicht mit sich identisch sein zu müssen
5595300	5603300	und ein Recht auf Disidentifikation, also die Möglichkeit von der digital zugewiesenen Identität zurücktreten zu können,
5603300	5607300	dass das schwerer wiegen muss als das Recht auf Anerkennung.
5607300	5611300	Also im Moment ist hier in der Verfassung festgeschrieben und in unserem Rechtsstaatsprinzip
5611300	5616300	dieses Recht auf Anerkennung, also Volkssouveränität hat ganz stark was mit so positiven Anerkennungsrechten zu tun.
5616300	5625300	Und ich sage, dass wenn wir davon ausgehen, dass es kein letztes Fundament gibt, auf das wir demokratische Gesellschaften aufbauen können.
5625300	5632300	Also es gibt kein universalistisches Prinzip, dass demokratische Gesellschaften und die Herrschaft rechtfertigen würden.
5632300	5638300	Also es gibt immer nur so vorletzte, die vorletzten Gründe, die immer wieder neu verhandelt werden müssen.
5639300	5646300	Also wenn es kein letztes Fundament gibt, dann können wir auch nicht davon ausgehen, dass es so eine letzte vollständige Identität gibt und so weiter.
5646300	5657300	Und das würde dann so weit gehen zu sagen, dass ein Recht zur Nichtidentität eben dem Recht auf Identifikation vorausgehen müsste.
5657300	5665300	Und konkret in der Praxis würde das beispielsweise bedeuten, so ein Recht auf Provokation würde dann bedeuten, dass die Beweislast auf der anderen Seite liegt.
5665300	5670300	Also die müssen erst mal beweisen, dass ich die Person bin, wo sie sagen, dass ich die Person bin.
5670300	5675300	Ja, statt dass ich beweisen muss, dass ich nicht die Person bin, wo sie sagen, dass ich aber die Person bin.
5675300	5677300	Also es wäre so ein ganz praktisches Beispiel.
5678300	5686300	Ich glaube, was bei mir ein wenig zurück bleibt, ist eben, also wie gesagt, ich finde das total unterstützend.
5687300	5706300	Ich glaube, ich frage mich am Ende eben einfach nur, inwiefern das insgesamt dann systemimmanente Provokationen sind und ob es nicht auch sowas wie kategoriale Provokationen gäbe, die dann in eine, vielleicht muss man es dann provokante Konstruktion münden oder sowas.
5706300	5708300	Muss man es dann so nennen oder so? Ich weiß es nicht.
5708300	5716300	Also ich teile das total alles, was du sagst und finde das absolut großartig und unterstützenswert.
5716300	5721300	Offensichtlich fehlt mir noch was.
5721300	5727300	Ich habe heute die Lehrstelle im Sinne der provokanten Konstruktion, ist, glaube ich, für mich dann noch zu groß.
5727300	5733300	Aber ich finde das alles unglaublich spannend und habe sehr, sehr viel gelernt bei deinem wirklich unglaublich interessanten Buch.
5733300	5739300	Rahel, am Schluss frage ich immer noch, wenn du dir Zukunft vorstellst, was stimmt dich freudig?
5739300	5743300	Das ist ja eine sehr schöne Frage.
5743300	5759300	Ich werde die Frage beantworten und zwar mit einem Zitat von, ja, von Jean-Luc Nocy, der was sehr Schönes über die, ja, über die Zukunft der Demokratie schreibt.
5759300	5771300	Und zwar sagt er, Demokratie bezeichnet die Pflicht zur Erfindung der Politik nicht als Ordnung von Zwecken, sondern als Mittel, die Räume zu eröffnen und offen zu halten, um sie zu erfinden.
5771300	5775300	So stelle ich mir die Zukunft der Demokratie vor.
