start	end	text
1399300	1405300	Also die Frage stellt sich ja, was wird überworfen auch im Zusammenhang der Erfahrungen, die jetzt gemacht werden?
1405300	1408300	Und was wird aber auch verstärkt?
1408300	1410300	Also welche Tendenzen verstärken sich?
1411300	1420300	Und da sehe ich doch ganz deutlich jetzt schon Anzeichen dafür, dass sich die Macht von Technologiekonzernen verstärken werden,
1420300	1432300	sich bereits verstärkt haben und hier auch insbesondere Kooperationen zwischen Nationalstaaten und den großen Konzernen beispielsweise jetzt schon verstärkt worden sind.
1432300	1442300	Und darin sehe ich eigentlich eher auch so unter so einer Demokratie, unter der Frage von, also unter diesem Demokratieaspekt eine ganz entscheidende Frage,
1442300	1450300	wie sich das in Zukunft auswirken wird, wenn sich dann sozusagen nationale Regierungen, die einen unglaublichen Zugriff haben auf Daten beispielsweise,
1450300	1457300	zusammentun mit gigantischen Tech-Konzernen, die auch unglaublichen Zugriff auf Daten haben und dann in gewisser Weise auch Abhängigkeit konstruieren.
1457300	1462300	Und dann inwiefern wirkt sich das auf Regulierungsmaßnahmen aus von diesen Tech-Konzernen?
1462300	1472300	Inwiefern wirkt sich das darauf aus, dass wir Möglichkeiten haben, diese Tech-Konzernen demokratisch zu kontrollieren, aber auch dann die Regierung in gewisser Weise demokratisch zu kontrollieren?
1472300	1480300	Also sozusagen zu schauen, was die eigentlich mit unseren Daten machen und wie die zusammenarbeiten mit diesen großen Technologiekonzernen.
1480300	1484300	Das ist tatsächlich die Frage, die mich besonders gerade umtreibt.
1484300	1490300	Ein zweiter Aspekt, der mir wichtig zu sein erscheint, ist die Frage von nationalistischen Bewegungen.
1490300	1496300	Also wie gehen diese Bewegungen hervor und gestärkt oder geschwächt?
1496300	1500300	Also wir haben in Deutschland ja gesehen, dass es da zu einer Schwächung kam.
1500300	1504300	Auch hier im Kontext von UK gab es eine Schwächung.
1504300	1514300	Aber jetzt beispielsweise hat die ehemalige Brexit-Partei sozusagen ihr Comeback angekündigt und zwar als eine Anti-Lockdown-Partei.
1514300	1520300	Und ich denke, auch das ist ein zweiter interessanter Aspekt für die Frage von Demokratie und Demokratisierung.
1520300	1534300	Wie sich nationalistische Parteien, wie sie die Stimmung nutzen oder die Situation nutzen und inwiefern sie mobilisieren werden.
1534300	1540300	Jetzt schon mobilisieren, aber dann auch in weiterer Folge mobilisieren werden.
1541300	1548300	Unbedingt, ja. Und nur quasi der Vollständigkeit halber sei noch gesagt, ich bin auch durchaus nicht optimistisch,
1548300	1557300	dass die Zeit nach den Corona-Maßnahmen dann eben in einem politischen Paradies mündet oder sowas.
1557300	1564300	Sondern es ist für mich glaube ich eher interessant, die Frage halt inwiefern da bestimmte Narrative in sich zusammenbrechen.
1565300	1575300	Also dass dann die politischen Apparate, Institutionen und so weiter nach der Krise unmittelbar dann in ihren üblichen Funktionslogiken noch verbleiben.
1575300	1583300	Und da dann sowas wie die schwarze Null durchaus wieder ausgerufen werden wird oder sowas, das kann ich mir sehr gut vorstellen.
1583300	1591300	Ich glaube, was ich interessant finde, ist halt immer die Frage, inwiefern diese übergeordneten Metanarrative,
1591300	1601300	inwiefern die, ob da quasi Brüche eingezogen werden, die so stark sind, dass eigentlich das als ein dominantes Narrativ nicht mehr überzeugend ist.
1601300	1606300	Und da hätte ich halt das Gefühl, dass wir da eventuell schon an einem Punkt angekommen sind,
1606300	1614300	wo dieses eben klassische neoliberale Narrativ, was ja auch durchaus eben mit so einem eben individualistischen Leistungsgedanken,
1615300	1623300	etwas Kompetitiven und natürlich auch eine Profitorientierung und auch einer marktbasierten Steuerung quasi verbunden ist,
1623300	1629300	dass diese Dinge mittel- bis langfristig, nicht kurzfristig, aber mittel- bis langfristig durchaus abgelöst werden könnten.
1629300	1634300	Und das heißt ja noch überhaupt nicht, dass das dann durch etwas Positiveres abgelöst werden würde.
1636300	1638300	Ich würde dazu ja noch kurz was sagen.
1638300	1646300	Ich denke, ein ganz entscheidender Aspekt ist eben diese Idee einer Leistungsgesellschaft, also diese Idee von Meritocracy.
1646300	1653300	Das heißt, dass diejenigen, die besonders hart arbeiten, dann es auch verdienen, was sie dann erreicht haben und so weiter.
1653300	1662300	Und diese Idee der Selbstverantwortung, also das sind ja ganz entscheidend auch kulturelle, ein kulturelles Selbstverständnis einer neoliberalen Gesellschaft.
1662300	1669300	Und da ist mein Eindruck schon, dass das nach wie vor auch im Zusammenhang der Corona-Pandemie ungemein präsent ist.
1669300	1678300	Also jemand ist ein guter Bürger oder eine gute Bürgerin, wenn man sich an die Regeln hält, an die Corona-Regeln hält.
1678300	1687300	Und für mein Gefühl wird hier ungemein, ist die politische Rhetorik eine ganz starke, die auf Eigenverantwortung setzt.
1687300	1690300	Also hier besonders in Großbritannien kann ich das sagen.
1690300	1700300	Das heißt, anstatt dass die Regierung hier beispielsweise eingesteht, ihre Fehler eingesteht und auch sagt, wir hätten das und das und das mehr machen können.
1700300	1712300	Und sie wurde vielfach dafür kritisiert, zu wenig zu tun, wurde stattdessen eine Rhetorik gefahren, die vor allen Dingen die Verantwortung an uns Bürgerinnen abgibt und sagt,
1712300	1717300	wenn wir das und das und das machen, dann sind wir alle sicher, dann sind wir alle.
1717300	1719300	Also es wurde dann auch zu einem moralischen Argument.
1719300	1725300	Es wurde nicht mehr ein politisches Argument, also ein politisches Argument im Sinne von Politik hat immer was damit zu tun,
1725300	1729300	sich entscheiden zu können, also zwischen Alternativen auswählen zu können.
1729300	1734300	Und deshalb muss man auch Alternativen verhandeln können, sondern es wurde zu einem moralischen Argument insbesondere.
1734300	1737300	Und bei Moral kann man nichts mehr verhandeln.
1737300	1740300	Da wird irgendwie festgesetzt, was ist gut und was ist schlecht.
1740300	1744300	Und dann bewegt man sich in diesen Parametern, was ist gut und was ist schlecht.
1744300	1755300	Und ich denke, darin liegt doch oder ich sehe da durchaus eine Paradede oder ich finde, das Verharrt verbleibt immer noch ganz stark in so einem kulturellen Selbstverständnis von Selbstverantwortung,
1755300	1767300	Selbstverantwortung und wenn die Infektionszahlen steigen, dann ist das unsere Schuld, also ist das unsere Schuld als Bürgerinnen.
1767300	1774300	Und es hat jetzt erst mal wenig damit zu tun, welche Schritte die Regierung beispielsweise unternommen hat,
1774300	1786300	wenn es zum Beispiel darum geht, die Krankenhäuser gut auszustatten oder andere Maßnahmen zu treffen, wo man sagen kann, da gibt es ganz andere Ressourcen beispielsweise.
1786300	1799300	Also hier gab es eine große Diskussion darüber, dass die Regierung einfach es verpasst hat, genügend Schutzmaterial zu bestellen und Ventilatoren und so weiter und so fort.
1799300	1817300	Und anstatt sozusagen mehr sich hier zu erklären und auch Maßnahmen zu treffen, gab es, wie ich gerade schon gesagt, eher die Diskussion darüber, warum wir eigentlich zu, warum wir die Verantwortung haben und warum wir es richten können und so weiter.
1817300	1824300	Das finde ich schon ganz spannend und das finde ich ist immer noch weiterhin in dieser Logik von Selbstverantwortung und wenn wir es gut machen, dann haben wir es gut gemacht.
1824300	1826300	Aber wenn es vielleicht läuft, dann ist es auch unsere Schuld.
1826300	1837300	Und das geht für mich an dem Gedanken von von Politik vorbei und auch an dem Gedanken an der Frage von ja, welche Aufgabe hat eigentlich Demokratie im Zusammenhang von Corona?
1837300	1843300	Also wie kann Demokratie in so Krisenzeiten denn eigentlich funktionieren und wie kann Demokratie ein Teil der Lösung werden?
1843300	1859300	Der Bewältigung dieser Covid-Krise, wenn man das so nennen möchte, das denke ich ist eine entscheidende Frage und diese Frage kann natürlich gar nicht so gestellt werden, wenn wir uns eher mit so moralischen Appellen aufhalten.
1859300	1877300	Absolut, ja, und es ist natürlich zusätzlich tragisch, dass gerade so eine Situation, die uns eigentlich so überdeutlich die diese Interdependenz eigentlich klar macht, dass die wieder zurück übersetzt wird oder gedeutet wird dann in solchen individualistischen Erklärungsmodellen.
1877300	1893300	Das ist natürlich ja schade einfach nur. Vielleicht gehen wir jetzt dann mal über zu den Alternativen, also die Ernüchterung über bestimmte Ausformungen der liberalen Demokratie.
1893300	1904300	Die hat ja nicht nur reaktionäre Kräfte auf den Plan gebracht, sondern auch eine Vielzahl an neuen Experimenten im Bereich der Deliberation und Partizipation entstehen lassen.
1904300	1916300	Worum handelt es sich dabei? Du bringst zum Beispiel die Bürgerinnenräte als ein prominentes Beispiel in deinem Buch. Und welches Demokratieverständnis liegt diesen Experimenten mehrheitlich zugrunde?
1916300	1930300	Wir sehen das schon seit einigen Jahren, dass die Unzufriedenheit mit der Politik, manche nennen es auch der repräsentativen Politik, dass diese Unzufriedenheit wächst.
1930300	1942300	Und jetzt statt zu warten, dass jetzt Reformbewegungen von innen sozusagen angestoßen werden, gibt es immer mehr Initiativen, die drüber nachdenken, wie ein Mehr an Demokratie aussehen könnte.
1942300	1955300	Also die tatsächlich wirklich mit neuen demokratischen Praktiken experimentieren, aber nicht nur mit Praktiken, sondern eben auch drüber nachdenken, wie wir neue demokratische Institutionen ausschauen könnten.
1955300	1966300	Und sich ganz konkret daran machen, diese Institutionen auch auszuprobieren und stetig auch weiterzuentwickeln. Und es gibt da eine ganze Reihe jetzt von Beispielen.
1966300	1980300	Ich meine, Nachbarschaftstreffen ist jetzt nicht unbedingt was Neues, aber insbesondere vielleicht als Kontext können wir daran denken, dass 2008 in der Weltwirtschaftskrise, dass bestimmte Länder von dieser Krise ganz besonders betroffen wurden.
1981300	1987300	Und wir sehen dann 2011 beispielsweise auch die zahlreichen Platzbesetzungen in Europa und darüber hinaus aber auch.
1987300	1999300	Und wir sehen, dass eine Forderung von den vielen Menschen, die auf diesen Plätzen waren und diese Plätze besetzt werden, war, dass sie eben eine wirkliche Demokratie wollten.
1999300	2016300	Also Forderungen nach mehr Demokratie, nach wirklicher Demokratie, nach einer Demokratie, die nicht nach den gleichen Logiken funktioniert, wie das derzeit passiert, nämlich nach so einer Repräsentationslogik, wo dann viele sagen, dass sie ihre Anliegen eigentlich gar nicht repräsentiert sehen.
2016300	2030300	Und genau die Leute haben da zusammengesessen auf diesen Plätzen und haben Anliegen, die sie ganz konkret betreffen, haben sie diskutiert und haben sozusagen sogenannte Assemblies abgehalten, also Versammlungen.
2030300	2047300	Und im Zuge dieser Weltwirtschaftskrise aber auch hat man gesehen, dass immer mehr, zum Beispiel Griechenland, aber auch in Spanien, dass immer mehr öffentliche Leistungen zurückgefahren wurden und dann an die Stelle dessen Nachbarschaftsnetzwerke getreten sind.
2047300	2057300	Also die Leute haben sich selber organisiert, die haben zum Teil Krankenhäuser, also so Gesundheitsinstitutionen auf die Beine gestellt, die haben dafür gesorgt, dass die Leute Zugang zu Bildung haben.
2057300	2071300	Also sie haben sozusagen selber Unterricht organisiert, Wohnraum organisiert, also all die Grundlegenden, also Bedürfnisse wurden gemeinsam nachbarschaftlich organisiert.
2071300	2087300	Und ein bekanntes Beispiel in diesem Zusammenhang ist dann, dass eben eine Bürgerinnenliste Barcelona in Comú 2015 es dann geschafft hat, also mit, geschafft hat, in die Regierung zu kommen in Barcelona.
2087300	2105300	Und das Besondere an dieser Regierung war beispielsweise, dass sie mit einer digitalen Infrastruktur ganz besonders gearbeitet hat, also mit einer digitalen Plattform, wo versucht wurde, solche Versammlungen, die vorher auf den Plätzen stattgefunden haben, permanent werden zu lassen.
2105300	2117300	Also Menschen mitentscheiden zu lassen, wenn es darum geht, darüber nachzudenken, wie man eben Wohnraum organisieren möchte, aber auch wie man irgendwie das Budget organisieren möchte.
2117300	2128300	Also wenn wir an participatives Budgeting beispielsweise denken. Genau, und das ist aber nur ein Beispiel und es gibt zahlreiche andere Initiativen, wie zum Beispiel losbasierte Bürgerinnenräte.
2128300	2138300	Also da wird gelost, wer in dieser Versammlung zusammentritt, um dann gemeinsam Empfehlungen zu erarbeiten für ein bestimmtes Thema, was im Vorfeld festgelegt wurde.
2138300	2148300	Es gibt sogenannte Minipublics, also man versucht oft auch im Zusammenhang mit diesen Bürgerräten, versucht man eben die Gesellschaft abzubilden repräsentativ.
2148300	2163300	Also losbasiert bedeutet nicht einfach nur, dass irgendwie willkürlich gelost wird, sondern man versucht schon, auch auf der Grundlage des Einwohner-Melderegistes, möglichst die Gesellschaft abzubilden, repräsentativ abzubilden.
2163300	2171300	Und dann kommen die Leute zusammen und tauschen sich aus und erarbeiten Empfehlungen, die dann in die Politik übergeben wird.
2171300	2178300	Und dann ist leider das Problem, dass es eigentlich nicht genügend Druckmöglichkeiten gibt. Also die Politik ist in der Regel nicht daran gebunden.
2178300	2186300	Vielleicht noch ein paar Beispiele. Also wir hatten jetzt in diesem Jahr in Frankreich die Klima Climate Assembly.
2186300	2195300	Es gibt es einerseits auf nationaler Ebene, aber es gibt es auch ganz kleinteilig auf lokalen Ebenen, wo einzelne Stadtbezirke solche Versammlungen abhalten.
2195300	2205300	Genau. Und die Frage danach, welches Demokratieverständnis liegt dem eigentlich zugrunde, ist vielleicht ganz einfach zu beantworten.
2205300	2213300	Also das Verständnis ist, dass die Demokratie verbessert werden kann über eine erhöhte Partizipation.
2213300	2222300	Also wir müssen die Partizipation steigern. Das ist sozusagen die Zauberformel zur Ergänzung der repräsentativen Demokratie.
2222300	2228300	Und die Idee ist es, also die Frage, wie kommen wir dahin? Also wie können wir die Partizipationen steigern?
2228300	2234300	Und da ist die Idee, dass wir das schaffen können durch Deliberation. Also Deliberation ist das Stichwort.
2234300	2244300	Und Deliberation bedeutet eine beratende Rede. Also Menschen kommen zusammen und tauschen sich aus, tauschen ihre Argumente aus zu einem bestimmten Thema.
2245300	2251300	Und da ist dann die Idee, oder das Ziel dieser beratenden Rede ist dann, dass man am Ende einen Konsens erreicht.
2251300	2262300	Und das Spannende bei diesem Demokratieverständnis ist jetzt, dass man davon ausgeht, dass sich die Präferenzen verändern können.
2262300	2272300	Also es gab lange so ein Demokratieverständnis, dass man gesagt hat, jeder hat, wir leben in einer Gesellschaft, die Individuen haben Präferenzen.
2272300	2278300	Und es geht jetzt darum, diese Präferenzen abzubilden. Und das ist die Aufgabe des Wählerinnenwillens.
2278300	2281300	Und wenn wir wählen, dann sind die Präferenzen abgebildet.
2281300	2293300	Deliberation jetzt sagt, diese Präferenzen sind nicht statisch. Wir können Räume öffnen und organisieren, wo Menschen sich zuhören,
2293300	2304300	wo Menschen auch Verständnis für die jeweilige andere Position entwickeln und aufgrund von Argumenten, die ausgetauscht werden, können sie auch überzeugt werden.
2304300	2309300	Also man kann sozusagen, man ist lernen und einsichtsfähig, was das bessere Argument betrifft.
2309300	2312300	Das ist so eine Annahme. Und Präferenzen können sich verändern.
2312300	2332300	Und am Ende steht man da und hat auch Konflikte, also tiefgreifende Wertkonflikte können überwunden werden, eben in dem so wechselseitiges Verständnis erreicht wird in diesen Assemblies, in diesen Versammlungen.
2332300	2342300	Die Legitimation, die dahinter steht, also wenn man sagt, mehr Demokratie durch mehr Partizipation, also hin zu einer partizipativen Demokratie,
2342300	2353300	die Idee, die dahinter steht, ist dann oft auch, dass die Know-how-Basis von politischen Entscheidungen gestärkt werden kann und auch eine breitere gesellschaftliche Akzeptanz aufgebaut werden kann.
2353300	2361300	Also von Seiten der politischen Entscheidungsträger innen, wie zum Beispiel in Frankreich jetzt bei der Climate Assembly, da wurde diese Climate Assembly einberufen.
2361300	2368300	Sozusagen von höchster Ebene, von Macron. Und da kann man natürlich fragen, was ist jetzt die Motivation?
2368300	2378300	Und oft ist es eben eine Motivation, der Kritik an den Institutionen und an der repräsentativen Demokratie zu begegnen und das interessanterweise,
2378300	2388300	und dann eben eine größere Akzeptanz herzustellen und das interessanterweise ist aber, und da komme ich jetzt auch schon zu den Schwächen dieser Demokratie-Experimente ist,
2388300	2395300	dass, wie gerade auch schon angedeutet, dass dann die PolitikerInnen an diese Empfehlungen gar nicht gebunden sind in der Regel.
2395300	2406300	Und das wird dann versucht, also man kann auf diese Versammlung, diese Bürgerräte kann man so sehen als eine Legitimationsbeschafferin.
2406300	2414300	Und deshalb gibt es jetzt auch schon Versuche, darauf zu reagieren und zu sagen, wir brauchen eigentlich ständige losbasierte BürgerInnenräte.
2414300	2424300	Also wie in Frankreich zum Beispiel die Forderung nach einer dritten Kammer, die dann eben darin besteht, dass immer wieder in periodischen Abständen Leute gelost werden,
2424300	2429300	die dann zusammenkommen und über drängende Fragen sich beraten und Empfehlungen abgeben.
2429300	2437300	Aber zumindest, dass das sichtbar ist und dass es nicht so eine Momentaufnahme ist und dann im besten Falle auch, dass diese Versammlung mehr Durchsetzungskraft bekommt.
2438300	2445300	Und KritikerInnen würden hier sagen, dass es, zum Beispiel, ein Beispiel ist das Extinction Rebellion beispielsweise.
2445300	2449300	Die fordern auch, dass es so eine Klima-Assembly geben sollte.
2449300	2458300	Und KritikerInnen beispielsweise sagen dann, dass solche Versammlungen oder BürgerInnenräte schon per Gesetz, per Verfassung keine Legitimation haben können.
2458300	2463300	Es gibt das Parlament, das Parlament, die Vertretungen im Parlament sind gewählt.
2463300	2470300	Und wenn wir jetzt plötzlich so nach dritten, wie in Frankreich nach dritten Kammer jetzt noch Handlungsmacht zusprechen,
2470300	2475300	dann würde das ja das System einer parlamentarischen Demokratie absurdem führen.
2475300	2481300	Also das sind Stimmen von KritikerInnen, die sich ganz entschieden gegen diese neuen Demokratie-Experimente aussprechen.
2481300	2487300	Genau, das ist interessant. Aus meiner Sicht ist das kein wirklich plausibles Argument,
2487300	2495300	denn es gibt zusätzlich zur repräsentativen Demokratie schon lange andere Formen der direkten Beteiligung.
2495300	2502300	Aus meiner Sicht die Schwächen an diesen Demokratie-Experimenten sind vielmehr,
2502300	2509300	dass es eben oft, was uns dort begegnet, ist ein Versprechen auf gleiche Repräsentation.
2509300	2512300	Und das ist aber oft gar nicht gegeben.
2512300	2520300	Also wir sehen zum Beispiel bisher, dass in diesen BildungsbürgerInnen, in diesen losbasierten BürgerInnen oftmals deutlich überrepräsentiert sind.
2520300	2524300	Und auch, dass der Input von ExpertInnen teilweise unausgewogen ist.
2524300	2531300	Und das, was ich schon öfters jetzt gesagt habe, dass die Regierungen an die Handlungsempfehlungen gar nicht gebunden sind.
2531300	2536300	Aber das aus demokratietheoretischer Sicht für mich entscheidender Argument ist zu sagen,
2536300	2545300	dass dieses Prinzip einer kommunikativen Rationalität, also die Idee, dass wir Einsicht erlangen können in das bessere Argument,
2545300	2548300	dass das aus meiner Sicht ja doch eher problematisch ist.
2548300	2557300	Weil es reduziert demokratische Politik auf eine Problemlösungsfunktion.
2557300	2565300	Also auf diese Idee, dass demokratische Politik eine Maschine der politischen Wahrheitsproduktion ist.
2565300	2570300	Und dass wir einfach nur Räume schaffen müssen, wo Leute zusammenkommen können, sich austauschen.
2570300	2574300	Und dann kann man so etwas wie einer Weisheit der vielen beispielsweise anzapfen.
2574300	2585300	Und aus meiner Sicht ist das deshalb problematisch, weil es die Bedeutung von Konflikten und, was ich nenne, Provokationen eben für eine lebendige Demokratie nicht anerkennt.
2585300	2593300	Und das wäre aus meiner Sicht aber die Voraussetzung dafür, damit Demokratien sich überhaupt immer wieder neu selbst regulieren können.
2593300	2599300	Weil Demokratien produzieren beständig neue Ausschlüsse und da kommen wir vielleicht gleich im nächsten Schritt noch dazu, uns das genauer anzuschauen.
2599300	2605300	Und deshalb brauchen sie eben Konflikte, um diese Ausschlüsse immer wieder neu auch verhandeln zu können.
2605300	2611300	Vielleicht noch eine letzte Schwäche, um den Bogen nochmal zurückzuspannen zu diesem neoliberalen Narrativ,
2611300	2620300	was natürlich in gewisser Weise mitschwingt bei diesen Demokratie-Experimenten ist, dass sie einen freien Markt der Zirkulation von Ideen annehmen.
2620300	2627300	Also da gibt es so ein bisschen diese Idee von, es gibt gute Ideen dort und die Leute müssen sich austauschen.
2627300	2638300	Und dann wird am Ende die beste Idee, die beste Idee kann man dann fassen, die dann auch die beste Lösung für ein bestimmtes soziales Problem darstellt.
2638300	2647300	Und ich denke, das ist aus meiner Sicht hochgradig problematisch, weil es natürlich bestehende Ungleichheiten verschleiert, zuweilen zementiert auch.
2650300	2656300	Ausgehend von der Kritik an bestimmten Formen des Experimentierens, wie du es jetzt auch gerade beschrieben hast,
2656300	2665300	bringst du dann einen anderen Begriff, eine andere Bewegung, eine andere Betonung vielleicht auch ins Feld.
2665300	2670300	Nämlich das Provozieren. Wie kann das aussehen und was kann es leisten?
2670300	2675300	Das, was ich vorschlage, ist in dem Buch eine Blickverschiebung.
2675300	2685300	Also wenn wir, ja die Ausgangsfrage ist, also die Struktur des Buches ist einerseits zu zeigen, was das Problem mit der heutigen Demokratie ist,
2685300	2693300	dann zu sagen, dann versuchen ein bisschen zu erklären, warum wir dennoch an Demokratie festhalten sollten und schließlich die Frage, wie wir sie erneuern können.
2693300	2701300	Und das, was ich jetzt versuche, ausgehend von einer Kritik der aktuellen Demokratie-Experimente, ist jetzt eine Blickverschiebung,
2701300	2717300	die versucht zu zeigen, warum Provokationen, und mit Provokationen meine ich Konflikte, wir können an zivilen Ungehorsam denken, an Proteste denken, an Blockaden denken,
2718300	2726300	beispielsweise, warum Provokationen eine Voraussetzung für Demokratie sind.
2726300	2734300	Die theoretische Annahme ist, dass die theoretische, wir haben darüber gar nicht so viel gesprochen,
2734300	2741300	aber das im Grunde das Verhältnis von Demokratie und Zukunft ist eines, das vermittelt ist über Ungewissheitserfahrung.
2741300	2747300	Also das, was ich argumentiere, ist, dass Ungewissheit ein Wesensmerkmal von Demokratie ist.
2747300	2757300	Ich hatte es hier und da schon im Gespräch angedeutet, also die Idee von moderner Demokratie, dass eben Herrschaft nicht legitimiert wird über so essenzialistische Annahmen,
2757300	2764300	eine Volkssouveränität beispielsweise, sondern dass Demokratie darauf abzielen muss, sich immer wieder neu zu hinterfragen.
2764300	2771300	Also immer wieder die eigenen Kategorien und Prinzipien immer wieder erneut zu hinterfragen.
2771300	2777300	Und das hat was damit zu tun, dass eben Demokratie und Rechtsstaat, und das hatte ich auch schon kurz erwähnt,
2777300	2786300	eben immer nur der Versuch sind, bestimmte Prinzipien zu institutionalisieren, und dieser Versuch ist nicht perfekt.
2787300	2790300	Und dieser Versuch kann immer auch nur vorläufig sein.
2790300	2798300	Und Wahlen haben immer nur die Funktion, die das, was Lefort zum Beispiel den leeren Ort der Macht nennt.
2798300	2804300	Also Lefort spricht von Demokratie als einem symbolischen Dispositiv von einem leeren Ort der Macht.
2804300	2809300	Und dieser leere Ort der Macht, der wird immer nur temporär besetzt durch beispielsweise Wahlen.
2810300	2817300	Und die Aufgabe von Demokratie muss es sein, dass dieser Ort der Macht niemals vollständig geschlossen wird.
2817300	2821300	Und das ist das, worauf die Idee der Provokation fußt.
2821300	2830300	Also die Idee der Provokation steht in der Tradition der radikaldemokratischen Theorie
2830300	2842300	und geht davon aus, dass Demokratie zuallererst einen Modus des Streits beschreibt um die Einrichtung von Gesellschaft.
2842300	2847300	Also die Idee ist es, dass die Konturen der Gesellschaft immer um Kämpf bleiben.
2847300	2851300	Wenn wir zum Beispiel in die Demokratiegeschichte schauen, dann können wir sehen,
2851300	2857300	dass Bewegungen uns immer eine stärkere Demokratisierung aufgezwungen haben.
2857300	2860300	Das wird zwar oft gerne übersehen.
2860300	2869300	Also zum Beispiel hier gab es jetzt im Sommer in Großbritannien den Vorstoß von 175 Wissenschaftlerinnen,
2869300	2880300	die kritisieren, dass es gibt hier den Staatsbildentest und als Teil dieses Tests muss man Fragen beantworten und ein Buch lesen im besten Falle.
