start	end	text
0	5560	Herzlich willkommen bei Future Histories, dem Podcast zur Erweiterung unserer Vorstellungen von Zukunft.
5560	11520	Mein Name ist Jan Groß und ich spreche heute mit Marlies Wirth und Paul Feigelfeld über künstliche Intelligenz.
11520	16760	Die beiden haben zusammen die Ausstellung Uncanny Values Künstliche Intelligenz und Duko ratiert,
16760	23680	die derzeit im Wiener Museum für angewahnte Kunst läuft und dort noch bis zum 6. Oktober 2019 zu sehen sein wird.
23680	28480	Wundert euch nicht, ich werde während des Interviews einmal auf eine andere Audioquelle umsteigen,
28480	33320	da es einen technischen Ausfall gab. Zum Glück gab es das B-Mikrofon,
33320	36880	sodass ihr in dem Genuss des vollen Interviews mit den beiden kommen könnt
36880	41400	und ich werde im weiteren Verlauf dann auch wieder zur ursprünglichen Audioquelle zurückkehren können.
41400	46880	Es war mal wieder ein ausgesprochen interessantes Gespräch für mich mit Perlen wie diesen hier.
46880	55040	In Wirklichkeit aber müssen wir uns vielleicht eben auch damit anfreunden und dann anfangen auf der Basis zu arbeiten, dass wir Arschlöcher sind.
55040	60760	Und dass keine Technologie das richten wird.
60760	65600	Lasst mich wissen, was ihr zu dem ganzen denkt, zum Beispiel auf Twitter unter Hashtag Future Histories
65600	72000	oder in unserem Subreddit oder per Mail unter future-histories-at-protonmail.com
72000	86080	Und wenn ihr den Podcast darüber hinaus unterstützen wollt, dann könnt ihr das auf Patreon unter www.patreon.com-future-histories.
86080	88920	Herzlich willkommen Marlies und Paul.
88920	90280	Danke für die Einladung.
90280	92160	Hallo Jan.
92160	96920	Fangen wir mal mit der Definitionsfrage an. Was ist künstliche Intelligenz?
96920	104480	Es ist eine ziemlich schwierige Frage. Ich glaube, künstliche Intelligenz ist ein sehr weiter und sehr ehreführender Begriff,
104480	113320	den es schon sehr, sehr lange gibt, der vielleicht zeitweise besser umschrieben wäre mit Maschinenintelligenz oder maschinischer, technischer Intelligenz,
113320	119960	aber als Forschungsgebiet sich aufteilt in verschiedene Techniken- und Methodengebiete.
119960	123840	Also es ist ein Begriff, der jetzt nicht unbedingt einen Zustand beschreibt.
123840	131080	Es gibt keine künstliche Intelligenz in dem Sinn, sondern einen Komplex von verschiedenen Techniken des Verstehen und Lernens,
131080	139680	die durch verschiedene Algorithmen und andere Methoden der Berechnung vollzogen werden können.
139680	146000	Und welche sind die derzeit am häufigsten angewandten Techniken in Bezug auf künstliche Intelligenz?
146000	153920	Seit ein paar Jahren geistert dieser Begriff Deep Learning durch die Gegend, der sich irrsinnig gut anhört,
153920	161680	deswegen auch, glaube ich, so beliebt ist, allerdings das Problem mit sich bringt, dass er in seiner Tiefe auch sehr schwer nachvollziehbar ist.
161680	166640	Diese Tiefe hat allerdings überhaupt nichts mit Tiefsinnigkeit zu tun, sondern hat einfach damit zu tun,
166640	174960	dass im Prinzip mehrere neuronale Netzwerke, mit denen versucht wird, irgendwie Neuronen im menschlichen Gehirn nachzuäffen,
174960	184440	aufeinander geschichtet werden und dabei eine bestimmte Fähigkeit trainiert wird, nämlich in die Tiefe, also vertikal.
184440	191320	Das heißt, dieses Wissen, das hier produziert wird, ist eins, das sich überhaupt nicht irgendwie horizontal und vertikal vernetzt
191320	197600	und besonders allgemein oder universell wäre, sondern dann zum Beispiel, und da gehen diese Anwendungsgebiete momentan hin,
197600	202800	eine Sache besonders gut kann, in der Regel schon weitaus besser und schneller als Menschen.
202800	211840	Das kann sein, Bilderkennung im medizinischen Bereich, weil zum Beispiel so ein Deep Learning-System schon dreieinhalb Milliarden Bilder
211840	216760	von menschlichen Augen gesehen hat und deswegen sehr gut darin ist, grauen Start zu erkennen,
216760	225040	viel mehr Bilder als ein menschlicher Arzt, das in seiner Lebzeit je kann, dafür aber nicht in der Lage ist, irgendwas anderes zu tun.
225040	229280	Das wäre so eine Technik, die die letzten Jahre in aller Munde war.
229280	237720	Da gab es dann eben auch AlphaGo, das berühmte Go-Programm von Google, oder Deep Dream, das ist alles im selben Methodenbereich.
237720	245800	Und momentan sprechen alle von den sogenannten ganz Generative Adversarial Networks, die verantwortlich zeichnen für Deepfakes,
245800	253240	wo sich ja derzeit die Ereignisse jeden Tag, jede Stunde überschlagen, was solche Generative Adversarial Networks sind.
253240	261480	Zwei Netzwerke, die sozusagen miteinander gegeneinander lernen, in der Lage sind zu produzieren.
261480	272720	Das heißt, das fing an damit, dass man versucht hat, bestimmte Ähnlichkeiten herzustellen oder herauszukitzeln aus solchen Bilddatenbanken zum Beispiel.
272720	277800	Also man gibt dem Ding so und so viele Bilder als Training-Datenbank und sagt dann, zeige mir was Neues,
277800	284480	verstärke nicht bestimmte Bildmerkmale, sondern mach mir zum Beispiel ein völlig neues Gesicht. Das war dann so das erste, was es gab,
284480	289440	diese berühmte Webseite This Person Does Not Exist.
289440	300600	Dann gab es die Porn-Deepfakes, wo man in der Lage war, eben fotorealistisch und zwar im Bewegtbild Gesichter von Prominenten auf Pornodarstellerinnen drauf zu montieren.
300600	308040	Das Ganze hat sich dann weiter ausgedehnt in die Politik und so weiter und ist ja mittlerweile ein gesellschaftspolitisches Thema geworden,
308040	319080	weil natürlich mittlerweile, und das ist gut so, die Risiken, die das Ganze mit sich bringt für die Manipulation im öffentlichen Raum,
319080	323720	im öffentlichen Bewusstsein, den Leuten langsam bewusst werden.
323720	330120	Wir kommen definitiv dann noch später zu den verschiedenen Anwendungsfeldern, aber mich würde noch interessieren,
330120	337000	du hast jetzt von neuronalen Netzen gesprochen, die in sogar der anderen Herangehensweise dann quasi gegeneinander antreten.
337000	344200	Nur damit ich das verstehen kann, basiert das grundsätzlich immer noch darauf, dass es quasi eine große Masse an Daten gibt,
344200	353600	dass die auf bestimmte Strukturähnlichkeiten analysiert wird und dass der Anteil der künstlichen Intelligenz oder das Intelligente an dem Ganzen
353600	360640	eigentlich darin basiert, dass man sozusagen in Bezug auf diese Mustererkennung sich selbst trainierende Algorithmen hat,
360640	367000	also die quasi ganz viele verschiedene Methoden versuchen, also Wege versuchen, bei manchen erfolgreich sind,
367000	372000	dann den Weg weitergehen, wieder ganz viele verschiedene Versuche und so weiter und so fort.
372000	375200	Also ist das immer noch die grundsätzlichste Herangehensweise?
375200	377440	Im Grunde genommen ja, so funktioniert das.
377440	385360	Also wir haben und deswegen befinden wir uns momentan an diesem Punkt, der sich sozusagen technikgeschichtlich entwickelt hat,
385360	394120	nachdem wir lange Zeit im sogenannten Winter of AI gefroren haben, gepaart mit Smartphone-Technologie
394120	403960	ab ungefähr Mitte der 2000er, 2007 Einführung des iPhones, mit Big Data und dem wahnsinnigen Aufkommen von Daten als Ressourcen
403960	410360	und der steigenden Möglichkeit und Kapazität von Prozessoren das Ganze zu verarbeiten,
410360	415880	hat sich jetzt sozusagen eine Kontingente, ein Moment ergeben, wo das funktionieren kann.
415880	418680	Plus es hat einen Infrastrukturwandel stattgefunden.
418680	427880	Die großen Konzerne haben allesamt innerhalb der letzten zehn Jahre angefangen, ihre inneren Methoden so weit umzuändern,
427880	436200	dass alles, was da an Daten prozessiert wird, zu einem Teil auch benutzt wird, um weiter an Methoden des Machine-Learnings
436200	438200	und der künstlichen Intelligenz zu arbeiten.
438200	445160	Das heißt, jeder Facebook-Post, jeder Instagram-Post, jede Google-Suche und so weiter wird auch dahingehend ausgewertet
445160	453160	oder zu Trainingszwecken eingesetzt, um verschiedenste Systeme, das kann eben alles sein, von Spracherkennung,
453160	458440	Bilderkennung, jede Form von Prediction und so weiter zu trainieren.
458440	464600	Was allerdings nicht außer Acht zu lassen ist, ist, dass es in dem Ganzen immer noch und auch weiterhin
464600	469960	einen sehr großen Anteil menschlicher Arbeit gibt, der zum Teil kaschiert wird.
469960	479000	Das ist ganz interessant, dass dadurch, dass es auch ein verkaufs-, wie sagt man, ein Unique Selling Point ist,
479000	484040	für viele Firmen zu sagen, wir benutzen Machine-Learning, dass viele sich das auf die Fahnen schreiben,
484040	493800	in Wirklichkeit aber irgendwo in Bangladesch sich 500 Leute in einem Call-Center oder sonst wo für Microlabor bezahlen,
493800	498280	die dann so eine Anfrage erkennen, die überhaupt nicht von Machine-Learning beantwortet wird oder sonst was,
498280	505000	sondern in Wirklichkeit von irgendjemandem, der dafür unterhalb jeder Armutsgrenze bezahlt wird.
505000	512040	Eine letzte Frage muss ich noch dazu stellen, wo ist der Punkt, an dem man dann eigentlich von Intelligenz spricht,
512040	517000	oder ab wann fängt man an, von Intelligenz zu sprechen, weil auf eine Art, und ich habe so das Gefühl,
517000	522520	mir fehlt da wie so ein Puzzlestück oder so, habe ich das Gefühl, dass es sich da jetzt primär immer noch
522520	532840	um wie so eine avanciertere Brute-Force-Methode handelt, also wo quasi eigentlich mit einer großen Rechenleistung
532840	536840	einfach eine große Vielfalt ausgetestet wird und manches funktioniert und manches nicht.
536840	543960	Auf der anderen Seite gibt es ja dann so Phantasmen der Emulation von menschlichen Gehirnen,
543960	551400	wo dann ja auch viele Aufladungen mit einhergehen in Bezug auf eine Menschenähnlichkeit.
551400	557240	Wie soll dieser Schritt vollzogen werden, von dem einen hin zu diesem idealisierten anderen?
557240	563720	Ist ja ein Paradoxerschild, eindeutig, also es ist sozusagen die Henne-AI-Frage,
563720	570360	weil wir nicht wissen, wie unser Hirn so richtig funktioniert, also was sollen wir dann um Himmels willen emulieren oder simulieren?
570360	575880	Ne, also wir wissen nicht, wie Intelligenz funktioniert, also die Definitionen von Intelligenz,
575880	585160	an denen hier gearbeitet wird, mit denen hier operiert wird, die ganze Zeit sind ein ganzes Spektrum verschiedener Bereiche auch dessen
585160	593240	und natürlich kommt da auch viel an sozusagen menschlichen Ängsten und so weiter,
593240	599160	deswegen auch in der Ausstellung der Begriff, der an Kenningens, der Unheimlichkeit so im Zentrum steht,
599160	607560	wie wir damit umgehen, also irgendwie wollen wir ja auch gar nicht, dass das überhaupt passiert,
607560	610760	weil wir auch Angst haben davor, was dann mit uns passieren könnte,
610760	619400	aber einerseits ist es eben so ein strange loop, wo man denkt, wir müssen erst selber verstehen, wie wir verstehen,
619400	626520	um eine künstliche Intelligenz produzieren zu können, gleichzeitig müssten wir eine künstliche Intelligenz implementieren, um uns verstehen zu können.
626520	632760	So dreht sich das, wie dieser Schritt oder dieser Schritt, der sich schlussendlich vollziehen werden, weiß ich nicht,
632760	641720	mir scheint wichtig vor allem, glaube ich, dass man so ein bisschen von diesem pre-kopernikanischen Standpunkt abkommt,
641720	648440	das hat Benjamin Weitem ganz gut beschrieben in einem Text, dass er so ein bisschen vermutet oder wir zumindest in Erregung ziehen sollten,
648440	656920	dass wir uns, was unsere Konzeptionen von menschlichen Geist, von Intelligenz, der Art und Weise, der Wirklichkeit und so weiter funktioniert,
656920	665560	weiter an einem Punkt befinden, der kurz zu einer koperikanischen Runde steht, so wie man damals auch davon ausgegangen ist über Millenia,
665560	673640	dass es ein, sagen wir jetzt zum Beispiel, geozentrisches Weltbild gibt und das war in Stein gemeißelt, dass wir jetzt sagen,
673640	681240	wir sind der Messstein für das, was Intelligenz ist, ohne dabei zu wissen, was Intelligenz ausmacht, genau,
681240	688760	aus der schwaligen Definition darüber, dass wir lernfähig sind, verschiedene Fähigkeiten miteinander verbinden können und so weiter.
688760	697720	Und das finde ich eigentlich einen guten Ausblick, dass man sagt, und ich glaube sozusagen, also ganz salopp gesagt,
697720	704680	wir müssen uns vielleicht ein bisschen locker machen bei dem Ganzen, ohne dabei zu sehr jetzt einerseits zum Beispiel
704680	715880	in einer Technologiebranche zu folgen, die da natürlich höchst affirmativ, aber mit ganz eindeutigem Monetarisierungs- und Profitgedanken rangeht
715880	726840	oder eine Regierungsinstitution, die da eindeutig natürlich angeht mit dem Interesse an Kontrolle und so weiter, zu sehen, die Arme zu spinnen.
726840	734920	Ihr breitet in der Ausstellung ja eine ganze Palette von Bereichen aus, in denen künstliche Intelligenz auch heute schon Einfluss auf unser aller Leben hat.
734920	740280	Das geht dann von Wirtschaft und Politik über Gesundheit und Forschung ein bisschen in Bereiche,
740280	747160	in denen man es vielleicht an sich nicht so vermuten würde, wie Spiritualität, Sex oder Liebe.
747160	753640	Kannst du uns ein paar Beispiele geben, inwiefern künstliche Intelligenz unseren Alltag heute schon beeinflusst?
753640	759960	Ja, vielleicht auch noch kurz zu diesem Thema Intelligenz generell, wo ja immer von Gehirn ausgegangen wird
759960	765240	und den Menschen natürlich auch eine wahnsinnige körperliche Intelligenz besitzen, die manchen vergessen wird.
765240	774760	Die Art, wie wir lernen, Kulturtechnik, wie wir lernen, sind ja auch bestimmt von unserem physischen Sein und von unserem Zusammenleben als Gesellschaft.
774760	785480	Da sind wir am Rande zu den Themen. Es ist natürlich wichtig, dass man sich überlegt, dass diese Begriffe natürlich Menschenbegriffe sind und künstliche Intelligenz zwar reinspielt,
785480	792280	aber per se keine interessanten Themen hat. Was Gefühle betrifft, sind wir da natürlich weit entfernt.
792280	801080	Wir haben allerdings versucht, mit einem schon genannten GAN, einem Generative Artificial Network, auch neue Emotionen darzustellen in dieser Ausstellung,
801080	809720	mit dem AI-Emoji, den AI-Generated Emojis, die von Fossil Studio mit uns entwickelt wurden und versuchen, mit uns jetzt zu kommunizieren.
809720	819960	Im Bereich der Politikgesundheit wurden auch schon Beispiele genannt, natürlich die Deepfakes, die sind auch konkrete Anwendungsbeispiele, die uns auch gefährlich werden,
819960	831480	die Bots, die quasi meinungsbildend einwirken in sozialen Medien, die verwält werden, um verschiedenste Ansichten zu verstärken und zu verbreiten,
831480	840920	ein Ausmaß, das normale User, menschliche User einzuschreiben würden. Im Gesundheitsbereich natürlich medizinische Einsatzgebiete,
840920	852680	die wieder leider gekoppelt sind an nationale AI-Strategien, wie beispielsweise in Singapur zur Bekämpfung von Diabetes Typ 2, was ja per se mal positiv klingt,
852680	859160	man kann das sehr gut mittlerweile erkennen mit Qualitsystemen, andererseits ist man sofort in einem regigen System gekoppelt,
859160	867640	in dem Gesundheitsdaten gegen einen verwendet werden und man keinen Versicherungsschutz mehr erhält, weil man bereits als gefährdete Person eingestellt wird,
867640	878920	bis hin zu Spiritualität natürlich, das ist so ein neuartigem Glauben, wo Menschen jetzt anstatt einer höheren Gewalt im Sinne einer kirchlichen,
878920	888760	gottähnlichen Gestalt jetzt glauben, dass KI uns retten kann, unseren Planeten retten kann, bessere, klügere, weisere Entscheidungen treffen kann als der Mensch,
888760	899960	und das ist natürlich fragwürdig, weil die Daten, die wir zur Verfügung stellen für diese Lernsysteme, immer noch von einer Geschichte geprägt sind,
899960	909160	die jenseits von einer sogenannten Gerechtigkeit oder sozialen gleichen Verteilung stattgefunden hat und bis heute natürlich hier problematisch ist,
909160	915160	wenn wir uns anschauen, dass beispielsweise in der Schweiz das Frauenwahlrecht auch erst vor 30 Jahren implementiert wurde,
915160	926600	möchte man nicht wissen, welche Daten diese Maschinen eigentlich lernen, welche Relevanz, welche Personen in der Gesellschaft und unserem Zusammenleben einnehmen.
926600	935160	Das darf man natürlich nicht aus der Augen lassen, wenn man sich anschaut, wie KI-Systeme auf welcher Basis sie Entscheidungen haben.
935160	945400	Da sprichst du ein ganz wichtiges Thema an, das Thema der Daten, denn zumindest so wie ich das verstanden habe, liefern diese Daten letztlich eigentlich den Rohstoff,
945400	958360	auf dem sagen, all dieses Lernen ja basiert und entgegen einer so weit verbreiteten Meinung einer scheinbaren Objektivität von Daten ist es keinesfalls so, dass die neutral wären.
958360	968600	Könnt ihr da vielleicht noch ein bisschen uns das genauer näherbringen, welche Rolle spielen Daten in Bezug auf künstliche Intelligenz und welche Auswirkungen hat das?
968600	976360	Ja, das ist natürlich klar, die Frage ist immer, neutral kann kaum etwas sein auf der Welt, jede unserer Entscheidungen, auch von uns Menschen,
976360	984120	ist eigentlich subjektiv von unseren eigenen Zielen und Motivationen geprägt, wenn man sich anschaut, wer stellt diese Daten zur Verfügung und warum,
984120	994120	kommt man eigentlich sehr schnell drauf, dass es in der Hand von einigen wenigen großen Konzernen ist, die aufgrund vorhandener Ressourcen und finanzieller Mittel jetzt in der Lage sind,
994120	1004600	etwas weiter zu entwickeln als vielleicht kleinere unabhängige Forschungsinstitutionen, die es aber Gott sei Dank mehr und mehr gibt und da gibt es jetzt diesen netten Begriff King Gaffa,
1004600	1018600	Google, Amazon, Facebook, Apple, den wir ja wie die Basalen immer noch die anderen darbringen und zwar unbezahlt, dafür diese Systeme nutzen, die uns diese mächtige Instanz zur Verfügung stellt.
1018600	1028600	Und die Frage ist, mit welchem Ziel werden diese Daten verarbeitet und manchmal werden Ziele vorgeschützt, die haben Muskeln oder im Hintergrund geht es eigentlich,
1028600	1040600	wie Paul vorhin schon erwähnt hat, warum das Machine Learning betrieben werden kann, mit beispielsweise hunderten, tausenden Profilbildern von Usern auf sozialen Medien zum Beispiel,
1040600	1050600	an denen Gesichtserkennung, Emotionserkennung etc. betrieben wird, trainiert wird und was mit den Daten weitergemacht wird.
1050600	1059600	Und da entsteht natürlich auch aufgrund der Sachlage, dass diese ganzen genannten Großkonzerne zwar supranational operieren,
1059600	1069600	aber eigentlich aus den westlichen, amerikanischen Realms stammen, dass diese Daten nurmals neutral sein können und dass sie auch gar nicht dafür eingesetzt werden,
1069600	1075600	beispielsweise soziale Ungleichheit zu minimieren, sondern im Gegenteil, diese Clou da noch verdreht.
1075600	1086600	Also wir sind da glaube ich noch, um das noch zu ergänzen oder noch zu eskalieren, in seiner ganz eigenartigen Produktions- und Verarbeitungs-Kybernetik drin,
1086600	1096600	die damit zu tun hat, dass einerseits die Produktion dieser Daten eine ist, die völlig anders funktioniert wie noch vor einigen Jahrzehnten oder sogar nur Jahren.
1096600	1099600	Das lässt sich sehr schön nachvollziehen an Facebook zum Beispiel.
1099600	1106600	Also sagen wir so, ich glaube Big Data fing an in einem Moment, wenn eine Ressource geschaffen wurde, ohne dass man wusste, was man damit machen soll.
1106600	1112600	Es war wie Öl finden ohne ein Konzept davon haben, dass man das irgendwie verbrennen kann oder einen Motor bauen kann.
1112600	1121600	Und das hat dann relativ schnell funktioniert und die Plattformen, die dann entstanden sind, sind tatsächlich vergleichbar Ölplattformen,
1121600	1128600	die da sozusagen irgendwas geschafft haben anzuzapfen, irgendwelche sentimentalen Sedimente, die in uns dran sind
1128600	1134600	und diese herauszufunden, indem sie jedem die Möglichkeit geben, da sozusagen zumindest das auszuschütten,
1134600	1141600	haben das Ganze aber dann so weit schon raffiniert, also es ist so perfekt aufgebaut, dass wir nicht nur die Daten produzieren,
1141600	1146600	sondern auch schon sozusagen die Raffinerie mitgestalten.
1146600	1155600	Das war ursprünglich mal nur ein Like, Facebook hat dann angefangen sozusagen diese Emotionen, die man hat zu reagieren, schon zu verfeinern.
1155600	1162600	Das heißt, wir haben die Daten schon so weit voraufbereitet für die, dass es schon natürlich einiges an Arbeit gestarrt hat,
1162600	1166600	wie man diese Daten dann weiter zu klassifizieren hat.
1166600	1172600	Dann hat man eben gesehen im Rahmen des Arabischen Frühlings und der sogenannten Twitter-Revolutionen und so weiter,
1172600	1180600	da auch der Jump-Fall seit 2016, was für einen massiven Impact das hat und was es für massive Manipulationsmöglichkeiten geben wird.
1180600	1190600	Und ich glaube, das war ein interessanter Moment für die guten Leute von Twitter, Facebook und Co, die dann da standen und das Gefühl hatten,
1190600	1197600	Moment, was passiert denn hier eigentlich? Wir haben eigentlich gedacht, wir machen da was relativ harmloses, lustiges,
1197600	1204600	vielleicht ein bisschen machistisches oder sonst was im Fall von Facebook und plötzlich haben wir so einen globalen Impact
1204600	1211600	und wir haben irrsinnige Ressource in der Hand. Es gibt diese berühmten Records von Mark Zuckerberg, der ja noch ganz jung ist,
1211600	1215600	wo er dann sagt, I don't know why people give me this, they're fucking stupid.
1215600	1220600	Und ich glaube, so funktioniert im Ende diese ganze Industrie. Also da ist was entstanden.
1220600	1226600	Das heißt, einerseits sind schon die Plattformen, wo das produziert wird, wie diese Algorithmen dort funktionieren,
1226600	1234600	wie sie sozusagen kompartmentalisieren innerhalb dieser Kulturgruppen und so weiter, bringen eine Bias mit sich,
1234600	1242600	provozieren und eskalieren bestimmte Biases dann noch weiter, plus dann natürlich die Schritte.
1242600	1250600	Es gibt nicht irgendwie drohe Daten und dann werden sie irgendwo, kommen sie einer Bias an, sondern wir befinden uns in einem totalen Dickicht von Bias.
1250600	1259600	Das ist zeitweise schwer nachzuvollziehen. Es gibt da, sozusagen Manifestationen des Ganzen, die relativ auf der Hand liegen.
1259600	1266600	So was, was wir kennen aus der Presse mittlerweile, wie, keine Ahnung, ein selbstfahrendes Auto erkennt Afroamerikaner nicht
1266600	1269600	und überfährt ihn deswegen, weil es einfach nicht darauf trainiert ist.
1269600	1276600	Wir müssen aber, glaube ich, und das wird interessant in den nächsten Jahren, da noch viel, viel feiner werden
1276600	1283600	in der Erforschung des Ganzen und in der Ausarbeitung des Ganzen, weil wir da, glaube ich, da kommt ein Haufen Scheiße auf uns zu,
1283600	1290600	ganz salopp gesagt noch. Das wird richtig schlimm. Und da kommen, da sind viele Konsequenzen noch drin,
1290600	1296600	die wir noch überhaupt nicht abschätzen können. Und das vielleicht, um jetzt den Bogen zurückzumachen zu den Themen,
1296600	1303600	die wir versucht haben in der Ausstellung anzusprechen und den Künstlern, die wir ausgewählt haben,
1303600	1309600	das sind so die ersten Schritte zu zeigen, nicht nur was kann künstliche Intelligenz, sondern wie funktioniert es,
1309600	1317600	was sind die Mechanismen, die dahinter stattfinden, weil das Moment kann so ist, dass wir zwar ein bisschen Angst haben davor,
1317600	1324600	aber im Endeffekt ist es gerade ein bisschen ein Kuriositätenkabinett. Also die Hälfte davon ist gar nicht echt,
1324600	1331600	da sitzen irgendwo irgendwelche armen Programmierer und armen Kreuzunternehmer, die das Ganze in Wirklichkeit echt menschlich machen.
1331600	1338600	Die andere Hälfte ist Brot und Spiele, das spielt dann Go und macht irgendwelche lustigen Sachen und erzeugt irgendwelche funky Bilder
1338600	1346600	oder kann irgendwelche Musik komponieren. Aber das Ausmaß dessen und die Tatsache, dass das bereits dabei ist,
1346600	1353600	unsere Zivilisation und zwar überall auf der Welt umzukrempeln, ist noch nicht so richtig angekommen, glaube ich.
1353600	1357600	Und das wäre interessant, da anzufangen und daran zu arbeiten.
1357600	1365600	Und um in Bezug auf die Daten noch mal ein bisschen nachzuhaken, es gibt auf der einen Seite so etwas wie eine
1365600	1374600	in Anführungsstrichen eine Verschmutzung der Daten mit den Biases, die unsere Gesellschaft hat und die sich natürlich
1374600	1381600	dann in die Daten übertragen. Und das wäre mal ein grundsätzliches Problem, das ihr angesprochen habt.
1381600	1390600	Und dann darüber hinaus frage ich mich, inwiefern es ein strukturelles Problem gibt, das immer erhalten bleiben wird,
1390600	1401600	weil quasi ein Übersetzungsproblem besteht. Also weil Daten an sich in Information verwandelt werden und dadurch
1401600	1407600	eine Auslassung passiert, die auch nicht kaschiert werden kann, die auch nicht überbrückt werden kann,
1407600	1412600	weil sie auf einer strukturellen Ebene passiert.
1412600	1420600	Ja, also wie Madis gesagt hat, kann ich noch mal unterstützen, es gibt da keine Neutralität und es gibt keine Rotafen.
1420600	1428600	Das hat es nie gegeben. Es gibt diese komische Nähe davon, dass Daten in irgendeiner Art und Weise,
1428600	1435600	dass sie nichts heraus entstehen und dann neutral und pristine und sauber daherkommen
1435600	1439600	und wir sie dann erst wieder schmutzig machen. Nein, wir haben die Daten gemacht.
1439600	1446600	Es ist genauso wie Erdöl aus Knochen ist. Alles das trägt bereits eine Geschichte in sich.
