start	end	text
2848600	2852600	Daraus entwickelt sich der Grundgedanke der Permutation, dass ich sage, ich habe ohne
2852600	2856600	endlich viele Zustände irgendwo, ich kann sie aber mit endlichen Mitteln darstellen
2856600	2859600	und dementsprechend einfangen.
2859600	2866600	Als nächstes entsteht daraus zum ersten Mal wirklich eine mathematische Technik der
2866600	2871600	Vorhersage, das ist im 17. Jahrhundert erst, also noch gar nicht lange her im Vergleich
2871600	2877600	zu dem, was davor passiert ist, in zwei, drei, viertausend Jahren in Form der Infinitisimalrechnung
2877600	2879600	von Leibniz oder auch von Newton.
2879600	2883600	Das heißt, da hat man zum ersten Mal eine mathematische Technik entwickelt, basierend
2883600	2888600	auf der vorhergegangenen, mit der es möglich ist, tatsächlich in die Zukunft zu schauen,
2888600	2894600	hätte man vorausgesetzt, man hätte Rechengeschwindigkeiten, die schneller sind als unser eigenes Gehirn.
2894600	2896600	Das gibt es zu der Zeit natürlich auch noch nicht.
2896600	2902600	Leibniz wünscht sich famously ein Heer von Mathematikern und baut ja dann erste Rechenmaschinen,
2902600	2907600	die aber natürlich noch keine Differenzialgleichungen können, sondern nur für Speziesrechnungen.
2907600	2914600	Und macht aber entwickelt plötzlich etwas, was in der Lage ist, den Flux der Natur einzufangen
2914600	2917600	und aber auch vorauszusagen, was passieren wird.
2917600	2920600	Und das ganze Dispositiv der Berechenbarkeit.
2920600	2924600	Und damit zum ersten Mal auch der Idee des freien Willens kommt heraus, weil er sagt,
2924600	2926600	es kann sowas eigentlich gar nicht geben.
2926600	2930600	Wenn ich genug Parameter habe und die richtigen Methoden habe, kann ich aus einem vergangenen
2930600	2934600	und einem Ist-Zustand immer die Zukunft vorher berechnen.
2934600	2941600	Leibniz täten das aus auf die Diplomatie und sagt, wenn sich zwei streiten, kann man hingehen
2941600	2946600	und sagen, meine Herren, es muss überhaupt keinen Streit gehen, Kalkulemos rechnen wir.
2946600	2953600	Und das ist eine der sozusagen Urszenen einer Kultur, die sich bis heute auch weiterhin vorzieht.
2953600	2960600	Weil nichts anderes tun diese Maschinen die ganze Zeit, als bestimmte Zustände auf einer bestimmten Datenbasis
2960600	2965600	und Methodenbasis zu analysieren und zu entscheiden, was passiert als nächstes.
2965600	2968600	Der Unterschied ist, dass ich im Englischen kann man das schön machen.
2968600	2973600	Was sich da getan hat, ist, dass es nicht mehr um Prediction geht, sondern um Production.
2973600	2976600	Also was sich verschoben hat, ist, dass wir nicht mehr nur davon sprechen,
2976600	2982600	dass wir finally in der Lage sind, Zukunft vorherzusagen, was wichtig ist in jederlei Hinsicht
2982600	2986600	für Klimaentwicklungen, Wetter und so weiter.
2986600	2989600	Und eben immer schon kulturgeschichtlich wichtig war für jede Zivilisation.
2989600	2994600	Es ist wichtig zu überlegen, wie das Wetter wird, weil sonst geht einfach mal die Ernte kaputt.
2994600	3000600	Also es geht hier nicht darum, den Oracle nur zu machen, sondern das ganz handfeste pragmatische Gründe.
3000600	3006600	Was sich verschoben hat in dem Zeitpunkt, wo die Rechenkapazität die Methoden überholt hat,
3006600	3009600	also wo es tatsächlich das, was Leibniz sich gewünscht hat,
3009600	3014600	nämlich ich führte ganz viele Parameter, ganz viel Daten irgendwo rein
3014600	3017600	und mit diesen relativ einfachen Methoden bin ich dann in der Lage,
3017600	3022600	einfach wirklich Jahre oder Jahrhunderte in die Zukunft zu rechnen,
3022600	3028600	ist, dass wir aus der Vorhersage zur Herstellung von Wirklichkeiten gewechselt haben.
3028600	3033600	Das Beispiel, das ich dabei am schönsten finde und wo sich ein Wendepunkt ergeben hat,
3033600	3037600	ich habe leider vergessen welches Jahr das war, als der isländische Vulkan ausgebrochen ist
3037600	3046600	und den ich nicht aussprechen kann, der dafür gesorgt hat, dass der Flugverkehr global auf dem Boden blieb.
3046600	3049600	Wegen besagter Aschewolke, die da da war.
3049600	3053600	Diese Aschewolke gab es nur als Berechnung erst mal.
3053600	3058600	Das heißt, es wurde basierend auf einem Komplex von Berechnungsmodellen,
3058600	3062600	zuerst über die Ausbreitung dieser Aschewolke,
3062600	3068600	anhand allmöglicher Geodaten und Klimadaten und Winddaten und so weiter berechnet,
3068600	3072600	wie groß ist sie, wie ist sie beschaffen, wo breitet sie sich wahrscheinlich aus,
3072600	3077600	weiterhin angeschlossen an den Komplex von Versicherungen und so weiter,
3077600	3082600	die überlegt haben, wie viel würde uns das theoretisch kosten, das alles auf dem Boden zu behalten,
3082600	3086600	wie viel würde es uns kosten, wenn jetzt sieben Flugzeuge tatsächlich abstürzen,
3086600	3094600	deswegen bis hin zu dem Individuum und dem Todesfall eines einzelnen Fluggasses.
3094600	3098600	Und dann beschlossen wurde, das ist die Entscheidung,
3098600	3104600	da wurde eine globale Wirklichkeit kreiert, basierend rein auf einer Berechnung,
3104600	3109600	nicht auf einer Evidenz, die einzige Evidenz war, dass klar war, dieser Vulkan ist tatsächlich ausgebrochen,
3109600	3117600	aber die Entscheidung ist getroffen, die tatsächliche Messung der Aschepartikel in der Luft hat erst nach der Stadt gefunden.
3117600	3124600	Das scheint mir als zumindest eine Instanz eines Wendepunkts dessen, was das angeht, ganz wichtig
3124600	3129600	und daran, finde ich, lässt sich auch schön nachvollziehen, was es mit freiem Willen auf sich hat.
3129600	3137600	Ich denke, was uns menschlich macht, ist, dass wir glauben, dass wir freien Willen haben.
3137600	3142600	Ich glaube sehr stark an die Kontingenz und die Unvollständigkeit
3142600	3147600	und nicht komplette Nachvollziehbarkeit aller Prozesse.
3147600	3154600	Ich glaube aber, dass das freie Wille oder nicht freie Wille keine binäre Frage ist,
3154600	3157600	sondern eher die Frage ist, wie viel freier Wille.
3157600	3162600	Das heißt, es gibt sicherlich irgendwo was, wo wir als menschliche Akteure
3162600	3169600	und alles, was uns ergibt als lakanianisches Reales, genug Rauschen erzeugt.
3169600	3174600	Dieses Rauschen ist dann der freie Wille, wo irgendwas passieren kann,
3174600	3177600	wo ich vielleicht denke, ich kann eine Entscheidung mit treffen.
3177600	3183600	Aber die ganzen anderen Parameter, die da reinfließen,
3183600	3186600	alle Entscheidungen, die dem Ganzen vorhergegangen sind,
3186600	3192600	und alle jedes halbe Grad im Temperaturunterschied draußen,
3192600	3194600	wird irgendwie einen Einfluss darauf haben, was passiert.
3194600	3200600	Ich glaube auch, dass wir natürlich nicht alleine entscheiden, frei oder nicht frei.
3200600	3206600	Wir sind ja umgeben von Wesenheiten, von Dingen, von zunehmend auch smarten, intelligenten Dingen.
3206600	3211600	Aber auch in der Vergangenheit ist der Einfluss darauf, welchen Weg ich einschlage,
3211600	3215600	auch schon als Teilzeitmensch, mag vielleicht inspiriert sein, nicht durch freien Willen,
3215600	3220600	sondern ich sehe in der Ferne etwas, was mich interessiert, uns gehe den anderen Weg.
3220600	3222600	Und das zeichnet uns ja auch aus.
3222600	3226600	Also ich würde mir sagen, der Begriff der Vorstellungskraft oder auch Kreativität
3226600	3230600	ist ja auch noch etwas, was uns Menschen momentan mal,
3230600	3234600	was wir gerne als Alleinstellungsmerkmal für uns beanspruchen, sagen wir mal so.
3234600	3236600	Wir sagen, was machen wir damit?
3236600	3240600	Und wir haben das Potenzial, uns etwas vorzustellen und es manchmal auch zu erreichen.
3240600	3244600	Und diese Entscheidungsprozesse, wie wäre es, man stellt sich vor,
3244600	3247600	ich könnte das Feuer nicht nur dann haben, wenn der Blitz einschlägt,
3247600	3250600	sondern ich könnte es selbst erzeugen.
3250600	3253600	Oder ich könnte nicht nur einen guten Stein finden,
3253600	3257600	sondern ich könnte mir selbst ein Werkzeug erschaffen.
3257600	3263600	Also diese Idee der Einflussnahme ergibt sich auch manchmal durch Zufälle, denke ich,
3263600	3267600	und durch diese Umwege, oder wie du sagst, die die Kontingenz macht.
3267600	3269600	Na ja, aber es ist eine Herstellung von Wirklichkeit.
3269600	3271600	Natürlich, eine Herstellung von Wirklichkeit.
3271600	3276600	Exactly, that's what we do. Und natürlich haben wir uns auch die künstliche Intelligenz hergeträumt
3276600	3283600	und jetzt erforschen wir ein Spiel, kommt mir immer so vor ein bisschen noch damit, was eigentlich passiert.
3283600	3287600	Und die Vorstellungskraft reicht im Moment zumindest bei mir
3287600	3290600	und vielen Menschen nicht aus, uns vorzustellen, was da noch kommen kann.
3290600	3296600	Also dass man sagt, es gibt dann diese ganze Science-Fiction-Idee der Singularity oder so.
3296600	3299600	Aber eigentlich kann es ja auch in eine ganz andere Richtung gehen.
3299600	3305600	Also das fände ich ja spannender, wenn diese Art Prognosen, die da getätigt wurden,
3305600	3310600	über mehrere Jahrzehnte eigentlich nicht eintreffen, sondern etwas ganz anderes passiert.
3310600	3314600	Vielleicht abschließend wenden wir uns ganz konkret der Frage der Zukunft zu.
3314600	3319600	Es wurde ja schon angesprochen, eben Werkzeuge haben schon immer auch daran gearbeitet,
3319600	3324600	sagen Wirklichkeit herzustellen. Ihr sprecht es in der Ausstellung an.
3324600	3330600	Vielleicht lese ich einfach mal kurz das Zitat vor, denn es ergänzt sich mit einem anderen kurzen Zitat, das ich gefunden habe.
3330600	3335600	Ihr schreibt in der Ausstellung, durch die Erkennung von Sprache und Bildern, die Verarbeitung von Daten
3335600	3339600	und die algorithmische Analyse von Verhaltensmustern durch künstliche Intelligenz
3339600	3345600	rückt die Bestimmung einer Zukunft in den Fokus, die nicht mehr vorhergesagt, sondern hergestellt wird.
3345600	3351600	Und dem mag ich jetzt was beistehen, was ich vor kurzem gelesen habe in einem Interview mit Antoinette Rouvois.
3351600	3356600	Und die hat gesagt, wer den Raum der Potentialität beherrscht, wird der Herrscher der Welt.
3356600	3362600	Das heißt, wir sind wieder angekommen bei der Frage der Machtkonfiguration.
3362600	3371600	Aber in Bezug auf die Frage, inwiefern diese technologischen Möglichkeiten dazu beitragen,
3371600	3380600	eine Bandbreite von Zukunft eigentlich viel mehr zu verengen, als dass sie die erweitern, wie es oft postuliert wird.
3380600	3383600	Wahrscheinlich ist beides möglich, aber…
3383600	3389600	Also total gut, ich muss dem Ganzen noch ein Zitat folgen lassen, nämlich von Carl Schmid.
3389600	3392600	Souveränes wäre, wer über den Ausnahmezustand entscheidet.
3392600	3400600	Agamben hat das in seinem Buch Homo Saka auf die Biopolitik bezogen und über die Entscheidung auf Leben und Tod.
3400600	3406600	Ich glaube, wir sollten es aussehen, eben sie sehen es den Raum der Potentialität, nennen wir es Fiktion.
3406600	3411600	Souveränes wäre, wer über die Fiktion entscheidet und wie die funktioniert.
3411600	3417600	Und ich denke, dass wir da sozusagen in diesen Bereich angekommen sind, wo natürlich all diese verschiedenen Politiken,
3417600	3423600	die Potentialität der Politik, die Biopolitik, die Geopolitik oder die Fiktiopolitik,
3423600	3432600	sozusagen die Auslegungshoheit und Produktionshoheit darüber, was Wirklichkeit ist und was nicht,
3432600	3438600	im Zeitalter von Deepfakes und Zeitalter heißt in dem Fall ein paar Wochen.
3438600	3445600	Eine ist die, die tatsächlich darüber entscheidet, wem die Zukunft gehört gerade.
3445600	3454600	Wir sind absolut on Topic zum Subtitel des Podcasts, der Podcast zur Erweiterung unserer Vorstellung von Zukunft.
3454600	3461600	Wenn ich das richtig verstehe, Paul, plädierst du also auch, dass Sie sich mehr mit Narrativen von Zukunft auseinanderzusetzen
3461600	3464600	als Formen des Politischen?
3464600	3470600	Ja, mit Narrativen von Zukunft, aber eben vor allem auch mit den Mechanismen und Infrastrukturen,
3470600	3473600	auf denen diese Narrative produziert werden.
3473600	3478600	Also ich glaube, es ist wichtig, sich nicht nur anzuschauen, wer macht die Geschichten, wie schauen die Geschichten aus,
3478600	3483600	sondern unter was für Bedingungen und zwar in jeder Hinsicht.
3483600	3488600	Also politische Bedingungen, technologische Bedingungen, ökologische Bedingungen passieren
3488600	3495600	und werden diese Narrative geschrieben. Wer sind die Autoren, die in der Regel eben nicht nur, wie Malis auch mehrfach schon gesagt hat,
3495600	3501600	vorhin nur Menschen sind, sondern das Schreibwerkzeug schreibt dann den Gedanken mit.
3501600	3508600	So ist das immer schon gewesen. Und lustigerweise umso mehr Schreibwerkzeug wir haben, und es wird immer mehr,
3508600	3514600	umso weniger scheint uns das bewusst zu sein, dass diese Technologien, die wir hier rund um uns herum haben,
3514600	3518600	das ist irgendwie geschickt gemacht worden. Ich weiß nicht, wer das gemacht hat,
3518600	3523600	ob die Technologien das selber gemacht haben, dass sie sich immer unsichtbarer machen.
3523600	3529600	Und dass man immer mehr das Gefühl hat, wir werden immer menschlicher, umso technologischer wir werden.
3529600	3536600	Das ist ein ganz komischer Move, der da passiert. Und ich glaube, das ist die große Aufgabe,
3536600	3545600	ist ein bisschen dem einen Widerstand entgegenzusetzen und weiterhin daran zu arbeiten, dass sichtbar wird und bleibt,
3545600	3551600	wie die Sachen funktionieren. Also den Blick hinter den Vorhang werfen und zu merken,
3551600	3556600	dass Wizard of Oz in Wirklichkeit einfach ein Medienkünstler ist.
3556600	3563600	Wunderbar. Ich frage zum Abschluss immer noch, wenn ihr euch Zukunft vorstellt, was stimmt euch freudig?
3563600	3567600	Mein Urlaub.
3567600	3570600	Marlies, Paul, vielen Dank für das Gespräch.
3570600	3571600	Vielen Dank.
3577600	3581600	Das war Future Histories für heute. Vielen Dank fürs Zuhören.
3581600	3586600	Show-Notizen und vieles mehr findet ihr auf www.futurehistories.today.
3586600	3591600	Diskutiert mit auf Twitter unter dem Hashtag Future Histories oder auf Reddit.
3591600	3595600	Lasst mich wissen, was ihr zu dem Ganzen denkt und wie euch diese Folge hier gefallen hat.
3595600	3600600	Unbedingt gut bewerten auf allen Podcast-Plattformen, die ihr nutzt.
3600600	3606600	Für unsere Patreon-Unterstützerinnen und Unterstützer gibt es auf www.patreon.com-futurehistories
3606600	3612600	vieles an Zusatzmaterial. Ich lese zum Beispiel jeden Monat einen Text ein, der zum jeweiligen Thema passt.
3612600	3621600	Da könnt ihr also auch vorbeischauen. Bis zum nächsten Mal. Ich freue mich.
