start	end	text
1750000	1773000	And this is something I highly appreciate because when you were talking about the anarchist skepticism towards the IFB, the Iteration Facilitation Board, I kind of share this anarchist skepticism towards central plant economies for sure because I'm not a big fan of central plant economies.
1773000	1789000	Definitely, but what I, on the other hand, like myths within the IFB are, and maybe this came through through my questions, are like political processes that might like assist the parametric ones.
1789000	1800000	And within this long term planning, I see this political debate, this need for radical deliberation as a process coming back into the model.
1800000	1817000	And I highly appreciate it, I have to say, because if I understand you correctly, there might be these people who are tasked with like finding out how to do things in the most efficient and ideal way.
1817000	1832000	But at the end, they will have to produce some form of plan, ideally plans, a landscape of different plans that will then be decided upon through a political process, as I understand it.
1832000	1849000	And this is something I think is the actually only way to go, because you cannot go about these questions, education, environment, long term planning, long term investment, just via some form of like utility function, so to speak.
1850000	1860000	No, I think, you know, this is very interesting. And what's curious is, we almost have opposite reactions.
1860000	1868000	So you were looking at the annual planning and saying, there's no real planning here.
1868000	1879000	And there's certainly no sort of political process that's guiding the planning, it seems just nobody is having to think about all of these things.
1879000	1892000	There's this thinking in terms of my own self activity proposal, and a very quick yes or no approving of others based on a very obvious criteria.
1893000	1901000	Where is the discussion, the debate, because there are complicated things about economics, where is the discussion, the debate, it's not there.
1901000	1908000	And then you're looking at our proposals about investment and long term development planning and saying, well, this is more pleasing to me.
1908000	1926000	It's the kind of thing that I've, and I have the opposite reaction, because, and actually there's various places in part five of the book, where I point out what I believe are some unfortunate consequences.
1926000	1946000	And the unfortunate consequences are, when you look at who we propose would be involved in the generation of the plan, it's consumer federations, it's industry federations of workers councils.
1946000	1950000	Those are delegates.
1951000	1959000	That's already one whole huge level removed from an actual worker, an actual consumer.
1959000	1967000	So what I like about the annual planning is, it's the actual workers and actual consumers who are doing it.
1967000	1981000	And what I find, what I find worrisome about the more long term planning stuff is that it's already one level removed from the ordinary citizen.
1981000	2002000	Now we can make sure that the people involved are represented, they're representing, and the procedures for having them elected to be the representatives are very democratic.
2002000	2013000	But I worry about it as, for the ordinary person, does it just sort of, I don't know, there was a whole bunch of long term plans that were drawn up.
2013000	2016000	I don't remember ever being involved in any of that.
2016000	2029000	So I almost see it as a necessary evil, that the objective conditions basically leave us no other choice.
2029000	2042000	When we're coming up with sensible procedures that are democratic, I want them to be efficient, I want them to be fair, I want them to be democratic.
2042000	2054000	I can do all that, but I can't make them as participatory as in your own workers council, you propose what you want to make and how you want to make it and nobody can revise it except for you.
2054000	2057000	I can't do that. And that upsets me.
2059000	2064000	That's very interesting. I mean, there you go. I'd say there you go.
2064000	2075000	There you go. There are questions that cannot be addressed within what is called in Paragon at some point, a self-sovereign workers council, if I'm correct.
2075000	2093000	And so there is not, I would answer maybe in this direction, whether it is on an individual level as a human being or on the level of the workers council, there's always these interdependencies that you yourself always talk about and point towards.
2093000	2114000	And this necessarily creates levels of engagement that are beyond this level of autonomy, the fiction of autonomy on this level that you yourself are able to influence in the manner that you would like it to be in the form of direct participation.
2115000	2124000	There's one other thing that I think is rather curious or interesting about the investment in the long-term development planning.
2124000	2129000	There's a world in which we have to argue about what kind of economy we like.
2129000	2145000	And then there's a much bigger world that has been having an argument over whether or not capitalism, actual real world economies, should be more or less planned than they are.
2145000	2150000	And that's a debate that's gone on since the beginning of capitalism.
2151000	2162000	And what we have just lived through the past 40 years was a huge swing away from planning toward just let the market rip.
2164000	2170000	And of course, different countries have always been in different places on that spectrum.
2170000	2177000	But globally, the spectrum has moved dramatically away from planning.
2177000	2195000	I think that that has proven to be such a palpable sort of mistake that we will see revived interest in planning amongst people who don't give a shit about socialism.
2196000	2215000	And I actually think some of the things that we have now recommended about how a desirable economy would tackle these issues are likely to become of interest to others who are not interested in a truly desirable economy or socialism of any kind.
2215000	2232000	You know, before our debates about market socialism versus Cockshop and Cottrell's Scottish model of planning or the Albert Hanell participatory economy annual planning, because I do think that there are two contributions.
2232000	2238000	So intellectual contributions to this sort of part five of the book.
2238000	2245000	And one is that the rest of the world is not going to be interested in the generational equity constraint.
2245000	2253000	But the rest of the world is going to be very interested in how the results of what just happened this year.
2253000	2260000	They identify where you made mistakes in your long term plan, and there's plenty of time to make corrections.
2260000	2273000	So that contribution is something that anybody doing long term planning of any kind, no matter what kind of economy they're interested in, should actually be very interested in.
2273000	2287000	The other thing is, I sense amongst the younger generation, there's a real sense amongst the younger generation that they want economic decision making to be more democratic and participatory.
2287000	2297000	Their nightmare is going to work for a global capitalist corporation or only the where they're just clogs in the wheel until they join management.
2297000	2318000	So I think that since what we have proposed is how can you do long run planning and make it as participatory as possible and make it democratic also in the end, that that will be an attractive idea to progressive politically minded people.
2318000	2325000	And it's in some sense separable from all the rest of the sort of model of a participatory economy.
2325000	2338000	So I think that there's sort of an opportunity for us to make some headway in some to make some headway in some political circles that are much broader than our usual ones.
2338000	2350000	And all progress will only come, you know, when you have maximized your allies, even if they're temporary.
2350000	2361000	So I think that's also another area in which when we do have sort of a fully vetting of all this about the proposals about doing long term.
2361000	2379000	The other thing is, there's nothing in these proposals about doing long term strategic, you know, strategic international long term planning, education planning, environmental planning, investment planning, that if I were David Schweikert and I had proposed the model of
2379000	2382000	market socialism.
2382000	2387000	That still isn't an answer about how do you go about doing planning.
2387000	2397000	I mean, that's, that's an alternative answer to don't do the annual planning, the participatory annual planning, don't do the central planning and a comprehensive central planning.
2397000	2405000	Leave all that to the markets and make sure that there's no capitalist owners of the workplaces have those be workers councils.
2405000	2411000	But the essence of his proposal simply at that point is and let markets decide all that.
2411000	2428000	And he really doesn't have any sensible proposal, the market socialists don't have sensible proposals about, they don't really they really don't make proposals, just like we, you know, for all these years didn't really make any concrete proposals about procedures for coming up with
2428000	2441000	investment and development plans and checking them for inevitable errors and then who gets to vote on them finally and how is it debated and decided in the end.
2441000	2455000	All of our competitors in the debate about alternatives to capitalism have really said very little about that and there's no reason that any one of them couldn't go ahead and use this as their answer to that question.
2455000	2459000	So there will be new alliances.
2459000	2463000	Don't expect David Schweiker to agree with that, by the way.
2463000	2482000	No, but I mean, I like the idea that you that you say okay, we have this building block now that addresses a whole bunch of questions concerning the question of planning as such, that might be attractive for a whole bunch of different people that that we were that are not our core
2482000	2492000	clientele, so to speak. And so this might be something that that further fuels this renaissance of planning, so to speak.
2492000	2494000	So this is a quite a nice idea.
2494000	2517000	I think that's the payoff for us. The payoff for us is if for 40 years neoliberalism gave planning a bad economic planning a bad reputation demeaned and convinced a large body of the global populace that you know it was just an inefficient mistake.
2517000	2526000	Well, the fact that Chinese capitalism is out competing US capitalism hands over fist is because they have a more planned version of capitalism.
2526000	2535000	So I think there's all sorts of reasons and there's no way you can solve climate change without a lot more planning.
2535000	2549000	So, I look forward to I can see reasonable reasons to expect that the reputation of planning is going to be rescued from the rubbing it took during the 40 year neoliberal period.
2549000	2558000	And that in and of itself is going to make it easier for us to talk about all of the stuff we want to talk about.
2558000	2578000	So I think that's a plus for us. Not only do we have some ideas they could make use of. I think that anything that makes people more have a more friendly attitude toward the idea of economic planning is just got to help us going forward.
2578000	2593000	I'm very much interested in the question of real life paragon examples and specifically whether or not there are examples of experiments that you know of that really try to tackle the question of scale.
2593000	2603000	So maybe even that try to make use of modern information and communication technologies in order to tackle this question of scale.
2603000	2617000	Do you know of any such experiments that try to envision an idea, not only envision an idea of paragon, but to also practice it?
2617000	2627000	Good question. And at some point we're going to connect this up to the issue of transition strategy.
2627000	2645000	So let me sow a seed for that connection that will come. Very broadly speaking, I think transition strategy comes down to two rather different kinds of things.
2645000	2665000	Two rather different kinds of organizing activities. One of which I call building and strengthening progressive social movements, the labor movement, the women's movement, the anti-racist movement, the anti-corporate movement.
2665000	2679000	These are all progressive movements where there are clearly problems in capitalism, in the existing society that clearly need to be addressed.
2679000	2686000	Large numbers of people are adversely affected by the problems that these different movements address.
2686000	2704000	So this is the opportunity for us to reach out to the broadest number of people and engage with them in activities that can win substantial victories even without economic system change.
2704000	2724000	And then the question becomes how do you participate in those movements in ways that not only win reforms, but also lead people to want even greater reforms and come to the conclusion that that can't happen at some point unless you have fundamental system change.
2724000	2747000	The other activity, the other major kind of organizing activity that I think is going to be necessary in many places for a successful transition is what I call building and creating real life experiences and equitable cooperation.
2747000	2762000	And that's actually organizing activities where we're starting to put into place what we are saying we want the entire economy and society to be able to do.
2762000	2772000	Now historically, probably the oldest example is this, is workers-owned cooperatives.
2772000	2786000	And there's a tendency amongst leftists to basically see our entire history as being the labor movement and unions.
2786000	2799000	And yet you could argue, particularly right now, the labor movement and unions in the United States are probably weaker than they have been.
2799000	2808000	You'd have to go back to the 1870s to find a period where the labor movement in the United States is as weak as it is presently.
2809000	2823000	So it's rather interesting that, on the other hand, the movement for workers cooperatives in the United States is not in such heavy decline as the labor movement is.
2823000	2837000	So that's one area. And I would say that workers cooperatives, now you want an example of workers cooperatives that's, and in terms of scale, some of them are rather large.
2838000	2840000	I mean, take a look at northern Italy.
2842000	2855000	I think a third of the economic activity in northern Italy is activity that is this whole system of sort of workers cooperatives and cooperatives that operates in northern Italy.
2855000	2860000	Or you look at Mondragon, you know, in the Basque region of Spain.
2860000	2864000	So some of these are not little tiny experiments.
2864000	2870000	Another example I would give is the whole idea of participatory budgeting.
2871000	2874000	And it's very interesting.
2874000	2884000	This idea came up in two places in the world, and I know from personal experience that neither one of them was aware of what was going on in the other place.
2885000	2894000	So this idea that we want to do participatory budgeting, what does that mean?
2894000	2903000	Well, city budgets are basically decided by sort of the city government bureaucracy.
2904000	2921000	And in Porto Alegre, Brazil, the Workers' Party, the Lula Workers' Party, came up with the idea that, you know, we want some percentage of the tax revenues of the city to be set aside.
2921000	2935000	And how they are used should be decided by different neighborhoods in the city are going to have assemblies, and they're going to go through a process of discussing how it is they'd like to have that money spent.
2935000	2942000	They're part of the money. They're going to decide how it's spent through some sort of neighborhood assemblies.
2945000	2948000	And that was what they called a participatory budgeting.
2948000	2970000	And at the same time, one of the most leftist states in India, which is Kerala, India, that the, in Kerala, India, there was a period, I mean, actually the Communist Party has been the ruling party in Kerala, India, two or three different times over the past 50 years.
2971000	2980000	And they had a more or less traditional sort of Marxist and Communist program when they governed.
2980000	2998000	And then in the early 2000s, a new generation of leaders in that party in Kerala, India, said, you know, when we govern, we basically have been trying to implement serve the people programs.
3000000	3003000	But that's not really what we're all about.
3004000	3010000	We also want to empower people to make decisions about how they best serve themselves.
3011000	3021000	And so they also pioneered a participatory budgeting process, and they ran on that platform and they were elected on that platform.
3021000	3039000	And for about a period of 10 years before they were voted out of power, they implemented this very elaborate participatory budgeting process where they literally had 20% of the population attending assemblies and meetings.
3039000	3046000	Making decisions about how they wanted to see the tax revenues spent on what kinds of projects and what kinds of programs.
3046000	3054000	Well, obviously, participatory budgeting, you know, is, it's two things.
3054000	3058000	It's an expression to the fact that this is something people want.
3058000	3071000	It's an expression of the fact that it also affords us real life experience about what are the pros and cons of trying to organize it in one kind of way or another kind of way.
3071000	3077000	Participatory economic decision making about how it is we want things done.
3077000	3086000	And it also, to the degree that it is successful, and in both these places, it was remarkably successful.
3086000	3097000	I mean, it wasn't lack of success in these programs that led to the electoral defeat of the Workers' Party in Brazil or the Communist Party in Kerala.
3097000	3104000	These programs were popular. Their electoral defeat was due to other causes.
3104000	3123000	It also just, it builds people's confidence that these kinds of things work and that they aren't just pie in the sky and somehow all these important economic decisions are best left to somebody else.
3123000	3127000	So those are some examples of big things.
3127000	3147000	Now, I mentioned that there were a couple of places, very small types of operations that really tried to implement the entire proposal, including effort and sacrifice rating and balancing jobs for empowerment and all of that.
3147000	3155000	And there were a series of small collectives that were organized jointly. It was called the A-Zone.
3155000	3162000	And they had a series of buildings in the city of Winnipeg in Canada.
3162000	3175000	And, I mean, the businesses, there was a bicycle repair business, there was a recording studio record business, there was a restaurant, there was the Mondragon Cafe restaurant.
3175000	3184000	They did a bicycle delivery program. I couldn't believe they delivered bicycles through the winter in Winnipeg when the snow was six feet high.
3184000	3191000	Obviously, this is a seasonal business. No? What do you mean seasonal? We deliver all year round.
3191000	3199000	In any case, so these people had read about participatory economics and said, we're going to do it.
3199000	3210000	We're going to at least do the part that has to do with how would a workers council run, you know, in these ways. And they did it for about 15 to 20 years.
3210000	3219000	And there's a really rich experience there of what sort of problems did they run into, what kinds of conflicts came up, what worked, what didn't work.
3219000	3226000	And I can tell you that one of the things that was most problematic was the effort rating.
3226000	3232000	And whether or not people were comfortable with it, whether they weren't comfortable with it, how to go about it, what to do about it.
3232000	3235000	And that's a rich experience to learn from.
3235000	3255000	The other place that very self-consciously applied, you know, tried to apply all these was the South End Press, which was a left press in Boston for they did finally go out of business about four or five years ago now.
3255000	3265000	But it was a very successful left press, you know, in the United States that operated for about 30 years.
3265000	3276000	And it was always organized along the, according to the principles of participatory economy in terms of balancing jobs, remuneration, all of that.
3276000	3284000	And if you take a look at other left presses, they're basically a pretty standard business model.
3284000	3299000	Usually there is some sort of major donor who has sort of poured a lot of money into it, but then it runs more or less, you know, the same way that other publishers, you know, book publishers do.
3299000	3314000	And there was a big question about, well, is South End Press going to be, is the standard business model for a publisher going to prove to be more competitively successful in the book publishing industry than South End Press is?
3314000	3320000	Which is insisting on apply, you know, running itself in a very, very different way.
3320000	3328000	And you could say, well, South End Press no longer exists, but it wasn't because it wasn't successful at publishing book for all those years.
3328000	3346000	It was amongst the most successful of left publishing houses in the United States during the time of its operation, which provides some evidence that, no, these things aren't so in, these ideas and suggestions about how better to organize work processes.
3346000	3365000	They aren't so limiting to productivity that people applying those principles and working in that way cannot be perfectly successful in competition with businesses that are being run along standard or what you might call capitalist principles.
3365000	3370000	I have some macro and some micro questions, I guess.
3370000	3393000	Let's start with the micro ones, because you stated that taken from the real life experience, one of the most problematic aspects of Perikan that was causing the most trouble was the, this idea of effort ratings that one judges his or her coworker,
3393000	3397000	and then the remuneration would be coupled to this kind of judgment.
3397000	3411000	And when I was reading about Perikan, this was immediately something that I could not get along with because I immediately thought this will definitely lead to some sort of toxic environment.
3411000	3423000	So if you hear about these experiments and then people who actually try to implement these ideas and they give you the feedback that this is something that actually did not work out,
3423000	3429000	why do you then stick to this principle in your most recent work, for example?
3429000	3447000	Why don't you, because usually one would think that this would lead you to a point where you would have to revise the idea of effort ratings and maybe stick to a different kind of model of how remuneration could be addressed, as you did with housework and care work.
3447000	3455000	Okay, first of all, so let me just say sort of three things to situate the discussion.
3455000	3461000	Our actual proposal is that workers councils do whatever the hell they want in this regard.
3461000	3469000	So, I have no trouble taking that position, but I consider that to be a principal position.
3469000	3480000	And the second thing is, while we recommend that you would want to do something about this, we leave it up to you how to do it.
3480000	3503000	And I am sure that if there were a participatory economy with hundreds of thousands of different workplaces, that there would be a huge difference in how different workplaces went on, you know, decided to go about this, including when they decided to do anything along these lines at all.
3503000	3508000	And I don't think that's a bad thing.
3508000	3515000	Because here's an area where we're not sure how work, we're not really sure how things work out.
3515000	3533000	And in that context, whenever you find yourself in that situation, having a social experiment where you have a very wide variety of people trying things that are quite different from one another is sort of a sensible way to find out what works best and what doesn't.
3533000	3545000	The third thing I'd say is, I think there's a huge difference between leftists and normal people on this subject.
3545000	3554000	Most leftist reaction to, do I want somebody sitting in judgment about whether I'm working very hard?
3554000	3560000	Do I want to sit in judgment of my co-workers about whether they're working very hard?
3560000	3566000	Most leftists just don't like that.
3566000	3569000	I don't like it.
3569000	3576000	I would choose a workplace where we all were more or less on the honor system.
3577000	3580000	I mean, where would I want to work in a participatory economy?
3580000	3588000	I would look for a place that was on the honor system extreme of the spectrum, because that's what I would be most comfortable with.
3588000	3602000	Both from the point of view of whether somebody else is judging whether I've been working very hard and whether I want to really get myself in the, do I want to put myself in a position where I'm getting into fellow workers' faces about, you haven't been working very hard this last month.
3602000	3615000	But I don't think that, I think there's a huge difference between people who are already progressive and leftist on this subject in terms of their own personal attitudes and normal people.
