start	end	text
5355000	5357000	You always wanted to do.
5357000	5361000	You always would have rather have done it another way, but you never had the opportunity.
5361000	5368000	But amongst yourselves, amongst yourselves, you can create the opportunity.
5368000	5374000	But that would require you to have already come to the conclusion that part of the problem is markets.
5374000	5383000	And part of what prevents us from achieving our cooperative goal is that we unfortunately have to operate in the markets.
5384000	5390000	Because what I was proposing is I can pose a way for you to get out at least amongst your interrelations.
5390000	5399000	I can I can free you from the sort of market exchange process that is always problematic for you.
5399000	5404000	If you don't think it's problematic, then the idea isn't that interesting.
5404000	5410000	But I think it's very in some ways, it's similar to what you were talking about, which is.
5411000	5422000	Like minded people don't have to be geographically, you know, contiguous necessarily in order to to engage in some sort of
5422000	5430000	collaborative activity that starts to look like participatory economic practices.
5430000	5439000	Oh, and I wrote it at the time that I was consulting in Venezuela because they were creating all these co-ops.
5439000	5446000	And so one of the things I wanted to talk to them, I did talk to them about, I said, look, you're doing a great job of creating the co-ops.
5446000	5449000	Good thing you got all that high oil price right now.
5449000	5451000	Don't worry about the failure rate.
5451000	5463000	But if the ones that aren't failing, look, here's a next step that and there I had an audience that at least for a period of time was not the typical.
5463000	5474000	I mean, the international cooperative movement basically sided with the United States and denounced the Chavez government.
5474000	5482000	They took the Western pro-U.S. attitude on Venezuela.
5482000	5496000	And it was sort of embarrassing because the Venezuelans reached out to that movement, invited them to come in Venezuela and help them think about how to establish a bunch of co-ops.
5496000	5508000	And the leaders of the international cooperative movement were busy agreeing with US State Department evaluation of this whole social experiment in Venezuela.
5508000	5514000	But I was there at the same time.
5514000	5525000	And that's when I said, look, I now remember why I wrote the whole damn article and published it in the Eastern Economic Journal was because I was actually thinking the Venezuelans,
5525000	5533000	unlike a lot of people in the cooperative movement who find no problem with markets, they do have a problem with markets.
5533000	5539000	The Venezuelan government and movement, the Bolivarian revolutionaries.
5539000	5542000	And yet they're very busy setting up all these co-ops.
5542000	5545000	So they are an ideal audience to talk with.
5545000	5556000	Is there a way that you can start to establish relations amongst these workers co-ops that is a non-market exchange process amongst them?
5556000	5571000	And since we are already touching upon the subject of digital mediation, information and communication technologies and how they might inform such experiments,
5571000	5584000	I also did an episode of Future Histories with Daniel E. Saros, who wrote a book that you at least commented on in your last book yourself and called it Amazon Socialism.
5584000	5600000	So he does propose a so-called general catalog in which he proposes that everybody, every workers council should post the use values that it produces.
5600000	5618000	And then everybody would also have a so-called needs profile in which one could place one's needs in a certain order in order to communicate how important these needs are for myself
5618000	5626000	and thereby also informing the production process of the workers councils.
5626000	5633000	What do you think about his proposal and where would you see connections to Perricon?
5633000	5639000	I mean, he states pretty clearly that his proposal is very much informed by Perricon.
5639000	5652000	So there are like considerable overlaps, but what are the strengths of his proposal from your point of view and what are the weaknesses?
5652000	5659000	Well, first of all, there's an appendix to democratic economic planning.
5659000	5681000	And in the appendix, I present and then evaluate from my perspective, the strengths and weaknesses of other people's proposals about how to go about
5681000	5685000	socialist planning or democratic, socialist economic planning.
5685000	5693000	And so one of the, I think I do Cotshot and Cottrell.
5693000	5697000	David Labrum's proposal.
5697000	5702000	Dan Saros' proposal.
5702000	5706000	Pat Devine and Frick with Adam's proposal.
5706000	5722000	And then I also review, I call them the sort of autonomous community, the autonomous community sort of approach.
5722000	5726000	Because most people associate that with Schumacher.
5727000	5740000	So I actually, and I don't want to try and recreate that sort of, because part of the problem with Dan's proposal is it's not his fault.
5740000	5743000	It's very complicated.
5743000	5754000	And it really, it takes a lot of work to figure out exactly what he's proposing and how it works.
5754000	5763000	I mean, I had to communicate with him back and forth for a year and a half, just asking him questions about, am I understanding this right?
5763000	5772000	And so it took me a long time to figure out exactly how his proposal works.
5772000	5784000	But I think I did, and I got him to confirm that, because I don't want to evaluate something where the person who, because I've had this happen to me all the time.
5784000	5791000	Somebody is saying they're criticizing participatory economics, but they're criticizing something I didn't propose.
5791000	5799000	So I wanted to be careful that at least I understood what he was proposing before I said, well, this is what I think is, here's where I think this is good.
5799000	5800000	This is what I think is good about it.
5800000	5804000	And this is what I find problematic.
5804000	5808000	First, let me say that I think everybody should read it.
5808000	5831000	I mean, he has gone farther in the direction of saying, new information technologies have created a new technological situation in which we can now think about what is possible and not possible.
5831000	5854000	So I think he is the part that I find most, most helpful and most insightful is the degree to which he is telling all of us, wake up and rethink everything that you thought could be done or couldn't be done.
5854000	5863000	And ask yourself, were you thinking about that in the context of a pre-information technology revolution?
5863000	5864000	Because guess what?
5864000	5866000	We've had one.
5866000	5878000	So I think that's the strength, that he is the, he's the first one who's come along among socialist planner type thinkers to say, we need to take advantage of new information technology.
5878000	5890000	In some ways it's very similar to what Kopp, Schott and Cottrell said in terms of, well, you know, central planning really should take advantage of the new computational powers that came into being after World War II.
5890000	5894000	And so those are, it's important in that way.
5894000	5898000	I don't think it works as well as participatory planning.
5898000	5914000	One of the things that I'm constantly having to try and convince people who worry about participatory planning that it wouldn't be so burdensome for consumers to sit down.
5914000	5930000	And what I say is take the same number of hours it takes you to fill out your federal and state tax returns to at least put in some sort of, you know, rough proposal about what you want your consumption activity to look like in the next year.
5930000	5939000	He puts a much higher burden, you know, on people in terms of what information they have to convey.
5939000	5952000	So I think in that area, just in terms of practicality, and whether this is the kind of thing you could expect people to reasonably do, that he's demanding much more in that regard.
5952000	5961000	So if there's a problem with what I'm demanding in that regard in terms of whether people would be able to do it or happy to do it or unhappy doing it.
5961000	5970000	I think there's a much bigger problem from a practical point of view, you know, with his proposal in that regard.
5970000	5979000	The other part of the critique I have is it's more or less technical. I'm proud of the fact that our proposal will reach a feasible plan.
5979000	5986000	I'm pretty sure his won't. I mean, not a feasible plan, but an optimal or an efficient plan.
5986000	5990000	Economists use the word optimal. When they say optimal, they just mean efficient.
5990000	6001000	So I'm proud of the fact that I know that our proposal, that our planning process would be an efficient plan, and I'm pretty sure his wouldn't.
6001000	6005000	But that's kind of a technical issue.
6005000	6023000	Another place we're on the same grounds is his reaction to market socialists is, well, you're proposing market socialism because you claim it's impossible to do the planning.
6023000	6030000	I mean, you can't really do the detailed planning, but I'm showing you can. And so on that, we're really on the same wavelength.
6030000	6038000	We're both saying you can do planning and you can do planning in a participatory way.
6038000	6046000	Planning that bears no resemblance to the kind of central planning that was done in the Soviet type economies in the 20th century.
6046000	6055000	It's not, Ove was wrong when he said either markets or there's sort of central allocation, central planning.
6055000	6066000	There is no alternative. So I think Dan has proved that he was wrong because his proposal is sort of proof positive.
6066000	6075000	At least in theory, we could do this. And our proposal, I think, is also proof wrong because a different proposal says you can do it.
6075000	6083000	You can do something. You can coordinate a modern economy, you know, without either markets and without central planning.
6083000	6092000	So in that regard, I also think of it as an important contribution to people's thinking about all these things.
6092000	6100000	I will restrain myself not to get into the technical questions of your criticism because I'm actually also interested in those.
6100000	6107000	But I think these would really very much go too deep for the general audience. And so let's move on.
6107000	6118000	And I mean, I already said it, I'm very much appreciative of how Paragon is flexible, as you rightly pointed out, in certain regards,
6118000	6125000	specifically those which I had my troubles getting along with, as I already stated.
6125000	6132000	You know, I can make this, you know what? I'll make it very easy. I'm getting to be in a somewhat joking mood at the moment.
6132000	6143000	But, you know, I can promise you we will find a workers council whose system of evaluation you are comfortable with.
6143000	6152000	I can promise you that there will be many such councils that will handle that situation the way that you are comfortable with.
6152000	6154000	Oh, I'm sure. I'm sure.
6154000	6159000	You know what? Let me make one further comment on this.
6159000	6169000	I think there's a similarity here. This analogy might sort of ring with people.
6169000	6183000	In any family, there are sort of disagreements and controversies, differences of opinion, and some families handle this by
6183000	6192000	We're not going to talk about it, because if we talk about it and we argue about it, we're just going to end up feeling worse.
6192000	6199000	So it's sort of the sweep it under the rug approach, you know, to family problems.
6199000	6204000	And then there are other families that basically take a very different tact.
6204000	6211000	They say, you know what? Sweeping it under the rug just makes it worse. It just festers.
6211000	6221000	It's better to just get it out there. And, you know, and I think in some sense, that's what we're talking about.
6221000	6232000	To what extent is it going to be helpful to sort of just live and let live?
6232000	6239000	And to what extent is it actually going to be more healthy?
6239000	6247000	Not to let resentment, so I don't think you're working as hard as I am, but you're getting paid as much.
6247000	6256000	Not to let resentments fester. To what extent is it going to just work out better?
6256000	6266000	If everybody agreed, I mean, if there were never any differences between self-evaluations and others evaluations, there would be no problem.
6266000	6272000	But it's important to realize in the real world that will not happen. In the real world, there will be disagreements.
6272000	6275000	And then it's a question of what's the best way to handle it.
6275000	6282000	And one way to handle it, I think, comes down to glossing over and just sort of ignoring.
6282000	6289000	And the other way of handling is, no, we're going to get up in each other's faces and have it out and then we'll all feel better afterwards.
6289000	6292000	Of course, the concern is maybe we won't feel better afterwards.
6292000	6297000	Maybe we'll actually really, you know, feel even worse about each other afterwards.
6297000	6303000	But I think that's I think essentially this is what we're sort of.
6303000	6309000	I guess I think this is what the discussion comes down to. I just wanted to throw that out there.
6309000	6330000	Well, I mean, this is kind of connected to the question that I wanted to pose, actually, because the way that you describe it already establishes a certain image of how people are and that they would, as you said before, at some point,
6330000	6343000	like you believe that the most of the people would react in ways in which they would get kind of angry if they had the feeling as if people who worked less than themselves would be paid the same.
6343000	6352000	And that you, as you just stated right now, think that it's better to address this resentment instead of glossing over it.
6352000	6358000	But this already operates on a level of assumptions that I maybe would not share.
6358000	6379000	Throughout reading Paracon and about the model, I had the feeling as if all of the aspects that I'm having trouble getting along with are in some way, shape or form connected to, I guess, some assumptions that that Paracon might share with,
6379000	6385000	I'd say, neoclassical economics and I would, or microeconomics to be specific.
6385000	6392000	So I would be interested in what is this connection and how do these assumptions inform Paracon?
6392000	6403000	Because, as I said, I had the feeling as if there was some type of, I would say, methodological individualism at play within how the model itself is structured.
6404000	6417000	And not only in terms of how you frame questions of efficiency or equity or fairness and stuff like that, but also on the level of how it is built.
6417000	6427000	So you build it kind of from the ground up, I would say, and the ground is some specific image of humans, so to speak.
6427000	6443000	And at some point in the book, I'm not sure, I guess, in the book or somewhere else, you quite clearly say that this nucleus, this image of how humans are being modeled on the ground of Paracon is actually the idea of homoeconomicus.
6443000	6450000	And that this is something that informs how this model is being built.
6450000	6470000	And I really had the strong sense that the elements with which I had a hard time agreeing and the fact that this type of modeling is somewhat close to how Paracon is being built, that this overlay is very informative.
6470000	6472000	I would be interested in this connection.
6472000	6476000	What is the connection between Paracon and neoclassical economics?
6476000	6483000	And why do you use some of these ideas and types of modeling?
6483000	6489000	Okay, I'm going to say a couple of things that sort of get at this.
6489000	6518000	Most people interpret when neoclassical economists model individual behavior as utility maximizing, most people interpret this as and most neoclassical economists themselves think of this as the only reasonable approximation we can make in theory to how people will behave.
6518000	6539000	That people have priorities and preferences and what they try to do is maximize their satisfaction, their enjoyment, given their preferences and given the opportunities available to them.
6539000	6559000	So most mainstream economists defend the use of the models of utility maximization as our best approach theoretically to predicting human behavior.
6559000	6573000	Now, if you then go and challenge a neoclassical economist and say, do you really think that that's a good predictor of people's behavior?
6573000	6579000	What the smart ones will say is, no.
6579000	6583000	Sometimes people don't behave that way.
6583000	6589000	They don't behave in their own self-interest, but that's the best we can do.
6589000	6598000	If we're trying to explain behavior and we start with the assumption that the behavior is irrational, well then we're not going to be able to explain it.
6598000	6604000	Now that's what a mainstream economist, I'm giving you the mainstream economist mindset.
6604000	6607000	Here's how my mindset differs from that.
6607000	6611000	First of all, I completely agree.
6611000	6615000	Sometimes people behave in their own self-interest and sometimes they don't.
6615000	6619000	I'm not interested in predicting how people will behave.
6619000	6625000	I'm interested in evaluating economic institutions.
6625000	6640000	So whether or not we can predict people, how good a job we can do in predicting how people behave by assuming that they will act in their rational self-interest given their preferences.
6640000	6645000	I'm not interested in that.
6645000	6653000	The answer might be we'll do a pretty good job of predicting behavior or it might be we'll do a pretty bad job of predicting behavior.
6653000	6662000	Certainly for some people we'll do a better job of predicting their behavior and for other people we'll do a terrible job of predicting their behavior if we do that.
6662000	6666000	But my job is not to predict people's behavior.
6666000	6671000	My job is to evaluate economic institutions.
6671000	6682000	And what economic institutions is, they promote some kinds of behavior and they discourage other kinds of behavior.
6682000	6694000	So if I'm going to evaluate an economic institution from the perspective of what kind of behavior does it promote, what kind of behavior does it discourage?
6694000	6707000	The only way I know how to answer that is what kind of behavior does the economic institution make rational for people to engage in?
6707000	6713000	So that's why I assume that people will behave rationally.
6713000	6717000	Not because I think they'll behave rationally.
6717000	6733000	But because the way that any social institution encourages some kinds of behavior and discourages other kinds of behavior is it encourages the behavior that it would be individually rational for people to engage in.
6733000	6741000	And it discourages or penalizes the behavior that would be irrational for people to engage in.
6741000	6744000	Now let me say one other thing.
6744000	6751000	So my goal is to evaluate the predictable effects of economic institutions.
6751000	6756000	Does it promote people, does it encourage people to behave in solidarity with one another?
6756000	6761000	Or does it discourage people from behaving in solidarity with one another?
6761000	6782000	I mean in the case of public goods, does it provide incentives for people to consume too little, choose to consume what we can demonstrably demonstrate is too little public goods?
6782000	6792000	So markets basically promote behavior because it's individually rational for everybody to demand too few public goods.
6792000	6800000	And therefore we will get an inefficient amount of public goods in market economies unless we have some other procedure for deciding how much there's going to be.
6800000	6803000	I'll give an example from centrally planning.
6803000	6818000	I think that the institution of central planning discourages people from trying to seek self-managed work opportunities.
6818000	6829000	It basically penalizes you if you try and seek that and it rewards you for not deciding you don't care.
6829000	6836000	So those are the reasons that I use what I constantly get criticizing for decades now.
6836000	6853000	I am criticized by many of my leftist colleagues as Robin you're always engaging in individualistic methodologies that are neoclassical.
6853000	6862000	I'm saying there's a certain part of what they do that's useful for us.
6862000	6865000	They misplay it.
6865000	6876000	They use it to answer a question that's actually rather boring, which is how much will people behave in their own self-interest and how much will they actually not?
6876000	6878000	And I already know the answer to that question.
6878000	6883000	The answer is sometimes they will, sometimes they won't, some people more, some people less.
6883000	6886000	There's nothing less that's interesting about that.
6886000	6901000	But if you want to know what kind of behavior an institution is going to promote, the only way to answer that is what kind of behavior would it make it rational for people to engage in and what kind of behavior would it make it irrational for people to behave in?
6901000	6908000	And I'm interested in judging institutions, not judging people in terms of how they behave or don't behave.
6908000	6925000	So now there's one other thing I'll add, and that is mainstream economists tell us we should just take we should just take people's preferences as given.
6925000	6935000	And this goes back to Jeremy Bentham, and it's sort of ours is not to reason why somebody likes something.
6935000	6942000	The job of an economist is to sort of you like what you like, you don't like what you don't like.
6942000	6945000	I do not stand in judgment of you.
6945000	6951000	I'm just supposed to be telling you whether we can give you whatever it is you want.
6951000	6954000	Are we doing a good job of helping you get it?
6954000	6958000	And neoclassical economists have taken that lesson.
6958000	6964000	I would say, you know, it's almost the bedrock that they stand on.
6964000	6967000	It's their Bible.
6967000	6972000	And there is something good to that Bible.
6972000	6986000	For instance, if the alternative is that Joseph Stalin is going to decide what the Russian people want, well, then I'd much rather go with Jeremy Bentham on that,
6986000	6990000	which is the Russian people want whatever they want.
6990000	6993000	Do not sit in judgment on that.
6993000	7001000	Do not say I, the revolutionary philosopher king, know better what people want than they know themselves.
7001000	7012000	So in that regard, you know, I think the tendency of the economics profession, you know, to abandon the whole notion
7012000	7021000	that there's somebody else who knows better what people should, what there's somebody else who knows better than people themselves
7021000	7027000	what it is that they should have and they should want and what will make them happy.
7027000	7029000	We really need to abandon that.
7029000	7033000	That should go into the dustbin of history.
7033000	7042000	However, isn't it obvious that people's preferences change over time?
7042000	7051000	And do you really think that people's preferences change over time randomly?
7051000	7054000	Here's what I think happens.
7054000	7060000	At any point in time, people have certain preferences and they'll act on them.
7060000	7065000	They'll act on them by choosing to work here and not there.
7065000	7070000	They'll act on them by choosing to buy this and not that.
7070000	7083000	Well, once they make those choices, today's preferences lead me to make choices.
7083000	7089000	When I make those choices, I consume certain things and I do certain work and I don't do other work.
7089000	7099000	Well, I have a model of human development that says you sort of start at birth, you have a genetic endowment,
7099000	7107000	and then in large part what you become through life is dependent on what activities you've engaged in.
7108000	7115000	So I'm going to engage in a whole bunch of activities over a 20-year time period.
7115000	7125000	Isn't it predictable that whatever activities I engage in are going to have some effect on what preferences I come to have at the end of the 20 years?
7125000	7131000	So here's the way I would put it.
7131000	7141000	When we make choices today, we satisfy our preferences more or less,
7141000	7151000	but we also, in some degree, sometimes we are transforming what I call our human characteristics.
7151000	7156000	We develop human characteristics over time.
7156000	7161000	And those human characteristics have an effect on our preferences.
7161000	7168000	So this is what I call a model of endogenous preferences or preference formation.
7168000	7175000	It says at any point in time, we have preferences based on whatever our human characteristics are.
7175000	7178000	We make our choices.
7178000	7181000	Two effects of the choices.
7181000	7186000	Given our characteristics, our choices more or less satisfied our preferences today.
7186000	7193000	But when we engage in the activity of those choices we've made,
7193000	7198000	we modify over time what our characteristics happen to be.
7198000	7203000	And when we have different characteristics two or three years down the road,
7203000	7210000	then we'll probably have some different preferences based on those different characteristics.
7210000	7223000	So one way I approach an economic institution is not only what behavior it makes rational for people to engage in,
