start	end	text
1469000	1474000	Verantwortung zu übernehmen. Und da kommen wir mal wieder zu diesen informellen Machtstrukturen zurück,
1474000	1480000	weil ich finde es wichtig, gerade in so aktivistischen Zusammenhängen oder vor allen Dingen an
1480000	1487000	anarchistischen Zusammenhängen, wo eben Macht, glaube ich, in den meisten Fällen immer noch schon eher
1487000	1492000	sowas Böses ist, was man nicht übernehmen darf und nicht übernehmen soll, dass das eben dazu beitragt,
1492000	1499000	dass man eben informelle Machtverhältnisse, eben dass es informelle Machtverhältnisse gibt und Machtverhältnisse
1499000	1507000	allgemein eher so verleugnet werden, anstatt dass man sie offen auf den Tisch legt und sagt, okay, das ist okay,
1507000	1513000	wenn ihr jetzt diese Entscheidungen trefft oder jetzt mehr Einfluss auf diese Entscheidungen habt,
1513000	1520000	aber damit kommt auch eine bestimmte Verantwortung und accountability auf Englisch.
1520000	1525000	Also man muss dann diese Verantwortung auch, man muss dann einstehen können für das später,
1525000	1531000	für diese Entscheidungen, die man trifft. Und auf der Basis, das war ja damals in Zusammenhang mit diesem Buch
1531000	1538000	der Versuch von mir, also diese begrifflichen Diskussionen oder diese theoretischen Diskussionen im Kontext dieses
1538000	1550000	Poststrukturalismus da ebenso für anarchistische Überlegungen auch nützlich und wertvoll zu machen.
1550000	1556000	Kann ich da vielleicht noch einmal einen Schritt nachhaken, weil du hattest jetzt eben Verantwortung angesprochen,
1556000	1562000	zum Beispiel, also was folgt dann daraus? Also was folgt aus dem Anerkennen der Macht?
1562000	1566000	Du hattest eigentlich jetzt vor allem zwei Dinge ausgewiesen, nämlich das Ausweisen,
1566000	1573000	also das nicht unter den Tisch kehren der Anwesenheit von Macht, wenn man so will,
1573000	1579000	und als zweites dann eben Verantwortung, accountability hattest du es jetzt dann noch genannt.
1579000	1590000	Gibt es noch andere Elemente, die daraus folgen, also aus dieser Feststellung, dass Macht eben auch produktiv sein kann?
1590000	1599000	Gibt es da andere Elemente vielleicht auch im Bezug auf ein Weiterdenken des Anarchismus als politische Theorie?
1599000	1607000	Also gerade wenn es jetzt um die Frage geht, über zum Beispiel ausschließlich dezentrale Strukturen hinauszugehen
1607000	1615000	und sich zu fragen, wie eine Skalierbarkeit des Anarchismus gedacht werden kann, wie eine Form von Meta-Koordination
1615000	1622000	über reine Dezentralisierung hinausgedacht werden kann, weil diese beiden Dinge, die scheinen mir irgendwie ja auch zusammen zu hängen.
1622000	1631000	Diese Frage nach einem sowohl als auch von Dezentralität und vielleicht auch zentralen Elementen,
1631000	1644000	die eben dann ja nicht zwingend herrschaftsförmig sein müssen und dieser Frage dessen, was aus der Analyse von Macht so gesehen eben dann folgt.
1644000	1653000	Ja, auf jeden Fall. Also das ist ja auch wieder so ein Reizwort, das du jetzt angesprochen hast, das sehr wichtig ist, das mit dieser Zentralisierung.
1653000	1663000	Klar, das folgt auch daraus. Das ist ja auch sowas, was eben, also Tabu ist übertrieben, aber es geht schon ein bisschen fast in diese Richtung.
1663000	1673000	Also in anarchistischen Kreisen ist das etwas Schlechtes, so ausfertig. Je dezentralisierter, je föderaler, je unmittelbarer die Entscheidungen, desto besser und so.
1673000	1685000	Und so als Grundprinzip ist das völlig richtig. Aber wiederum, also jetzt realistisch gesehen, also die Gesellschaften, in denen wir leben, sind unglaublich komplex.
1685000	1693000	Wir sehen uns heute also Problemen globaler Dimensionen gegenüber, die lokal halt nicht zu lösen sind.
1693000	1702000	Das ist wirklich trivial, aber es ist manchmal dann doch wichtig, nochmal darauf hinzuweisen, also ob das jetzt die Klimakrise ist, aber selbst ökonomische Zusammenhänge.
1702000	1710000	Wir sind ja alle extrem abhängig geworden. Und das kann man natürlich zurückschrauben, aber auch nicht von heute auf morgen, sondern so schrittweise.
1710000	1719000	Also die Abhängigkeit von globalen Lieferketten und allem Möglichen, damit wir ein Leben führen, nicht einmal einfach nur in großen Luxus, sondern wie es halt wir so,
1719000	1728000	also selbst wenn man jetzt zumindest im globalen Norden relativ bescheiden lebt, sind wir mittlerweile unheimlich abhängig von diesen globalen Lieferketten.
1728000	1741000	Und so sind auch viele Menschen im globalen Süden, weil die aufgrund der Kolonialgeschichte sehr viel mit Monokulturen zu tun haben und auch auf Importe angewiesen sind und so weiter.
1741000	1751000	Das sind ja Probleme eines unglaublichen Ausmaßes, die sich nur über gewissen Grad der Zentralisierung lösen lassen.
1751000	1762000	Also alles andere sind wirklich so heikle oder schwierige Themen, weil ich zum Beispiel bin ja durchaus ein Freund davon, dass man aufs Land zieht und so Kommunen startet
1762000	1771000	und dann so viel wie möglich da eben für sich selber organisiert und entscheidet und vielleicht so einen gewissen Grad Selbstversorgung macht und so.
1771000	1788000	Das ist ja alles jetzt nicht nur einfach so nett, sondern das hat auch darüber hinausgehend politische Bedeutung, weil das ja oft schon so Experimentierfelder sind für gemeinschaftliche Lebensformen,
1788000	1796000	die in einer besseren, nachhaltigeren, gerechteren Welt dann in größeren Rahmen durchaus eine wichtige Rolle spielen können.
1796000	1809000	Aber das lässt sich ja nicht eins zu eins übertragen. Also wiederum so ein gemeinsames Kollektiv ein paar Hühner zu halten ist nicht das gleiche wie jetzt sicherzustellen,
1809000	1818000	dass alle Menschen auf der Welt sauberes Wasser haben. Also das sind unterschiedliche Dimensionen, aber trotzdem, also diese Erfahrungen, die sind alle wertvoll.
1818000	1826000	Gleichzeitig aber eben, um diese wirklich großen globalen Probleme anzugehen, da braucht es klarerweise bestimmte Formen der Zentralisierung.
1826000	1840000	Also ich finde ja zum Beispiel sowas wie, also es braucht bestimmte Formen von Planökonomie, also um, wir müssen Sachen produzieren, damit alle Leute genug zum Essen haben,
1840000	1854000	damit die medizinisch versorgt werden, damit sie unter menschenwürdigen Bedingungen wohnen können, damit es Kleidung gibt, damit es ein bisschen andere Sachen gibt,
1854000	1859000	zum künstlerisch tätig zu sein und kreativ und spattlich und so, also es muss ja alles produziert werden.
1859000	1869000	Gleichzeitig, glaube ich, wissen wiederum die meisten Menschen, dass heutzutage viel zu viele Sachen produziert werden, die man überhaupt nicht braucht,
1869000	1880000	die in Formen produziert werden, die weder sozial noch ökologisch nachhaltig sind und so weiter. Aber um das alles zu ändern, also da braucht es bestimmte Formen von einer zentralen Entscheidungsfindung.
1880000	1890000	Die Frage ist halt, wie es zu denen kommt. Und wenn wir jetzt also wirklich so konkret von alternativen Regierungsformen reden, also ich glaube schon,
1890000	1907000	dass so heutereite demokratische Strukturen die sind, die von den Modellen, die es halt jetzt so gibt, diese Balance zwischen so grundlegenden anaphistischen Prinzipien von jetzt zum Beispiel Dezentralisierung,
1907000	1918000	Basisdemokratie und der Notwendigkeit auch einer gewissen zentralen Entscheidungsfindung und einer Delegation von Aufgaben am ehesten kommen würde.
1918000	1926000	Das hat jetzt dann eigentlich schon ein bisschen die Frage vorher weggenommen, die ich hier als nächstes gestellt hätte, nämlich wie kann das Zentrale positiv gedacht werden?
1926000	1931000	Das heißt, am ehesten dann in Form der Rätedemokratie, wenn ich das jetzt richtig verstehe.
1931000	1938000	Ja, ich würde das sagen. Wobei es natürlich so ist, das ist ja noch noch meine eigene Diskussion.
1938000	1950000	Also den Rätekommunismus und entsprechende Ideen gibt es ja mittlerweile auch schon seit über 100 Jahren als auch explizite politische Richtung.
1950000	1961000	Die Erfolge, die man da historisch aufweisen kann, sind vielleicht beschränkter Natur.
1961000	1964000	Also man muss sich natürlich auch da die Frage stellen.
1964000	1975000	Also es gibt da nicht ein Modell, das irgendwann einmal von Pannekoek oder anderen um 1920 formuliert worden ist und das jetzt die Antwort für alles ist.
1975000	1982000	Also das ist es ja offensichtlich nicht, sondern man muss diese Ideen weiterentwickeln und so anpassen.
1982000	1992000	Dann gibt es natürlich auch gegenwärtig ja konkrete Versuche, wo das geschieht, in Rojava und auch in anderen kleineren Zusammenhängen.
1992000	1999000	Aber das ist ein langer Prozess, aber tatsächlich, also wir sind ja hier auch so in einer kleinen theoretischen Diskussion.
1999000	2017000	Also gerade wenn es eben um diesen Kompromiss zwischen bestimmten so grundlegenden anarchistischen Idealen und der Notwendigkeit in einer gewissen Form von Zentralisierung geht, ist das glaube ich das Modell, wo man uns setzen muss.
2017000	2029000	Und vielleicht können wir da jetzt dann auch nochmal die bestehende anarchistische Praxis mit hineinbringen, weil eigentlich ist das ja dann auch das Scharnier, das notwendigerweise mit hineingebracht werden muss.
2029000	2044000	Dass man also sagt, wenn es darum geht, kollektiv auch alternative Guvernmentalitäten zu entwickeln, dann gilt es sich zu bedienen beim Anarchismus und zwar nicht nur in theoretischer Form, sondern vor allem eben auch in der Praxis des Anarchismus.
2045000	2056000	Vielleicht kannst du da uns ein paar Ansatzpunkte geben, wo man sich da produktiv bedienen könnte in der tatsächlich gelebten Praxis des Anarchismus.
2057000	2066000	Ja, also das ist sehr wichtig, dass du das nochmal ansprichst. Scharnier ist übrigens ein gutes Wort zu noch so ein ähnlichem, aber vorher wird es immer gesucht.
2066000	2075000	Darum geht es hier und ich glaube, dass wirklich der Anarchismus da auch diese Leistung bieten kann.
2075000	2090000	Bevor ich da jetzt nochmal konkreter sage, wo kann man sich bedienen, möchte ich auch nochmal sagen, weil ihr habt selber davon von eingeschränkten Erfolgen oder so gesprochen, was jetzt die redet demokratische Geschichte zum Beispiel anlässt.
2090000	2098000	Aufgrund deiner Frage, was gut ist, modifiziere das jetzt aber ein bisschen oder erkläre das ein bisschen mehr.
2098000	2107000	Also was ich damit mein, ist, dass man jetzt nicht auf irgendwelche Beispiele verweisen kann. Schaut, da hat das ja super funktioniert, über auch einen längeren Zeitraum hinweg oder so.
2107000	2115000	Solche Beispiele gibt es halt wenig. Da gibt es alle möglichen Gründe, zum Teil einfach, weil andere mächtigere politische Kräfte das verhindert haben.
2116000	2124000	Aber es gibt natürlich auch eigene Schwächen, sowohl in der Theorie als auch in der praktischen Anwendung, historisch und so.
2124000	2138000	Also das ist wichtig und ich habe das ja deshalb gesagt, um so diesen naheliegenden Kritik vorzubeugen, dass Leute sagen, naja, eben, es gibt ja diese Theorie seit 100 Jahren, aber wo hat das funktioniert oder so.
2138000	2149000	Das stimmt einerseits und es gibt auch Anlass zum Nachdenken und auch zur Selbstkritik und zur Notwendigkeit, diese Theorien weiterzuentwickeln.
2149000	2157000	Es bedeutet aber eben nicht zwangsläufig erstens, dass die grundlegenden Ideen falsch sind.
2157000	2166000	Also ich kann nicht sagen, gerade in historischen Entwicklungen, also das ist ja auch so, man sagt 100 Jahre, also im Zuge der Menschheitsgeschichte sind 100 Jahre gar nichts.
2166000	2180000	Also wenn man zum Beispiel die Geschichte des Kapitalismus verfolgt, von den ersten Ansätzen kapitalistischer Produktionsform bis sich der Kapitalismus wirklich als globales System etabliert hat, sind mehrere hundert Jahre vergangen.
2180000	2183000	Also diese Sachen brauchen schon Zeit.
2183000	2186000	Also das gilt ja für den Sozialismus oder so.
2186000	2196000	Okay, das 20. Jahrhundert war jetzt nicht von großartigen Erfolgsgeschichten des Sozialismus geprägt, aber gut, es waren einmal 100 Jahre, das heißt jetzt zwangsläufig, dass diese Ideen falsch sind.
2196000	2201000	Das dauert halt eine Zeit, bis sich sowas auch verwirklichen kann und man muss dazulernen und so weiter.
2201000	2219000	So, was genau aus dem Grund wichtig ist, ist, dass sich Erfolg ja letztlich oder ob etwas, ich habe jetzt das selber mit dem Erfolg eingeführt, jetzt muss ich noch am anderen Wort suchen, ob etwas wertvoll war oder nicht.
2219000	2227000	Das bemisst sich nicht alleine daran, wie lange das jetzt besteht oder wie groß oder klein das war oder so.
2227000	2243000	Also zum Beispiel, wenn Leute sagen, schließt man das Beispiel an einer selbstversorgenden ökoanarchistischen Landkommune oder so, dann ziehen Leute hin und die machen das zehn Jahre und dann löst sie das auf aus verschiedenen Gründen.
2243000	2247000	Und dann steht man da und sagt, ha ha, hätte ich gleich schon sagen können, das funktioniert nicht.
2247000	2251000	Und man betrachtet das Experiment als gescheiter dann.
2251000	2262000	Also das stimmt in dem Sinne, wenn jetzt der Anspruch gewesen wäre, dass das jetzt zu einer Keimzelle der Weltrevolution wird, die dann ewig bestehen wird oder so.
2262000	2283000	Aber unabhängig davon, nur weil sie das nach zehn Jahren auflöst, das sagt dir überhaupt nichts darüber aus, was in diesen zehn Jahren passiert ist an Lernprozessen, was diese Leute, die dort waren, mit sich nehmen können, vielleicht in andere Projekte und Experimente tragen können, die dann entsprechend vielleicht auch besser werden oder anders werden oder so.
2284000	2290000	Das heißt, überall in allen diesen Versuchen, da kommen wir jetzt zu diesem Konkreteren und dem würde ich schon zustimmen.
2290000	2309000	Also anarchistische Praxis, also vom Organisieren von anarchistischen Buchmessen über autonome Zentren, die auf anarchistischen Prinzipien passieren, bis hin zu Erfahrungen von Arbeit der Selbstverwaltung in Fabriken,
2309000	2319000	bis zu größer angelegten Experimenten, die jetzt vielleicht nicht explizit anarchistisch angelegt sind, aber zumindest redet demokratisch, nehmen wir jetzt Roger Waugh oder so.
2319000	2334000	Da gibt es natürlich eine ganz reiche Geschichte, an der man sie ja bedienen kann und die erstens inspiriert, aber zweitens auch ganz konkrete Erfahrungen liefert.
2334000	2342000	Und auf der Basis kann man dann eben neue, vielleicht größere, vielleicht bessere entsprechende Experimente starten.
2342000	2349000	Und deshalb zum Beispiel finde ich das sehr wichtig, vielleicht eine kleine Fußnote, aber trotzdem wäre das auch sehr bedeutend.
2349000	2359000	Also auch das Dokumentieren von solchen anarchistischen Experimenten, also selbst von Leuten, die selber mit dabei waren oder wenn das halt länger zurückliegt, auch so in historischer Arbeit.
2359000	2374000	Also sie ja so, keine Ahnung, utopische Experimente, anarchistisch oder im weiteren Sinne sozialistisch, das 19. Jahrhundert, sie uns anschauen, das sind nicht nur so nerdische, akademisch-historische Übungen oder so.
2374000	2386000	Also das sind schon Sachen, die sehr konkretes Wissen liefern können, auch für Versuche, eine bessere Welt zu gestalten heute.
2386000	2401000	Ich glaube, das Problem bei diesen Sachen ist, dass das manchmal, wenn man so nach anarchistischer Praxis sagt, wie soll das funktionieren, dann verweist man eben auf solche oft kleinere Zusammenhänge und dann bleibt das stehen.
2401000	2420000	Und dann ist die Kritik natürlich einfach wiederum das zu sagen, naja gut, aber selbst dann wollte das Café, wie man das macht, das ist was anderes als Gesellschaften von Tausenden, Zehntausenden Millionen von Menschen zu organisieren und deren Bedürfnisse zu befriedigen und so.
2420000	2441000	Und das stimmt natürlich und ich finde, da muss man auch dann Antworten darauf haben, weil das ist ja auch bis zu so ein anarchistischer Reflex, dass man sagt, naja, aber das sieht man ja dann und alles ist Experiment und das muss man halt, also diese Antwort befriedigt ja meines Erachtens zu Recht niemanden wirklich.
2441000	2464000	Also wenn ihr jetzt sagt, ok, diese Gesellschaft, in der wir leben, ist schlecht und ich würde schon was dafür tun und man nimmt ja, wenn man politisch aktiv ist, bestimmte Risiken auf sich und so, ich würde das schon tun, wenn mir wirklich so eine konkrete Alternative vorschwebt, die meines Erachtens nach auch realistisch zu verwirklichen ist.
2464000	2476000	Das sind völlig legitime Fragen, auf die man, wenn man sich selbst so als politischer Aktivist, vielleicht sogar revolutionär versteht, zumindest andeutungsweise Antworten haben sollte.
2476000	2486000	Warum sollten Leute ansonsten mit einem zusammenarbeiten, wenn keine Aussicht darauf besteht, dass es besser wird oder vielleicht sogar die Gefahr besteht, dass es schlechter wird oder so.
2486000	2499000	Also keine Ahnung, man kann jetzt alle staatlichen Strukturen hier zerschlagen, weil die alle so fürchterlich sind, aber wenn da keine Alternativen aufgebaut sind, wer was, vielleicht wird dann alles nur noch schlimmer.
2499000	2512000	Also das ist ja so eine gegenwärtige politische Debatte rund um, wer eigentlich so, also die kritische Vormachtstellung heute hat, das sind ja leider eher rechte Kräfte momentan als linke.
2512000	2521000	Also was wäre jetzt das Resultat einer großen gesellschaftlichen Umwälzung jetzt, also wäre das dann wirklich besser oder wäre es vielleicht sogar noch schlechter oder so.
2521000	2536000	Das heißt, es müsste auf der Basis, also es darf nicht, man darf nicht stehen bleiben bei diesem Verweis, naja, aber schau, in diesen kleinen Projekten funktioniert es und irgendwann einmal für zwei Jahre hat es in Spanien funktioniert für 80 Jahre oder irgendwie so.
2536000	2547000	Sondern man muss sagen, ja, das sind wichtige Sachen und meine Idee, wie man daraus oder unsere Idee, wie man jetzt daraus etwas für die Zukunft entwickeln kann, schaut so und so aus.
2547000	2550000	Also dieser Teil muss dazukommen.
2550000	2551000	So.
2551000	2553000	Und wie schaut der aus?
2553000	2558000	Jetzt brennt einem das natürlich jetzt auf den Finger.
2558000	2561000	Das ist ja jetzt sozusagen die Frage, die es zu beantworten gilt.
2561000	2566000	Also was sind die spannendsten Ansätze in dieser Richtung, das zu beantworten?
2566000	2568000	Was gibt es da?
2568000	2573000	Ja, jetzt bediene ich mir natürlich der gewöhnlichen Zuflüchte und sage, ich selber kann das nicht beantworten.
2573000	2576000	Das muss kollektiv erarbeitet werden.
2576000	2578000	Was auch richtig ist.
2578000	2582000	Also ich habe diese Antwort nicht, aber okay, ich stimme dir natürlich völlig zu.
2582000	2584000	Völlig berechtigte Frage.
2584000	2596000	Und ich kann jetzt einfach völlig ausweichen und würde tatsächlich sagen, also jetzt konkret vor allen Dingen, was so größere gesellschaftliche Versuche anlangt.
2596000	2601000	Also ich finde schon, man muss sich die kurdische Bewegung schon sehr genau anschauen, was in Rotschauer passiert.
2601000	2604000	Ich finde aber auch noch wie vor, das ist ein bisschen so.
2604000	2613000	Das Interesse ein bisschen eingeschlafen, wobei vielleicht durch die Tour letztes Jahr, also die zapatistische Tour auch in Europa ist, das ein bisschen ins Bewusstsein zurückgekommen.
2613000	2619000	Also ich finde es auch sehr wichtig, sich nach wie vor anzuschauen, was in Chiapas passiert.
2619000	2626000	Das sind so diese zwei größten, glaube ich, Beispiele, an dem man gegenwärtig anschließen könnte.
2626000	2636000	Aber gleichzeitig, es gibt ja auch sehr viele so größere soziale Bewegungen, vor allen Dingen auch im globalen Süden.
2636000	2644000	Ich glaube, nach wie vor, dass hier, nachdem wir wahrscheinlich auch die meisten, die den Podcast hören, sich im globalen Norden befinden,
2644000	2653000	dass es da nach wie vor gewisse Wissenslücken, die auch natürlich sich ergeben, aus unseren Lebenszusammenhängen gibt.
2653000	2672000	Aber was jetzt gerade eben, also eine Bewegung von, das jetzt landlose Bewegung in Brasilien ist oder Bauernbewegungen in Indien oder auch radikale Gewerkschaftsbewegungen in Südafrika oder so.
2672000	2680000	Weil das ja auch oft Bewegungen sind, die sich durchaus, auch wenn sie selbst diese Begrifflichkeiten anwenden,
2680000	2690000	auf anarchistische und zumindest so basisdemokratische Basis organisieren und aber ja oft wirklich große Dimensionen,
2690000	2699000	also tausende Menschen, die daran beteiligt sind und so. Und das sind, glaube ich, die Orientierungspunkte.
2700000	2712000	Plus wiederum klar, es gibt so diese, wo man vielleicht persönlich mehr Erfahrung hat, diese kleineren Experimente in Basisdemokratie.
2712000	2719000	Aber man müsste, glaube ich, man müsste an, also wie gesagt, diese kollektive Diskussion, auf die ich vorher verwiesen habe,
2719000	2730000	die müsste ansetzen in einem Austausch mit Personengruppenkräften, die in Bewegungen aktiv sind, die ich jetzt vorher angesprochen habe.
2730000	2736000	Und ich glaube, es müsste da entsprechend mehr Vernetzung geben. Ja, und dort wird das anfangen.
2736000	2741000	Aber wie das dann, wie gesagt, also dieses Modell habe ich auch nicht anzubieten.
2741000	2748000	Und das ist ja weder meine noch die Aufgabe von sonst jemanden. Also mit Modellen, das glaube ich, da stimmt schon die anarchistische Kritik.
2748000	2755000	Also jetzt diesen Blueprint, so muss man das jetzt machen, Anleitung eins bis zwanzig, so wird es nicht funktionieren.
2755000	2760000	Aber wie gesagt, man darf sie da auch nicht völlig, wie das manchmal passiert.
2760000	2764000	Na ja, es ist quasi unanarchistisch, da überhaupt was dazu zu sagen.
2764000	2769000	Also ich glaube, man muss schon schauen, es gibt Orientierungspunkte, man muss entsprechend mit diesen Leuten.
2769000	2776000	Also es gibt theoretische Orientierungspunkte, vor allen Dingen, das war wichtig, es gibt auch praktische Erfahrungen, auch in großer Basis.
2776000	2783000	Und die politische Organisierung und Arbeit, glaube ich, müsste an der Vernetzung dort ansetzen.
2783000	2790000	Und mit dem Verweis auf die Modelle hast du mir jetzt schon eine schöne Stellvorlage gegeben zur nächsten Frage.
2790000	2799000	Denn wo diese Debatten rund um Modelle durchaus stattfinden, ist derzeit in der Auseinandersetzung mit Fragen demokratischer Planwirtschaft.
2800000	2808000	Wobei ich dann eben anmerken würde, dass es hoffentlich eben nicht hinausläuft auf einen Blueprint, der dann irgendwie eins zu eins umgesetzt werden solle,
2808000	2814000	sondern eher in diese Richtung deutet, die du ja vorhin auch eigentlich umschrieben hattest,
2814000	2822000	dass es einfach eine Auseinandersetzung mit der Frage geben muss, wie eben in dem Fall das Wirtschaftstreiben anders organisiert werden könne.
2822000	2832000	Aber was mir in der Auseinandersetzung mit diesen zeitgenössischen Modellen demokratische Wirtschaftsplanung immer wieder auffällt und auch ehrlich gesagt aufstößt,
2832000	2842000	muss ich sagen, ist, dass da immer wieder mal ein durchaus entscheidender Stelle auf bestimmte Konstrukte zurückgegriffen wird,
2842000	2845000	die mir absolut nicht mehr zeitgemäß erscheinen.
2845000	2855000	Also da wird dann zum Beispiel Wirtschaftsdemokratie eingefordert und konzeptionalisiert, was ja total wünschenswert ist, also ganz unbedingt wünschenswert ist.
2855000	2860000	Aber wenn man dann genauer hinsieht, dann basiert das Modell – und ich sage da jetzt keinen Namen,
2860000	2865000	weil es geht nur darum, das mal einfach als eine grundsätzliche Problematik auszuweisen –
2865000	2875000	dann basiert das Modell an so ganz zentraler Stelle, auf der für im Grunde dann alle verallgemeinerten Idee eines
2875000	2881000	autonomous self-activating, self-governing individual.
2881000	2886000	Und da bleibe ich dann total hängen, weil ich mir denke,
2886000	2895000	ne, also wenn sich jetzt alle dieser einen Idee, wie ich finde, ziemlich eigentlich ein altbackenden Idee von Subjektivierung hingeben müssen,
2895000	2901000	damit das Ganze funktioniert, wenn das sozusagen den Nukleus dieser Modellbildung darstellt,
2901000	2912000	dann steckt doch der Fehler eigentlich schon im Keim und dann ist auf der Ebene der Subjektivierung eigentlich dann fast schon so was wie ein reaktionäres Element eingezogen.
2912000	2916000	Wenn man das so ein bisschen polemisch vielleicht auch sagen will.
2916000	2921000	Und man merkt aber, dass dann die Autorinnen selbst das absolut überhaupt nicht so meinen.
2921000	2929000	Also die wollen das gar nicht irgendwie, natürlich nicht reaktionär orientieren, sondern emanzipatorisch, aber bedienen sich eben dieser Konstrukte.
2929000	2940000	Und also ich hatte das Gefühl, dass beim Lesen deiner Texte und deines Buches, dass sich ähnliche Konstellationen in der Auseinandersetzung mit dem klassischen Anarchismus finden
2940000	2952000	in Bezug auf bestimmte implizite Annahmen, die da zum Teil einfach drinstecken und dass du da aber so eine Art von nuancierterem Umgang mit vorschlägst und für dich irgendwie entwickelt hast.
2952000	2957000	Also insofern ist das ja eigentlich vor allem ein Nachrat fragen.
2957000	2969000	Also wie umgehen mit diesen Essentialismen, wenn man auf sie stößt, die ja dann leider eben oft so als ein scheinbares Fundament bestimmter Modelle und Theorien im Raum stehen?
2969000	2977000	Ja, das ist ja schön, wenn du das als nuanzierter wahrgenommen hast. Nuancen sind gut.
2977000	2991000	Ja, also zwei Sachen. Also erstens haben wir das Zitat, ich weiß jetzt nicht aus welchen Texte siehst oder von welchen Leuten oder so, aber das mit diesem Self-Acting, Self-Governing Individual oder was das war.
