start	end	text
2992000	2998000	Also das klingt ja sehr neoliberal so, also jetzt aus dem Kontext gerissen zumindest diese Bezeichnung.
2998000	3018000	Und das ist ja ganz allgemein, glaube ich, schon ein Problem oder in mir das auch so war, dass sich so neoliberale Glaubenssätze also bis weit heutzutage so in die Linke hinein quasi verselbstständigt haben.
3018000	3034000	Man könnte da natürlich dazu sagen und dem würde ich zustimmen als Kritik auch am Anarchismus, dass der Anarchismus dem auch Vorschub leistet, weil es eben auch wieder historisch, jetzt kommen wir ganz zum Anfang des Gesprächs zurück,
3034000	3060000	diese liberale Dimension im Anarchismus hier gibt, die finde ich positiv gewendet, ein wichtiges Korrektiv immer war zu so einer Form des Sozialismus, die die Frage der Individualität nicht sehr ernst genommen hat oder einfach davon ausgegangen ist,
3060000	3075000	dass sich die dann quasi automatisch nach der Revolution lösen wird. Also so als dieses als Korrektiv oder man kann sagen einfach auch anti-autoritäres Korrektiv in der sozialistischen Bewegung, glaube ich, war das wichtig für den Anarchismus.
3075000	3097000	Aber es gibt und das zeigt ja auch die Geschichte des Anarchismus, es bedeutet natürlich auch, dass wenn man sich zu sehr auf dieses Element, auf diesen Teil der anarchistischen Weltanschauung konzentriert, man letztlich heute einfach in so einem radikalen Liberalismus endet.
3097000	3108000	Also das ist ja diese, diese Strömung des Libertarismus, glaube ich, sagt man mittlerweile im Deutschen, also das Libertarianism, der ja auch so Anknüpfungen an Anarchismus hat oder so.
3108000	3117000	Es gibt ja sogar diese, also explizit diese sogenannten Formen des Anarcho-Kapitalismus, das sind ja dann die extremsten Formen eigentlich, diese Tendenz.
3117000	3132000	Aber ich glaube, man sieht das auch so in gegenwärtigen Debatten. Inwiefern, musst du mich dann korrigieren, weil du da in dem Zusammenhang da neben auch gekommen bist, auf so klassische Essenzialismen, die vielleicht in Anarchismus eine Rolle spielen.
3132000	3148000	Also inwiefern da zum Beispiel dann sowas mitspielt wie, na ja, man muss sich einfach nur auf das genuine Individuum verlassen, weil das von sich aus ja dann eigentlich eh die richtigen und guten Entscheidungen trifft oder so.
3148000	3170000	Das ist schon möglich oder so, wobei ich tatsächlich eher, also bei meiner Kritik sozusagen, auch Selbstkritik des Anarchismus, weniger eigentlich an diesen klassischen Essenzialismen ansetzen würde, die ich, wo ich den Eindruck habe, die wäre manchmal zu sehr betont oder so.
3170000	3179000	Also die Vorstellung zum Beispiel, dass Anarchisten, Anarchistinnen davon ausgehen würden, dass der Mensch an sich gut sei, ist, glaube ich, falsch.
3179000	3196000	Also das, glaube ich, hat niemand. Man könnte das sogar eher umdrehen und sagen, dass genau, weil Anarchisten, Anarchistinnen sich immer eher als andere, zum Beispiel der Korruption der Macht oder der Anfälligkeit auch der Menschen sich von Macht korrumpieren zu lassen,
3196000	3205000	bewusst gewesen sind, hat man eben diese anti-autoritären Elemente oder so früh betont. Also man kann diese Argumente auch umdrehen.
3205000	3223000	Aber was sicherlich stimmt, ist, dass ohne ein, sage ich jetzt, dieses Korrektiv der sozialen Gerechtigkeit, man auch im Anarchismus sehr leicht zu einer Überbetonung des Individuums, sowohl der individuellen Freiheit, aber auch der individuellen Handlungsmöglichkeiten oder Handlungskraft kommt,
3223000	3233000	die sich vielleicht auch in diesen gegenwärtigen Debatten widerspiegeln. Wobei, wie gesagt, du hast ja, das finde ich ja völlig richtig so, man muss derzeit irgendwelche Namen nennen oder so.
3233000	3252000	Also ich weiß nicht genau, auf welche Diskussionszusammenhänge du anspielst, aber ja, ich habe dieses Gefühl auch manchmal so, dass die, wie gesagt, die Handlungskraft und die Bedeutung auch der Subjektivität oder des Handelns des Individuums
3252000	3261000	überbetont wird. Man könnte, um das ein bisschen zu konkretisieren, ja sagen, dass sich das auch widerspiegelt in so Zugängen, die durchaus auch in anarchistischen Kreisen beliebt sind.
3261000	3273000	Wo man globale Probleme am ehesten über das eigene, den eigenen Lebensstil oder das eigene Konsumverhalten oder so lösen könnte. Wo das dann so in den Fokus gerät.
3273000	3288000	Und was machen jetzt diese, also auch so zum Beispiel diese Diskussionen um die imperiale Lebensweise, die in den letzten Jahren recht populär geworden ist, die ausgeht von einem sehr wichtigen Verweis auf globale Ungerechtigkeiten oder so.
3288000	3299000	Wo es aber manchmal auch, meine Sachen sind in der Diskussion, also wenn es dann um die praktischen Antworten geht, sehr stark auf so Subjektivität setzt.
3299000	3317000	Also eben, man fährt dann weniger Auto und isst weniger Fleisch und das sind ja alles richtige Sachen, die aber jetzt nicht vielleicht zwangsläufig unsere Probleme lösen werden, weil dazu kollektivere gesellschaftliche Ansätze wichtiger sind.
3318000	3332000	Ja, also ich denke, dass einfach für mich vielleicht das Problem ist, dass, also eben wieder in Bezug auf diese Modelle demokratischer Wirtschaftsplanung und das ist eben nicht nur eins, sondern das finde ich bei verschiedenen, wenn ich mir die angucke.
3332000	3341000	Mein Problem ist da eigentlich, dass ich das Gefühl habe, sie verwenden eben bestimmte Konstrukte zu unreflektiert.
3341000	3344000	Ja, also das wird dann sozusagen einfach da so eingesetzt.
3344000	3352000	Ja, sei es jetzt das Demokratie einfach nur als Schlagwort genommen wird, mehr oder minder, und es wird halt draufgeklatscht, als wäre damit alles gesagt.
3352000	3355000	Ja, und dann regeln wir das demokratisch.
3355000	3358000	Das ist ein Platzhalter, mehr dazu findet man nicht.
3358000	3361000	Und ich habe nur riesengroße Fragezeichen im Kopf.
3361000	3366000	Aber das bezieht sich eben vor allem auch auf so Konstrukte.
3366000	3371000	Vielleicht kann man es da jetzt auch als eine Frage festmachen, wie zum Beispiel die Frage der Autonomie.
3371000	3377000	Ja, also das ist ja was, was auch durchaus ambivalent ist oder was ein Begriff ist.
3378000	3386000	Du hattest jetzt eben schon den Nacho Kapitalismus und sozusagen den Rechtslibertarismus angesprochen,
3386000	3393000	die ja sich auch zum Beispiel auf Autonomie beziehen würden, halt in einer eben komplett individualistisch gedachten,
3393000	3400000	radikalisierten Art und Weise, die all das vermissen lässt, was du jetzt zuletzt wiederum richtigerweise eingefordert hattest.
3400000	3410000	Also genau, vielleicht mein Gefühl wäre eigentlich, dass man halt bei solchen Grundelementen halt ansetzen müsste,
3410000	3415000	sich das jeweils angucken, sowohl in Bezug auf die Subjektivierung eben, aber auch in Bezug auf Autonomie,
3415000	3420000	in Bezug auf die Frage, was heißt eigentlich demokratisch, wie sieht das denn konkret aus,
3420000	3428000	dass man all diese Dinge in einer viel eben wieder nuancierteren Art und Weise betrachten müsste
3428000	3435000	und eben auch noch mal reflektieren müsste, bevor man sie jetzt dann in diese Form der Modellbindung einfach so einbezieht.
3435000	3441000	Weil sonst hat man eben, läuft man Gefahr, dass man da solche, weiß ich nicht,
3441000	3449000	komplett ultra traditionellen humanistischen Ideen des Individuums plötzlich dann sich mit ins Boot holt,
3449000	3454000	ohne dass da irgendwie noch mal mit einem kritischen Auge drauf geschaut würde,
3455000	3461000	was das denn eigentlich sonst noch so mit ins Haus holt, wenn man sich dessen einfach so bedient.
3461000	3469000	Ja, dem stimme ich dann natürlich völlig zu. Also so diese Schlagwörter, ich sag dann noch was dazu,
3469000	3475000	was das ein bisschen so quasi nicht verteidigt, aber noch mal ein anderer Winkel darauf.
3475000	3483000	Aber grundsätzlich, ja absolut, das ist, wenn es dann so sehr von gerade so Schlagwörtern oder so unklaren Begriffen wimmelt,
3483000	3490000	die einem dann als große Antwort oder Lösung oder Erklärung verkauft werden, dann ist das unbefriedigend.
3490000	3494000	Das ist klar. Es ist natürlich auch so wiederum jetzt zur Begrifflichkeit.
3494000	3500000	Also Begriffe haben ja auch ihre eigene Geschichte und Gott so was mit der Autonomie.
3500000	3511000	Also es hat ja eine für die radikale außerparlamentarische Linke in Deutschland sehr wichtige Zeitschrift mit dem Namen Autonomie gegeben.
3511000	3521000	In den 70er und 80er Jahren, in dem Zusammenhang ist dann auch die sogenannte autonome Bewegung entstanden.
3521000	3529000	Und da kann man ja wohl noch bevor sagen, also da sind natürlich Aspekte des Autonomiebegriffes aufgegriffen worden,
3529000	3539000	die, glaube ich, du und ich und viele andere ja als positiv also auch erfassen.
3539000	3548000	Also die wiederum dieses eine kritische, anti-autoritäre, anti-herrschaftliche Haltung,
3548000	3555000	die eben eher wieder auf so einen Aspekt des Individuellen wie Kollektiven Empowerments bedrohen,
3555000	3558000	auch die Fähigkeit, Sachen selber machen zu können und so.
3558000	3564000	Und gleichzeitig, und darüber hat man dann oft weniger Einfluss, wie sie das so entwickelt.
3564000	3571000	Also gerade dann in einem neoliberalen Kontext, wo Subjektivität ganz was Zentrales und Hohes ist,
3571000	3577000	nimmt dann auch dieser Begriff der Autonomie plötzlich andere Bedeutungen an.
3577000	3582000	Und ja, man ist irgendwie völlig unabhängig, wie, wenn das überhaupt möglich wäre,
3582000	3586000	dass wir als Menschen eine unabhängige Existenz führen könnten.
3586000	3591000	Also wir gehören zu den abhängigsten Lebewesen, die es überhaupt gibt,
3591000	3597000	also von was Fürsorge und Pflege und so weiter anlangt.
3597000	3601000	Ja, also so können sich auch so Begriffe verschieben.
3601000	3606000	Eine Sache, die aber glaube ich auch noch wirklich wichtig ist in dem Zusammenhang,
3606000	3615000	ist das, weil ich glaube mir geht es ja auch sehr oft beim Lesen von Büchern oder ehrlich gesagt beim Schreiben
3615000	3623000	oder in so Gesprächen, dass man bei den Fragen darum, wie soll denn jetzt eigentlich alles besser werden
3623000	3626000	oder wie schaut eigentlich diese bessere Welt wirklich aus,
3627000	3635000	dass man irgendwann in den Punkt stößt, wo man dann eben sehr stark auf Schlagwörter oder so zurückgreift,
3635000	3643000	weil wenn es dann wirklich ums Konkrete und Eingemachte geht, das so schwierig zu fassen ist.
3643000	3646000	Und das ehrlich gesagt ist ja einfach so.
3646000	3651000	Also ich glaube, da stößt man nicht zwangsläufig dann auf so individuelle Grenzen von,
3651000	3656000	naja, ja, sehr interessante Kritik, der jetzt dieser Autor oder diese Autorin hat,
3656000	3659000	aber wenn es dann wirklich um die Lösung oder die Antwort geht,
3659000	3663000	folgt ihnen wieder nichts ein, außer diese Schlagwörter oder so.
3663000	3671000	Aber da kann man heute, also das glaube ich ist da nicht die Grenze von diesen individuellen Autoren und Autorinnen,
3671000	3675000	oft einmal, wobei man natürlich dann anders je unterschiedlich damit umgehen kann.
3675000	3678000	Problematisch jetzt, wenn man dann immer nur versucht, was als großartig,
3678000	3681000	tolle Lösung zu verkaufen, die es nicht ist oder so.
3681000	3684000	Aber im Prinzip ist das Problem sozusagen, das ist nicht die Grenze von denen,
3684000	3687000	sondern die Grenze halt dessen, was Theorie leisten kann.
3687000	3698000	Also Theorie kann politische Praxis besser machen, anregen, inspirieren, informieren,
3698000	3703000	da eine entsprechende Basis schaffen, um effektiv das machen zu können.
3703000	3707000	Aber die Antworten selber kommen dann aus dieser Praxis.
3707000	3712000	Also deshalb, wie wir vorher an diesen Punkt gekommen sind,
3712000	3715000	wie schaut es dann wirklich aus mit diesen Gegenmodellen.
3715000	3722000	Da muss es dann wirklich zu einer Synthese von theoretischen Überlegungen und Analysen
3722000	3725000	und aber eben einer politischen Praxis kommen.
3725000	3731000	Und die, also wenn man jetzt es wirklich so anschaut, so historisch,
3732000	3740000	also theoretische Schriften, die am nähesten dann wirklich an so praktischen Lösungen sind,
3740000	3747000	wo man am wenigsten das Gefühl hat, dass es da jetzt nur noch so um Schlagwerte geht oder so.
3747000	3754000	Das sind ja oft Schriften von Leuten, die selber ganz konkret in entsprechende Kämpfe involviert waren.
3754000	3759000	Also wenn man jetzt die Kolonialgeschichte anschaut, Amelka Cabral oder meine Dinge,
3759000	3765000	Archie Guevara oder so, diese Sachen haben schon eine besondere Dimension,
3765000	3768000	ob man das jetzt gut oder schlecht findet oder richtig, das ist nochmal eine andere Frage.
3768000	3774000	Aber da glaube ich, ist es schwierig dann an den Leuten das vorzuwerfen, dass es da nicht konkret wäre,
3774000	3781000	weil diese Schriften halt auch aus einer ganz konkreten Verbindung von Theorie und Praxis kommen.
3782000	3787000	Und an diesem Punkt, ich glaube, da ist es heute, da gibt es eben große,
3787000	3792000	erstens gibt es diese großen revolutionären Bewegungen nicht mehr, leider,
3792000	3798000	also dies zu der Zeit, wo jetzt zum Beispiel diese Autohandtätigkeit gegeben hat.
3798000	3804000	Und es gibt so eine gewisse Entfremdung auch von Theorie und Praxis aus allen möglichen Gründen,
3804000	3810000	die sich auch so in linken oder linksradikalen Zusammenhängen widerspiegeln.
3810000	3817000	Aber ich glaube, man müsste eben so an diesen Punkt kommen, wo es auch wieder eine stärkere Verbindung von Theorie und Praxis gibt.
3817000	3822000	Dann glaube ich, wird es auch für alle Involvierten einfacher werden,
3822000	3829000	diese Schlagwörter zu vermeiden oder weil man hätte mehr zu sorgen, wenn es dann zum Eingemachten geht oder so.
3830000	3841000	Also ich glaube, das ist eine dialektische Bewegung zwischen politischer Praxistheorie und dem Verhältnis, die diese zwei Aspekte haben miteinander.
3841000	3844000	Das ist eine ausgezeichnete Antwort, finde ich.
3844000	3849000	Und ich darf auch vielleicht noch nachschieben, dass es mir zum Beispiel jetzt bei der Autonomie,
3849000	3854000	da geht es mir auch gar nicht darum zu sagen, so man darf dieses Wort nicht mehr verwenden und das ist verbrannt oder sowas,
3854000	3862000	sondern eher, dass ich das Gefühl hätte, wenn man es verwendet oder dass es vielleicht einfach eine Weiterentwicklung braucht.
3862000	3869000	Und die steckt in dem, was du jetzt darüber sprichst oder wie du darüber sprichst, wie du das auffasst, finde ich sowieso schon immer drin.
3869000	3877000	Weil eigentlich, was es ja bräuchte, ist eine Form des Denkens in relationaler Autonomie.
3877000	3881000	Also wo einfach beides immer schon enthalten ist letztlich auf einer Art.
3881000	3891000	Also insofern wäre das eigentlich jetzt eher mein Punkt vielleicht nochmal zur Rettung der Autonomie auch aus meiner Perspektive.
3891000	3902000	Und genau, in Bezug auf die Grenzen, also dass man da vielleicht halt wo anstößt, wo dann einfach die Dinge eigentlich auch in der Theorie nicht mehr zu fassen sind
3902000	3907000	und deswegen dann diese Synthese aus Theorie und Praxis stattfinden muss, da würde ich absolut zustimmen.
3907000	3916000	In Bezug auf manche Beispiele, bei denen ich das ein bisschen problematisch finde, wenn man sich bedient verschiedener Konstrukte,
3916000	3923000	also gerade eben, wie ich das vorhin mit dem Autonomous Self-Activating Self-Governing Individual angesprochen hatte,
3923000	3927000	da ist es zum Beispiel so, dass ich das Gefühl habe, okay, das geht eigentlich über das hinaus.
3927000	3937000	Also das ist nicht nur sozusagen ein Punkt, wo man wo anstößt, wo das nicht mehr weiter irgendwie auch produktiv theoretisiert werden kann
3937000	3941000	und deswegen eigentlich nur eine alternative Praxis ein, die einen Weg aufzeigt,
3941000	3948000	sondern dass da eigentlich selbst schon im Grunde der theoretische Kern eigentlich auf einer Art defizitär ist
3948000	3955000	und dass da eigentlich man aus einem anderen Nukleus heraus denken, das Modell auch denken muss,
3955000	3959000	eben nicht aus dem Autonomous Self-Activating Self-Governing Individual heraus,
3959000	3964000	sondern wie zum Beispiel Bini Adamchak aus den Beziehungsweisen heraus.
3964000	3971000	Also wo dann einfach auch, wenn man am Anfang schon eine andere Perspektivierung einnimmt,
3971000	3980000	dann eben hoffentlich auf Basis dieses Denkens in Beziehungsweisen auch andere Formen der Modellbildung daraus resultieren.
3980000	3984000	Nur so ein bisschen vielleicht auch zur Einordnung nochmal.
3985000	3997000	Ich würde trotzdem gerne noch, auch wenn wir jetzt im Grunde schon so ein bisschen pauschaler diesen Ort der Schlüsselbegriffe eigentlich abgehakt haben,
3997000	4003000	wird es mich trotzdem noch interessieren, wie du denn mit der Frage der Freiheit umgehst.
4003000	4009000	Das ist so ein bisschen ähnlich wie mit der Autonomie. Natürlich ist das zu gewissen Teilen ein verbrannter Begriff.
4009000	4017000	Gleichzeitig ist ja eine bestimmte Idee der Freiheit nach wie vor absolut attraktiv und eben auch in weiten Teilen natürlich uneingelöst.
4017000	4023000	Und du hattest es jetzt hier im Laufe des Gesprächs schon angesprochen, Daniel Leuk hat es damals auch angesprochen,
4023000	4033000	die Freiheit zur Gemeinschaft oder nicht im Gegensatz, in einer Gleichzeitigkeit zu einer Freiheit auch des Individuums,
4033000	4044000	das eben miteinander gedacht werden muss. Und jetzt würde ich das aber vielleicht gerne nochmal zur Frage nach alternativen Governmentalitäten rückbinden.
4044000	4052000	Denn die liberale Governmentalität dirigiert ja eben zentral mit und durch Freiheit hindurch.
4052000	4058000	Wenn man jetzt also an der Idee der Freiheit festhalten will, sie nicht einfach aufgeben will,
4059000	4068000	wie müsste dann eine alternative Governmentalität anders mit der Frage der Freiheit umgehen, um eben nicht in die Falle zu tappen,
4068000	4078000	sich an liberale Governmentalität einfach nur dran zu heften, wie das ja Foucault zum Beispiel auch an einem Punkt dem Sozialismus eigentlich vorwirft,
4078000	4086000	dass er eben keine eigene intrinsische Governmentalität entwickelt hätte, dass sie nicht in den Texten drin stünde
4086000	4089000	und dass es gelte, diese zu erfinden?
4089000	4096000	Also ich habe eine große Frage jetzt, ich fange jetzt einmal so an, es ist wirklich lustig, weil gerade dieser Freiheitsbegriff,
4096000	4105000	also da tue ich mir seit langem schwer, also man kriegt ja das immer wieder als Anfrage, ja und so Freiheit aus anarchistischer Perspektive,
4105000	4114000	also ich gebe sowas oft gerne ab, ehrlich gesagt, weil das halt wirklich als Begriff, aber es ist auch bei der Demokratie ein bisschen ähnlich oder so,
4114000	4122000	weil das natürlich mittlerweile, also in so vielen Konten, also alle beanspruchen diese Sachen ja für sich, es gibt irgendwie niemand,
4122000	4131000	der sagt Freiheit ist was Schlechtes oder so, sondern alle finden ja Freiheit gut und dann gibt es halt 100.000 unterschiedliche Interpretationen davon.
4131000	4140000	Also die, gerade was die Komplexität auch der Frage anlangt, wird mit meiner Antwort unglaublich unbefriedigend ausfallen,
4141000	4150000	aber ich glaube, es müsste halt wirklich ansetzen, weil du ja das auch schon angesprochen hast, also so wie jetzt da das vielleicht auch Daniel sieht oder so,
4150000	4159000	oder ja auch viele andere, also ich glaube, was man, also diesen Begriff der gesellschaftlichen Freiheit,
4159000	4163000	ich glaube da müsste die Antwort letztlich ansetzen, aber was bedeutet eigentlich das?
4164000	4171000	Also ich glaube also als anarchistische Perspektive und dann vielleicht auch so in Hinsicht eben auf so eine alternative Kriminalität oder so,
4171000	4181000	wer das eigentlich ist, das ist der entscheidende Punkt, was bedeutet eigentlich gesellschaftliche Freiheit im Gegensatz jetzt eben zu einer rein individuell gedachten,
4181000	4191000	wobei das ja kein Gegensatz dann sein sollte, auch theoretisch, also die individuelle Freiheit ergibt sich ja dann, also ist ja dann impliziert auch in gesellschaftliche Freiheit,
4191000	4199000	aber das wäre eben die Basis dafür, dass das wirklich ein Wert ist, der allen zukommt und nicht eben einer beschränkten Gruppe,
4199000	4206000	die sich das dann auch leisten kann oder die privilegiert genug ist, dass ihr das zukommt.
4206000	4213000	Aber ich komme jetzt da nicht weiter ehrlich gesagt, also es ist wirklich Anschluss an dem, was wir eingangs erwähnt haben,
4213000	4224000	also ich glaube die Basis für gesellschaftliche Freiheit ist soziale Gerechtigkeit, nur auf der Basis ist das überhaupt entsprechend denkbar.
4224000	4232000	Und dann muss es aber, vielleicht kann ich das noch dazu sagen, weil das also bis zur ständigen Diskussion ist,
4232000	4244000	die oft mit bekannten Genossen, Genossinnen haben, die vielleicht etwas eine etwas andere Sicht des Sozialismus haben als ich.
4244000	4257000	Also also die gesellschaftliche Freiheit muss dann schon auch die individuelle Freiheit sozusagen heute ernst nehmen oder deshalb als Wert entsprechend betrachten oder so,
4257000	4266000	weil ich glaube, dass so in dem, was man oft so eben aus die autoritären Formen des Sozialismus des 20. Jahrhunderts bezeichnet oder Staatssozialismus oder so,
4266000	4271000	ich glaube schon, dass das ein Element war, das tatsächlich unterschätzt worden ist.
4271000	4286000	Also es ist wohl so, dass sich in vielen dieser Zusammenhänge Menschen, obwohl man versucht hat, ein hohes Maß an soziale Gerechtigkeit zu schaffen, individuell sehr unfrei gefühlt haben.
4286000	4292000	Was nicht das Ziel an der gesellschaftlichen Freiheit sein kann.
4292000	4301000	Also es muss schon sein, dass sich Individuen frei fühlen, aber eben im Kontext einer Sorge zur gesellschaftlichen Freiheit im Zusammenhang mit sozialer Gerechtigkeit
4301000	4309000	und nicht als Resultat dessen, dass man zu dem privilegierten Teil der Gesellschaft gehört, dass er sowas leisten kann.
4309000	4312000	Konkret, da kann ich der Erfolge leider nicht beantworten.
4313000	4322000	Das macht überhaupt nichts. Bevor wir uns der letzten Frage zuwenden, wollte ich nur fragen, welches sind deiner Meinung nach die aktuell spannendsten Entwicklungen im Anarchismus?
4322000	4333000	Die aktuell spannendsten Entwicklungen im Anarchismus, jetzt muss man schnell was einfallen, sonst klingt das so, als würde es nichts Spannendes geben.
4333000	4345000	Also ich habe jetzt ein nettes Gefühl, dass sich jetzt wahnsinnig, okay, okay, ich glaube, das, was ich tatsächlich am spannendsten finde momentan,
4345000	4362000	sind Adoptionen des Anarchismus in gesellschaftlichen Kontexten, in denen der Anarchismus als explizite ideologische oder politische Weltanschauung traditionell keine große Rolle gespielt hat.
4362000	4374000	Also im Teilen des globalen Südens vor allen Dingen, aber auch in Kontexten, die jetzt, wenn wir jetzt im globalen Norden bleiben,
4374000	4388000	die jetzt nicht zwangsläufig sich so der aktivistischen Szene oder diesem Milieu zurechnen lassen, sondern von Leuten, die auf den Anarchismus stoßen,
4388000	4397000	sagen wir jetzt in Zusammenhang gerade vielleicht mit Arbeitskämpfen oder so, Leute, die politisch jetzt wahnsinnig ideologisch sind, aber aufgrund ihrer Erfahrungen im Arbeitskampf
4397000	4408000	dann vielleicht auch, sagen wir jetzt zunächst, syndikalistisch-anarchistische Ideen stoßen, weil sie das Gefühl haben, dass sie doch auch am effektivsten
4408000	4423000	also Widerstand leisten können gegen die, also gegen ihre Arbeitgeber und die Arbeitsbedingungen, unter denen sie zu leiden haben.
4423000	4433000	Und da gibt es, glaube ich, schon einiges in diesen Bereichen, das würde ich sagen, finde ich gegenwärtig eigentlich so am spannendsten,
4433000	4447000	weil ich also da das Gefühl habe, dass sich in diesen Kontexten am ehesten auch eben so ein Dialog ergibt zwischen jetzt Aktivistinnen, die so selbst eine anarchistische Identität vielleicht haben
4447000	4460000	oder sich auch als politisch begreifen und Menschen, die das nicht zwangsläufig tun, die aus anderen Kontexten kommen, aber genauso ein Interesse darum haben, ihre Lebensbedingungen zu verbessern.
4460000	4473000	Das finde ich eigentlich am spannendsten, weil anschließend an vieles, worüber wir geredet haben, also ich finde, ich bin niemand, der so Szenen und Milieuen so baschen will,
4473000	4485000	also da passiert viel von dem, was wir vorher angesprochen haben, was wichtig ist, ein Experiment, man sammelt viel Erfahrung, aber der entscheidende Punkt für gesellschaftliche Veränderung ist natürlich,
4485000	4493000	aus diesen Blasen herauszukommen und diese Ansätze finde ich am wichtigsten und spannendsten.
4493000	4511000	Und in Bezug auf dein letzteres Beispiel fällt mir sofort eben die FAU ein und die Arbeitskämpfe zum Beispiel, die Sie begleitet haben im Kontext der Gig Economy, da hatte ich jetzt gerade ein Interview geführt mit Nina Scholz zu dem Thema,
4511000	4520000	also da habe ich sofort direkt konkrete Beispiele vor Augen, wo eben genau das passiert. Kannst du uns vielleicht noch ein Beispiel geben, weil du jetzt auch angesprochen hattest,
4520000	4533000	dass es eben im globalen Süden auch eine Auseinandersetzung mit Anarchismus gibt durch Leute, die vielleicht von sich aus eigentlich gar nicht so viel damit zu tun gehabt hätten,
4533000	4544000	aber dass es da durchaus auch zu beobachten ist, dass diese Ideen mit aufgegriffen werden und auch eben in die Praxis mit einfließen. Hast du da vielleicht ein Beispiel für uns?
