start	end	text
4544000	4567000	Ja, also das naheliegendste Beispiel für mich sind immer die Philippinen, weil ich dort da persönliche Kontakte habe aufgrund meiner persönlichen Geschichte und weil ich das Land besucht habe und seit längerem mit Leuten dort in Kontakt und auch an bestimmten Projekten zusammengearbeitet habe.
4567000	4585000	Und dort ist es ja zum Beispiel so, was ich da gerade in dem philippinischen Kontext nochmal interessant finde, ist ja, dass da traditionell die Linke sehr stark von der kommunistischen Partei und der mit ihr verbundenen neuen Volksarmee bestimmt ist,
4585000	4600000	die auch, wenn man jetzt bei diesen Kategorien bleibt, eben eher einer autoritär-sozialistischen Tradition zu zordnen ist und viele der Leute, die sich in der anarchistischen Bewegung heute,
4600000	4616000	ich glaube, ich kann schon von einer Bewegung sprechen, selbst wenn auch Kleinen in den Philippinen tätig sind, die diese Geschichte eigentlich haben und aus diesen Zusammenhängen kommen und aus diesem Kontext heraus, aus einer Kritik an diesen internen Strukturen,
4616000	4630000	dieser mehr, sage ich jetzt wieder, autoritär orientierten Bewegungen, sich dann am Anarchismus zugenähert haben, wobei dort aber dann nochmal viele andere Elemente reinkommen, also gerade auch so ökologische Fragen.
4630000	4650000	Und man aber auch, also was ich jetzt von der Praxis auch eben weiß, also sowas wie Info-Läden, die halt nicht in irgendwelchen Szenevierteln sind, sondern halt wirklich in so ärmeren Vierteln von Manila und anderen Städten
4650000	4669000	und man da auch so in seiner Praxis viele Sachen macht, die eben für die Lokalbevölkerung, also wo man mit der Lokalbevölkerung zusammenarbeitet, die wiederum, wie gesagt, jetzt nicht zwangsläufig sehr ideologisch politisch geprägt ist oder so.
4669000	4689000	Also das wäre eines, das wäre das Beispiel, das mir immer als erstes sozusagen auch einfolgt, weil ich halt da das am nähersten verfolge seit langer Zeit, aber es gibt ähnliche Beispiele aus vielen anderen Ländern oder Regionen, gerade im Mittleren, Osten, Nordafrika.
4689000	4704000	Und da gibt es ja, wie gesagt, es gibt ja heute das Internet, also man findet da relativ leicht, sowohl auf Deutsch als auch auf Englisch, mehr Quellen dazu.
4704000	4718000	Man muss natürlich bei Internetquellen immer ein bisschen vorsichtig sein, also es ist leicht für ein, zwei Personen irgendwelche Bewegungen zu gründen online, aber da kommt man dann relativ schnell drauf, wenn man sich das genauer anschaut und ein bisschen mehr umsucht.
4718000	4734000	Ja, aber da finde ich, also wie gesagt, da finde ich, da stoßt man. Und ich finde, das kann ich auch nochmal dazu sagen, was ich genannt habe, diese Adaptionen von Anarchismus in Kontexten, wo er historisch oder traditionell vielleicht nicht so bedeutend war als explizite Bewegung.
4734000	4746000	Man stößt da vielleicht auch dann manchmal auf Deutungen oder Ansichten, die jetzt dem, was man aus der eigenen Szene oder so gewohnt ist, zu widerlaufen oder herausfordernd sind.
4746000	4757000	Aber ich finde das ehrlich gesagt nur gut. Also die Welt ist groß und widersprüchlich und vielfältig und spielt sich nicht alles nur genauso ab wie vor der eigenen Haustür.
4757000	4768000	Und das, findet man das nicht gut und soll man das auch sagen und in kritischen Dialog treten, aber der Dialog ist wichtig und man lernt selber nur davon.
4768000	4776000	Wunderbar. Als letzte Frage stelle ich immer noch, wenn du dir Zukunft vorstellst, was stimmt dich freudig?
4776000	4801000	Die vielen guten Dinge, die man im Alltag erleben kann und die nicht verschwinden werden. Also soziale Kontakte, Fußball spielen, was Gutes essen, die ganz einfachen Dinge des Lebens, die auch Lebensqualität ausmachen.
4801000	4818000	Und die das in der Zukunft ausmachen werden, wobei man sich eben entsprechenden Rahmen schaffen kann, der noch viel mehr Freude an diesen Sachen macht, weil wir viel weniger Sorgen mit anderen haben.
4818000	4821000	Wunderbar. Gabriel, vielen Dank für das Gespräch.
4821000	4824000	Danke nochmal für die Einladung. Herzlichen Dank.
4831000	4833000	Leute, vielen Dank fürs Zuhören.
4833000	4839000	Show-Notizen und vieles mehr findet ihr auf www.futurehistories.today.
4839000	4845000	Diskutiert mit auf Twitter unter dem Hashtag Future Histories oder im eigenen Subreddit.
4845000	4858000	Ihr könnt Future Histories nicht nur auf allen großen Podcast-Plattformen hören und abonnieren, sondern auch auf YouTube, wo ihr neben den Episoden dann auch Kurzvideos zu Kernbegriffen einzelner Episoden findet.
4858000	4867000	Schreibt mir gerne unter jan at futurehistories.today. Ich freue mich immer sehr über interessante Rückmeldungen und Hinweise.
4867000	4877000	Wenn ihr Future Histories unterstützen wollt, dann könnt ihr das auf patreon.com schrägstrich Future Histories oder auch via Spende auf unserer Homepage.
4877000	4886000	Future Histories ist eine Produktion von MetaLapsis. Zu finden auf meta-lapsis.net. Bis zum nächsten Mal. Ich freue mich.
