start	end	text
4670000	4677000	Und ich finde, was ist ein bisschen kompliziert, ist, dass es nämlich nicht nur all das leisten können muss, was Sie jetzt gerade gesagt haben,
4677000	4681000	sondern dass es auch auf einer narrativen Ebene sexy sein muss.
4681000	4685000	Also es muss irgendwie funktionieren, narrativ.
4685000	4693000	Aber wenn man sich das anguckt, wie quasi der Markt, obwohl er die ganze Zeit, ich sag ja, pardon my French, jetzt mal die ganze Zeit Scheiße baut,
4693000	4702000	trotzdem noch so fest im Sattel bleibt, hat auch was damit zu tun, dass es auf einer narrativen Ebene einfach wirklich geschickt konstruiert ist sozusagen.
4702000	4708000	Und quasi den Leuten, die jetzt sozusagen auf einer theoretischen Ebene sich nicht sonderlich viel immer auseinandersetzen,
4708000	4719000	trotzdem quasi ein Narrativ bereithält, wo quasi auf so einer bestimmten intuitiven Ebene die Leute dann denken, na ja klar, macht schon sinnmäßig.
4719000	4728000	Also das muss es sozusagen auch noch leisten können, zusätzlich zu all dem, was Sie jetzt gerade schon richtigerweise herausgestellt haben.
4728000	4735000	Also insofern gibt es noch, sagen, einige Konstruktionsarbeit zu leisten, darf ich quasi festhalten.
4735000	4742000	Ich frage am Ende einer jeden Episode immer noch, wenn Sie sich Zukunft vorstellen, was stimmt Sie freudig?
4742000	4748000	Was stimmt mich freudig? Da muss ich jetzt mal lange überlegen.
4748000	4750000	Bitte gerne.
4750000	4752000	Was stimmt mich freudig?
4752000	4763000	Freudig, dass es immer Überraschungen gibt und immer positive Überraschungen.
4763000	4779000	Ja, und das, also insofern bei allem Pessimismus, der, glaube ich, jetzt nicht nur irgendwie so eine persönliche Eigenschaft ist oder so,
4779000	4783000	glaube ich schon, gibt es bei mir so ein Grundlegend mit Optimismus.
4784000	4796000	Es gibt immer positive Überraschungen und Dinge, die auftauchen, die dann irgendwie das Ganze wieder in ein besseres oder ein positives Licht rücken können.
4796000	4803000	Also insofern das, worüber wir gesprochen haben, dieses Nichts, was man nicht planen kann.
4804000	4812000	Und das geht natürlich in alle Richtungen und kann unterschiedlich bewertet werden, aber es kann eben auch positive Effekte entfalten.
4812000	4815000	Wunderbar. Herr Lemke, vielen Dank für das Gespräch.
4815000	4817000	Ja, ich danke auch.
4822000	4832000	Das war Future Histories für heute. Vielen Dank fürs Zuhören, Shownotizen und vieles mehr findet ihr auf www.futurehistories.today.
4832000	4838000	Diskutiert mit auf Twitter unter dem Hashtag Future Histories oder im eigenen Subreddit.
4838000	4845000	Ihr könnt Future Histories nicht nur auf allen großen Podcast-Plattformen hören und abonnieren, sondern auch auf YouTube,
4845000	4851000	wo ihr neben den Episoden dann auch Kurzvideos zu Kernbegriffen einzelner Episoden findet.
4851000	4860000	Schreibt mir gerne unter jan at futurehistories.today. Ich freue mich immer sehr über interessante Rückmeldungen und Hinweise.
4860000	4870000	Wenn ihr Future Histories unterstützen wollt, dann könnt ihr das auf patreon.com-futurehistories oder auch via Spende auf unserer Homepage.
4870000	4880000	Future Histories ist eine Produktion von MetaLapses zu finden auf meta-lapses.net. Bis zum nächsten Mal. Ich freue mich.
