start	end	text
3079000	3096000	Und darin liegen natürlich auch Chancen. Und ich glaube, diese, sage ich mal, diese befreienden Möglichkeiten, die darin liegen, die gilt es dann eben auch auszubustabieren und zu nutzen.
3096000	3114000	Ja, es soll jetzt keine Dystopie, das wollte ich jetzt nicht zeichnen, sondern einfach eher, sage ich mal, bestimmte Kurzschlüsse oder Sackgassen, dass das ein automatischer Prozess ist, das Aufzeigen mit dem Buch und eigentlich in die Richtung andeuten, wie dann weiter zu fragen wäre und wo zu suchen ist.
3114000	3127000	Also das ist auch absolut durchgekommen, vielleicht an die Hörerinnen und Hörer gerichtet. Also ich habe überhaupt nicht das Gefühl, dass das Buch in irgendeiner Form quasi in einer Dystopie endet, sondern im Gegenteil, dass das eben genau diese Fragen aufmacht.
3127000	3156000	Und ich denke mal, eine Frage, die ja sich relativ fast schon logisch anschließt, wenn man eben in diese Richtung plädiert, dass in technologischen Ökologien gedacht werden soll, in mehr als menschlichen Konstellationen und so weiter, ist, wenn man jetzt mal so ganz handfest sich der politischen Frage im Sinne der politischen Theorie oder sowas zuwendet, dann ist ja mehr oder minder der gesamte Korpus unserer politischen Theorie fußt sozusagen.
3156000	3169000	Auf einem komplett anderen Verständnis, nämlich auf einem Verständnis der Souveränität, in dem es sozusagen dann auch souveräne Individuen gibt, die dann in den politischen Prozess eben sich mit ihrer Meinung einspeisen und so weiter und so fort.
3169000	3185000	Wenn man jetzt eben mal konkret sich diesen Raum der politischen Theorie anschaut und dem zuwendet, was sind denn da die vielversprechendsten Zugänge, die versuchen, auch da konkret zu werden?
3185000	3198000	Weil jetzt also das mit den Sicherheitstechnologien, wie wir es jetzt gerade besprochen hatten, das ist ja relativ greifbar, dass man sagt, okay, es kann quasi eine andere Form der Sicherheit produziert werden durch X, Y, Z und so, so wie wir es jetzt gerade gemacht haben.
3198000	3207000	Aber wie kann ein politisches System aussehen, das diesen diesen relationalen Materialismus, wie sie ihn beschreiben, Rechnung trägt?
3207000	3224000	Wie ist das zu denken? Und Sie hatten vorhin in einer Antwort ja auch schon ein paar Sachen angedeutet. Welche politischen Kollektive ergibt das? Wie artikulieren die sich? Was ist das, was den Demos ausmacht und wie er funktioniert?
3224000	3240000	Also das sind ja dann, da ist man ja in einem Terrain, wo finde ich also nicht unmittelbar dann irgendwie zumindest mir nicht irgendwie die Antworten zufliegen, wo ich denke, aha, na klar, das kann man ja dann so oder so machen oder so was, sondern das ist erst mal eine große Stille.
3240000	3247000	Und ich habe das auch schon also wirklich verschiedenste Leute innerhalb von Future Histories gefragt, wie man das denn denken könnte.
3247000	3259000	Und ich meine, was ich zurück bekomme, ist eben zum Beispiel mit Verweis auf Haraway oder so was dann quasi das Angucken der Kontexte, das die Situiertheit und so weiter und so fort.
3259000	3272000	Aber das beantwortet noch nicht eine bestimmte Ebene, nämlich eine höherstufige Ebene, also eine von mir aus auch Metaebene der politischen Theorie, weil die dadurch noch nicht zu genüge adressiert wird.
3272000	3280000	Und auch diese Leerstelle der Frage, wie eine solche politische Theorie aussehen, könnte dadurch noch nicht zu genüge gefüllt wird, finde ich.
3280000	3286000	Kennen Sie da Zugänge? Also ich fürchte, ich habe jetzt da auch keine Antworten.
3286000	3299000	Das ist natürlich eine extrem wichtige Frage, aber ich glaube, die Punkte, die mir wichtig sind oder die es zu berücksichtigen gilt aus meiner Sicht, die habe ich eigentlich schon genannt.
3299000	3318000	Also die Frage ist, wie sich auf der einen Seite tatsächlich und das ist, glaube ich, die Herausforderung, Prozesse auf einer sehr, also das, was jetzt diese situierte Ebene in relativ konkreten Praktiken, überschaubaren Kontexten,
3318000	3320000	bestimmte Entscheidungen gefällt werden.
3321000	3329000	Aber gleichzeitig ist natürlich wichtig eine Rückkopplung an die Ebenen, die Sie jetzt genannt haben, also die übergreifende Ebene.
3329000	3345000	Also wenn man sich das jetzt anschaut, diese ganzen Fragen, die mit Klimakatastrophe, Begrenzung jetzt der Erderwärmung zu tun haben, das sind ja Fragen, die lassen sich eben nicht in so kleinen Formaten bearbeiten.
3345000	3359000	Beziehungsweise die entscheidende Frage ist, wie diese kleinen Formate oder kleinere Kontexte dann letztlich mit Fragen einer, kann man sagen, globalen Bürgerinnschaft auch korrespondieren.
3359000	3372000	Und wie lassen sich diese Ebenen miteinander so in einen Austauschprozess bringen, dass auch die Probleme adressiert werden können, um die es heute geht.
3372000	3387000	Und das ist, glaube ich, die entscheidende Frage. Also diese Ebenenfrage ist wichtig. Aber dann, und das ist ja der weitere Punkt, gilt es ja eigentlich auch, Entitäten mit einzubeziehen, die über menschliche Kollektive dann auch hinausgehen
3387000	3409000	und deren Stimme jetzt nicht mal hörbar zu machen oder die Übersetzungsprozesse irgendwie in Gang zu bringen. Wie lassen sich dann auch die Interessen, also wenn man von der Wirkmächtigkeit ausgeht, wie lassen sich diese Interessen dann auch irgendwie berücksichtigen?
3409000	3424000	Und in welcher Weise geht es dann eben auch um Entscheidungen, die über menschliche Kollektive dann auch hinausgehen bzw. eigentlich auch grundlegend sind für ein enges Verständnis menschliche Kollektive.
3424000	3444000	Also wie gibt es dann auch, sage ich mal, ein Eigeninteresse, wiederum ein aufgeklärtes Eigeninteresse darin bestünde, dieses sich zu öffnen für Interessen, für Willensbekundungen von nichtmenschlichen Entitäten.
3444000	3464000	Und das ist, glaube ich, so die doppelte Herausforderung. Also man kann sagen, so ein Ebenenproblem. Wie lassen sich da Formen finden, wie sich gewissermaßen, das halte ich für wirklich wichtig, die Einbeziehung von ganz, sage ich mal, von lokalen Kontexten und dort die Generierung von Entscheidungen.
3464000	3493000	Dann lässt sich das aber rückkoppeln bis hin zur globalen Ebene eigentlich. Und da auch bindende Entscheidungen fällen auf dieser globalen Ebene, die dann gewissermaßen in einem Austauschprozess ist mit dieser situierten oder lokalen Ebene, aber gleichzeitig sich eben öffnet, sage ich mal, für Belange von Kollektiven, die letztlich wie eine planetäre Grundlage haben, um es mal so auszudrücken.
3494000	3507000	Ja, aber das ist natürlich extrem abstrakt. Ich fürchte so wirklich konkret, ich würde auch nicht beanspruchen, jetzt für die politische Theorie da irgendwelche aussagekräftigen Vorschläge machen zu können.
3507000	3524000	Aber das ist zumindest auch da muss man mal die Herausforderung sehen, vor der wir eigentlich stehen und das irgendwie anerkennen. Das ist eigentlich die Dimension, das ist das Problem.
3524000	3548000	Und ich fürchte es ist nicht einfach darin gelöst, das ist ganz offensichtlich ja nicht darin gelöst, dass es solche Klimagipfel gibt, die letztlich dann zu Ergebnissen führen, wo man sich schon fragt, also welche Art von Fehlwahrnehmung gibt es da, die dann dazu führt, dass die Probleme nicht richtig adressiert werden?
3548000	3556000	Dass das, was dann beschlossen wird, sozusagen entweder nicht umgesetzt wird oder in den Beschlüssen weit hinter dem zurück bleibt, was es bräuchte.
3557000	3571000	Und wenngleich Sie jetzt natürlich sagen, okay, Sie hätten jetzt auch nicht eben die das eine Modell der politischen Theorie parat oder die Mehreren, die quasi diese Fragen jetzt hinreichend beantworten würden oder sowas.
3571000	3601000	Aber gibt es Pferden? Also kennen Sie Autorinnen, Autoren, bei denen man vielleicht mal hineinschauen sollte, die sich dezidiert diesen, sie hatten jetzt zwei Stränge aufgemacht, diesen strengen zuwenden und versuchen auch so ein bisschen praktikable Antworten dafür bereitzustellen, wie eben auf der einen Seite quasi diese Mikro-Makro-Koordination oder Meta-Koordination quasi gewährleistet werden kann und wie eben das Denken in Technologie,
3601000	3613000	in technologischen Ökologien und mehr als menschlichen Konstellationen, wie sich das einbinden lässt in einer ganz konkreten, also praktisch umsetzbaren Art und Weise.
3614000	3628000	Ich frage das auch nur vielleicht für Sie auch, um so ein bisschen einen Kontext herzustellen, weil ein anderer Strang von Future Histories, der beschäftigt sich mit der Frage, also der mittlerweile wieder sehr stark aufkommenden Debatte rund um Fragen demokratischer Planwirtschaft.
3628000	3650000	Und innerhalb dieser Debatte bin ich immer mal wieder doch recht frustriert und ein bisschen ernüchtert, muss ich sagen, weil all diese Fragen, die wir jetzt hier besprechen, da eigentlich nicht wirklich vorkommen und nicht wirklich mit hineinspielen, sondern stattdessen wird halt dann eben wieder zurückgefallen in ein Souveränitätsdenken, wenn man ehrlich ist.
3650000	3664000	Ja, also das wird dann anders gedacht, vielleicht, obwohl eigentlich nicht wirklich anders, aber da wird halt quasi dann das eher aus einer emanzipatorischen Gestus herausgedacht, aber es verbleibt im Souveränitätsdenken.
3664000	3673000	Also wo dann halt quasi natürlich der Souverän ist dann eben nicht mehr nur jetzt irgendwie der Staat oder sowas, sondern es sind dann eben partizipative Prozesse und so weiter und so.
3673000	3681000	Aber es wird dezitiert auf das Souveränitätsdenken referiert und als positiv quasi versucht, das jetzt sozusagen geltend zu machen.
3681000	3687000	Und dann stoße ich da immer an und denke, das kann doch jetzt auch nicht quasi die Gangart sein.
3687000	3697000	Ich bin natürlich absolut dafür, den Bereich der Wirtschaft natürlich einer Demokratisierung zuzuführen.
3697000	3719000	Aber geht das nur um den Preis der Wiederbelebung von Konstruktionen, die man in anderen Feldern eigentlich schon längst im Grunde nicht mehr in dieser scheinbar quasi unbelasteten Form irgendwie aktivieren wollen würde, wie eben zum Beispiel das souveräne Individuum oder sowas.
3719000	3741000	Das heißt, wenn ich jetzt aber zu den Planungsleuten gehe, also den Freundinnen und Freunden, Kollegen und Kolleginnen, die auch daran arbeiten und sagen, hey Leute, ich finde, ich bin natürlich absolut interessiert daran, diese Debatte weiterzuführen rund um demokratische Planung und demokratische Planwirtschaft.
3741000	3749000	Aber können wir bitte versuchen, eben sowas wie ein Denken in mehr als menschlichen Konstellationen mit einzubeben und mitzudenken?
3749000	3764000	Dann werde ich wahrscheinlich nicht auf sonderlich offene Ohren stoßen, wenn es quasi nur damit aufhört zu sagen, es gilt das sozusagen zu problematisieren oder mit theoretisch mitzudenken und so weiter,
3764000	3777000	sondern es bedarf nämlich auch als ein Angebot einer Alternative, einer tragfähigen Alternative, bedarf es dann durchaus ein bisschen konkreterer Vorschläge, wie denn das gehen sollte.
3777000	3788000	Und in diesem Dilemma stecke ich da so ein bisschen drin, dass ich beides eigentlich richtig wichtig und gut finde und jetzt eigentlich ein Interesse hätte, quasi der Brücken zu schlagen.
3788000	3805000	Und um diese Brücken aber fruchtbar schlagen zu können, müsste es, glaube ich, ein bisschen handfester werden auf Seite der, sagen, des politischen Denkens oder der politischen Theorie in mehr als menschlichen Konstellationen und technologischen Ökologien als konkrete Praxis.
3805000	3809000	Das ist, glaube ich, so ein bisschen der Kontext vielleicht auch noch zum Verständnis.
3809000	3816000	Also falls Ihnen da noch andere einfallen, andere fährten vielleicht auch, dann freue ich mich natürlich auch über Hinweise.
3817000	3829000	Also höchster fällt mir im Moment jetzt nichts Konkretes ein. Ich finde die Idee der Planung finde ich interessant.
3829000	3836000	Aber man muss natürlich, aber das ist wahrscheinlich in diesen Debatten auch dann mitgedacht, so wie Sie es gerade geschildert haben,
3836000	3845000	natürlich auch von den Fehlern lernen, jetzt von, sage ich mal, Planungspraktiken, wie wir sie jetzt kennengelernt haben.
3847000	3863000	Wo es, glaube ich, schon darum gehen müsste, bei zukünftigen Planungsprojekten auch stärker, sage ich mal, offen zu sein für jetzt Prozesse, die man nicht planen kann.
3863000	3874000	Aber wie soll ich sagen, dass dieses nicht Planbare, das müsste konstitutiv in diese Planungsprozesse eingehen
3874000	3882000	und auch nicht mit der Vorstellung an, sozusagen erschöpfend und sättigend die Zukunft planen.
3882000	3890000	Das ist, glaube ich, ein ganz zentraler Punkt. Also einfach mit welchem Ethos, sage ich mal, geht man da dran an dieses Planungsversprechen.
3890000	3904000	Natürlich geht es zunächst mal darum, sage ich mal, um es mal so auszudrücken, der Anarchie und den Ungleichheiten und Ungerechtigkeiten von der Abwesenheit
3904000	3914000	oder von der reinen Marktplanung, um es mal so auszudrücken, der Anarchie des Marktes wegzukommen und dann auch die Sphären einer demokratischen Planung zuzuführen,
3914000	3924000	die gewissermaßen jetzt nicht demokratisch regiert werden, die sozusagen da privaten Interessen überlassen werden und von denen davon ausgegangen,
3924000	3931000	es wird sich gewissermaßen das Gemeinwohl, stellt sich darüber dann auch schon irgendwie her. Also das finde ich, insofern finde ich die Idee interessant.
3931000	3940000	Nur wie gesagt, es ist wichtig, aus diesen vergangenen Planungsutopien und Planungspraktiken,
3940000	3951000	den tatsächlich erfolgten historischen Planungspraktiken auch zu lernen. Und ich weiß nicht, aber es ist natürlich im Prinzip auch, das ist jetzt alles sehr abstrakt.
3951000	3960000	Aber ich glaube, wenn man es konkreter runterbricht, dann lassen sich, glaube ich, schon bestimmte Prozesse so planen, dass ich denken würde,
3960000	3970000	dass dann auch die Interessen, sage ich mal, von Lebensbedingungen, wenn es sich um jetzt um etwa Tiere oder Pflanzen handelt,
3970000	3979000	dass man die durchaus mit einbeziehen kann in diese Planungsprozesse. Also eins der Beispiele wäre dann natürlich irgendwie,
3979000	3993000	wie lässt sich da zum Beispiel der Fleischkonsum runterfahren, gleichzeitig die Bedingungen, unter denen die Tiere, die für die Nahrungsmittelproduktion sozusagen herhalten,
3993000	4004000	wie lässt sich das verbessern, der Tierbestand reduzieren gleichzeitig, damit bestimmte erwünschte Klimaeffekte erzielen und so weiter.
4004000	4015000	Also die Biodiversität steil. Also ich glaube, es gibt schon bestimmte Möglichkeiten, die es da gibt, von denen ich denken würde, dass das jetzt gar nicht so abstrakt ist.
4015000	4023000	Also wie kann man gewissermaßen die Stimmen hörbar machen, sondern ich glaube, man kann durchaus dann davon ausgehen,
4023000	4033000	dass man an bestimmten Projekten Arbeit oder bestimmten Stellstauben dreht, dass das eben auch Effekte hat, die in vielerlei Hinsicht positive Auswirkungen haben.
4033000	4038000	Absolut. Also das wird auch schon gemacht und das würde ich sagen auch gar nicht das Problem.
4038000	4045000	Die Frage ist, inwiefern das schon aus einem bestimmten Paradigma heraus tritt. Das tut es nämlich nicht zwingend,
4045000	4056000	weil es gibt auch Stränge, die eben im Grunde genau das machen und die könnte man quasi zusammenfassen unter so einem Tag oder Schlagwort wie Planning the Good Anthropocene.
4057000	4065000	Das ist zum Beispiel ein sehr bekanntes Buch in dieser neueren Planungsdebatte The People's Republic of Walmart.
4065000	4075000	Da ist das sozusagen dann eine Conclusio, dass man sagt, im Grunde wird es weiter sozusagen einen Anthropozentrismus geben,
4075000	4082000	weil quasi der Mensch zum einen natürlich quasi die Karre vor die Wand gefahren hat und insofern da auch eine gewisse Bringschuld hat.
4083000	4090000	Und auch wahrscheinlich, würde ich mal sagen, in Anbetracht des Fehlens konkreter Vorschläge,
4090000	4099000	auch für politische Handlungsfähigkeit jenseits dieser Konstruktionen des Menschen als dem Souverän, der da handelt sozusagen,
4099000	4107000	fällt man dann eben zurück auf genau sowas wie Planning the Good Anthropocene, wo man aber dann immer noch das Anthropozene hat
4107000	4113000	und das anthropozentrische Denken hat, aber halt dann quasi mindful in Handführungsstrichen.
4113000	4118000	Also sowas existiert sozusagen durchaus, aber eben wie gesagt, das heißt dann noch nicht zwingend,
4118000	4124000	dass man paradigmatisch quasi herausgetreten ist aus einem Souveränitätsdenken
4124000	4134000	und tatsächlich quasi diese Form des relationalen Materialismus auf einer paradigmatischen Ebene sozusagen mit eingeflochten hat, würde ich sagen.
4135000	4143000	Ich hätte vielleicht noch, wenn ich darf, eigentlich auch auf eine Art angrenzende Frage, wenn man so will,
4143000	4155000	die mich auch anhaltend beschäftigt, auch bis zum gewissen Grad sowohl mit der Planungsfrage verbunden als auch mit einer Kritik,
4155000	4163000	die Sie am neuen Materialismus von Karen Barad, die Sie da dran haben, und da geht es um die Frage der Wahrheitsproduktion.
4163000	4171000	Denn also wenn man überlegt, wie Planung als alternative Regierungskunst aussehen könnte,
4171000	4175000	das ist nämlich gerade im Buchkapitel, an dem ich schreibe, deswegen beschäftigt mich das sehr.
4175000	4182000	Also wenn man überlegt, wie Planung als eine alternative Regierungskunst aussehen könnte, finde ich,
4182000	4188000	muss man auch der Tatsache Rechnung tragen, dass der Markt eben nicht nur ein Ort der Allokation von Mitteln ist,
4188000	4196000	von Ressourcen und eben ein Ort der Koordination von Produktion und Distribution und so,
4196000	4203000	sondern dass er eben auch, und da sind wir natürlich wieder bei Foucault eigentlich, dass er auch ein Ort der Wahrheitsproduktion ist,
4203000	4210000	also ein Ort der Verediktion, der eben absolut sich nicht nur auf die Sphäre des Ökonomischen irgendwie beschränken würde.
4210000	4216000	Und das heißt auch, dass dann eigentlich eine Idee der Planung als alternative Regierungskunst
4216000	4224000	auch alternative Mechanismen auf dieser Flughöhe bereitstellen müsste, wenn man so will, auf dieser Flughöhe der Wahrheitsproduktion.
4224000	4232000	Also wenn man sich jetzt zum Beispiel Politikerinnen vorstellt heutzutage, dann passiert das ja permanent,
4233000	4244000	dass sie sich sozusagen auf den Markt berufen, um bestimmtes Handeln zu legitimieren oder auch das Ausbleiben bestimmter Handlungen zu legitimieren.
4244000	4251000	Das passiert ja auch durchaus oft genug. Und was mich so ein bisschen umtreibt, ist eben die Frage,
4251000	4260000	wenn der Markt als ein solcher Ort des Wahrsprechens eben es nicht sein soll, weil man eben alternative Formen der Regierungskunst
4260000	4272000	gerne in der Welt haben will, wie schafft man es dann auf dieser Ebene eine Alternative bereit zu halten,
4272000	4278000	ohne wieder zurückzufallen in Formen des Essenzialismus oder der Naturalisierung,
4278000	4282000	also ohne quasi dann in diese Wahrheitsspiele einzutreten.
4282000	4287000	Denn das ist ja eigentlich das, was Sie, Karen Barad, wenn ich das richtig verstanden habe,
4287000	4294000	im Grunde bis zum gewissen Grad vorwerfen oder das kritisieren, dass Sie eigentlich so einen Scientismus mit sich schleift,
4294000	4304000	der am Ende eigentlich dann doch wieder sozusagen in diese Spiele, ich glaube es heißt dann telling the truth about matter sozusagen eintritt.
4304000	4311000	Und quasi die Frage in Bezug auf die alternative Regierungskunst würde dann eben heißen,
4311000	4320000	ob man nicht so eine Art des nicht-essenzialistischen Wahrsprechens braucht, um bei einer alternativen Regierungskunst trotzdem,
4320000	4328000	ja, ich weiß nicht, Strukturen, Mechanismen zu haben, um bestimmte Prozesse trotzdem,
4328000	4334000	ich nehme jetzt einfach mal das Wort steuerbar zu machen.
4334000	4347000	Also wie kann das dann aussehen, ohne dass man in diese Falle tappt, eben wieder so komische Naturalisierung und eben Wahrheitsspiele sozusagen zu produzieren?
4347000	4353000	Ja, das ist die Frage. Also vielleicht nochmal Karen Barad.
4353000	4363000	Also der Punkt bei ihr ist, dass sie im Prinzip dann doch letztlich das Fundament der Physik nutzt,
4363000	4371000	der Quantenphysik, um genau zu sein, um einen sehr komplexen Vorschlag, den sie dann agenziellen Realismus nennt.
4371000	4379000	Das ist insbesondere ihr Programm. Aber letztlich ist es dann doch eben die Physik, die alles anleitet und insbesondere Nils Bohr,
4379000	4390000	der gewissermaßen da die Grundlagen liefert. Und dass dann die Gefahr besteht, nicht nur bei ihr, sondern bei relativ vielen Vertreterinnen der neuen Materialismen,
4390000	4399000	dann doch einfach das Argument ist, wir brauchen ein komplexeres, ein reicheres, ein besseres Verständnis von Materie.
4399000	4407000	Und ihr habt es gewissermaßen noch nicht richtig geblickt, wie komplex es eigentlich ist und dass es eigentlich um die Wirkmächtigkeit geht von Materie
4407000	4411000	und dass Materie lebendig ist oder wie auch immer die einzelnen Formulierungen dann sind.
4411000	4420000	Und ich glaube, die Falle, in die man dann tappt ist, das meinen Sie ja mit diesem Wahrheitsspiel, dass man dieses Wahrheitsspiel dann gewissermaßen mitspielt.
4420000	4429000	Das ist dann eine Auseinandersetzung, was sind eigentlich die richtigen Wissensformen oder Disziplinen, die dann die Autorität besitzen, diese Wahrheit dann eben zu sprechen,
4429000	4435000	ob es die Physik ist oder die Biologie. In der Regel ist die Suche dann in den Naturwissenschaften angesiedelt.
4435000	4445000	Und darum, also der entscheidende Punkt ist dann, glaube ich, diesen Prozess der Autorisierung, den zu irritieren.
4445000	4450000	Und das lässt sich, glaube ich, mit dem verknüpfen, was jetzt ihr Anliegen ist.
4450000	4462000	Also was ist dann eigentlich die Grundlage, wenn man davon ausgeht, die Ökonomie, die Form des Marktes spricht die Wahrheit und dient als permanenter Referenzpunkt,
4462000	4468000	welche andere alternativen Wahrheiten lassen sich dann finden, wenn man das nicht will.
4468000	4475000	Und wenn man gewissermaßen da die Probleme sieht, die genau dieser Rekurs auf diese Art von Wahrheit dann produziert.
4475000	4482000	Und ich glaube, im Prinzip ist das bei Foucault immer angeregt mit der Vorstellung einer Rationalität.
4482000	4489000	Also die Unterscheidung von verschiedenen Rationalitäten bedeutet ja dann, es müsste eine andere Rationalität,
4489000	4494000	wo sozusagen die verschiedenen Verweise und die Elemente in einer spezifischen Weise so verknüpft sind,
4494000	4506000	dass dann diese Art von Integrität oder die Sicherheit von Verweisen dann so gesichert ist, dass man dann wiederum darauf verweisen kann.
4506000	4512000	Und das finde ich generell das Interessante und auch das Anschauliche jetzt bei Foucault in diesen Vorlesungen,
4512000	4521000	dass er dann wirklich diese unterschiedlichen Rationalitäten einfach mal durchgeht und sagt, okay, ich habe hier das Beispiel,
4521000	4526000	also ich kann mit Krankheiten oder mit Epidemien unterschiedlich umgehen.
4526000	4530000	Ich kann mit sowas wie Nahrungsmittelknappheit unterschiedlich umgehen.
4530000	4533000	Da gibt es einen souveränen Umgang, disziplinären Umgang.
4533000	4538000	Dann gibt es irgendwie das, was dann von den Physiokraten und später von den Liberalen vorgeschlagen wird.
4538000	4542000	Und das fußt auf eigenständigen Rationalitäten.
4542000	4550000	Und die produzieren ihre je spezifischen Wahrheiten, die funktionieren und zirkulieren innerhalb dieses Regimes.
4550000	4562000	Und die Herausforderung ist gewissermaßen dann, so habe ich sie verstanden oder so würde ich sie, ich glaube in die Richtung müsste das dann gehen,
4562000	4569000	eine Form von Wahrheitsproduktion, die sich ihrer Historicität und Kontingenz immer schon selbst versichert.
4569000	4579000	Also nicht im Sinne von das ist die letzte Grundlage und gewissermaßen das ist die Natur der Dinge,
4579000	4584000	so wie sie sich ganz selbstverständlich darstellt, sondern das wäre eine Referenz,
4584000	4591000	die immer schon die Präkarität und die sozusagen die perspektivische Überwindung mit einbaut.
4591000	4599000	Und diese Art von, sage ich mal, Reflexivität und Relationalität und Materialität,
4599000	4607000	was ist eigentlich das Spezifische, die stoffliche Verbindung, die hier hergestellt wird zwischen den Elementen.
4607000	4616000	Und inwiefern ist das auch etwas, was sich historisch dann verändert und möglicherweise in Zukunft dann verblasst, weniger einleuchtend erscheint.
4616000	4620000	Das wäre, glaube ich, dann wichtig, das mit zu reflektieren.
4620000	4626000	Aber ich glaube, da wäre einfach die Aufgabe dann eine andere politische Rationalität,
4626000	4634000	die gewissermaßen dann das, was sie meinten, dieser Gefahr des Essentialismus oder soermaßen eine Autorisierung,
4634000	4641000	die davon ausgeht, es gibt nur uns, es gibt nur diese Form der Rationalität, der zu entgehen.
4641000	4646000	Da sind wir jetzt eigentlich wieder bei der sozialistischen Governmentalität,
4646000	4652000	weil Foucault ja auch gesagt hat, der Sozialismus hat eben noch keine solche Rationalität,
4652000	4657000	sondern er hat sich eigentlich immer bedient beim Liberalismus oder bei der Souveränität eigentlich.
4657000	4658000	Genau.
4658000	4667000	Und das heißt, das ist also nach wie vor sozusagen der Ort, an dem es, es heißt sogar, glaube ich, bei Foucault, das gilt es zu erfinden.
4667000	4670000	Also es gilt das weiterhin zu erfinden.
