start	end	text
5029000	5046000	Das war Future Histories für heute. Vielen Dank fürs Zuhören, Shownotizen und vieles mehr findet ihr auf www.futurehistories.today.
5046000	5052000	Diskutiert mit auf Twitter unter dem Hashtag Future Histories oder im eigenen Subreddit.
5052000	5065000	Ihr könnt Future Histories nicht nur auf allen großen Podcast-Plattformen hören und abonnieren, sondern auch auf YouTube, wo ihr neben den Episoden dann auch Kurzvideos zu Kernbegriffen einzelner Episoden findet.
5065000	5074000	Schreibt mir gerne unter jan at futurehistories.today. Ich freue mich immer sehr über interessante Rückmeldungen und Hinweise.
5074000	5084000	Wenn ihr Future Histories unterstützen wollt, könnt ihr das auf patreon.com-futurehistories oder auch auf unserer Homepage.
5084000	5091000	Future Histories ist eine Produktion von MetaLapses zu finden auf meta lapses.net.
5091000	5094000	Bis zum nächsten Mal. Ich freue mich.
